[2025-11-02 22:49:13] ✅ Fecha string convertida: 7/1/2025 -> 2025-07-01 (Campo: fecha_asignacion)
[2025-11-02 22:49:13] ✅ Fecha string convertida: 6/24/2025 -> 2025-06-24 (Campo: fecha_proceso)
[2025-11-02 22:49:13] ✅ Fecha string convertida: 5/5/2025 -> 2025-05-05 (Campo: fecha_castigo)
[2025-11-02 22:49:13] ✅ Fecha string convertida: 9/5/2024 -> 2024-09-05 (Campo: fecha_pago)
[2025-11-02 22:49:13] ✅ Fecha string convertida: 11/5/2024 -> 2024-11-05 (Campo: fecha_vencimiento)
[2025-11-02 22:49:13] ✅ Fecha string convertida: 9/20/2016 -> 2016-09-20 (Campo: fecha_susc)
[2025-11-02 22:49:13] ✅ Fecha string convertida: 7/1/2025 -> 2025-07-01 (Campo: fecha_asignacion)
[2025-11-02 22:49:13] ✅ Fecha string convertida: 6/24/2025 -> 2025-06-24 (Campo: fecha_proceso)
[2025-11-02 22:49:13] ✅ Fecha string convertida: 5/15/2025 -> 2025-05-15 (Campo: fecha_castigo)
[2025-11-02 22:49:13] ✅ Fecha string convertida: 10/8/2024 -> 2024-10-08 (Campo: fecha_pago)
[2025-11-02 22:49:13] ✅ Fecha string convertida: 11/15/2024 -> 2024-11-15 (Campo: fecha_vencimiento)
[2025-11-02 22:49:13] ✅ Fecha string convertida: 10/28/2017 -> 2017-10-28 (Campo: fecha_susc)
[2025-11-02 22:49:13] ✅ Fecha string convertida: 7/1/2025 -> 2025-07-01 (Campo: fecha_asignacion)
[2025-11-02 22:49:13] ✅ Fecha string convertida: 6/24/2025 -> 2025-06-24 (Campo: fecha_proceso)
[2025-11-02 22:49:13] ✅ Fecha string convertida: 5/5/2025 -> 2025-05-05 (Campo: fecha_castigo)
[2025-11-02 22:49:13] ✅ Fecha string convertida: 12/11/2024 -> 2024-12-11 (Campo: fecha_pago)
[2025-11-02 22:49:13] ✅ Fecha string convertida: 11/5/2024 -> 2024-11-05 (Campo: fecha_vencimiento)
[2025-11-02 22:49:13] ✅ Fecha string convertida: 11/24/2013 -> 2013-11-24 (Campo: fecha_susc)
[2025-11-02 22:49:13] ✅ Fecha string convertida: 7/1/2025 -> 2025-07-01 (Campo: fecha_asignacion)
[2025-11-02 22:49:13] ✅ Fecha string convertida: 6/24/2025 -> 2025-06-24 (Campo: fecha_proceso)
[2025-11-02 22:49:13] ✅ Fecha string convertida: 5/5/2025 -> 2025-05-05 (Campo: fecha_castigo)
[2025-11-02 22:49:13] ✅ Fecha string convertida: 12/26/2024 -> 2024-12-26 (Campo: fecha_pago)
[2025-11-02 22:49:13] ✅ Fecha string convertida: 11/5/2024 -> 2024-11-05 (Campo: fecha_vencimiento)
[2025-11-02 22:49:13] ✅ Fecha string convertida: 6/8/2018 -> 2018-06-08 (Campo: fecha_susc)
[2025-11-02 22:49:13] ✅ Fecha string convertida: 7/1/2025 -> 2025-07-01 (Campo: fecha_asignacion)
[2025-11-02 22:49:13] ✅ Fecha string convertida: 6/24/2025 -> 2025-06-24 (Campo: fecha_proceso)
[2025-11-02 22:49:13] ✅ Fecha string convertida: 5/5/2025 -> 2025-05-05 (Campo: fecha_castigo)
[2025-11-02 22:49:13] ✅ Fecha string convertida: 10/3/2024 -> 2024-10-03 (Campo: fecha_pago)
[2025-11-02 22:49:13] ✅ Fecha string convertida: 11/5/2024 -> 2024-11-05 (Campo: fecha_vencimiento)
[2025-11-02 22:49:13] ✅ Fecha string convertida: 9/3/2016 -> 2016-09-03 (Campo: fecha_susc)
[2025-11-02 22:49:13] ✅ Fecha string convertida: 7/1/2025 -> 2025-07-01 (Campo: fecha_asignacion)
[2025-11-02 22:49:13] ✅ Fecha string convertida: 6/24/2025 -> 2025-06-24 (Campo: fecha_proceso)
[2025-11-02 22:49:13] ✅ Fecha string convertida: 5/15/2025 -> 2025-05-15 (Campo: fecha_castigo)
[2025-11-02 22:49:13] ✅ Fecha string convertida: 10/21/2024 -> 2024-10-21 (Campo: fecha_pago)
[2025-11-02 22:49:13] ✅ Fecha string convertida: 11/15/2024 -> 2024-11-15 (Campo: fecha_vencimiento)
[2025-11-02 22:49:13] ✅ Fecha string convertida: 2/25/2012 -> 2012-02-25 (Campo: fecha_susc)
[2025-11-02 22:49:13] ✅ Fecha string convertida: 7/1/2025 -> 2025-07-01 (Campo: fecha_asignacion)
[2025-11-02 22:49:13] ✅ Fecha string convertida: 6/24/2025 -> 2025-06-24 (Campo: fecha_proceso)
[2025-11-02 22:49:13] ✅ Fecha string convertida: 5/20/2025 -> 2025-05-20 (Campo: fecha_castigo)
[2025-11-02 22:49:13] ✅ Fecha string convertida: 10/18/2024 -> 2024-10-18 (Campo: fecha_pago)
[2025-11-02 22:49:13] ✅ Fecha string convertida: 11/20/2024 -> 2024-11-20 (Campo: fecha_vencimiento)
[2025-11-02 22:49:13] ✅ Fecha string convertida: 1/22/2024 -> 2024-01-22 (Campo: fecha_susc)
[2025-11-02 22:49:13] ✅ Fecha string convertida: 7/1/2025 -> 2025-07-01 (Campo: fecha_asignacion)
[2025-11-02 22:49:13] ✅ Fecha string convertida: 6/24/2025 -> 2025-06-24 (Campo: fecha_proceso)
[2025-11-02 22:49:13] ✅ Fecha string convertida: 5/20/2025 -> 2025-05-20 (Campo: fecha_castigo)
[2025-11-02 22:49:13] ✅ Fecha string convertida: 11/17/2024 -> 2024-11-17 (Campo: fecha_pago)
[2025-11-02 22:49:13] ✅ Fecha string convertida: 11/20/2024 -> 2024-11-20 (Campo: fecha_vencimiento)
[2025-11-02 22:49:13] ✅ Fecha string convertida: 9/12/2019 -> 2019-09-12 (Campo: fecha_susc)
[2025-11-02 22:49:13] ✅ Fecha string convertida: 7/1/2025 -> 2025-07-01 (Campo: fecha_asignacion)
[2025-11-02 22:49:13] ✅ Fecha string convertida: 6/24/2025 -> 2025-06-24 (Campo: fecha_proceso)
[2025-11-02 22:49:13] ✅ Fecha string convertida: 5/5/2025 -> 2025-05-05 (Campo: fecha_castigo)
[2025-11-02 22:49:13] ✅ Fecha string convertida: 12/9/2024 -> 2024-12-09 (Campo: fecha_pago)
[2025-11-02 22:49:13] ✅ Fecha string convertida: 11/5/2024 -> 2024-11-05 (Campo: fecha_vencimiento)
[2025-11-02 22:49:13] ✅ Fecha string convertida: 4/22/2016 -> 2016-04-22 (Campo: fecha_susc)
[2025-11-02 22:49:13] ✅ Fecha string convertida: 7/1/2025 -> 2025-07-01 (Campo: fecha_asignacion)
[2025-11-02 22:49:13] ✅ Fecha string convertida: 6/24/2025 -> 2025-06-24 (Campo: fecha_proceso)
[2025-11-02 22:49:13] ✅ Fecha string convertida: 5/5/2025 -> 2025-05-05 (Campo: fecha_castigo)
[2025-11-02 22:49:13] ✅ Fecha string convertida: 9/25/2024 -> 2024-09-25 (Campo: fecha_pago)
[2025-11-02 22:49:13] ✅ Fecha string convertida: 11/5/2024 -> 2024-11-05 (Campo: fecha_vencimiento)
[2025-11-02 22:49:13] ✅ Fecha string convertida: 8/1/2014 -> 2014-08-01 (Campo: fecha_susc)
[2025-11-02 22:49:13] ✅ Fecha string convertida: 7/1/2025 -> 2025-07-01 (Campo: fecha_asignacion)
[2025-11-02 22:49:13] ✅ Fecha string convertida: 6/24/2025 -> 2025-06-24 (Campo: fecha_proceso)
[2025-11-02 22:49:13] ✅ Fecha string convertida: 5/5/2025 -> 2025-05-05 (Campo: fecha_castigo)
[2025-11-02 22:49:13] ✅ Fecha string convertida: 12/2/2024 -> 2024-12-02 (Campo: fecha_pago)
[2025-11-02 22:49:13] ✅ Fecha string convertida: 11/5/2024 -> 2024-11-05 (Campo: fecha_vencimiento)
[2025-11-02 22:49:13] ✅ Fecha string convertida: 4/25/2016 -> 2016-04-25 (Campo: fecha_susc)
[2025-11-02 22:49:13] ✅ Fecha string convertida: 7/1/2025 -> 2025-07-01 (Campo: fecha_asignacion)
[2025-11-02 22:49:13] ✅ Fecha string convertida: 6/24/2025 -> 2025-06-24 (Campo: fecha_proceso)
[2025-11-02 22:49:13] ✅ Fecha string convertida: 5/5/2025 -> 2025-05-05 (Campo: fecha_castigo)
[2025-11-02 22:49:13] ✅ Fecha string convertida: 10/22/2024 -> 2024-10-22 (Campo: fecha_pago)
[2025-11-02 22:49:13] ✅ Fecha string convertida: 11/5/2024 -> 2024-11-05 (Campo: fecha_vencimiento)
[2025-11-02 22:49:13] ✅ Fecha string convertida: 11/13/2013 -> 2013-11-13 (Campo: fecha_susc)
[2025-11-02 22:49:13] ✅ Fecha string convertida: 7/1/2025 -> 2025-07-01 (Campo: fecha_asignacion)
[2025-11-02 22:49:13] ✅ Fecha string convertida: 6/24/2025 -> 2025-06-24 (Campo: fecha_proceso)
[2025-11-02 22:49:13] ✅ Fecha string convertida: 5/5/2025 -> 2025-05-05 (Campo: fecha_castigo)
[2025-11-02 22:49:13] ✅ Fecha string convertida: 10/7/2024 -> 2024-10-07 (Campo: fecha_pago)
[2025-11-02 22:49:13] ✅ Fecha string convertida: 11/5/2024 -> 2024-11-05 (Campo: fecha_vencimiento)
[2025-11-02 22:49:13] ✅ Fecha string convertida: 10/15/2023 -> 2023-10-15 (Campo: fecha_susc)
[2025-11-02 22:49:13] ✅ Fecha string convertida: 7/1/2025 -> 2025-07-01 (Campo: fecha_asignacion)
[2025-11-02 22:49:13] ✅ Fecha string convertida: 6/24/2025 -> 2025-06-24 (Campo: fecha_proceso)
[2025-11-02 22:49:13] ✅ Fecha string convertida: 5/5/2025 -> 2025-05-05 (Campo: fecha_castigo)
[2025-11-02 22:49:13] ✅ Fecha string convertida: 10/17/2024 -> 2024-10-17 (Campo: fecha_pago)
[2025-11-02 22:49:13] ✅ Fecha string convertida: 11/5/2024 -> 2024-11-05 (Campo: fecha_vencimiento)
[2025-11-02 22:49:13] ✅ Fecha string convertida: 12/16/1990 -> 1990-12-16 (Campo: fecha_susc)
[2025-11-02 22:49:13] ✅ Fecha string convertida: 7/1/2025 -> 2025-07-01 (Campo: fecha_asignacion)
[2025-11-02 22:49:13] ✅ Fecha string convertida: 6/24/2025 -> 2025-06-24 (Campo: fecha_proceso)
[2025-11-02 22:49:13] ✅ Fecha string convertida: 5/5/2025 -> 2025-05-05 (Campo: fecha_castigo)
[2025-11-02 22:49:13] ✅ Fecha string convertida: 2/28/2025 -> 2025-02-28 (Campo: fecha_pago)
[2025-11-02 22:49:13] ✅ Fecha string convertida: 11/5/2024 -> 2024-11-05 (Campo: fecha_vencimiento)
[2025-11-02 22:49:13] ✅ Fecha string convertida: 6/10/2017 -> 2017-06-10 (Campo: fecha_susc)
[2025-11-02 22:49:13] ✅ Fecha string convertida: 7/1/2025 -> 2025-07-01 (Campo: fecha_asignacion)
[2025-11-02 22:49:13] ✅ Fecha string convertida: 9/25/2025 -> 2025-09-25 (Campo: fecha_proceso)
[2025-11-02 22:49:13] ✅ Fecha string convertida: 8/25/2025 -> 2025-08-25 (Campo: fecha_castigo)
[2025-11-02 22:49:13] ✅ Fecha Excel convertida: 45743 -> 2025-03-27 (Campo: fecha_pago)
[2025-11-02 22:49:13] ✅ Fecha string convertida: 2/25/2025 -> 2025-02-25 (Campo: fecha_vencimiento)
[2025-11-02 22:49:14] ✅ Fecha string convertida: 1/22/2018 -> 2018-01-22 (Campo: fecha_susc)
[2025-11-02 22:49:14] ✅ Fecha string convertida: 10/1/2025 -> 2025-10-01 (Campo: fecha_asignacion)
[2025-11-02 22:49:14] ✅ Fecha string convertida: 9/25/2025 -> 2025-09-25 (Campo: fecha_proceso)
[2025-11-02 22:49:14] ✅ Fecha string convertida: 8/10/2025 -> 2025-08-10 (Campo: fecha_castigo)
[2025-11-02 22:49:14] ✅ Fecha Excel convertida: 45672 -> 2025-01-15 (Campo: fecha_pago)
[2025-11-02 22:49:14] ✅ Fecha string convertida: 2/10/2025 -> 2025-02-10 (Campo: fecha_vencimiento)
[2025-11-02 22:49:14] ✅ Fecha string convertida: 10/24/1992 -> 1992-10-24 (Campo: fecha_susc)
[2025-11-02 22:49:14] ✅ Fecha string convertida: 10/1/2025 -> 2025-10-01 (Campo: fecha_asignacion)
[2025-11-02 22:49:14] ✅ Fecha string convertida: 9/25/2025 -> 2025-09-25 (Campo: fecha_proceso)
[2025-11-02 22:49:14] ✅ Fecha string convertida: 8/5/2025 -> 2025-08-05 (Campo: fecha_castigo)
[2025-11-02 22:49:14] ✅ Fecha Excel convertida: 45659 -> 2025-01-02 (Campo: fecha_pago)
[2025-11-02 22:49:14] ✅ Fecha string convertida: 2/5/2025 -> 2025-02-05 (Campo: fecha_vencimiento)
[2025-11-02 22:49:14] ✅ Fecha string convertida: 1/8/2022 -> 2022-01-08 (Campo: fecha_susc)
[2025-11-02 22:49:14] ✅ Fecha string convertida: 10/1/2025 -> 2025-10-01 (Campo: fecha_asignacion)
[2025-11-02 22:49:14] ✅ Fecha string convertida: 9/25/2025 -> 2025-09-25 (Campo: fecha_proceso)
[2025-11-02 22:49:14] ✅ Fecha string convertida: 8/5/2025 -> 2025-08-05 (Campo: fecha_castigo)
[2025-11-02 22:49:14] ✅ Fecha Excel convertida: 45656 -> 2024-12-30 (Campo: fecha_pago)
[2025-11-02 22:49:14] ✅ Fecha string convertida: 2/5/2025 -> 2025-02-05 (Campo: fecha_vencimiento)
[2025-11-02 22:49:14] ✅ Fecha string convertida: 10/25/2024 -> 2024-10-25 (Campo: fecha_susc)
[2025-11-02 22:49:14] ✅ Fecha string convertida: 10/1/2025 -> 2025-10-01 (Campo: fecha_asignacion)
[2025-11-02 22:49:14] ✅ Fecha string convertida: 9/25/2025 -> 2025-09-25 (Campo: fecha_proceso)
[2025-11-02 22:49:14] ✅ Fecha string convertida: 8/5/2025 -> 2025-08-05 (Campo: fecha_castigo)
[2025-11-02 22:49:14] ✅ Fecha Excel convertida: 45564 -> 2024-09-29 (Campo: fecha_pago)
[2025-11-02 22:49:14] ✅ Fecha string convertida: 2/5/2025 -> 2025-02-05 (Campo: fecha_vencimiento)
[2025-11-02 22:49:14] ✅ Fecha string convertida: 1/30/2017 -> 2017-01-30 (Campo: fecha_susc)
[2025-11-02 22:49:14] ✅ Fecha string convertida: 10/1/2025 -> 2025-10-01 (Campo: fecha_asignacion)
[2025-11-02 22:49:14] ✅ Fecha string convertida: 9/25/2025 -> 2025-09-25 (Campo: fecha_proceso)
[2025-11-02 22:49:14] ✅ Fecha string convertida: 8/10/2025 -> 2025-08-10 (Campo: fecha_castigo)
[2025-11-02 22:49:14] ✅ Fecha Excel convertida: 45664 -> 2025-01-07 (Campo: fecha_pago)
[2025-11-02 22:49:14] ✅ Fecha string convertida: 2/10/2025 -> 2025-02-10 (Campo: fecha_vencimiento)
[2025-11-02 22:49:14] ✅ Fecha string convertida: 2/5/2021 -> 2021-02-05 (Campo: fecha_susc)
[2025-11-02 22:49:14] ✅ Fecha string convertida: 10/1/2025 -> 2025-10-01 (Campo: fecha_asignacion)
[2025-11-02 22:49:14] ✅ Fecha string convertida: 9/25/2025 -> 2025-09-25 (Campo: fecha_proceso)
[2025-11-02 22:49:14] ✅ Fecha string convertida: 8/15/2025 -> 2025-08-15 (Campo: fecha_castigo)
[2025-11-02 22:49:14] ✅ Fecha Excel convertida: 45672 -> 2025-01-15 (Campo: fecha_pago)
[2025-11-02 22:49:14] ✅ Fecha string convertida: 2/15/2025 -> 2025-02-15 (Campo: fecha_vencimiento)
[2025-11-02 22:49:14] ✅ Fecha string convertida: 6/6/2023 -> 2023-06-06 (Campo: fecha_susc)
[2025-11-02 22:49:14] ✅ Fecha string convertida: 10/1/2025 -> 2025-10-01 (Campo: fecha_asignacion)
[2025-11-02 22:49:14] ✅ Fecha string convertida: 9/25/2025 -> 2025-09-25 (Campo: fecha_proceso)
[2025-11-02 22:49:14] ✅ Fecha string convertida: 8/10/2025 -> 2025-08-10 (Campo: fecha_castigo)
[2025-11-02 22:49:14] ✅ Fecha Excel convertida: 45691 -> 2025-02-03 (Campo: fecha_pago)
[2025-11-02 22:49:14] ✅ Fecha string convertida: 2/10/2025 -> 2025-02-10 (Campo: fecha_vencimiento)
[2025-11-02 22:49:14] ✅ Fecha string convertida: 2/23/2018 -> 2018-02-23 (Campo: fecha_susc)
[2025-11-02 22:49:14] ✅ Fecha string convertida: 10/1/2025 -> 2025-10-01 (Campo: fecha_asignacion)
[2025-11-02 22:49:14] ✅ Fecha string convertida: 9/25/2025 -> 2025-09-25 (Campo: fecha_proceso)
[2025-11-02 22:49:14] ✅ Fecha string convertida: 8/5/2025 -> 2025-08-05 (Campo: fecha_castigo)
[2025-11-02 22:49:14] ✅ Fecha Excel convertida: 45692 -> 2025-02-04 (Campo: fecha_pago)
[2025-11-02 22:49:14] ✅ Fecha string convertida: 2/5/2025 -> 2025-02-05 (Campo: fecha_vencimiento)
[2025-11-02 22:49:14] ✅ Fecha string convertida: 8/28/2023 -> 2023-08-28 (Campo: fecha_susc)
[2025-11-02 22:49:14] ✅ Fecha string convertida: 10/1/2025 -> 2025-10-01 (Campo: fecha_asignacion)
[2025-11-02 22:49:14] ✅ Fecha string convertida: 9/25/2025 -> 2025-09-25 (Campo: fecha_proceso)
[2025-11-02 22:49:14] ✅ Fecha string convertida: 8/25/2025 -> 2025-08-25 (Campo: fecha_castigo)
[2025-11-02 22:49:14] ✅ Fecha Excel convertida: 45680 -> 2025-01-23 (Campo: fecha_pago)
[2025-11-02 22:49:14] ✅ Fecha string convertida: 2/25/2025 -> 2025-02-25 (Campo: fecha_vencimiento)
[2025-11-02 22:49:14] ✅ Fecha string convertida: 7/22/2018 -> 2018-07-22 (Campo: fecha_susc)
[2025-11-02 22:49:14] ✅ Fecha string convertida: 10/1/2025 -> 2025-10-01 (Campo: fecha_asignacion)
[2025-11-02 22:49:14] ✅ Fecha string convertida: 9/25/2025 -> 2025-09-25 (Campo: fecha_proceso)
[2025-11-02 22:49:14] ✅ Fecha string convertida: 8/10/2025 -> 2025-08-10 (Campo: fecha_castigo)
[2025-11-02 22:49:14] ✅ Fecha Excel convertida: 45664 -> 2025-01-07 (Campo: fecha_pago)
[2025-11-02 22:49:14] ✅ Fecha string convertida: 2/10/2025 -> 2025-02-10 (Campo: fecha_vencimiento)
[2025-11-02 22:49:14] ✅ Fecha string convertida: 11/4/2006 -> 2006-11-04 (Campo: fecha_susc)
[2025-11-02 22:49:14] ✅ Fecha string convertida: 10/1/2025 -> 2025-10-01 (Campo: fecha_asignacion)
[2025-11-02 22:49:14] ✅ Fecha string convertida: 9/25/2025 -> 2025-09-25 (Campo: fecha_proceso)
[2025-11-02 22:49:14] ✅ Fecha string convertida: 8/10/2025 -> 2025-08-10 (Campo: fecha_castigo)
[2025-11-02 22:49:14] ✅ Fecha Excel convertida: 45667 -> 2025-01-10 (Campo: fecha_pago)
[2025-11-02 22:49:14] ✅ Fecha string convertida: 2/10/2025 -> 2025-02-10 (Campo: fecha_vencimiento)
[2025-11-02 22:49:14] ✅ Fecha string convertida: 8/4/2024 -> 2024-08-04 (Campo: fecha_susc)
[2025-11-02 22:49:14] ✅ Fecha string convertida: 10/1/2025 -> 2025-10-01 (Campo: fecha_asignacion)
[2025-11-02 22:49:14] ✅ Fecha string convertida: 9/25/2025 -> 2025-09-25 (Campo: fecha_proceso)
[2025-11-02 22:49:14] ✅ Fecha string convertida: 8/5/2025 -> 2025-08-05 (Campo: fecha_castigo)
[2025-11-02 22:49:14] ✅ Fecha Excel convertida: 45749 -> 2025-04-02 (Campo: fecha_pago)
[2025-11-02 22:49:14] ✅ Fecha string convertida: 2/5/2025 -> 2025-02-05 (Campo: fecha_vencimiento)
[2025-11-02 22:49:14] ✅ Fecha string convertida: 11/30/2009 -> 2009-11-30 (Campo: fecha_susc)
[2025-11-02 22:49:14] ✅ Fecha string convertida: 10/1/2025 -> 2025-10-01 (Campo: fecha_asignacion)
[2025-11-02 22:49:14] ✅ Fecha string convertida: 9/25/2025 -> 2025-09-25 (Campo: fecha_proceso)
[2025-11-02 22:49:14] ✅ Fecha string convertida: 8/5/2025 -> 2025-08-05 (Campo: fecha_castigo)
[2025-11-02 22:49:14] ✅ Fecha Excel convertida: 45662 -> 2025-01-05 (Campo: fecha_pago)
[2025-11-02 22:49:14] ✅ Fecha string convertida: 2/5/2025 -> 2025-02-05 (Campo: fecha_vencimiento)
[2025-11-02 22:49:14] ✅ Fecha string convertida: 12/21/2018 -> 2018-12-21 (Campo: fecha_susc)
[2025-11-02 22:49:14] ✅ Fecha string convertida: 10/1/2025 -> 2025-10-01 (Campo: fecha_asignacion)
[2025-11-02 22:49:14] ✅ Fecha string convertida: 9/25/2025 -> 2025-09-25 (Campo: fecha_proceso)
[2025-11-02 22:49:14] ✅ Fecha string convertida: 8/5/2025 -> 2025-08-05 (Campo: fecha_castigo)
[2025-11-02 22:49:14] ✅ Fecha Excel convertida: 45615 -> 2024-11-19 (Campo: fecha_pago)
[2025-11-02 22:49:14] ✅ Fecha string convertida: 2/5/2025 -> 2025-02-05 (Campo: fecha_vencimiento)
[2025-11-02 22:49:14] ✅ Fecha string convertida: 7/18/2014 -> 2014-07-18 (Campo: fecha_susc)
[2025-11-02 22:49:14] ✅ Fecha string convertida: 10/1/2025 -> 2025-10-01 (Campo: fecha_asignacion)
[2025-11-02 22:49:14] ✅ Fecha string convertida: 9/25/2025 -> 2025-09-25 (Campo: fecha_proceso)
[2025-11-02 22:49:14] ✅ Fecha string convertida: 8/5/2025 -> 2025-08-05 (Campo: fecha_castigo)
[2025-11-02 22:49:14] ✅ Fecha Excel convertida: 45666 -> 2025-01-09 (Campo: fecha_pago)
[2025-11-02 22:49:14] ✅ Fecha string convertida: 2/5/2025 -> 2025-02-05 (Campo: fecha_vencimiento)
[2025-11-02 22:49:14] ✅ Fecha string convertida: 8/28/2011 -> 2011-08-28 (Campo: fecha_susc)
[2025-11-02 22:49:14] ✅ Fecha string convertida: 10/1/2025 -> 2025-10-01 (Campo: fecha_asignacion)
[2025-11-02 22:49:14] ✅ Fecha string convertida: 9/25/2025 -> 2025-09-25 (Campo: fecha_proceso)
[2025-11-02 22:49:14] ✅ Fecha string convertida: 8/5/2025 -> 2025-08-05 (Campo: fecha_castigo)
[2025-11-02 22:49:14] ✅ Fecha Excel convertida: 45804 -> 2025-05-27 (Campo: fecha_pago)
[2025-11-02 22:49:14] ✅ Fecha string convertida: 2/5/2025 -> 2025-02-05 (Campo: fecha_vencimiento)
[2025-11-02 22:49:14] ✅ Fecha string convertida: 2/6/2018 -> 2018-02-06 (Campo: fecha_susc)
[2025-11-02 22:49:14] ✅ Fecha string convertida: 10/1/2025 -> 2025-10-01 (Campo: fecha_asignacion)
[2025-11-02 22:49:14] ✅ Fecha string convertida: 9/25/2025 -> 2025-09-25 (Campo: fecha_proceso)
[2025-11-02 22:49:14] ✅ Fecha string convertida: 8/28/2025 -> 2025-08-28 (Campo: fecha_castigo)
[2025-11-02 22:49:14] ✅ Fecha Excel convertida: 45702 -> 2025-02-14 (Campo: fecha_pago)
[2025-11-02 22:49:14] ✅ Fecha string convertida: 2/28/2025 -> 2025-02-28 (Campo: fecha_vencimiento)
[2025-11-02 22:49:14] ✅ Fecha string convertida: 2/10/2023 -> 2023-02-10 (Campo: fecha_susc)
[2025-11-02 22:49:14] ✅ Fecha string convertida: 10/1/2025 -> 2025-10-01 (Campo: fecha_asignacion)
[2025-11-02 22:49:14] ✅ Fecha string convertida: 9/25/2025 -> 2025-09-25 (Campo: fecha_proceso)
[2025-11-02 22:49:14] ✅ Fecha string convertida: 8/28/2025 -> 2025-08-28 (Campo: fecha_castigo)
[2025-11-02 22:49:14] ✅ Fecha string convertida: 2/28/2025 -> 2025-02-28 (Campo: fecha_vencimiento)
[2025-11-02 22:49:14] ✅ Fecha string convertida: 12/16/2024 -> 2024-12-16 (Campo: fecha_susc)
[2025-11-02 22:49:14] ✅ Fecha string convertida: 10/1/2025 -> 2025-10-01 (Campo: fecha_asignacion)
[2025-11-02 22:49:14] ✅ Fecha string convertida: 9/25/2025 -> 2025-09-25 (Campo: fecha_proceso)
[2025-11-02 22:49:14] ✅ Fecha string convertida: 8/5/2025 -> 2025-08-05 (Campo: fecha_castigo)
[2025-11-02 22:49:14] ✅ Fecha Excel convertida: 45666 -> 2025-01-09 (Campo: fecha_pago)
[2025-11-02 22:49:14] ✅ Fecha string convertida: 2/5/2025 -> 2025-02-05 (Campo: fecha_vencimiento)
[2025-11-02 22:49:14] ✅ Fecha string convertida: 4/29/2021 -> 2021-04-29 (Campo: fecha_susc)
[2025-11-02 22:49:14] ✅ Fecha string convertida: 10/1/2025 -> 2025-10-01 (Campo: fecha_asignacion)
[2025-11-02 22:49:14] ✅ Fecha string convertida: 9/25/2025 -> 2025-09-25 (Campo: fecha_proceso)
[2025-11-02 22:49:14] ✅ Fecha string convertida: 8/5/2025 -> 2025-08-05 (Campo: fecha_castigo)
[2025-11-02 22:49:14] ✅ Fecha Excel convertida: 45660 -> 2025-01-03 (Campo: fecha_pago)
[2025-11-02 22:49:14] ✅ Fecha string convertida: 2/5/2025 -> 2025-02-05 (Campo: fecha_vencimiento)
[2025-11-02 22:49:14] ✅ Fecha string convertida: 8/30/2007 -> 2007-08-30 (Campo: fecha_susc)
[2025-11-02 22:49:14] ✅ Fecha string convertida: 10/1/2025 -> 2025-10-01 (Campo: fecha_asignacion)
[2025-11-02 22:49:14] ✅ Fecha string convertida: 9/25/2025 -> 2025-09-25 (Campo: fecha_proceso)
[2025-11-02 22:49:14] ✅ Fecha string convertida: 8/5/2025 -> 2025-08-05 (Campo: fecha_castigo)
[2025-11-02 22:49:14] ✅ Fecha Excel convertida: 45663 -> 2025-01-06 (Campo: fecha_pago)
[2025-11-02 22:49:14] ✅ Fecha string convertida: 2/5/2025 -> 2025-02-05 (Campo: fecha_vencimiento)
[2025-11-02 22:49:14] ✅ Fecha string convertida: 8/12/2005 -> 2005-08-12 (Campo: fecha_susc)
[2025-11-02 22:49:14] ✅ Fecha string convertida: 10/1/2025 -> 2025-10-01 (Campo: fecha_asignacion)
[2025-11-02 22:49:14] ✅ Fecha string convertida: 9/25/2025 -> 2025-09-25 (Campo: fecha_proceso)
[2025-11-02 22:49:14] ✅ Fecha string convertida: 8/5/2025 -> 2025-08-05 (Campo: fecha_castigo)
[2025-11-02 22:49:14] ✅ Fecha Excel convertida: 45588 -> 2024-10-23 (Campo: fecha_pago)
[2025-11-02 22:49:14] ✅ Fecha string convertida: 2/5/2025 -> 2025-02-05 (Campo: fecha_vencimiento)
[2025-11-02 22:49:14] ✅ Fecha string convertida: 6/17/2024 -> 2024-06-17 (Campo: fecha_susc)
[2025-11-02 22:49:14] ✅ Fecha string convertida: 10/1/2025 -> 2025-10-01 (Campo: fecha_asignacion)
[2025-11-02 22:49:14] ✅ Fecha string convertida: 1/27/2025 -> 2025-01-27 (Campo: fecha_proceso)
[2025-11-02 22:49:14] ✅ Fecha string convertida: 11/5/2024 -> 2024-11-05 (Campo: fecha_castigo)
[2025-11-02 22:49:14] ✅ Fecha string convertida: 3/26/2024 -> 2024-03-26 (Campo: fecha_pago)
[2025-11-02 22:49:14] ✅ Fecha string convertida: 5/5/2024 -> 2024-05-05 (Campo: fecha_vencimiento)
[2025-11-02 22:49:14] ✅ Fecha string convertida: 4/8/2016 -> 2016-04-08 (Campo: fecha_susc)
[2025-11-02 22:49:14] ✅ Fecha string convertida: 1/1/2025 -> 2025-01-01 (Campo: fecha_asignacion)
[2025-11-02 22:49:14] ✅ Fecha string convertida: 1/27/2025 -> 2025-01-27 (Campo: fecha_proceso)
[2025-11-02 22:49:14] ✅ Fecha string convertida: 11/5/2024 -> 2024-11-05 (Campo: fecha_castigo)
[2025-11-02 22:49:14] ✅ Fecha string convertida: 4/2/2024 -> 2024-04-02 (Campo: fecha_pago)
[2025-11-02 22:49:14] ✅ Fecha string convertida: 5/5/2024 -> 2024-05-05 (Campo: fecha_vencimiento)
[2025-11-02 22:49:14] ✅ Fecha string convertida: 1/27/2020 -> 2020-01-27 (Campo: fecha_susc)
[2025-11-02 22:49:14] ✅ Fecha string convertida: 1/1/2025 -> 2025-01-01 (Campo: fecha_asignacion)
[2025-11-02 22:49:14] ✅ Fecha string convertida: 1/27/2025 -> 2025-01-27 (Campo: fecha_proceso)
[2025-11-02 22:49:14] ✅ Fecha string convertida: 11/5/2024 -> 2024-11-05 (Campo: fecha_castigo)
[2025-11-02 22:49:14] ✅ Fecha string convertida: 3/16/2024 -> 2024-03-16 (Campo: fecha_pago)
[2025-11-02 22:49:14] ✅ Fecha string convertida: 5/5/2024 -> 2024-05-05 (Campo: fecha_vencimiento)
[2025-11-02 22:49:14] ✅ Fecha string convertida: 5/17/2018 -> 2018-05-17 (Campo: fecha_susc)
[2025-11-02 22:49:14] ✅ Fecha string convertida: 1/1/2025 -> 2025-01-01 (Campo: fecha_asignacion)
[2025-11-02 22:49:14] ✅ Fecha string convertida: 1/27/2025 -> 2025-01-27 (Campo: fecha_proceso)
[2025-11-02 22:49:14] ✅ Fecha string convertida: 11/5/2024 -> 2024-11-05 (Campo: fecha_castigo)
[2025-11-02 22:49:14] ✅ Fecha string convertida: 4/15/2024 -> 2024-04-15 (Campo: fecha_pago)
[2025-11-02 22:49:14] ✅ Fecha string convertida: 5/5/2024 -> 2024-05-05 (Campo: fecha_vencimiento)
[2025-11-02 22:49:14] ✅ Fecha string convertida: 9/7/2018 -> 2018-09-07 (Campo: fecha_susc)
[2025-11-02 22:49:14] ✅ Fecha string convertida: 1/1/2025 -> 2025-01-01 (Campo: fecha_asignacion)
[2025-11-02 22:49:14] ✅ Fecha string convertida: 1/27/2025 -> 2025-01-27 (Campo: fecha_proceso)
[2025-11-02 22:49:14] ✅ Fecha string convertida: 11/10/2024 -> 2024-11-10 (Campo: fecha_castigo)
[2025-11-02 22:49:14] ✅ Fecha string convertida: 4/5/2024 -> 2024-04-05 (Campo: fecha_pago)
[2025-11-02 22:49:14] ✅ Fecha string convertida: 5/10/2024 -> 2024-05-10 (Campo: fecha_vencimiento)
[2025-11-02 22:49:14] ✅ Fecha string convertida: 5/5/2003 -> 2003-05-05 (Campo: fecha_susc)
[2025-11-02 22:49:14] ✅ Fecha string convertida: 1/1/2025 -> 2025-01-01 (Campo: fecha_asignacion)
[2025-11-02 22:49:14] ✅ Fecha string convertida: 1/27/2025 -> 2025-01-27 (Campo: fecha_proceso)
[2025-11-02 22:49:14] ✅ Fecha string convertida: 11/15/2024 -> 2024-11-15 (Campo: fecha_castigo)
[2025-11-02 22:49:14] ✅ Fecha string convertida: 4/17/2024 -> 2024-04-17 (Campo: fecha_pago)
[2025-11-02 22:49:14] ✅ Fecha string convertida: 5/15/2024 -> 2024-05-15 (Campo: fecha_vencimiento)
[2025-11-02 22:49:14] ✅ Fecha string convertida: 12/22/2018 -> 2018-12-22 (Campo: fecha_susc)
[2025-11-02 22:49:14] ✅ Fecha string convertida: 1/1/2025 -> 2025-01-01 (Campo: fecha_asignacion)
[2025-11-02 22:49:14] ✅ Fecha string convertida: 1/27/2025 -> 2025-01-27 (Campo: fecha_proceso)
[2025-11-02 22:49:14] ✅ Fecha string convertida: 11/25/2024 -> 2024-11-25 (Campo: fecha_castigo)
[2025-11-02 22:49:14] ✅ Fecha string convertida: 8/22/2024 -> 2024-08-22 (Campo: fecha_pago)
[2025-11-02 22:49:14] ✅ Fecha string convertida: 5/25/2024 -> 2024-05-25 (Campo: fecha_vencimiento)
[2025-11-02 22:49:14] ✅ Fecha string convertida: 12/15/2022 -> 2022-12-15 (Campo: fecha_susc)
[2025-11-02 22:49:14] ✅ Fecha string convertida: 1/1/2025 -> 2025-01-01 (Campo: fecha_asignacion)
[2025-11-02 22:49:14] ✅ Fecha string convertida: 1/27/2025 -> 2025-01-27 (Campo: fecha_proceso)
[2025-11-02 22:49:14] ✅ Fecha string convertida: 12/5/2024 -> 2024-12-05 (Campo: fecha_castigo)
[2025-11-02 22:49:14] ✅ Fecha string convertida: 5/25/2024 -> 2024-05-25 (Campo: fecha_pago)
[2025-11-02 22:49:14] ✅ Fecha string convertida: 6/5/2024 -> 2024-06-05 (Campo: fecha_vencimiento)
[2025-11-02 22:49:14] ✅ Fecha string convertida: 8/21/2010 -> 2010-08-21 (Campo: fecha_susc)
[2025-11-02 22:49:14] ✅ Fecha string convertida: 2/1/2025 -> 2025-02-01 (Campo: fecha_asignacion)
[2025-11-02 22:49:14] ✅ Fecha string convertida: 1/27/2025 -> 2025-01-27 (Campo: fecha_proceso)
[2025-11-02 22:49:14] ✅ Fecha string convertida: 12/5/2024 -> 2024-12-05 (Campo: fecha_castigo)
[2025-11-02 22:49:14] ✅ Fecha string convertida: 8/1/2024 -> 2024-08-01 (Campo: fecha_pago)
[2025-11-02 22:49:14] ✅ Fecha string convertida: 6/5/2024 -> 2024-06-05 (Campo: fecha_vencimiento)
[2025-11-02 22:49:14] ✅ Fecha string convertida: 3/10/2023 -> 2023-03-10 (Campo: fecha_susc)
[2025-11-02 22:49:14] ✅ Fecha string convertida: 2/1/2025 -> 2025-02-01 (Campo: fecha_asignacion)
[2025-11-02 22:49:14] ✅ Fecha string convertida: 1/27/2025 -> 2025-01-27 (Campo: fecha_proceso)
[2025-11-02 22:49:14] ✅ Fecha string convertida: 12/5/2024 -> 2024-12-05 (Campo: fecha_castigo)
[2025-11-02 22:49:14] ✅ Fecha string convertida: 5/20/2024 -> 2024-05-20 (Campo: fecha_pago)
[2025-11-02 22:49:14] ✅ Fecha string convertida: 6/5/2024 -> 2024-06-05 (Campo: fecha_vencimiento)
[2025-11-02 22:49:14] ✅ Fecha string convertida: 12/16/2012 -> 2012-12-16 (Campo: fecha_susc)
[2025-11-02 22:49:14] ✅ Fecha string convertida: 2/1/2025 -> 2025-02-01 (Campo: fecha_asignacion)
[2025-11-02 22:49:14] ✅ Fecha string convertida: 1/27/2025 -> 2025-01-27 (Campo: fecha_proceso)
[2025-11-02 22:49:14] ✅ Fecha string convertida: 12/5/2024 -> 2024-12-05 (Campo: fecha_castigo)
[2025-11-02 22:49:14] ✅ Fecha string convertida: 4/28/2024 -> 2024-04-28 (Campo: fecha_pago)
[2025-11-02 22:49:14] ✅ Fecha string convertida: 6/5/2024 -> 2024-06-05 (Campo: fecha_vencimiento)
[2025-11-02 22:49:14] ✅ Fecha string convertida: 12/18/2020 -> 2020-12-18 (Campo: fecha_susc)
[2025-11-02 22:49:14] ✅ Fecha string convertida: 2/1/2025 -> 2025-02-01 (Campo: fecha_asignacion)
[2025-11-02 22:49:14] ✅ Fecha string convertida: 1/27/2025 -> 2025-01-27 (Campo: fecha_proceso)
[2025-11-02 22:49:14] ✅ Fecha string convertida: 12/5/2024 -> 2024-12-05 (Campo: fecha_castigo)
[2025-11-02 22:49:14] ✅ Fecha string convertida: 5/2/2024 -> 2024-05-02 (Campo: fecha_pago)
[2025-11-02 22:49:14] ✅ Fecha string convertida: 6/5/2024 -> 2024-06-05 (Campo: fecha_vencimiento)
[2025-11-02 22:49:14] ✅ Fecha string convertida: 6/15/2022 -> 2022-06-15 (Campo: fecha_susc)
[2025-11-02 22:49:14] ✅ Fecha string convertida: 2/1/2025 -> 2025-02-01 (Campo: fecha_asignacion)
[2025-11-02 22:49:14] ✅ Fecha string convertida: 1/27/2025 -> 2025-01-27 (Campo: fecha_proceso)
[2025-11-02 22:49:14] ✅ Fecha string convertida: 12/5/2024 -> 2024-12-05 (Campo: fecha_castigo)
[2025-11-02 22:49:14] ✅ Fecha string convertida: 6/18/2024 -> 2024-06-18 (Campo: fecha_pago)
[2025-11-02 22:49:14] ✅ Fecha string convertida: 6/5/2024 -> 2024-06-05 (Campo: fecha_vencimiento)
[2025-11-02 22:49:14] ✅ Fecha string convertida: 2/6/2017 -> 2017-02-06 (Campo: fecha_susc)
[2025-11-02 22:49:14] ✅ Fecha string convertida: 2/1/2025 -> 2025-02-01 (Campo: fecha_asignacion)
[2025-11-02 22:49:14] ✅ Fecha string convertida: 1/27/2025 -> 2025-01-27 (Campo: fecha_proceso)
[2025-11-02 22:49:14] ✅ Fecha string convertida: 12/5/2024 -> 2024-12-05 (Campo: fecha_castigo)
[2025-11-02 22:49:14] ✅ Fecha string convertida: 5/8/2024 -> 2024-05-08 (Campo: fecha_pago)
[2025-11-02 22:49:14] ✅ Fecha string convertida: 6/5/2024 -> 2024-06-05 (Campo: fecha_vencimiento)
[2025-11-02 22:49:14] ✅ Fecha string convertida: 4/13/2007 -> 2007-04-13 (Campo: fecha_susc)
[2025-11-02 22:49:14] ✅ Fecha string convertida: 2/1/2025 -> 2025-02-01 (Campo: fecha_asignacion)
[2025-11-02 22:49:14] ✅ Fecha string convertida: 1/27/2025 -> 2025-01-27 (Campo: fecha_proceso)
[2025-11-02 22:49:14] ✅ Fecha string convertida: 12/5/2024 -> 2024-12-05 (Campo: fecha_castigo)
[2025-11-02 22:49:14] ✅ Fecha string convertida: 6/5/2024 -> 2024-06-05 (Campo: fecha_vencimiento)
[2025-11-02 22:49:14] ✅ Fecha string convertida: 6/15/2014 -> 2014-06-15 (Campo: fecha_susc)
[2025-11-02 22:49:14] ✅ Fecha string convertida: 2/1/2025 -> 2025-02-01 (Campo: fecha_asignacion)
[2025-11-02 22:49:14] ✅ Fecha string convertida: 1/27/2025 -> 2025-01-27 (Campo: fecha_proceso)
[2025-11-02 22:49:14] ✅ Fecha string convertida: 12/5/2024 -> 2024-12-05 (Campo: fecha_castigo)
[2025-11-02 22:49:14] ✅ Fecha string convertida: 1/5/2024 -> 2024-01-05 (Campo: fecha_pago)
[2025-11-02 22:49:14] ✅ Fecha string convertida: 6/5/2024 -> 2024-06-05 (Campo: fecha_vencimiento)
[2025-11-02 22:49:14] ✅ Fecha string convertida: 5/19/2021 -> 2021-05-19 (Campo: fecha_susc)
[2025-11-02 22:49:14] ✅ Fecha string convertida: 2/1/2025 -> 2025-02-01 (Campo: fecha_asignacion)
[2025-11-02 22:49:14] ✅ Fecha string convertida: 1/27/2025 -> 2025-01-27 (Campo: fecha_proceso)
[2025-11-02 22:49:14] ✅ Fecha string convertida: 12/5/2024 -> 2024-12-05 (Campo: fecha_castigo)
[2025-11-02 22:49:14] ✅ Fecha string convertida: 5/16/2024 -> 2024-05-16 (Campo: fecha_pago)
[2025-11-02 22:49:14] ✅ Fecha string convertida: 6/5/2024 -> 2024-06-05 (Campo: fecha_vencimiento)
[2025-11-02 22:49:14] ✅ Fecha string convertida: 8/25/2011 -> 2011-08-25 (Campo: fecha_susc)
[2025-11-02 22:49:14] ✅ Fecha string convertida: 2/1/2025 -> 2025-02-01 (Campo: fecha_asignacion)
[2025-11-02 22:49:14] ✅ Fecha string convertida: 1/27/2025 -> 2025-01-27 (Campo: fecha_proceso)
[2025-11-02 22:49:14] ✅ Fecha string convertida: 12/5/2024 -> 2024-12-05 (Campo: fecha_castigo)
[2025-11-02 22:49:14] ✅ Fecha string convertida: 5/10/2024 -> 2024-05-10 (Campo: fecha_pago)
[2025-11-02 22:49:14] ✅ Fecha string convertida: 6/5/2024 -> 2024-06-05 (Campo: fecha_vencimiento)
[2025-11-02 22:49:14] ✅ Fecha string convertida: 9/14/2013 -> 2013-09-14 (Campo: fecha_susc)
[2025-11-02 22:49:14] ✅ Fecha string convertida: 2/1/2025 -> 2025-02-01 (Campo: fecha_asignacion)
[2025-11-02 22:49:14] ✅ Fecha string convertida: 1/27/2025 -> 2025-01-27 (Campo: fecha_proceso)
[2025-11-02 22:49:14] ✅ Fecha string convertida: 12/5/2024 -> 2024-12-05 (Campo: fecha_castigo)
[2025-11-02 22:49:14] ✅ Fecha string convertida: 5/9/2024 -> 2024-05-09 (Campo: fecha_pago)
[2025-11-02 22:49:14] ✅ Fecha string convertida: 6/5/2024 -> 2024-06-05 (Campo: fecha_vencimiento)
[2025-11-02 22:49:14] ✅ Fecha string convertida: 11/11/2009 -> 2009-11-11 (Campo: fecha_susc)
[2025-11-02 22:49:14] ✅ Fecha string convertida: 2/1/2025 -> 2025-02-01 (Campo: fecha_asignacion)
[2025-11-02 22:49:14] ✅ Fecha string convertida: 1/27/2025 -> 2025-01-27 (Campo: fecha_proceso)
[2025-11-02 22:49:14] ✅ Fecha string convertida: 12/5/2024 -> 2024-12-05 (Campo: fecha_castigo)
[2025-11-02 22:49:14] ✅ Fecha string convertida: 6/6/2024 -> 2024-06-06 (Campo: fecha_pago)
[2025-11-02 22:49:14] ✅ Fecha string convertida: 6/5/2024 -> 2024-06-05 (Campo: fecha_vencimiento)
[2025-11-02 22:49:14] ✅ Fecha string convertida: 1/11/2014 -> 2014-01-11 (Campo: fecha_susc)
[2025-11-02 22:49:14] ✅ Fecha string convertida: 2/1/2025 -> 2025-02-01 (Campo: fecha_asignacion)
[2025-11-02 22:49:14] ✅ Fecha string convertida: 1/27/2025 -> 2025-01-27 (Campo: fecha_proceso)
[2025-11-02 22:49:14] ✅ Fecha string convertida: 12/10/2024 -> 2024-12-10 (Campo: fecha_castigo)
[2025-11-02 22:49:14] ✅ Fecha string convertida: 9/30/2024 -> 2024-09-30 (Campo: fecha_pago)
[2025-11-02 22:49:14] ✅ Fecha string convertida: 6/10/2024 -> 2024-06-10 (Campo: fecha_vencimiento)
[2025-11-02 22:49:14] ✅ Fecha string convertida: 8/3/2013 -> 2013-08-03 (Campo: fecha_susc)
[2025-11-02 22:49:14] ✅ Fecha string convertida: 2/1/2025 -> 2025-02-01 (Campo: fecha_asignacion)
[2025-11-02 22:49:14] ✅ Fecha string convertida: 1/27/2025 -> 2025-01-27 (Campo: fecha_proceso)
[2025-11-02 22:49:14] ✅ Fecha string convertida: 12/15/2024 -> 2024-12-15 (Campo: fecha_castigo)
[2025-11-02 22:49:14] ✅ Fecha string convertida: 5/14/2024 -> 2024-05-14 (Campo: fecha_pago)
[2025-11-02 22:49:14] ✅ Fecha string convertida: 6/15/2024 -> 2024-06-15 (Campo: fecha_vencimiento)
[2025-11-02 22:49:14] ✅ Fecha string convertida: 2/3/2020 -> 2020-02-03 (Campo: fecha_susc)
[2025-11-02 22:49:14] ✅ Fecha string convertida: 2/1/2025 -> 2025-02-01 (Campo: fecha_asignacion)
[2025-11-02 22:49:14] ✅ Fecha string convertida: 1/27/2025 -> 2025-01-27 (Campo: fecha_proceso)
[2025-11-02 22:49:14] ✅ Fecha string convertida: 12/20/2024 -> 2024-12-20 (Campo: fecha_castigo)
[2025-11-02 22:49:14] ✅ Fecha string convertida: 7/1/2024 -> 2024-07-01 (Campo: fecha_pago)
[2025-11-02 22:49:14] ✅ Fecha string convertida: 6/20/2024 -> 2024-06-20 (Campo: fecha_vencimiento)
[2025-11-02 22:49:14] ✅ Fecha string convertida: 9/23/2019 -> 2019-09-23 (Campo: fecha_susc)
[2025-11-02 22:49:14] ✅ Fecha string convertida: 2/1/2025 -> 2025-02-01 (Campo: fecha_asignacion)
[2025-11-02 22:49:14] ✅ Fecha string convertida: 1/27/2025 -> 2025-01-27 (Campo: fecha_proceso)
[2025-11-02 22:49:14] ✅ Fecha string convertida: 12/30/2024 -> 2024-12-30 (Campo: fecha_castigo)
[2025-11-02 22:49:14] ✅ Fecha string convertida: 6/30/2024 -> 2024-06-30 (Campo: fecha_vencimiento)
[2025-11-02 22:49:14] ✅ Fecha string convertida: 11/6/2023 -> 2023-11-06 (Campo: fecha_susc)
[2025-11-02 22:49:14] ✅ Fecha string convertida: 2/1/2025 -> 2025-02-01 (Campo: fecha_asignacion)
[2025-11-02 22:49:14] ✅ Fecha string convertida: 1/27/2025 -> 2025-01-27 (Campo: fecha_proceso)
[2025-11-02 22:49:14] ✅ Fecha string convertida: 12/30/2024 -> 2024-12-30 (Campo: fecha_castigo)
[2025-11-02 22:49:14] ✅ Fecha string convertida: 7/9/2024 -> 2024-07-09 (Campo: fecha_pago)
[2025-11-02 22:49:14] ✅ Fecha string convertida: 6/30/2024 -> 2024-06-30 (Campo: fecha_vencimiento)
[2025-11-02 22:49:14] ✅ Fecha string convertida: 8/11/2019 -> 2019-08-11 (Campo: fecha_susc)
[2025-11-02 22:49:14] ✅ Fecha string convertida: 2/1/2025 -> 2025-02-01 (Campo: fecha_asignacion)
[2025-11-02 22:49:14] ✅ Fecha string convertida: 2/24/2025 -> 2025-02-24 (Campo: fecha_proceso)
[2025-11-02 22:49:14] ✅ Fecha string convertida: 1/5/2025 -> 2025-01-05 (Campo: fecha_castigo)
[2025-11-02 22:49:14] ✅ Fecha string convertida: 7/5/2024 -> 2024-07-05 (Campo: fecha_vencimiento)
[2025-11-02 22:49:14] ✅ Fecha string convertida: 4/22/2024 -> 2024-04-22 (Campo: fecha_susc)
[2025-11-02 22:49:14] ✅ Fecha string convertida: 3/1/2025 -> 2025-03-01 (Campo: fecha_asignacion)
[2025-11-02 22:49:14] ✅ Fecha string convertida: 2/24/2025 -> 2025-02-24 (Campo: fecha_proceso)
[2025-11-02 22:49:14] ✅ Fecha string convertida: 1/5/2025 -> 2025-01-05 (Campo: fecha_castigo)
[2025-11-02 22:49:14] ✅ Fecha string convertida: 5/31/2024 -> 2024-05-31 (Campo: fecha_pago)
[2025-11-02 22:49:14] ✅ Fecha string convertida: 7/5/2024 -> 2024-07-05 (Campo: fecha_vencimiento)
[2025-11-02 22:49:14] ✅ Fecha string convertida: 8/9/2023 -> 2023-08-09 (Campo: fecha_susc)
[2025-11-02 22:49:14] ✅ Fecha string convertida: 3/1/2025 -> 2025-03-01 (Campo: fecha_asignacion)
[2025-11-02 22:49:14] ✅ Fecha string convertida: 2/24/2025 -> 2025-02-24 (Campo: fecha_proceso)
[2025-11-02 22:49:14] ✅ Fecha string convertida: 1/5/2025 -> 2025-01-05 (Campo: fecha_castigo)
[2025-11-02 22:49:14] ✅ Fecha string convertida: 8/21/2024 -> 2024-08-21 (Campo: fecha_pago)
[2025-11-02 22:49:14] ✅ Fecha string convertida: 7/5/2024 -> 2024-07-05 (Campo: fecha_vencimiento)
[2025-11-02 22:49:14] ✅ Fecha string convertida: 12/4/2021 -> 2021-12-04 (Campo: fecha_susc)
[2025-11-02 22:49:14] ✅ Fecha string convertida: 3/1/2025 -> 2025-03-01 (Campo: fecha_asignacion)
[2025-11-02 22:49:14] ✅ Fecha string convertida: 2/24/2025 -> 2025-02-24 (Campo: fecha_proceso)
[2025-11-02 22:49:14] ✅ Fecha string convertida: 1/5/2025 -> 2025-01-05 (Campo: fecha_castigo)
[2025-11-02 22:49:14] ✅ Fecha string convertida: 6/11/2024 -> 2024-06-11 (Campo: fecha_pago)
[2025-11-02 22:49:14] ✅ Fecha string convertida: 7/5/2024 -> 2024-07-05 (Campo: fecha_vencimiento)
[2025-11-02 22:49:15] ✅ Fecha string convertida: 5/2/2024 -> 2024-05-02 (Campo: fecha_susc)
[2025-11-02 22:49:15] ✅ Fecha string convertida: 3/1/2025 -> 2025-03-01 (Campo: fecha_asignacion)
[2025-11-02 22:49:15] ✅ Fecha string convertida: 2/24/2025 -> 2025-02-24 (Campo: fecha_proceso)
[2025-11-02 22:49:15] ✅ Fecha string convertida: 1/5/2025 -> 2025-01-05 (Campo: fecha_castigo)
[2025-11-02 22:49:15] ✅ Fecha string convertida: 7/19/2024 -> 2024-07-19 (Campo: fecha_pago)
[2025-11-02 22:49:15] ✅ Fecha string convertida: 7/5/2024 -> 2024-07-05 (Campo: fecha_vencimiento)
[2025-11-02 22:49:15] ✅ Fecha string convertida: 8/17/2021 -> 2021-08-17 (Campo: fecha_susc)
[2025-11-02 22:49:15] ✅ Fecha string convertida: 3/1/2025 -> 2025-03-01 (Campo: fecha_asignacion)
[2025-11-02 22:49:15] ✅ Fecha string convertida: 2/24/2025 -> 2025-02-24 (Campo: fecha_proceso)
[2025-11-02 22:49:15] ✅ Fecha string convertida: 1/20/2025 -> 2025-01-20 (Campo: fecha_castigo)
[2025-11-02 22:49:15] ✅ DV con valor '0' - ES VÁLIDO
[2025-11-02 22:49:15] ✅ Fecha string convertida: 10/23/2024 -> 2024-10-23 (Campo: fecha_pago)
[2025-11-02 22:49:15] ✅ Fecha string convertida: 7/20/2024 -> 2024-07-20 (Campo: fecha_vencimiento)
[2025-11-02 22:49:15] ✅ Fecha string convertida: 12/17/2020 -> 2020-12-17 (Campo: fecha_susc)
[2025-11-02 22:49:15] ✅ Fecha string convertida: 3/1/2025 -> 2025-03-01 (Campo: fecha_asignacion)
[2025-11-02 22:49:15] ✅ Fecha string convertida: 2/24/2025 -> 2025-02-24 (Campo: fecha_proceso)
[2025-11-02 22:49:15] ✅ Fecha string convertida: 1/5/2025 -> 2025-01-05 (Campo: fecha_castigo)
[2025-11-02 22:49:15] ✅ Fecha string convertida: 5/30/2024 -> 2024-05-30 (Campo: fecha_pago)
[2025-11-02 22:49:15] ✅ Fecha string convertida: 7/5/2024 -> 2024-07-05 (Campo: fecha_vencimiento)
[2025-11-02 22:49:15] ✅ Fecha string convertida: 10/18/2017 -> 2017-10-18 (Campo: fecha_susc)
[2025-11-02 22:49:15] ✅ Fecha string convertida: 3/1/2025 -> 2025-03-01 (Campo: fecha_asignacion)
[2025-11-02 22:49:15] ✅ Fecha string convertida: 2/24/2025 -> 2025-02-24 (Campo: fecha_proceso)
[2025-11-02 22:49:15] ✅ Fecha string convertida: 1/20/2025 -> 2025-01-20 (Campo: fecha_castigo)
[2025-11-02 22:49:15] ✅ Fecha string convertida: 8/12/2024 -> 2024-08-12 (Campo: fecha_pago)
[2025-11-02 22:49:15] ✅ Fecha string convertida: 7/20/2024 -> 2024-07-20 (Campo: fecha_vencimiento)
[2025-11-02 22:49:15] ✅ Fecha string convertida: 11/4/2001 -> 2001-11-04 (Campo: fecha_susc)
[2025-11-02 22:49:15] ✅ Fecha string convertida: 3/1/2025 -> 2025-03-01 (Campo: fecha_asignacion)
[2025-11-02 22:49:15] ✅ Fecha string convertida: 2/24/2025 -> 2025-02-24 (Campo: fecha_proceso)
[2025-11-02 22:49:15] ✅ Fecha string convertida: 1/15/2025 -> 2025-01-15 (Campo: fecha_castigo)
[2025-11-02 22:49:15] ✅ Fecha string convertida: 7/10/2024 -> 2024-07-10 (Campo: fecha_pago)
[2025-11-02 22:49:15] ✅ Fecha string convertida: 7/15/2024 -> 2024-07-15 (Campo: fecha_vencimiento)
[2025-11-02 22:49:15] ✅ Fecha string convertida: 8/4/2017 -> 2017-08-04 (Campo: fecha_susc)
[2025-11-02 22:49:15] ✅ Fecha string convertida: 3/1/2025 -> 2025-03-01 (Campo: fecha_asignacion)
[2025-11-02 22:49:15] ✅ Fecha string convertida: 2/24/2025 -> 2025-02-24 (Campo: fecha_proceso)
[2025-11-02 22:49:15] ✅ Fecha string convertida: 1/10/2025 -> 2025-01-10 (Campo: fecha_castigo)
[2025-11-02 22:49:15] ✅ Fecha string convertida: 6/26/2024 -> 2024-06-26 (Campo: fecha_pago)
[2025-11-02 22:49:15] ✅ Fecha string convertida: 7/10/2024 -> 2024-07-10 (Campo: fecha_vencimiento)
[2025-11-02 22:49:15] ✅ Fecha string convertida: 10/27/2017 -> 2017-10-27 (Campo: fecha_susc)
[2025-11-02 22:49:15] ✅ Valor convertido a DECIMAL: '$ 2,006,338' -> 2006338
[2025-11-02 22:49:15] ✅ Fecha string convertida: 3/1/2025 -> 2025-03-01 (Campo: fecha_asignacion)
[2025-11-02 22:49:15] ✅ Fecha string convertida: 2/24/2025 -> 2025-02-24 (Campo: fecha_proceso)
[2025-11-02 22:49:15] ✅ Fecha string convertida: 1/10/2025 -> 2025-01-10 (Campo: fecha_castigo)
[2025-11-02 22:49:15] ✅ Fecha string convertida: 7/22/2024 -> 2024-07-22 (Campo: fecha_pago)
[2025-11-02 22:49:15] ✅ Fecha string convertida: 7/10/2024 -> 2024-07-10 (Campo: fecha_vencimiento)
[2025-11-02 22:49:15] ✅ Fecha string convertida: 1/15/2013 -> 2013-01-15 (Campo: fecha_susc)
[2025-11-02 22:49:15] ✅ Fecha string convertida: 3/1/2025 -> 2025-03-01 (Campo: fecha_asignacion)
[2025-11-02 22:49:15] ✅ Fecha string convertida: 2/24/2025 -> 2025-02-24 (Campo: fecha_proceso)
[2025-11-02 22:49:15] ✅ Fecha string convertida: 1/30/2025 -> 2025-01-30 (Campo: fecha_castigo)
[2025-11-02 22:49:15] ✅ Fecha string convertida: 7/4/2024 -> 2024-07-04 (Campo: fecha_pago)
[2025-11-02 22:49:15] ✅ Fecha string convertida: 7/30/2024 -> 2024-07-30 (Campo: fecha_vencimiento)
[2025-11-02 22:49:15] ✅ Fecha string convertida: 8/21/2006 -> 2006-08-21 (Campo: fecha_susc)
[2025-11-02 22:49:15] ✅ Fecha string convertida: 3/1/2025 -> 2025-03-01 (Campo: fecha_asignacion)
[2025-11-02 22:49:15] ✅ Fecha string convertida: 2/24/2025 -> 2025-02-24 (Campo: fecha_proceso)
[2025-11-02 22:49:15] ✅ Fecha string convertida: 1/25/2025 -> 2025-01-25 (Campo: fecha_castigo)
[2025-11-02 22:49:15] ✅ Fecha string convertida: 6/30/2024 -> 2024-06-30 (Campo: fecha_pago)
[2025-11-02 22:49:15] ✅ Fecha string convertida: 7/25/2024 -> 2024-07-25 (Campo: fecha_vencimiento)
[2025-11-02 22:49:15] ✅ Fecha string convertida: 12/8/2023 -> 2023-12-08 (Campo: fecha_susc)
[2025-11-02 22:49:15] ✅ Fecha string convertida: 3/1/2025 -> 2025-03-01 (Campo: fecha_asignacion)
[2025-11-02 22:49:15] ✅ Fecha string convertida: 2/24/2025 -> 2025-02-24 (Campo: fecha_proceso)
[2025-11-02 22:49:15] ✅ Fecha string convertida: 1/10/2025 -> 2025-01-10 (Campo: fecha_castigo)
[2025-11-02 22:49:15] ✅ Fecha string convertida: 7/10/2024 -> 2024-07-10 (Campo: fecha_vencimiento)
[2025-11-02 22:49:15] ✅ Fecha string convertida: 2/9/2019 -> 2019-02-09 (Campo: fecha_susc)
[2025-11-02 22:49:15] ✅ Fecha string convertida: 3/1/2025 -> 2025-03-01 (Campo: fecha_asignacion)
[2025-11-02 22:49:15] ✅ Fecha string convertida: 3/27/2025 -> 2025-03-27 (Campo: fecha_proceso)
[2025-11-02 22:49:15] ✅ Fecha string convertida: 2/25/2025 -> 2025-02-25 (Campo: fecha_castigo)
[2025-11-02 22:49:15] ✅ Fecha string convertida: 7/5/2024 -> 2024-07-05 (Campo: fecha_pago)
[2025-11-02 22:49:15] ✅ Fecha string convertida: 8/25/2024 -> 2024-08-25 (Campo: fecha_vencimiento)
[2025-11-02 22:49:15] ✅ Fecha string convertida: 11/4/2000 -> 2000-11-04 (Campo: fecha_susc)
[2025-11-02 22:49:15] ✅ Fecha string convertida: 4/1/2025 -> 2025-04-01 (Campo: fecha_asignacion)
[2025-11-02 22:49:15] ✅ Fecha string convertida: 3/27/2025 -> 2025-03-27 (Campo: fecha_proceso)
[2025-11-02 22:49:15] ✅ Fecha string convertida: 2/5/2025 -> 2025-02-05 (Campo: fecha_castigo)
[2025-11-02 22:49:15] ✅ DV con valor '0' - ES VÁLIDO
[2025-11-02 22:49:15] ✅ Fecha string convertida: 6/26/2024 -> 2024-06-26 (Campo: fecha_pago)
[2025-11-02 22:49:15] ✅ Fecha string convertida: 8/5/2024 -> 2024-08-05 (Campo: fecha_vencimiento)
[2025-11-02 22:49:15] ✅ Fecha string convertida: 12/31/2019 -> 2019-12-31 (Campo: fecha_susc)
[2025-11-02 22:49:15] ✅ Fecha string convertida: 4/1/2025 -> 2025-04-01 (Campo: fecha_asignacion)
[2025-11-02 22:49:15] ✅ Fecha string convertida: 3/27/2025 -> 2025-03-27 (Campo: fecha_proceso)
[2025-11-02 22:49:15] ✅ Fecha string convertida: 2/20/2025 -> 2025-02-20 (Campo: fecha_castigo)
[2025-11-02 22:49:15] ✅ Fecha string convertida: 7/24/2024 -> 2024-07-24 (Campo: fecha_pago)
[2025-11-02 22:49:15] ✅ Fecha string convertida: 8/20/2024 -> 2024-08-20 (Campo: fecha_vencimiento)
[2025-11-02 22:49:15] ✅ Fecha string convertida: 10/19/2021 -> 2021-10-19 (Campo: fecha_susc)
[2025-11-02 22:49:15] ✅ Fecha string convertida: 4/1/2025 -> 2025-04-01 (Campo: fecha_asignacion)
[2025-11-02 22:49:15] ✅ Fecha string convertida: 3/27/2025 -> 2025-03-27 (Campo: fecha_proceso)
[2025-11-02 22:49:15] ✅ Fecha string convertida: 2/10/2025 -> 2025-02-10 (Campo: fecha_castigo)
[2025-11-02 22:49:15] ✅ Fecha string convertida: 7/7/2024 -> 2024-07-07 (Campo: fecha_pago)
[2025-11-02 22:49:15] ✅ Fecha string convertida: 8/10/2024 -> 2024-08-10 (Campo: fecha_vencimiento)
[2025-11-02 22:49:15] ✅ Fecha string convertida: 2/18/2021 -> 2021-02-18 (Campo: fecha_susc)
[2025-11-02 22:49:15] ✅ Fecha string convertida: 4/1/2025 -> 2025-04-01 (Campo: fecha_asignacion)
[2025-11-02 22:49:15] ✅ Fecha string convertida: 3/27/2025 -> 2025-03-27 (Campo: fecha_proceso)
[2025-11-02 22:49:15] ✅ Fecha string convertida: 2/5/2025 -> 2025-02-05 (Campo: fecha_castigo)
[2025-11-02 22:49:15] ✅ Fecha string convertida: 10/14/2024 -> 2024-10-14 (Campo: fecha_pago)
[2025-11-02 22:49:15] ✅ Fecha string convertida: 8/5/2024 -> 2024-08-05 (Campo: fecha_vencimiento)
[2025-11-02 22:49:15] ✅ Fecha string convertida: 9/21/2023 -> 2023-09-21 (Campo: fecha_susc)
[2025-11-02 22:49:15] ✅ Fecha string convertida: 4/1/2025 -> 2025-04-01 (Campo: fecha_asignacion)
[2025-11-02 22:49:15] ✅ Fecha string convertida: 3/27/2025 -> 2025-03-27 (Campo: fecha_proceso)
[2025-11-02 22:49:15] ✅ Fecha string convertida: 2/5/2025 -> 2025-02-05 (Campo: fecha_castigo)
[2025-11-02 22:49:15] ✅ Fecha string convertida: 10/31/2024 -> 2024-10-31 (Campo: fecha_pago)
[2025-11-02 22:49:15] ✅ Fecha string convertida: 8/5/2024 -> 2024-08-05 (Campo: fecha_vencimiento)
[2025-11-02 22:49:15] ✅ Fecha string convertida: 3/6/2022 -> 2022-03-06 (Campo: fecha_susc)
[2025-11-02 22:49:15] ✅ Fecha string convertida: 4/1/2025 -> 2025-04-01 (Campo: fecha_asignacion)
[2025-11-02 22:49:15] ✅ Fecha string convertida: 3/27/2025 -> 2025-03-27 (Campo: fecha_proceso)
[2025-11-02 22:49:15] ✅ Fecha string convertida: 2/15/2025 -> 2025-02-15 (Campo: fecha_castigo)
[2025-11-02 22:49:15] ✅ Fecha string convertida: 7/5/2024 -> 2024-07-05 (Campo: fecha_pago)
[2025-11-02 22:49:15] ✅ Fecha string convertida: 8/15/2024 -> 2024-08-15 (Campo: fecha_vencimiento)
[2025-11-02 22:49:15] ✅ Fecha string convertida: 3/18/2013 -> 2013-03-18 (Campo: fecha_susc)
[2025-11-02 22:49:15] ✅ Fecha string convertida: 4/1/2025 -> 2025-04-01 (Campo: fecha_asignacion)
[2025-11-02 22:49:15] ✅ Fecha string convertida: 3/27/2025 -> 2025-03-27 (Campo: fecha_proceso)
[2025-11-02 22:49:15] ✅ Fecha string convertida: 2/20/2025 -> 2025-02-20 (Campo: fecha_castigo)
[2025-11-02 22:49:15] ✅ Fecha string convertida: 7/13/2024 -> 2024-07-13 (Campo: fecha_pago)
[2025-11-02 22:49:15] ✅ Fecha string convertida: 8/20/2024 -> 2024-08-20 (Campo: fecha_vencimiento)
[2025-11-02 22:49:15] ✅ Fecha string convertida: 10/31/2007 -> 2007-10-31 (Campo: fecha_susc)
[2025-11-02 22:49:15] ✅ Fecha string convertida: 4/1/2025 -> 2025-04-01 (Campo: fecha_asignacion)
[2025-11-02 22:49:15] ✅ Fecha string convertida: 3/27/2025 -> 2025-03-27 (Campo: fecha_proceso)
[2025-11-02 22:49:15] ✅ Fecha string convertida: 2/5/2025 -> 2025-02-05 (Campo: fecha_castigo)
[2025-11-02 22:49:15] ✅ Fecha string convertida: 7/10/2024 -> 2024-07-10 (Campo: fecha_pago)
[2025-11-02 22:49:15] ✅ Fecha string convertida: 8/5/2024 -> 2024-08-05 (Campo: fecha_vencimiento)
[2025-11-02 22:49:15] ✅ Fecha string convertida: 6/24/2014 -> 2014-06-24 (Campo: fecha_susc)
[2025-11-02 22:49:15] ✅ Fecha string convertida: 4/1/2025 -> 2025-04-01 (Campo: fecha_asignacion)
[2025-11-02 22:49:15] ✅ Fecha string convertida: 3/27/2025 -> 2025-03-27 (Campo: fecha_proceso)
[2025-11-02 22:49:15] ✅ Fecha string convertida: 2/20/2025 -> 2025-02-20 (Campo: fecha_castigo)
[2025-11-02 22:49:15] ✅ Fecha string convertida: 7/1/2024 -> 2024-07-01 (Campo: fecha_pago)
[2025-11-02 22:49:15] ✅ Fecha string convertida: 8/20/2024 -> 2024-08-20 (Campo: fecha_vencimiento)
[2025-11-02 22:49:15] ✅ Fecha string convertida: 6/3/2018 -> 2018-06-03 (Campo: fecha_susc)
[2025-11-02 22:49:15] ✅ Fecha string convertida: 4/1/2025 -> 2025-04-01 (Campo: fecha_asignacion)
[2025-11-02 22:49:15] ✅ Fecha string convertida: 3/27/2025 -> 2025-03-27 (Campo: fecha_proceso)
[2025-11-02 22:49:15] ✅ Fecha string convertida: 2/5/2025 -> 2025-02-05 (Campo: fecha_castigo)
[2025-11-02 22:49:15] ✅ DV con valor '0' - ES VÁLIDO
[2025-11-02 22:49:15] ✅ Fecha string convertida: 8/5/2024 -> 2024-08-05 (Campo: fecha_vencimiento)
[2025-11-02 22:49:15] ✅ Fecha string convertida: 4/16/2024 -> 2024-04-16 (Campo: fecha_susc)
[2025-11-02 22:49:15] ✅ Fecha string convertida: 4/1/2025 -> 2025-04-01 (Campo: fecha_asignacion)
[2025-11-02 22:49:15] ✅ Fecha string convertida: 3/27/2025 -> 2025-03-27 (Campo: fecha_proceso)
[2025-11-02 22:49:15] ✅ Fecha string convertida: 2/25/2025 -> 2025-02-25 (Campo: fecha_castigo)
[2025-11-02 22:49:15] ✅ Fecha string convertida: 7/1/2024 -> 2024-07-01 (Campo: fecha_pago)
[2025-11-02 22:49:15] ✅ Fecha string convertida: 8/25/2024 -> 2024-08-25 (Campo: fecha_vencimiento)
[2025-11-02 22:49:15] ✅ Fecha string convertida: 7/29/2021 -> 2021-07-29 (Campo: fecha_susc)
[2025-11-02 22:49:15] ✅ Fecha string convertida: 4/1/2025 -> 2025-04-01 (Campo: fecha_asignacion)
[2025-11-02 22:49:15] ✅ Fecha string convertida: 3/27/2025 -> 2025-03-27 (Campo: fecha_proceso)
[2025-11-02 22:49:15] ✅ Fecha string convertida: 2/10/2025 -> 2025-02-10 (Campo: fecha_castigo)
[2025-11-02 22:49:15] ✅ DV con valor '0' - ES VÁLIDO
[2025-11-02 22:49:15] ✅ Fecha string convertida: 7/19/2024 -> 2024-07-19 (Campo: fecha_pago)
[2025-11-02 22:49:15] ✅ Fecha string convertida: 8/10/2024 -> 2024-08-10 (Campo: fecha_vencimiento)
[2025-11-02 22:49:15] ✅ Fecha string convertida: 5/22/2010 -> 2010-05-22 (Campo: fecha_susc)
[2025-11-02 22:49:15] ✅ Fecha string convertida: 4/1/2025 -> 2025-04-01 (Campo: fecha_asignacion)
[2025-11-02 22:49:15] ✅ Fecha string convertida: 4/28/2025 -> 2025-04-28 (Campo: fecha_proceso)
[2025-11-02 22:49:15] ✅ Fecha string convertida: 3/5/2025 -> 2025-03-05 (Campo: fecha_castigo)
[2025-11-02 22:49:15] ✅ Fecha string convertida: 7/27/2024 -> 2024-07-27 (Campo: fecha_pago)
[2025-11-02 22:49:15] ✅ Fecha string convertida: 9/5/2024 -> 2024-09-05 (Campo: fecha_vencimiento)
[2025-11-02 22:49:15] ✅ Fecha string convertida: 5/13/2017 -> 2017-05-13 (Campo: fecha_susc)
[2025-11-02 22:49:15] ✅ Fecha string convertida: 5/1/2025 -> 2025-05-01 (Campo: fecha_asignacion)
[2025-11-02 22:49:15] ✅ Fecha string convertida: 4/28/2025 -> 2025-04-28 (Campo: fecha_proceso)
[2025-11-02 22:49:15] ✅ Fecha string convertida: 3/5/2025 -> 2025-03-05 (Campo: fecha_castigo)
[2025-11-02 22:49:15] ✅ Fecha string convertida: 8/1/2024 -> 2024-08-01 (Campo: fecha_pago)
[2025-11-02 22:49:15] ✅ Fecha string convertida: 9/5/2024 -> 2024-09-05 (Campo: fecha_vencimiento)
[2025-11-02 22:49:15] ✅ Fecha string convertida: 4/4/2007 -> 2007-04-04 (Campo: fecha_susc)
[2025-11-02 22:49:15] ✅ Fecha string convertida: 5/1/2025 -> 2025-05-01 (Campo: fecha_asignacion)
[2025-11-02 22:49:15] ✅ Fecha string convertida: 4/28/2025 -> 2025-04-28 (Campo: fecha_proceso)
[2025-11-02 22:49:15] ✅ Fecha string convertida: 3/5/2025 -> 2025-03-05 (Campo: fecha_castigo)
[2025-11-02 22:49:15] ✅ Fecha string convertida: 8/9/2024 -> 2024-08-09 (Campo: fecha_pago)
[2025-11-02 22:49:15] ✅ Fecha string convertida: 9/5/2024 -> 2024-09-05 (Campo: fecha_vencimiento)
[2025-11-02 22:49:15] ✅ Fecha string convertida: 6/19/2019 -> 2019-06-19 (Campo: fecha_susc)
[2025-11-02 22:49:15] ✅ Fecha string convertida: 5/1/2025 -> 2025-05-01 (Campo: fecha_asignacion)
[2025-11-02 22:49:15] ✅ Fecha string convertida: 4/28/2025 -> 2025-04-28 (Campo: fecha_proceso)
[2025-11-02 22:49:15] ✅ Fecha string convertida: 3/15/2025 -> 2025-03-15 (Campo: fecha_castigo)
[2025-11-02 22:49:15] ✅ Fecha string convertida: 8/6/2024 -> 2024-08-06 (Campo: fecha_pago)
[2025-11-02 22:49:15] ✅ Fecha string convertida: 9/15/2024 -> 2024-09-15 (Campo: fecha_vencimiento)
[2025-11-02 22:49:15] ✅ Fecha string convertida: 2/27/2015 -> 2015-02-27 (Campo: fecha_susc)
[2025-11-02 22:49:15] ✅ Fecha string convertida: 5/1/2025 -> 2025-05-01 (Campo: fecha_asignacion)
[2025-11-02 22:49:15] ✅ Fecha string convertida: 4/28/2025 -> 2025-04-28 (Campo: fecha_proceso)
[2025-11-02 22:49:15] ✅ Fecha string convertida: 3/5/2025 -> 2025-03-05 (Campo: fecha_castigo)
[2025-11-02 22:49:15] ✅ Fecha string convertida: 8/5/2024 -> 2024-08-05 (Campo: fecha_pago)
[2025-11-02 22:49:15] ✅ Fecha string convertida: 9/5/2024 -> 2024-09-05 (Campo: fecha_vencimiento)
[2025-11-02 22:49:15] ✅ Fecha string convertida: 2/4/1997 -> 1997-02-04 (Campo: fecha_susc)
[2025-11-02 22:49:15] ✅ Fecha string convertida: 5/1/2025 -> 2025-05-01 (Campo: fecha_asignacion)
[2025-11-02 22:49:15] ✅ Fecha string convertida: 4/28/2025 -> 2025-04-28 (Campo: fecha_proceso)
[2025-11-02 22:49:15] ✅ Fecha string convertida: 3/5/2025 -> 2025-03-05 (Campo: fecha_castigo)
[2025-11-02 22:49:15] ✅ Fecha string convertida: 7/30/2024 -> 2024-07-30 (Campo: fecha_pago)
[2025-11-02 22:49:15] ✅ Fecha string convertida: 9/5/2024 -> 2024-09-05 (Campo: fecha_vencimiento)
[2025-11-02 22:49:15] ✅ Fecha string convertida: 7/21/2021 -> 2021-07-21 (Campo: fecha_susc)
[2025-11-02 22:49:15] ✅ Fecha string convertida: 5/1/2025 -> 2025-05-01 (Campo: fecha_asignacion)
[2025-11-02 22:49:15] ✅ Fecha string convertida: 4/28/2025 -> 2025-04-28 (Campo: fecha_proceso)
[2025-11-02 22:49:15] ✅ Fecha string convertida: 3/10/2025 -> 2025-03-10 (Campo: fecha_castigo)
[2025-11-02 22:49:15] ✅ Fecha string convertida: 7/7/2024 -> 2024-07-07 (Campo: fecha_pago)
[2025-11-02 22:49:15] ✅ Fecha string convertida: 9/10/2024 -> 2024-09-10 (Campo: fecha_vencimiento)
[2025-11-02 22:49:15] ✅ Fecha string convertida: 6/29/2018 -> 2018-06-29 (Campo: fecha_susc)
[2025-11-02 22:49:15] ✅ Fecha string convertida: 5/1/2025 -> 2025-05-01 (Campo: fecha_asignacion)
[2025-11-02 22:49:15] ✅ Fecha string convertida: 4/28/2025 -> 2025-04-28 (Campo: fecha_proceso)
[2025-11-02 22:49:15] ✅ Fecha string convertida: 3/10/2025 -> 2025-03-10 (Campo: fecha_castigo)
[2025-11-02 22:49:15] ✅ Fecha string convertida: 8/12/2024 -> 2024-08-12 (Campo: fecha_pago)
[2025-11-02 22:49:15] ✅ Fecha string convertida: 9/10/2024 -> 2024-09-10 (Campo: fecha_vencimiento)
[2025-11-02 22:49:15] ✅ Fecha string convertida: 12/5/2017 -> 2017-12-05 (Campo: fecha_susc)
[2025-11-02 22:49:15] ✅ Fecha string convertida: 5/1/2025 -> 2025-05-01 (Campo: fecha_asignacion)
[2025-11-02 22:49:15] ✅ Fecha string convertida: 4/28/2025 -> 2025-04-28 (Campo: fecha_proceso)
[2025-11-02 22:49:15] ✅ Fecha string convertida: 3/5/2025 -> 2025-03-05 (Campo: fecha_castigo)
[2025-11-02 22:49:15] ✅ Fecha string convertida: 8/5/2024 -> 2024-08-05 (Campo: fecha_pago)
[2025-11-02 22:49:15] ✅ Fecha string convertida: 9/5/2024 -> 2024-09-05 (Campo: fecha_vencimiento)
[2025-11-02 22:49:15] ✅ Fecha string convertida: 7/22/2023 -> 2023-07-22 (Campo: fecha_susc)
[2025-11-02 22:49:15] ✅ Fecha string convertida: 5/1/2025 -> 2025-05-01 (Campo: fecha_asignacion)
[2025-11-02 22:49:15] 🔍 MATERNO PROBLEMA - Forzando string vacío para materno
[2025-11-02 22:49:15] ✅ Fecha string convertida: 4/28/2025 -> 2025-04-28 (Campo: fecha_proceso)
[2025-11-02 22:49:15] ✅ Fecha string convertida: 3/10/2025 -> 2025-03-10 (Campo: fecha_castigo)
[2025-11-02 22:49:15] ✅ Fecha string convertida: 8/3/2024 -> 2024-08-03 (Campo: fecha_pago)
[2025-11-02 22:49:15] ✅ Fecha string convertida: 9/10/2024 -> 2024-09-10 (Campo: fecha_vencimiento)
[2025-11-02 22:49:15] ✅ Fecha string convertida: 8/28/2007 -> 2007-08-28 (Campo: fecha_susc)
[2025-11-02 22:49:15] ✅ Fecha string convertida: 5/1/2025 -> 2025-05-01 (Campo: fecha_asignacion)
[2025-11-02 22:49:15] ✅ Fecha string convertida: 4/28/2025 -> 2025-04-28 (Campo: fecha_proceso)
[2025-11-02 22:49:15] ✅ Fecha string convertida: 3/5/2025 -> 2025-03-05 (Campo: fecha_castigo)
[2025-11-02 22:49:15] ✅ Fecha string convertida: 11/25/2024 -> 2024-11-25 (Campo: fecha_pago)
[2025-11-02 22:49:15] ✅ Fecha string convertida: 9/5/2024 -> 2024-09-05 (Campo: fecha_vencimiento)
[2025-11-02 22:49:15] ✅ Fecha string convertida: 9/23/1998 -> 1998-09-23 (Campo: fecha_susc)
[2025-11-02 22:49:15] ✅ Fecha string convertida: 5/1/2025 -> 2025-05-01 (Campo: fecha_asignacion)
[2025-11-02 22:49:15] ✅ Fecha string convertida: 4/28/2025 -> 2025-04-28 (Campo: fecha_proceso)
[2025-11-02 22:49:15] ✅ Fecha string convertida: 3/15/2025 -> 2025-03-15 (Campo: fecha_castigo)
[2025-11-02 22:49:15] ✅ Fecha string convertida: 8/19/2024 -> 2024-08-19 (Campo: fecha_pago)
[2025-11-02 22:49:15] ✅ Fecha string convertida: 9/15/2024 -> 2024-09-15 (Campo: fecha_vencimiento)
[2025-11-02 22:49:15] ✅ Fecha string convertida: 2/5/2011 -> 2011-02-05 (Campo: fecha_susc)
[2025-11-02 22:49:15] ✅ Fecha string convertida: 5/1/2025 -> 2025-05-01 (Campo: fecha_asignacion)
[2025-11-02 22:49:15] ✅ Fecha string convertida: 4/28/2025 -> 2025-04-28 (Campo: fecha_proceso)
[2025-11-02 22:49:15] ✅ Fecha string convertida: 3/10/2025 -> 2025-03-10 (Campo: fecha_castigo)
[2025-11-02 22:49:15] ✅ Fecha string convertida: 8/5/2024 -> 2024-08-05 (Campo: fecha_pago)
[2025-11-02 22:49:15] ✅ Fecha string convertida: 9/10/2024 -> 2024-09-10 (Campo: fecha_vencimiento)
[2025-11-02 22:49:15] ✅ Fecha string convertida: 8/31/2019 -> 2019-08-31 (Campo: fecha_susc)
[2025-11-02 22:49:15] ✅ Fecha string convertida: 5/1/2025 -> 2025-05-01 (Campo: fecha_asignacion)
[2025-11-02 22:49:15] ✅ Fecha string convertida: 4/28/2025 -> 2025-04-28 (Campo: fecha_proceso)
[2025-11-02 22:49:15] ✅ Fecha string convertida: 3/15/2025 -> 2025-03-15 (Campo: fecha_castigo)
[2025-11-02 22:49:15] ✅ Fecha string convertida: 8/20/2024 -> 2024-08-20 (Campo: fecha_pago)
[2025-11-02 22:49:15] ✅ Fecha string convertida: 9/15/2024 -> 2024-09-15 (Campo: fecha_vencimiento)
[2025-11-02 22:49:15] ✅ Fecha string convertida: 8/26/2015 -> 2015-08-26 (Campo: fecha_susc)
[2025-11-02 22:49:15] ✅ Fecha string convertida: 5/1/2025 -> 2025-05-01 (Campo: fecha_asignacion)
[2025-11-02 22:49:15] ✅ Fecha string convertida: 4/28/2025 -> 2025-04-28 (Campo: fecha_proceso)
[2025-11-02 22:49:15] ✅ Fecha string convertida: 3/10/2025 -> 2025-03-10 (Campo: fecha_castigo)
[2025-11-02 22:49:15] ✅ Fecha string convertida: 8/12/2024 -> 2024-08-12 (Campo: fecha_pago)
[2025-11-02 22:49:15] ✅ Fecha string convertida: 9/10/2024 -> 2024-09-10 (Campo: fecha_vencimiento)
[2025-11-02 22:49:15] ✅ Fecha string convertida: 10/6/2019 -> 2019-10-06 (Campo: fecha_susc)
[2025-11-02 22:49:15] ✅ Fecha string convertida: 5/1/2025 -> 2025-05-01 (Campo: fecha_asignacion)
[2025-11-02 22:49:15] ✅ Fecha string convertida: 4/28/2025 -> 2025-04-28 (Campo: fecha_proceso)
[2025-11-02 22:49:15] ✅ Fecha string convertida: 3/5/2025 -> 2025-03-05 (Campo: fecha_castigo)
[2025-11-02 22:49:15] ✅ Fecha string convertida: 6/4/2024 -> 2024-06-04 (Campo: fecha_pago)
[2025-11-02 22:49:15] ✅ Fecha string convertida: 9/5/2024 -> 2024-09-05 (Campo: fecha_vencimiento)
[2025-11-02 22:49:15] ✅ Fecha string convertida: 4/23/2014 -> 2014-04-23 (Campo: fecha_susc)
[2025-11-02 22:49:15] ✅ Fecha string convertida: 5/1/2025 -> 2025-05-01 (Campo: fecha_asignacion)
[2025-11-02 22:49:15] ✅ Fecha string convertida: 4/28/2025 -> 2025-04-28 (Campo: fecha_proceso)
[2025-11-02 22:49:15] ✅ Fecha string convertida: 3/15/2025 -> 2025-03-15 (Campo: fecha_castigo)
[2025-11-02 22:49:15] ✅ Fecha string convertida: 10/13/2024 -> 2024-10-13 (Campo: fecha_pago)
[2025-11-02 22:49:15] ✅ Fecha string convertida: 9/15/2024 -> 2024-09-15 (Campo: fecha_vencimiento)
[2025-11-02 22:49:15] ✅ Fecha string convertida: 3/4/2017 -> 2017-03-04 (Campo: fecha_susc)
[2025-11-02 22:49:15] ✅ Fecha string convertida: 5/1/2025 -> 2025-05-01 (Campo: fecha_asignacion)
[2025-11-02 22:49:15] ✅ Fecha string convertida: 4/28/2025 -> 2025-04-28 (Campo: fecha_proceso)
[2025-11-02 22:49:15] ✅ Fecha string convertida: 3/5/2025 -> 2025-03-05 (Campo: fecha_castigo)
[2025-11-02 22:49:15] ✅ Fecha string convertida: 7/29/2024 -> 2024-07-29 (Campo: fecha_pago)
[2025-11-02 22:49:15] ✅ Fecha string convertida: 9/5/2024 -> 2024-09-05 (Campo: fecha_vencimiento)
[2025-11-02 22:49:15] ✅ Fecha string convertida: 7/15/2023 -> 2023-07-15 (Campo: fecha_susc)
[2025-11-02 22:49:15] ✅ Fecha string convertida: 5/1/2025 -> 2025-05-01 (Campo: fecha_asignacion)
[2025-11-02 22:49:15] ✅ Fecha string convertida: 5/26/2025 -> 2025-05-26 (Campo: fecha_proceso)
[2025-11-02 22:49:15] ✅ Fecha string convertida: 4/5/2025 -> 2025-04-05 (Campo: fecha_castigo)
[2025-11-02 22:49:15] ✅ Fecha string convertida: 11/30/2024 -> 2024-11-30 (Campo: fecha_pago)
[2025-11-02 22:49:15] ✅ Fecha string convertida: 10/5/2024 -> 2024-10-05 (Campo: fecha_vencimiento)
[2025-11-02 22:49:15] ✅ Fecha string convertida: 11/19/2018 -> 2018-11-19 (Campo: fecha_susc)
[2025-11-02 22:49:15] ✅ Fecha string convertida: 6/1/2025 -> 2025-06-01 (Campo: fecha_asignacion)
[2025-11-02 22:49:15] ✅ Fecha string convertida: 5/26/2025 -> 2025-05-26 (Campo: fecha_proceso)
[2025-11-02 22:49:15] ✅ Fecha string convertida: 4/10/2025 -> 2025-04-10 (Campo: fecha_castigo)
[2025-11-02 22:49:15] ✅ Fecha string convertida: 9/16/2024 -> 2024-09-16 (Campo: fecha_pago)
[2025-11-02 22:49:15] ✅ Fecha string convertida: 10/10/2024 -> 2024-10-10 (Campo: fecha_vencimiento)
[2025-11-02 22:49:15] ✅ Fecha string convertida: 8/29/2023 -> 2023-08-29 (Campo: fecha_susc)
[2025-11-02 22:49:15] ✅ Fecha string convertida: 6/1/2025 -> 2025-06-01 (Campo: fecha_asignacion)
[2025-11-02 22:49:15] ✅ Fecha string convertida: 5/26/2025 -> 2025-05-26 (Campo: fecha_proceso)
[2025-11-02 22:49:15] ✅ Fecha string convertida: 4/5/2025 -> 2025-04-05 (Campo: fecha_castigo)
[2025-11-02 22:49:15] ✅ Fecha string convertida: 10/5/2024 -> 2024-10-05 (Campo: fecha_vencimiento)
[2025-11-02 22:49:15] ✅ Fecha string convertida: 9/13/2024 -> 2024-09-13 (Campo: fecha_susc)
[2025-11-02 22:49:15] ✅ Fecha string convertida: 6/1/2025 -> 2025-06-01 (Campo: fecha_asignacion)
[2025-11-02 22:49:15] ✅ Fecha string convertida: 5/26/2025 -> 2025-05-26 (Campo: fecha_proceso)
[2025-11-02 22:49:15] ✅ Fecha string convertida: 4/5/2025 -> 2025-04-05 (Campo: fecha_castigo)
[2025-11-02 22:49:15] ✅ Fecha string convertida: 9/4/2024 -> 2024-09-04 (Campo: fecha_pago)
[2025-11-02 22:49:15] ✅ Fecha string convertida: 10/5/2024 -> 2024-10-05 (Campo: fecha_vencimiento)
[2025-11-02 22:49:15] ✅ Fecha string convertida: 9/11/2020 -> 2020-09-11 (Campo: fecha_susc)
[2025-11-02 22:49:15] ✅ Fecha string convertida: 6/1/2025 -> 2025-06-01 (Campo: fecha_asignacion)
[2025-11-02 22:49:15] ✅ Fecha string convertida: 5/26/2025 -> 2025-05-26 (Campo: fecha_proceso)
[2025-11-02 22:49:15] ✅ Fecha string convertida: 4/5/2025 -> 2025-04-05 (Campo: fecha_castigo)
[2025-11-02 22:49:15] ✅ Fecha string convertida: 9/11/2024 -> 2024-09-11 (Campo: fecha_pago)
[2025-11-02 22:49:15] ✅ Fecha string convertida: 10/5/2024 -> 2024-10-05 (Campo: fecha_vencimiento)
[2025-11-02 22:49:15] ✅ Fecha string convertida: 8/29/2015 -> 2015-08-29 (Campo: fecha_susc)
[2025-11-02 22:49:15] ✅ Fecha string convertida: 6/1/2025 -> 2025-06-01 (Campo: fecha_asignacion)
[2025-11-02 22:49:15] ✅ Fecha string convertida: 5/26/2025 -> 2025-05-26 (Campo: fecha_proceso)
[2025-11-02 22:49:15] ✅ Fecha string convertida: 4/10/2025 -> 2025-04-10 (Campo: fecha_castigo)
[2025-11-02 22:49:15] ✅ Fecha string convertida: 9/14/2024 -> 2024-09-14 (Campo: fecha_pago)
[2025-11-02 22:49:15] ✅ Fecha string convertida: 10/10/2024 -> 2024-10-10 (Campo: fecha_vencimiento)
[2025-11-02 22:49:15] ✅ Fecha string convertida: 4/4/2019 -> 2019-04-04 (Campo: fecha_susc)
[2025-11-02 22:49:15] ✅ Fecha string convertida: 6/1/2025 -> 2025-06-01 (Campo: fecha_asignacion)
[2025-11-02 22:49:15] ✅ Fecha string convertida: 5/26/2025 -> 2025-05-26 (Campo: fecha_proceso)
[2025-11-02 22:49:15] ✅ Fecha string convertida: 4/5/2025 -> 2025-04-05 (Campo: fecha_castigo)
[2025-11-02 22:49:15] ✅ Fecha string convertida: 9/1/2024 -> 2024-09-01 (Campo: fecha_pago)
[2025-11-02 22:49:15] ✅ Fecha string convertida: 10/5/2024 -> 2024-10-05 (Campo: fecha_vencimiento)
[2025-11-02 22:49:15] ✅ Fecha string convertida: 3/1/2015 -> 2015-03-01 (Campo: fecha_susc)
[2025-11-02 22:49:15] ✅ Fecha string convertida: 6/1/2025 -> 2025-06-01 (Campo: fecha_asignacion)
[2025-11-02 22:49:15] ✅ Fecha string convertida: 5/26/2025 -> 2025-05-26 (Campo: fecha_proceso)
[2025-11-02 22:49:15] ✅ Fecha string convertida: 4/5/2025 -> 2025-04-05 (Campo: fecha_castigo)
[2025-11-02 22:49:15] ✅ Fecha string convertida: 9/15/2024 -> 2024-09-15 (Campo: fecha_pago)
[2025-11-02 22:49:15] ✅ Fecha string convertida: 10/5/2024 -> 2024-10-05 (Campo: fecha_vencimiento)
[2025-11-02 22:49:15] ✅ Fecha string convertida: 12/18/2008 -> 2008-12-18 (Campo: fecha_susc)
[2025-11-02 22:49:15] ✅ Fecha string convertida: 6/1/2025 -> 2025-06-01 (Campo: fecha_asignacion)
[2025-11-02 22:49:15] ✅ Fecha string convertida: 5/26/2025 -> 2025-05-26 (Campo: fecha_proceso)
[2025-11-02 22:49:15] ✅ Fecha string convertida: 4/15/2025 -> 2025-04-15 (Campo: fecha_castigo)
[2025-11-02 22:49:15] ✅ Fecha string convertida: 8/1/2024 -> 2024-08-01 (Campo: fecha_pago)
[2025-11-02 22:49:15] ✅ Fecha string convertida: 10/15/2024 -> 2024-10-15 (Campo: fecha_vencimiento)
[2025-11-02 22:49:15] ✅ Fecha string convertida: 5/15/2024 -> 2024-05-15 (Campo: fecha_susc)
[2025-11-02 22:49:15] ✅ Fecha string convertida: 6/1/2025 -> 2025-06-01 (Campo: fecha_asignacion)
[2025-11-02 22:49:15] ✅ Fecha string convertida: 5/26/2025 -> 2025-05-26 (Campo: fecha_proceso)
[2025-11-02 22:49:16] ✅ Fecha string convertida: 4/5/2025 -> 2025-04-05 (Campo: fecha_castigo)
[2025-11-02 22:49:16] ✅ Fecha string convertida: 9/3/2024 -> 2024-09-03 (Campo: fecha_pago)
[2025-11-02 22:49:16] ✅ Fecha string convertida: 10/5/2024 -> 2024-10-05 (Campo: fecha_vencimiento)
[2025-11-02 22:49:16] ✅ Fecha string convertida: 1/13/2022 -> 2022-01-13 (Campo: fecha_susc)
[2025-11-02 22:49:16] ✅ Fecha string convertida: 6/1/2025 -> 2025-06-01 (Campo: fecha_asignacion)
[2025-11-02 22:49:16] ✅ Fecha string convertida: 5/26/2025 -> 2025-05-26 (Campo: fecha_proceso)
[2025-11-02 22:49:16] ✅ Fecha string convertida: 4/5/2025 -> 2025-04-05 (Campo: fecha_castigo)
[2025-11-02 22:49:16] ✅ Fecha string convertida: 9/6/2024 -> 2024-09-06 (Campo: fecha_pago)
[2025-11-02 22:49:16] ✅ Fecha string convertida: 10/5/2024 -> 2024-10-05 (Campo: fecha_vencimiento)
[2025-11-02 22:49:16] ✅ Fecha string convertida: 3/22/2022 -> 2022-03-22 (Campo: fecha_susc)
[2025-11-02 22:49:16] ✅ Fecha string convertida: 6/1/2025 -> 2025-06-01 (Campo: fecha_asignacion)
[2025-11-02 22:49:16] ✅ Fecha string convertida: 5/26/2025 -> 2025-05-26 (Campo: fecha_proceso)
[2025-11-02 22:49:16] ✅ Fecha string convertida: 4/5/2025 -> 2025-04-05 (Campo: fecha_castigo)
[2025-11-02 22:49:16] ✅ Fecha string convertida: 8/20/2024 -> 2024-08-20 (Campo: fecha_pago)
[2025-11-02 22:49:16] ✅ Fecha string convertida: 10/5/2024 -> 2024-10-05 (Campo: fecha_vencimiento)
[2025-11-02 22:49:16] ✅ Fecha string convertida: 2/20/2022 -> 2022-02-20 (Campo: fecha_susc)
[2025-11-02 22:49:16] ✅ Fecha string convertida: 6/1/2025 -> 2025-06-01 (Campo: fecha_asignacion)
[2025-11-02 22:49:16] ✅ Fecha string convertida: 5/26/2025 -> 2025-05-26 (Campo: fecha_proceso)
[2025-11-02 22:49:16] ✅ Fecha string convertida: 4/5/2025 -> 2025-04-05 (Campo: fecha_castigo)
[2025-11-02 22:49:16] ✅ Fecha string convertida: 8/30/2024 -> 2024-08-30 (Campo: fecha_pago)
[2025-11-02 22:49:16] ✅ Fecha string convertida: 10/5/2024 -> 2024-10-05 (Campo: fecha_vencimiento)
[2025-11-02 22:49:16] ✅ Fecha string convertida: 6/15/2024 -> 2024-06-15 (Campo: fecha_susc)
[2025-11-02 22:49:16] ✅ Fecha string convertida: 6/1/2025 -> 2025-06-01 (Campo: fecha_asignacion)
[2025-11-02 22:49:16] ✅ Fecha string convertida: 5/26/2025 -> 2025-05-26 (Campo: fecha_proceso)
[2025-11-02 22:49:16] ✅ Fecha string convertida: 4/5/2025 -> 2025-04-05 (Campo: fecha_castigo)
[2025-11-02 22:49:16] ✅ Fecha string convertida: 10/7/2024 -> 2024-10-07 (Campo: fecha_pago)
[2025-11-02 22:49:16] ✅ Fecha string convertida: 10/5/2024 -> 2024-10-05 (Campo: fecha_vencimiento)
[2025-11-02 22:49:16] ✅ Fecha string convertida: 12/22/2017 -> 2017-12-22 (Campo: fecha_susc)
[2025-11-02 22:49:16] ✅ Fecha string convertida: 6/1/2025 -> 2025-06-01 (Campo: fecha_asignacion)
[2025-11-02 22:49:16] ✅ Fecha string convertida: 5/26/2025 -> 2025-05-26 (Campo: fecha_proceso)
[2025-11-02 22:49:16] ✅ Fecha string convertida: 4/5/2025 -> 2025-04-05 (Campo: fecha_castigo)
[2025-11-02 22:49:16] ✅ Fecha string convertida: 12/2/2024 -> 2024-12-02 (Campo: fecha_pago)
[2025-11-02 22:49:16] ✅ Fecha string convertida: 10/5/2024 -> 2024-10-05 (Campo: fecha_vencimiento)
[2025-11-02 22:49:16] ✅ Fecha string convertida: 3/7/2002 -> 2002-03-07 (Campo: fecha_susc)
[2025-11-02 22:49:16] ✅ Fecha string convertida: 6/1/2025 -> 2025-06-01 (Campo: fecha_asignacion)
[2025-11-02 22:49:16] ✅ Fecha string convertida: 6/24/2025 -> 2025-06-24 (Campo: fecha_proceso)
[2025-11-02 22:49:16] ✅ Fecha string convertida: 5/20/2025 -> 2025-05-20 (Campo: fecha_castigo)
[2025-11-02 22:49:16] ✅ Fecha string convertida: 11/19/2024 -> 2024-11-19 (Campo: fecha_pago)
[2025-11-02 22:49:16] ✅ Fecha string convertida: 11/20/2024 -> 2024-11-20 (Campo: fecha_vencimiento)
[2025-11-02 22:49:16] ✅ Fecha string convertida: 8/24/2024 -> 2024-08-24 (Campo: fecha_susc)
[2025-11-02 22:49:16] ✅ Fecha string convertida: 7/1/2025 -> 2025-07-01 (Campo: fecha_asignacion)
[2025-11-02 22:49:16] ✅ Fecha string convertida: 6/24/2025 -> 2025-06-24 (Campo: fecha_proceso)
[2025-11-02 22:49:16] ✅ Fecha string convertida: 5/5/2025 -> 2025-05-05 (Campo: fecha_castigo)
[2025-11-02 22:49:16] ✅ Fecha string convertida: 10/4/2024 -> 2024-10-04 (Campo: fecha_pago)
[2025-11-02 22:49:16] ✅ Fecha string convertida: 11/5/2024 -> 2024-11-05 (Campo: fecha_vencimiento)
[2025-11-02 22:49:16] ✅ Fecha string convertida: 5/28/2022 -> 2022-05-28 (Campo: fecha_susc)
[2025-11-02 22:49:16] ✅ Fecha string convertida: 7/1/2025 -> 2025-07-01 (Campo: fecha_asignacion)
[2025-11-02 22:49:16] ✅ Fecha string convertida: 6/24/2025 -> 2025-06-24 (Campo: fecha_proceso)
[2025-11-02 22:49:16] ✅ Fecha string convertida: 5/5/2025 -> 2025-05-05 (Campo: fecha_castigo)
[2025-11-02 22:49:16] ✅ Fecha string convertida: 9/26/2024 -> 2024-09-26 (Campo: fecha_pago)
[2025-11-02 22:49:16] ✅ Fecha string convertida: 11/5/2024 -> 2024-11-05 (Campo: fecha_vencimiento)
[2025-11-02 22:49:16] ✅ Fecha string convertida: 10/24/2013 -> 2013-10-24 (Campo: fecha_susc)
[2025-11-02 22:49:16] ✅ Fecha string convertida: 7/1/2025 -> 2025-07-01 (Campo: fecha_asignacion)
[2025-11-02 22:49:16] ✅ Fecha string convertida: 6/24/2025 -> 2025-06-24 (Campo: fecha_proceso)
[2025-11-02 22:49:16] ✅ Fecha string convertida: 5/20/2025 -> 2025-05-20 (Campo: fecha_castigo)
[2025-11-02 22:49:16] ✅ Fecha string convertida: 11/23/2024 -> 2024-11-23 (Campo: fecha_pago)
[2025-11-02 22:49:16] ✅ Fecha string convertida: 11/20/2024 -> 2024-11-20 (Campo: fecha_vencimiento)
[2025-11-02 22:49:16] ✅ Fecha string convertida: 8/5/2023 -> 2023-08-05 (Campo: fecha_susc)
[2025-11-02 22:49:16] ✅ Fecha string convertida: 7/1/2025 -> 2025-07-01 (Campo: fecha_asignacion)
[2025-11-02 22:49:16] ✅ Fecha string convertida: 6/24/2025 -> 2025-06-24 (Campo: fecha_proceso)
[2025-11-02 22:49:16] ✅ Fecha string convertida: 5/30/2025 -> 2025-05-30 (Campo: fecha_castigo)
[2025-11-02 22:49:16] ✅ Fecha string convertida: 12/7/2024 -> 2024-12-07 (Campo: fecha_pago)
[2025-11-02 22:49:16] ✅ Fecha string convertida: 11/30/2024 -> 2024-11-30 (Campo: fecha_vencimiento)
[2025-11-02 22:49:16] ✅ Fecha string convertida: 12/6/2008 -> 2008-12-06 (Campo: fecha_susc)
[2025-11-02 22:49:16] ✅ Fecha string convertida: 7/1/2025 -> 2025-07-01 (Campo: fecha_asignacion)
[2025-11-02 22:49:16] ✅ Fecha string convertida: 6/24/2025 -> 2025-06-24 (Campo: fecha_proceso)
[2025-11-02 22:49:16] ✅ Fecha string convertida: 5/5/2025 -> 2025-05-05 (Campo: fecha_castigo)
[2025-11-02 22:49:16] ✅ Fecha string convertida: 10/3/2024 -> 2024-10-03 (Campo: fecha_pago)
[2025-11-02 22:49:16] ✅ Fecha string convertida: 11/5/2024 -> 2024-11-05 (Campo: fecha_vencimiento)
[2025-11-02 22:49:16] ✅ Fecha string convertida: 5/29/2023 -> 2023-05-29 (Campo: fecha_susc)
[2025-11-02 22:49:16] ✅ Fecha string convertida: 7/1/2025 -> 2025-07-01 (Campo: fecha_asignacion)
[2025-11-02 22:49:16] ✅ Fecha string convertida: 6/24/2025 -> 2025-06-24 (Campo: fecha_proceso)
[2025-11-02 22:49:16] ✅ Fecha string convertida: 5/15/2025 -> 2025-05-15 (Campo: fecha_castigo)
[2025-11-02 22:49:16] ✅ Fecha string convertida: 10/18/2024 -> 2024-10-18 (Campo: fecha_pago)
[2025-11-02 22:49:16] ✅ Fecha string convertida: 11/15/2024 -> 2024-11-15 (Campo: fecha_vencimiento)
[2025-11-02 22:49:16] ✅ Fecha string convertida: 12/11/2004 -> 2004-12-11 (Campo: fecha_susc)
[2025-11-02 22:49:16] ✅ Fecha string convertida: 7/1/2025 -> 2025-07-01 (Campo: fecha_asignacion)
[2025-11-02 22:49:16] ✅ Fecha string convertida: 6/24/2025 -> 2025-06-24 (Campo: fecha_proceso)
[2025-11-02 22:49:16] ✅ Fecha string convertida: 5/25/2025 -> 2025-05-25 (Campo: fecha_castigo)
[2025-11-02 22:49:16] ✅ Fecha string convertida: 10/10/2024 -> 2024-10-10 (Campo: fecha_pago)
[2025-11-02 22:49:16] ✅ Fecha string convertida: 11/25/2024 -> 2024-11-25 (Campo: fecha_vencimiento)
[2025-11-02 22:49:16] ✅ Fecha string convertida: 8/23/2023 -> 2023-08-23 (Campo: fecha_susc)
[2025-11-02 22:49:16] ✅ Fecha string convertida: 7/1/2025 -> 2025-07-01 (Campo: fecha_asignacion)
[2025-11-02 22:49:16] ✅ Fecha string convertida: 6/24/2025 -> 2025-06-24 (Campo: fecha_proceso)
[2025-11-02 22:49:16] ✅ Fecha string convertida: 5/10/2025 -> 2025-05-10 (Campo: fecha_castigo)
[2025-11-02 22:49:16] ✅ Fecha string convertida: 10/30/2024 -> 2024-10-30 (Campo: fecha_pago)
[2025-11-02 22:49:16] ✅ Fecha string convertida: 11/10/2024 -> 2024-11-10 (Campo: fecha_vencimiento)
[2025-11-02 22:49:16] ✅ Fecha string convertida: 7/13/2019 -> 2019-07-13 (Campo: fecha_susc)
[2025-11-02 22:49:16] ✅ Fecha string convertida: 7/1/2025 -> 2025-07-01 (Campo: fecha_asignacion)
[2025-11-02 22:49:16] ✅ Fecha string convertida: 6/24/2025 -> 2025-06-24 (Campo: fecha_proceso)
[2025-11-02 22:49:16] ✅ Fecha string convertida: 5/5/2025 -> 2025-05-05 (Campo: fecha_castigo)
[2025-11-02 22:49:16] ✅ Fecha string convertida: 10/8/2024 -> 2024-10-08 (Campo: fecha_pago)
[2025-11-02 22:49:16] ✅ Fecha string convertida: 11/5/2024 -> 2024-11-05 (Campo: fecha_vencimiento)
[2025-11-02 22:49:16] ✅ Fecha string convertida: 8/13/2024 -> 2024-08-13 (Campo: fecha_susc)
[2025-11-02 22:49:16] ✅ Fecha string convertida: 7/1/2025 -> 2025-07-01 (Campo: fecha_asignacion)
[2025-11-02 22:49:16] ✅ Fecha string convertida: 6/24/2025 -> 2025-06-24 (Campo: fecha_proceso)
[2025-11-02 22:49:16] ✅ Fecha string convertida: 5/10/2025 -> 2025-05-10 (Campo: fecha_castigo)
[2025-11-02 22:49:16] ✅ Fecha string convertida: 1/2/2025 -> 2025-01-02 (Campo: fecha_pago)
[2025-11-02 22:49:16] ✅ Fecha string convertida: 11/10/2024 -> 2024-11-10 (Campo: fecha_vencimiento)
[2025-11-02 22:49:16] ✅ Fecha string convertida: 3/22/2018 -> 2018-03-22 (Campo: fecha_susc)
[2025-11-02 22:49:16] ✅ Fecha string convertida: 7/1/2025 -> 2025-07-01 (Campo: fecha_asignacion)
[2025-11-02 22:49:16] ✅ Fecha string convertida: 6/24/2025 -> 2025-06-24 (Campo: fecha_proceso)
[2025-11-02 22:49:16] ✅ Fecha string convertida: 5/5/2025 -> 2025-05-05 (Campo: fecha_castigo)
[2025-11-02 22:49:16] ✅ Fecha string convertida: 12/9/2024 -> 2024-12-09 (Campo: fecha_pago)
[2025-11-02 22:49:16] ✅ Fecha string convertida: 11/5/2024 -> 2024-11-05 (Campo: fecha_vencimiento)
[2025-11-02 22:49:16] ✅ Fecha string convertida: 11/30/2022 -> 2022-11-30 (Campo: fecha_susc)
[2025-11-02 22:49:16] ✅ Fecha string convertida: 7/1/2025 -> 2025-07-01 (Campo: fecha_asignacion)
[2025-11-02 22:49:16] ✅ Fecha string convertida: 6/24/2025 -> 2025-06-24 (Campo: fecha_proceso)
[2025-11-02 22:49:16] ✅ Fecha string convertida: 5/20/2025 -> 2025-05-20 (Campo: fecha_castigo)
[2025-11-02 22:49:16] ✅ Fecha string convertida: 10/19/2024 -> 2024-10-19 (Campo: fecha_pago)
[2025-11-02 22:49:16] ✅ Fecha string convertida: 11/20/2024 -> 2024-11-20 (Campo: fecha_vencimiento)
[2025-11-02 22:49:16] ✅ Fecha string convertida: 9/24/2006 -> 2006-09-24 (Campo: fecha_susc)
[2025-11-02 22:49:16] ✅ Fecha string convertida: 7/1/2025 -> 2025-07-01 (Campo: fecha_asignacion)
[2025-11-02 22:49:16] ✅ Fecha string convertida: 6/24/2025 -> 2025-06-24 (Campo: fecha_proceso)
[2025-11-02 22:49:16] ✅ Fecha string convertida: 5/5/2025 -> 2025-05-05 (Campo: fecha_castigo)
[2025-11-02 22:49:16] ✅ Fecha string convertida: 9/21/2024 -> 2024-09-21 (Campo: fecha_pago)
[2025-11-02 22:49:16] ✅ Fecha string convertida: 11/5/2024 -> 2024-11-05 (Campo: fecha_vencimiento)
[2025-11-02 22:49:16] ✅ Fecha string convertida: 1/7/2018 -> 2018-01-07 (Campo: fecha_susc)
[2025-11-02 22:49:16] ✅ Fecha string convertida: 7/1/2025 -> 2025-07-01 (Campo: fecha_asignacion)
[2025-11-02 22:49:16] ✅ Fecha string convertida: 6/24/2025 -> 2025-06-24 (Campo: fecha_proceso)
[2025-11-02 22:49:16] ✅ Fecha string convertida: 5/15/2025 -> 2025-05-15 (Campo: fecha_castigo)
[2025-11-02 22:49:16] ✅ Fecha string convertida: 10/6/2024 -> 2024-10-06 (Campo: fecha_pago)
[2025-11-02 22:49:16] ✅ Fecha string convertida: 11/15/2024 -> 2024-11-15 (Campo: fecha_vencimiento)
[2025-11-02 22:49:16] ✅ Fecha string convertida: 11/5/2021 -> 2021-11-05 (Campo: fecha_susc)
[2025-11-02 22:49:16] ✅ Fecha string convertida: 7/1/2025 -> 2025-07-01 (Campo: fecha_asignacion)
[2025-11-02 22:49:16] ✅ Fecha string convertida: 6/24/2025 -> 2025-06-24 (Campo: fecha_proceso)
[2025-11-02 22:49:16] ✅ Fecha string convertida: 5/15/2025 -> 2025-05-15 (Campo: fecha_castigo)
[2025-11-02 22:49:16] ✅ Fecha string convertida: 10/10/2024 -> 2024-10-10 (Campo: fecha_pago)
[2025-11-02 22:49:16] ✅ Fecha string convertida: 11/15/2024 -> 2024-11-15 (Campo: fecha_vencimiento)
[2025-11-02 22:49:16] ✅ Fecha string convertida: 8/12/2020 -> 2020-08-12 (Campo: fecha_susc)
[2025-11-02 22:49:16] ✅ Fecha string convertida: 7/1/2025 -> 2025-07-01 (Campo: fecha_asignacion)
[2025-11-02 22:49:16] ✅ Fecha string convertida: 6/24/2025 -> 2025-06-24 (Campo: fecha_proceso)
[2025-11-02 22:49:16] ✅ Fecha string convertida: 5/30/2025 -> 2025-05-30 (Campo: fecha_castigo)
[2025-11-02 22:49:16] ✅ Fecha string convertida: 11/5/2024 -> 2024-11-05 (Campo: fecha_pago)
[2025-11-02 22:49:16] ✅ Fecha string convertida: 11/30/2024 -> 2024-11-30 (Campo: fecha_vencimiento)
[2025-11-02 22:49:16] ✅ Fecha string convertida: 10/13/2007 -> 2007-10-13 (Campo: fecha_susc)
[2025-11-02 22:49:16] ✅ Fecha string convertida: 7/1/2025 -> 2025-07-01 (Campo: fecha_asignacion)
[2025-11-02 22:49:16] ✅ Fecha string convertida: 6/24/2025 -> 2025-06-24 (Campo: fecha_proceso)
[2025-11-02 22:49:16] ✅ Fecha string convertida: 5/5/2025 -> 2025-05-05 (Campo: fecha_castigo)
[2025-11-02 22:49:16] ✅ Fecha string convertida: 10/2/2024 -> 2024-10-02 (Campo: fecha_pago)
[2025-11-02 22:49:16] ✅ Fecha string convertida: 11/5/2024 -> 2024-11-05 (Campo: fecha_vencimiento)
[2025-11-02 22:49:16] ✅ Fecha string convertida: 2/25/2022 -> 2022-02-25 (Campo: fecha_susc)
[2025-11-02 22:49:16] ✅ Fecha string convertida: 7/1/2025 -> 2025-07-01 (Campo: fecha_asignacion)
[2025-11-02 22:49:16] ✅ Fecha string convertida: 6/24/2025 -> 2025-06-24 (Campo: fecha_proceso)
[2025-11-02 22:49:16] ✅ Fecha string convertida: 5/30/2025 -> 2025-05-30 (Campo: fecha_castigo)
[2025-11-02 22:49:16] ✅ Fecha string convertida: 11/4/2024 -> 2024-11-04 (Campo: fecha_pago)
[2025-11-02 22:49:16] ✅ Fecha string convertida: 11/30/2024 -> 2024-11-30 (Campo: fecha_vencimiento)
[2025-11-02 22:49:16] ✅ Fecha string convertida: 1/8/2019 -> 2019-01-08 (Campo: fecha_susc)
[2025-11-02 22:49:16] ✅ Fecha string convertida: 7/1/2025 -> 2025-07-01 (Campo: fecha_asignacion)
[2025-11-02 22:49:16] ✅ Fecha string convertida: 6/24/2025 -> 2025-06-24 (Campo: fecha_proceso)
[2025-11-02 22:49:16] ✅ Fecha string convertida: 5/5/2025 -> 2025-05-05 (Campo: fecha_castigo)
[2025-11-02 22:49:16] ✅ Fecha string convertida: 11/23/2024 -> 2024-11-23 (Campo: fecha_pago)
[2025-11-02 22:49:16] ✅ Fecha string convertida: 11/5/2024 -> 2024-11-05 (Campo: fecha_vencimiento)
[2025-11-02 22:49:16] ✅ Fecha string convertida: 10/6/2010 -> 2010-10-06 (Campo: fecha_susc)
[2025-11-02 22:49:16] ✅ Fecha string convertida: 7/1/2025 -> 2025-07-01 (Campo: fecha_asignacion)
[2025-11-02 22:49:16] ✅ Fecha string convertida: 6/24/2025 -> 2025-06-24 (Campo: fecha_proceso)
[2025-11-02 22:49:16] ✅ Fecha string convertida: 5/5/2025 -> 2025-05-05 (Campo: fecha_castigo)
[2025-11-02 22:49:16] ✅ Fecha string convertida: 11/30/2023 -> 2023-11-30 (Campo: fecha_pago)
[2025-11-02 22:49:16] ✅ Fecha string convertida: 11/5/2024 -> 2024-11-05 (Campo: fecha_vencimiento)
[2025-11-02 22:49:16] ✅ Fecha string convertida: 3/16/2016 -> 2016-03-16 (Campo: fecha_susc)
[2025-11-02 22:49:16] ✅ Fecha string convertida: 7/1/2025 -> 2025-07-01 (Campo: fecha_asignacion)
[2025-11-02 22:49:16] ✅ Fecha string convertida: 6/24/2025 -> 2025-06-24 (Campo: fecha_proceso)
[2025-11-02 22:49:16] ✅ Fecha string convertida: 5/25/2025 -> 2025-05-25 (Campo: fecha_castigo)
[2025-11-02 22:49:16] ✅ Fecha string convertida: 10/28/2024 -> 2024-10-28 (Campo: fecha_pago)
[2025-11-02 22:49:16] ✅ Fecha string convertida: 11/25/2024 -> 2024-11-25 (Campo: fecha_vencimiento)
[2025-11-02 22:49:16] ✅ Fecha string convertida: 8/11/2023 -> 2023-08-11 (Campo: fecha_susc)
[2025-11-02 22:49:16] ✅ Fecha string convertida: 7/1/2025 -> 2025-07-01 (Campo: fecha_asignacion)
[2025-11-02 22:49:16] ✅ Fecha string convertida: 9/25/2025 -> 2025-09-25 (Campo: fecha_proceso)
[2025-11-02 22:49:16] ✅ Fecha string convertida: 8/5/2025 -> 2025-08-05 (Campo: fecha_castigo)
[2025-11-02 22:49:16] ✅ Fecha Excel convertida: 45532 -> 2024-08-28 (Campo: fecha_pago)
[2025-11-02 22:49:16] ✅ Fecha string convertida: 2/5/2025 -> 2025-02-05 (Campo: fecha_vencimiento)
[2025-11-02 22:49:16] ✅ Fecha string convertida: 6/3/2024 -> 2024-06-03 (Campo: fecha_susc)
[2025-11-02 22:49:16] ✅ Fecha string convertida: 10/1/2025 -> 2025-10-01 (Campo: fecha_asignacion)
[2025-11-02 22:49:16] ✅ Fecha string convertida: 9/25/2025 -> 2025-09-25 (Campo: fecha_proceso)
[2025-11-02 22:49:16] ✅ Fecha string convertida: 8/5/2025 -> 2025-08-05 (Campo: fecha_castigo)
[2025-11-02 22:49:16] ✅ Fecha Excel convertida: 45657 -> 2024-12-31 (Campo: fecha_pago)
[2025-11-02 22:49:16] ✅ Fecha string convertida: 2/5/2025 -> 2025-02-05 (Campo: fecha_vencimiento)
[2025-11-02 22:49:16] ✅ Fecha string convertida: 7/16/2019 -> 2019-07-16 (Campo: fecha_susc)
[2025-11-02 22:49:16] ✅ Fecha string convertida: 10/1/2025 -> 2025-10-01 (Campo: fecha_asignacion)
[2025-11-02 22:49:16] ✅ Fecha string convertida: 9/25/2025 -> 2025-09-25 (Campo: fecha_proceso)
[2025-11-02 22:49:16] ✅ Fecha string convertida: 8/15/2025 -> 2025-08-15 (Campo: fecha_castigo)
[2025-11-02 22:49:16] ✅ Fecha Excel convertida: 45679 -> 2025-01-22 (Campo: fecha_pago)
[2025-11-02 22:49:16] ✅ Fecha string convertida: 2/15/2025 -> 2025-02-15 (Campo: fecha_vencimiento)
[2025-11-02 22:49:16] ✅ Fecha string convertida: 9/24/2020 -> 2020-09-24 (Campo: fecha_susc)
[2025-11-02 22:49:16] ✅ Fecha string convertida: 10/1/2025 -> 2025-10-01 (Campo: fecha_asignacion)
[2025-11-02 22:49:16] ✅ Fecha string convertida: 9/25/2025 -> 2025-09-25 (Campo: fecha_proceso)
[2025-11-02 22:49:16] ✅ Fecha string convertida: 8/5/2025 -> 2025-08-05 (Campo: fecha_castigo)
[2025-11-02 22:49:16] ✅ Fecha Excel convertida: 45665 -> 2025-01-08 (Campo: fecha_pago)
[2025-11-02 22:49:16] ✅ Fecha string convertida: 2/5/2025 -> 2025-02-05 (Campo: fecha_vencimiento)
[2025-11-02 22:49:16] ✅ Fecha string convertida: 4/3/2018 -> 2018-04-03 (Campo: fecha_susc)
[2025-11-02 22:49:16] ✅ Fecha string convertida: 10/1/2025 -> 2025-10-01 (Campo: fecha_asignacion)
[2025-11-02 22:49:16] ✅ Fecha string convertida: 9/25/2025 -> 2025-09-25 (Campo: fecha_proceso)
[2025-11-02 22:49:16] ✅ Fecha string convertida: 8/5/2025 -> 2025-08-05 (Campo: fecha_castigo)
[2025-11-02 22:49:16] ✅ Fecha Excel convertida: 45669 -> 2025-01-12 (Campo: fecha_pago)
[2025-11-02 22:49:16] ✅ Fecha string convertida: 2/5/2025 -> 2025-02-05 (Campo: fecha_vencimiento)
[2025-11-02 22:49:16] ✅ Fecha string convertida: 2/12/2024 -> 2024-02-12 (Campo: fecha_susc)
[2025-11-02 22:49:16] ✅ Fecha string convertida: 10/1/2025 -> 2025-10-01 (Campo: fecha_asignacion)
[2025-11-02 22:49:16] ✅ Fecha string convertida: 9/25/2025 -> 2025-09-25 (Campo: fecha_proceso)
[2025-11-02 22:49:16] ✅ Fecha string convertida: 8/5/2025 -> 2025-08-05 (Campo: fecha_castigo)
[2025-11-02 22:49:16] ✅ Fecha Excel convertida: 45672 -> 2025-01-15 (Campo: fecha_pago)
[2025-11-02 22:49:16] ✅ Fecha string convertida: 2/5/2025 -> 2025-02-05 (Campo: fecha_vencimiento)
[2025-11-02 22:49:16] ✅ Fecha string convertida: 2/24/2015 -> 2015-02-24 (Campo: fecha_susc)
[2025-11-02 22:49:16] ✅ Fecha string convertida: 10/1/2025 -> 2025-10-01 (Campo: fecha_asignacion)
[2025-11-02 22:49:16] ✅ Fecha string convertida: 9/25/2025 -> 2025-09-25 (Campo: fecha_proceso)
[2025-11-02 22:49:16] ✅ Fecha string convertida: 8/10/2025 -> 2025-08-10 (Campo: fecha_castigo)
[2025-11-02 22:49:16] ✅ Fecha Excel convertida: 45661 -> 2025-01-04 (Campo: fecha_pago)
[2025-11-02 22:49:16] ✅ Fecha string convertida: 2/10/2025 -> 2025-02-10 (Campo: fecha_vencimiento)
[2025-11-02 22:49:16] ✅ Fecha string convertida: 12/11/2021 -> 2021-12-11 (Campo: fecha_susc)
[2025-11-02 22:49:16] ✅ Fecha string convertida: 10/1/2025 -> 2025-10-01 (Campo: fecha_asignacion)
[2025-11-02 22:49:16] ✅ Fecha string convertida: 9/25/2025 -> 2025-09-25 (Campo: fecha_proceso)
[2025-11-02 22:49:16] ✅ Fecha string convertida: 8/25/2025 -> 2025-08-25 (Campo: fecha_castigo)
[2025-11-02 22:49:16] ✅ Fecha string convertida: 2/25/2025 -> 2025-02-25 (Campo: fecha_vencimiento)
[2025-11-02 22:49:16] ✅ Fecha string convertida: 9/6/2024 -> 2024-09-06 (Campo: fecha_susc)
[2025-11-02 22:49:16] ✅ Fecha string convertida: 10/1/2025 -> 2025-10-01 (Campo: fecha_asignacion)
[2025-11-02 22:49:16] ✅ Fecha string convertida: 9/25/2025 -> 2025-09-25 (Campo: fecha_proceso)
[2025-11-02 22:49:16] ✅ Fecha string convertida: 8/15/2025 -> 2025-08-15 (Campo: fecha_castigo)
[2025-11-02 22:49:16] ✅ Fecha Excel convertida: 45658 -> 2025-01-01 (Campo: fecha_pago)
[2025-11-02 22:49:16] ✅ Fecha string convertida: 2/15/2025 -> 2025-02-15 (Campo: fecha_vencimiento)
[2025-11-02 22:49:16] ✅ Fecha string convertida: 3/24/2010 -> 2010-03-24 (Campo: fecha_susc)
[2025-11-02 22:49:16] ✅ Fecha string convertida: 10/1/2025 -> 2025-10-01 (Campo: fecha_asignacion)
[2025-11-02 22:49:16] ✅ Fecha string convertida: 9/25/2025 -> 2025-09-25 (Campo: fecha_proceso)
[2025-11-02 22:49:16] ✅ Fecha string convertida: 8/10/2025 -> 2025-08-10 (Campo: fecha_castigo)
[2025-11-02 22:49:16] ✅ Fecha Excel convertida: 45667 -> 2025-01-10 (Campo: fecha_pago)
[2025-11-02 22:49:16] ✅ Fecha string convertida: 2/10/2025 -> 2025-02-10 (Campo: fecha_vencimiento)
[2025-11-02 22:49:16] ✅ Fecha string convertida: 1/15/2023 -> 2023-01-15 (Campo: fecha_susc)
[2025-11-02 22:49:16] ✅ Fecha string convertida: 10/1/2025 -> 2025-10-01 (Campo: fecha_asignacion)
[2025-11-02 22:49:16] ✅ Fecha string convertida: 9/25/2025 -> 2025-09-25 (Campo: fecha_proceso)
[2025-11-02 22:49:16] ✅ Fecha string convertida: 8/5/2025 -> 2025-08-05 (Campo: fecha_castigo)
[2025-11-02 22:49:16] ✅ Fecha Excel convertida: 45658 -> 2025-01-01 (Campo: fecha_pago)
[2025-11-02 22:49:16] ✅ Fecha string convertida: 2/5/2025 -> 2025-02-05 (Campo: fecha_vencimiento)
[2025-11-02 22:49:16] ✅ Fecha string convertida: 4/19/2015 -> 2015-04-19 (Campo: fecha_susc)
[2025-11-02 22:49:16] ✅ Fecha string convertida: 10/1/2025 -> 2025-10-01 (Campo: fecha_asignacion)
[2025-11-02 22:49:16] ✅ Fecha string convertida: 9/25/2025 -> 2025-09-25 (Campo: fecha_proceso)
[2025-11-02 22:49:16] ✅ Fecha string convertida: 8/5/2025 -> 2025-08-05 (Campo: fecha_castigo)
[2025-11-02 22:49:16] ✅ Fecha Excel convertida: 45653 -> 2024-12-27 (Campo: fecha_pago)
[2025-11-02 22:49:16] ✅ Fecha string convertida: 2/5/2025 -> 2025-02-05 (Campo: fecha_vencimiento)
[2025-11-02 22:49:16] ✅ Fecha string convertida: 11/20/2016 -> 2016-11-20 (Campo: fecha_susc)
[2025-11-02 22:49:16] ✅ Valor convertido a DECIMAL: '$ 2,781,810' -> 2781810
[2025-11-02 22:49:16] ✅ Fecha string convertida: 10/1/2025 -> 2025-10-01 (Campo: fecha_asignacion)
[2025-11-02 22:49:16] ✅ Fecha string convertida: 9/25/2025 -> 2025-09-25 (Campo: fecha_proceso)
[2025-11-02 22:49:16] ✅ Fecha string convertida: 8/5/2025 -> 2025-08-05 (Campo: fecha_castigo)
[2025-11-02 22:49:16] ✅ Fecha Excel convertida: 45674 -> 2025-01-17 (Campo: fecha_pago)
[2025-11-02 22:49:16] ✅ Fecha string convertida: 2/5/2025 -> 2025-02-05 (Campo: fecha_vencimiento)
[2025-11-02 22:49:16] ✅ Fecha string convertida: 12/3/2023 -> 2023-12-03 (Campo: fecha_susc)
[2025-11-02 22:49:16] ✅ Fecha string convertida: 10/1/2025 -> 2025-10-01 (Campo: fecha_asignacion)
[2025-11-02 22:49:16] ✅ Fecha string convertida: 9/25/2025 -> 2025-09-25 (Campo: fecha_proceso)
[2025-11-02 22:49:16] ✅ Fecha string convertida: 8/5/2025 -> 2025-08-05 (Campo: fecha_castigo)
[2025-11-02 22:49:16] ✅ Fecha Excel convertida: 45600 -> 2024-11-04 (Campo: fecha_pago)
[2025-11-02 22:49:16] ✅ Fecha string convertida: 2/5/2025 -> 2025-02-05 (Campo: fecha_vencimiento)
[2025-11-02 22:49:16] ✅ Fecha string convertida: 7/2/2024 -> 2024-07-02 (Campo: fecha_susc)
[2025-11-02 22:49:16] ✅ Fecha string convertida: 10/1/2025 -> 2025-10-01 (Campo: fecha_asignacion)
[2025-11-02 22:49:16] ✅ Fecha string convertida: 9/25/2025 -> 2025-09-25 (Campo: fecha_proceso)
[2025-11-02 22:49:16] ✅ Fecha string convertida: 8/10/2025 -> 2025-08-10 (Campo: fecha_castigo)
[2025-11-02 22:49:16] ✅ Fecha Excel convertida: 45657 -> 2024-12-31 (Campo: fecha_pago)
[2025-11-02 22:49:16] ✅ Fecha string convertida: 2/10/2025 -> 2025-02-10 (Campo: fecha_vencimiento)
[2025-11-02 22:49:16] ✅ Fecha string convertida: 8/20/2022 -> 2022-08-20 (Campo: fecha_susc)
[2025-11-02 22:49:16] ✅ Fecha string convertida: 10/1/2025 -> 2025-10-01 (Campo: fecha_asignacion)
[2025-11-02 22:49:16] ✅ Fecha string convertida: 9/25/2025 -> 2025-09-25 (Campo: fecha_proceso)
[2025-11-02 22:49:16] ✅ Fecha string convertida: 8/10/2025 -> 2025-08-10 (Campo: fecha_castigo)
[2025-11-02 22:49:16] ✅ Fecha Excel convertida: 45716 -> 2025-02-28 (Campo: fecha_pago)
[2025-11-02 22:49:16] ✅ Fecha string convertida: 2/10/2025 -> 2025-02-10 (Campo: fecha_vencimiento)
[2025-11-02 22:49:16] ✅ Fecha string convertida: 9/23/2024 -> 2024-09-23 (Campo: fecha_susc)
[2025-11-02 22:49:16] ✅ Fecha string convertida: 10/1/2025 -> 2025-10-01 (Campo: fecha_asignacion)
[2025-11-02 22:49:16] ✅ Fecha string convertida: 9/25/2025 -> 2025-09-25 (Campo: fecha_proceso)
[2025-11-02 22:49:16] ✅ Fecha string convertida: 8/5/2025 -> 2025-08-05 (Campo: fecha_castigo)
[2025-11-02 22:49:16] ✅ Fecha Excel convertida: 45689 -> 2025-02-01 (Campo: fecha_pago)
[2025-11-02 22:49:16] ✅ Fecha string convertida: 2/5/2025 -> 2025-02-05 (Campo: fecha_vencimiento)
[2025-11-02 22:49:16] ✅ Fecha string convertida: 2/7/2015 -> 2015-02-07 (Campo: fecha_susc)
[2025-11-02 22:49:16] ✅ Fecha string convertida: 10/1/2025 -> 2025-10-01 (Campo: fecha_asignacion)
[2025-11-02 22:49:16] ✅ Fecha string convertida: 9/25/2025 -> 2025-09-25 (Campo: fecha_proceso)
[2025-11-02 22:49:16] ✅ Fecha string convertida: 8/5/2025 -> 2025-08-05 (Campo: fecha_castigo)
[2025-11-02 22:49:16] ✅ Fecha Excel convertida: 45632 -> 2024-12-06 (Campo: fecha_pago)
[2025-11-02 22:49:16] ✅ Fecha string convertida: 2/5/2025 -> 2025-02-05 (Campo: fecha_vencimiento)
[2025-11-02 22:49:16] ✅ Fecha string convertida: 4/9/2024 -> 2024-04-09 (Campo: fecha_susc)
[2025-11-02 22:49:16] ✅ Fecha string convertida: 10/1/2025 -> 2025-10-01 (Campo: fecha_asignacion)
[2025-11-02 22:49:16] ✅ Fecha string convertida: 9/25/2025 -> 2025-09-25 (Campo: fecha_proceso)
[2025-11-02 22:49:16] ✅ Fecha string convertida: 8/5/2025 -> 2025-08-05 (Campo: fecha_castigo)
[2025-11-02 22:49:16] ✅ Fecha Excel convertida: 45658 -> 2025-01-01 (Campo: fecha_pago)
[2025-11-02 22:49:16] ✅ Fecha string convertida: 2/5/2025 -> 2025-02-05 (Campo: fecha_vencimiento)
[2025-11-02 22:49:16] ✅ Fecha string convertida: 4/28/2022 -> 2022-04-28 (Campo: fecha_susc)
[2025-11-02 22:49:16] ✅ Fecha string convertida: 10/1/2025 -> 2025-10-01 (Campo: fecha_asignacion)
[2025-11-02 22:49:16] 📊 Registros en tabla temporal: 2984
[2025-11-02 22:49:16] ⚙️ Ejecutando stored procedure...
[2025-11-02 22:49:17] ✅ Stored procedure ejecutado exitosamente
[2025-11-02 22:49:17] ✅ Registro en Control_Cargas_Mensuales: ASIGNACION_STOCK - 202510 - 2984 registros
[2025-11-02 22:49:17] 📈 RESUMEN FINAL: 2984 filas procesadas, 0 filas con error, 0 filas omitidas
[2025-11-02 22:49:17] 🔄 Actualizando log ID 142 - Estado: COMPLETADO
[2025-11-02 22:49:17] ✅ Log actualizado exitosamente
[2025-11-02 22:49:17] 📊 Resultado final del procesamiento: | Data: {"success":true,"registros_procesados":2984,"errores":[],"log_id":"142","mensaje":"Archivo procesado correctamente. Registros insertados: 2984","filas_con_error":0,"filas_omitidas":0}
[2025-11-02 22:49:17] =================== FIN SOLICITUD ===================

[2025-11-02 22:49:43] 🎯 PROCESAR_EXCEL.PHP INICIADO - Usuario: admin
[2025-11-02 22:49:43] =================== NUEVA SOLICITUD ===================
[2025-11-02 22:49:43] 🔍 Verificando archivo subido...
[2025-11-02 22:49:43] 🎯 Tipo de archivo: ASIGNACION_STOCK
[2025-11-02 22:49:43] 📄 Archivo: Asignación 202510 - MAB - copia.xlsx | Extensión: xlsx
[2025-11-02 22:49:43] 📏 Tamaño: 929838 bytes
[2025-11-02 22:49:43] 💾 Guardando en: ../../files/uploads/20251102_224943_6907d1f7bf8ff_Asignación 202510 - MAB - copia.xlsx
[2025-11-02 22:49:43] ✅ Archivo guardado exitosamente
[2025-11-02 22:49:43] 🚀 INICIANDO PROCESAMIENTO COMPLETO: ASIGNACION_STOCK
[2025-11-02 22:49:43] 📝 Registrando log en BD...
[2025-11-02 22:49:43] ✅ Log registrado exitosamente - ID: 143
[2025-11-02 22:49:43] 📦 CARGANDO ARCHIVO EXCEL...
[2025-11-02 22:49:48] ✅ Excel cargado exitosamente
[2025-11-02 22:49:50] 📊 Total de filas en Excel: 2985
[2025-11-02 22:49:50] 📋 Headers encontrados: | Data: ["PERIODO_PROCESO","FECHA_PROCESO","PERIODO_CASTIGO","RUT","DV","CONTRATO","NOMBRE","PATERNO","MATERNO","FECHA_CASTIGO","SALDO_GENERADO","CLASIFICACION_BIENES","CANAL","CLASIFICACION","DIRECCION","NUMERACION_DIR","RESTO","REGION","COMUNA","CIUDAD","ABOGADO","ZONA","CORREO1","CORREO2","CORREO3","CORREO4","CORREO5","TELEFONO1","TELEFONO2","TELEFONO3","TELEFONO4","TELEFONO5","FECHA_PAGO","MONTO_PAGO","FECHA_VENCIMIENTO","DIAS_MORA","FECHA_SUSC","TIPO_CAMPA\u00d1A","DESCUENTO","MONTO_A_PAGAR","SALDO_EN_CAMPA\u00d1A","FECHA_ASIGNACION","TIPO_CARTERA"]
[2025-11-02 22:49:50] 🧹 Limpiando tabla temporal...
[2025-11-02 22:49:50] ✅ Tabla temporal limpiada
[2025-11-02 22:49:50] 💾 Insertando datos en tabla temporal...
[2025-11-02 22:49:50] ✅ Fecha string convertida: 1/27/2025 -> 2025-01-27 (Campo: fecha_proceso)
[2025-11-02 22:49:50] ✅ DV con valor '0' - ES VÁLIDO
[2025-11-02 22:49:50] ✅ Fecha string convertida: 5/31/2018 -> 2018-05-31 (Campo: fecha_castigo)
[2025-11-02 22:49:50] ✅ Fecha string convertida: 1/30/2021 -> 2021-01-30 (Campo: fecha_pago)
[2025-11-02 22:49:50] ✅ Fecha string convertida: 11/5/2017 -> 2017-11-05 (Campo: fecha_vencimiento)
[2025-11-02 22:49:50] ✅ Fecha string convertida: 8/15/2014 -> 2014-08-15 (Campo: fecha_susc)
[2025-11-02 22:49:50] ✅ Fecha string convertida: 1/1/2019 -> 2019-01-01 (Campo: fecha_asignacion)
[2025-11-02 22:49:50] ✅ Fecha string convertida: 1/27/2025 -> 2025-01-27 (Campo: fecha_proceso)
[2025-11-02 22:49:50] ✅ DV con valor '0' - ES VÁLIDO
[2025-11-02 22:49:50] ✅ Fecha string convertida: 12/5/2019 -> 2019-12-05 (Campo: fecha_castigo)
[2025-11-02 22:49:50] ✅ Fecha string convertida: 1/30/2021 -> 2021-01-30 (Campo: fecha_pago)
[2025-11-02 22:49:50] ✅ Fecha string convertida: 6/5/2019 -> 2019-06-05 (Campo: fecha_vencimiento)
[2025-11-02 22:49:50] ✅ Fecha string convertida: 2/16/2004 -> 2004-02-16 (Campo: fecha_susc)
[2025-11-02 22:49:50] ✅ Fecha string convertida: 2/1/2020 -> 2020-02-01 (Campo: fecha_asignacion)
[2025-11-02 22:49:50] ✅ Fecha string convertida: 1/27/2025 -> 2025-01-27 (Campo: fecha_proceso)
[2025-11-02 22:49:50] ✅ DV con valor '0' - ES VÁLIDO
[2025-11-02 22:49:50] ✅ Fecha string convertida: 3/15/2020 -> 2020-03-15 (Campo: fecha_castigo)
[2025-11-02 22:49:50] ✅ Fecha string convertida: 11/2/2022 -> 2022-11-02 (Campo: fecha_pago)
[2025-11-02 22:49:50] ✅ Fecha string convertida: 9/15/2019 -> 2019-09-15 (Campo: fecha_vencimiento)
[2025-11-02 22:49:50] ✅ Fecha string convertida: 9/7/2006 -> 2006-09-07 (Campo: fecha_susc)
[2025-11-02 22:49:50] ✅ Fecha string convertida: 2/1/2020 -> 2020-02-01 (Campo: fecha_asignacion)
[2025-11-02 22:49:50] ✅ Fecha string convertida: 1/27/2025 -> 2025-01-27 (Campo: fecha_proceso)
[2025-11-02 22:49:50] ✅ DV con valor '0' - ES VÁLIDO
[2025-11-02 22:49:50] ✅ Fecha string convertida: 6/5/2020 -> 2020-06-05 (Campo: fecha_castigo)
[2025-11-02 22:49:50] ✅ Fecha string convertida: 12/5/2019 -> 2019-12-05 (Campo: fecha_vencimiento)
[2025-11-02 22:49:50] ✅ Fecha string convertida: 12/20/2017 -> 2017-12-20 (Campo: fecha_susc)
[2025-11-02 22:49:50] ✅ Fecha string convertida: 8/1/2020 -> 2020-08-01 (Campo: fecha_asignacion)
[2025-11-02 22:49:50] ✅ Fecha string convertida: 1/27/2025 -> 2025-01-27 (Campo: fecha_proceso)
[2025-11-02 22:49:50] ✅ DV con valor '0' - ES VÁLIDO
[2025-11-02 22:49:50] ✅ Fecha string convertida: 6/30/2020 -> 2020-06-30 (Campo: fecha_castigo)
[2025-11-02 22:49:50] ✅ Fecha string convertida: 12/30/2019 -> 2019-12-30 (Campo: fecha_vencimiento)
[2025-11-02 22:49:50] ✅ Fecha string convertida: 7/23/2017 -> 2017-07-23 (Campo: fecha_susc)
[2025-11-02 22:49:50] ✅ Fecha string convertida: 8/1/2020 -> 2020-08-01 (Campo: fecha_asignacion)
[2025-11-02 22:49:50] ✅ Fecha string convertida: 1/27/2025 -> 2025-01-27 (Campo: fecha_proceso)
[2025-11-02 22:49:50] ✅ DV con valor '0' - ES VÁLIDO
[2025-11-02 22:49:50] ✅ Fecha string convertida: 7/5/2020 -> 2020-07-05 (Campo: fecha_castigo)
[2025-11-02 22:49:50] ✅ Fecha string convertida: 1/5/2020 -> 2020-01-05 (Campo: fecha_vencimiento)
[2025-11-02 22:49:50] ✅ Fecha string convertida: 1/3/2006 -> 2006-01-03 (Campo: fecha_susc)
[2025-11-02 22:49:50] ✅ Fecha string convertida: 9/1/2020 -> 2020-09-01 (Campo: fecha_asignacion)
[2025-11-02 22:49:50] ✅ Fecha string convertida: 1/27/2025 -> 2025-01-27 (Campo: fecha_proceso)
[2025-11-02 22:49:50] ✅ DV con valor '0' - ES VÁLIDO
[2025-11-02 22:49:50] ✅ Fecha string convertida: 7/10/2020 -> 2020-07-10 (Campo: fecha_castigo)
[2025-11-02 22:49:50] ✅ Fecha string convertida: 1/10/2020 -> 2020-01-10 (Campo: fecha_vencimiento)
[2025-11-02 22:49:50] ✅ Fecha string convertida: 11/6/2017 -> 2017-11-06 (Campo: fecha_susc)
[2025-11-02 22:49:50] ✅ Fecha string convertida: 9/1/2020 -> 2020-09-01 (Campo: fecha_asignacion)
[2025-11-02 22:49:50] ✅ Fecha string convertida: 1/27/2025 -> 2025-01-27 (Campo: fecha_proceso)
[2025-11-02 22:49:50] ✅ DV con valor '0' - ES VÁLIDO
[2025-11-02 22:49:50] ✅ Fecha string convertida: 10/5/2020 -> 2020-10-05 (Campo: fecha_castigo)
[2025-11-02 22:49:50] ✅ Fecha string convertida: 5/22/2023 -> 2023-05-22 (Campo: fecha_pago)
[2025-11-02 22:49:50] ✅ Fecha string convertida: 4/5/2020 -> 2020-04-05 (Campo: fecha_vencimiento)
[2025-11-02 22:49:50] ✅ Fecha string convertida: 2/19/2009 -> 2009-02-19 (Campo: fecha_susc)
[2025-11-02 22:49:50] ✅ Fecha string convertida: 12/1/2020 -> 2020-12-01 (Campo: fecha_asignacion)
[2025-11-02 22:49:50] ✅ Fecha string convertida: 1/27/2025 -> 2025-01-27 (Campo: fecha_proceso)
[2025-11-02 22:49:50] ✅ DV con valor '0' - ES VÁLIDO
[2025-11-02 22:49:50] ✅ Fecha string convertida: 10/5/2020 -> 2020-10-05 (Campo: fecha_castigo)
[2025-11-02 22:49:50] ✅ Fecha string convertida: 4/5/2020 -> 2020-04-05 (Campo: fecha_vencimiento)
[2025-11-02 22:49:50] ✅ Fecha string convertida: 6/10/2010 -> 2010-06-10 (Campo: fecha_susc)
[2025-11-02 22:49:50] ✅ Fecha string convertida: 12/1/2020 -> 2020-12-01 (Campo: fecha_asignacion)
[2025-11-02 22:49:50] ✅ Fecha string convertida: 1/27/2025 -> 2025-01-27 (Campo: fecha_proceso)
[2025-11-02 22:49:50] ✅ DV con valor '0' - ES VÁLIDO
[2025-11-02 22:49:50] ✅ Fecha string convertida: 12/5/2020 -> 2020-12-05 (Campo: fecha_castigo)
[2025-11-02 22:49:50] ✅ Fecha string convertida: 1/22/2024 -> 2024-01-22 (Campo: fecha_pago)
[2025-11-02 22:49:50] ✅ Fecha string convertida: 6/5/2020 -> 2020-06-05 (Campo: fecha_vencimiento)
[2025-11-02 22:49:50] ✅ Fecha string convertida: 6/26/2016 -> 2016-06-26 (Campo: fecha_susc)
[2025-11-02 22:49:50] ✅ Fecha string convertida: 2/1/2021 -> 2021-02-01 (Campo: fecha_asignacion)
[2025-11-02 22:49:50] ✅ Fecha string convertida: 1/27/2025 -> 2025-01-27 (Campo: fecha_proceso)
[2025-11-02 22:49:51] ✅ DV con valor '0' - ES VÁLIDO
[2025-11-02 22:49:51] ✅ Fecha string convertida: 1/5/2021 -> 2021-01-05 (Campo: fecha_castigo)
[2025-11-02 22:49:51] ✅ Fecha string convertida: 7/5/2020 -> 2020-07-05 (Campo: fecha_vencimiento)
[2025-11-02 22:49:51] ✅ Fecha string convertida: 8/19/2009 -> 2009-08-19 (Campo: fecha_susc)
[2025-11-02 22:49:51] ✅ Fecha string convertida: 3/1/2021 -> 2021-03-01 (Campo: fecha_asignacion)
[2025-11-02 22:49:51] ✅ Fecha string convertida: 1/27/2025 -> 2025-01-27 (Campo: fecha_proceso)
[2025-11-02 22:49:51] ✅ DV con valor '0' - ES VÁLIDO
[2025-11-02 22:49:51] ✅ Fecha string convertida: 1/5/2021 -> 2021-01-05 (Campo: fecha_castigo)
[2025-11-02 22:49:51] ✅ Fecha string convertida: 7/5/2020 -> 2020-07-05 (Campo: fecha_vencimiento)
[2025-11-02 22:49:51] ✅ Fecha string convertida: 11/29/2014 -> 2014-11-29 (Campo: fecha_susc)
[2025-11-02 22:49:51] ✅ Fecha string convertida: 3/1/2021 -> 2021-03-01 (Campo: fecha_asignacion)
[2025-11-02 22:49:51] ✅ Fecha string convertida: 1/27/2025 -> 2025-01-27 (Campo: fecha_proceso)
[2025-11-02 22:49:51] ✅ DV con valor '0' - ES VÁLIDO
[2025-11-02 22:49:51] ✅ Fecha string convertida: 1/15/2021 -> 2021-01-15 (Campo: fecha_castigo)
[2025-11-02 22:49:51] ✅ Fecha string convertida: 7/15/2020 -> 2020-07-15 (Campo: fecha_vencimiento)
[2025-11-02 22:49:51] ✅ Fecha string convertida: 11/2/2011 -> 2011-11-02 (Campo: fecha_susc)
[2025-11-02 22:49:51] ✅ Fecha string convertida: 3/1/2021 -> 2021-03-01 (Campo: fecha_asignacion)
[2025-11-02 22:49:51] ✅ Fecha string convertida: 1/27/2025 -> 2025-01-27 (Campo: fecha_proceso)
[2025-11-02 22:49:51] ✅ DV con valor '0' - ES VÁLIDO
[2025-11-02 22:49:51] ✅ Fecha string convertida: 1/30/2021 -> 2021-01-30 (Campo: fecha_castigo)
[2025-11-02 22:49:51] ✅ Fecha string convertida: 7/30/2020 -> 2020-07-30 (Campo: fecha_vencimiento)
[2025-11-02 22:49:51] ✅ Fecha string convertida: 2/7/2008 -> 2008-02-07 (Campo: fecha_susc)
[2025-11-02 22:49:51] ✅ Fecha string convertida: 3/1/2021 -> 2021-03-01 (Campo: fecha_asignacion)
[2025-11-02 22:49:51] ✅ Fecha string convertida: 1/27/2025 -> 2025-01-27 (Campo: fecha_proceso)
[2025-11-02 22:49:51] ✅ DV con valor '0' - ES VÁLIDO
[2025-11-02 22:49:51] ✅ Fecha string convertida: 2/5/2021 -> 2021-02-05 (Campo: fecha_castigo)
[2025-11-02 22:49:51] ✅ Fecha string convertida: 8/5/2020 -> 2020-08-05 (Campo: fecha_vencimiento)
[2025-11-02 22:49:51] ✅ Fecha string convertida: 8/4/2018 -> 2018-08-04 (Campo: fecha_susc)
[2025-11-02 22:49:51] ✅ Fecha string convertida: 4/1/2021 -> 2021-04-01 (Campo: fecha_asignacion)
[2025-11-02 22:49:51] ✅ Fecha string convertida: 1/27/2025 -> 2025-01-27 (Campo: fecha_proceso)
[2025-11-02 22:49:51] ✅ DV con valor '0' - ES VÁLIDO
[2025-11-02 22:49:51] ✅ Fecha string convertida: 2/5/2021 -> 2021-02-05 (Campo: fecha_castigo)
[2025-11-02 22:49:51] ✅ Fecha string convertida: 8/5/2020 -> 2020-08-05 (Campo: fecha_vencimiento)
[2025-11-02 22:49:51] ✅ Fecha string convertida: 4/17/2016 -> 2016-04-17 (Campo: fecha_susc)
[2025-11-02 22:49:51] ✅ Fecha string convertida: 4/1/2021 -> 2021-04-01 (Campo: fecha_asignacion)
[2025-11-02 22:49:51] ✅ Fecha string convertida: 1/27/2025 -> 2025-01-27 (Campo: fecha_proceso)
[2025-11-02 22:49:51] ✅ DV con valor '0' - ES VÁLIDO
[2025-11-02 22:49:51] ✅ Fecha string convertida: 3/5/2021 -> 2021-03-05 (Campo: fecha_castigo)
[2025-11-02 22:49:51] ✅ Fecha string convertida: 1/29/2021 -> 2021-01-29 (Campo: fecha_pago)
[2025-11-02 22:49:51] ✅ Fecha string convertida: 9/5/2020 -> 2020-09-05 (Campo: fecha_vencimiento)
[2025-11-02 22:49:51] ✅ Fecha string convertida: 7/27/1994 -> 1994-07-27 (Campo: fecha_susc)
[2025-11-02 22:49:51] ✅ Fecha string convertida: 5/1/2021 -> 2021-05-01 (Campo: fecha_asignacion)
[2025-11-02 22:49:51] ✅ Fecha string convertida: 1/27/2025 -> 2025-01-27 (Campo: fecha_proceso)
[2025-11-02 22:49:51] ✅ DV con valor '0' - ES VÁLIDO
[2025-11-02 22:49:51] ✅ Fecha string convertida: 6/15/2021 -> 2021-06-15 (Campo: fecha_castigo)
[2025-11-02 22:49:51] ✅ Fecha string convertida: 11/27/2024 -> 2024-11-27 (Campo: fecha_pago)
[2025-11-02 22:49:51] ✅ Fecha string convertida: 12/15/2020 -> 2020-12-15 (Campo: fecha_vencimiento)
[2025-11-02 22:49:51] ✅ Fecha string convertida: 1/13/2012 -> 2012-01-13 (Campo: fecha_susc)
[2025-11-02 22:49:51] ✅ Fecha string convertida: 7/1/2021 -> 2021-07-01 (Campo: fecha_asignacion)
[2025-11-02 22:49:51] ✅ Fecha string convertida: 1/27/2025 -> 2025-01-27 (Campo: fecha_proceso)
[2025-11-02 22:49:51] ✅ DV con valor '0' - ES VÁLIDO
[2025-11-02 22:49:51] ✅ Fecha string convertida: 7/5/2021 -> 2021-07-05 (Campo: fecha_castigo)
[2025-11-02 22:49:51] ✅ DV con valor '0' - ES VÁLIDO
[2025-11-02 22:49:51] ✅ Fecha string convertida: 1/5/2021 -> 2021-01-05 (Campo: fecha_pago)
[2025-11-02 22:49:51] ✅ Fecha string convertida: 1/5/2021 -> 2021-01-05 (Campo: fecha_vencimiento)
[2025-11-02 22:49:51] ✅ Fecha string convertida: 7/28/2015 -> 2015-07-28 (Campo: fecha_susc)
[2025-11-02 22:49:51] ✅ Fecha string convertida: 9/1/2021 -> 2021-09-01 (Campo: fecha_asignacion)
[2025-11-02 22:49:51] ✅ Fecha string convertida: 1/27/2025 -> 2025-01-27 (Campo: fecha_proceso)
[2025-11-02 22:49:51] ✅ DV con valor '0' - ES VÁLIDO
[2025-11-02 22:49:51] ✅ Fecha string convertida: 9/5/2021 -> 2021-09-05 (Campo: fecha_castigo)
[2025-11-02 22:49:51] ✅ Fecha string convertida: 10/7/2024 -> 2024-10-07 (Campo: fecha_pago)
[2025-11-02 22:49:51] ✅ Fecha string convertida: 3/5/2021 -> 2021-03-05 (Campo: fecha_vencimiento)
[2025-11-02 22:49:51] ✅ Fecha string convertida: 9/13/2016 -> 2016-09-13 (Campo: fecha_susc)
[2025-11-02 22:49:51] ✅ Fecha string convertida: 11/1/2021 -> 2021-11-01 (Campo: fecha_asignacion)
[2025-11-02 22:49:51] ✅ Fecha string convertida: 1/27/2025 -> 2025-01-27 (Campo: fecha_proceso)
[2025-11-02 22:49:51] ✅ DV con valor '0' - ES VÁLIDO
[2025-11-02 22:49:51] ✅ Fecha string convertida: 10/5/2021 -> 2021-10-05 (Campo: fecha_castigo)
[2025-11-02 22:49:51] ✅ Fecha string convertida: 8/30/2022 -> 2022-08-30 (Campo: fecha_pago)
[2025-11-02 22:49:51] ✅ Fecha string convertida: 4/5/2021 -> 2021-04-05 (Campo: fecha_vencimiento)
[2025-11-02 22:49:51] ✅ Fecha string convertida: 11/26/2017 -> 2017-11-26 (Campo: fecha_susc)
[2025-11-02 22:49:51] ✅ Fecha string convertida: 12/1/2021 -> 2021-12-01 (Campo: fecha_asignacion)
[2025-11-02 22:49:51] ✅ Fecha string convertida: 1/27/2025 -> 2025-01-27 (Campo: fecha_proceso)
[2025-11-02 22:49:51] ✅ DV con valor '0' - ES VÁLIDO
[2025-11-02 22:49:51] ✅ Fecha string convertida: 11/5/2021 -> 2021-11-05 (Campo: fecha_castigo)
[2025-11-02 22:49:51] ✅ Fecha string convertida: 5/5/2021 -> 2021-05-05 (Campo: fecha_vencimiento)
[2025-11-02 22:49:51] ✅ Fecha string convertida: 9/3/2014 -> 2014-09-03 (Campo: fecha_susc)
[2025-11-02 22:49:51] ✅ Fecha string convertida: 1/1/2022 -> 2022-01-01 (Campo: fecha_asignacion)
[2025-11-02 22:49:51] ✅ Fecha string convertida: 1/27/2025 -> 2025-01-27 (Campo: fecha_proceso)
[2025-11-02 22:49:51] ✅ DV con valor '0' - ES VÁLIDO
[2025-11-02 22:49:51] ✅ Fecha string convertida: 1/5/2022 -> 2022-01-05 (Campo: fecha_castigo)
[2025-11-02 22:49:51] ✅ Fecha string convertida: 7/5/2021 -> 2021-07-05 (Campo: fecha_vencimiento)
[2025-11-02 22:49:51] ✅ Fecha string convertida: 8/19/2016 -> 2016-08-19 (Campo: fecha_susc)
[2025-11-02 22:49:51] ✅ Fecha string convertida: 3/1/2022 -> 2022-03-01 (Campo: fecha_asignacion)
[2025-11-02 22:49:51] ✅ Fecha string convertida: 1/27/2025 -> 2025-01-27 (Campo: fecha_proceso)
[2025-11-02 22:49:51] ✅ DV con valor '0' - ES VÁLIDO
[2025-11-02 22:49:51] ✅ Fecha string convertida: 1/5/2022 -> 2022-01-05 (Campo: fecha_castigo)
[2025-11-02 22:49:51] ✅ Fecha string convertida: 7/5/2021 -> 2021-07-05 (Campo: fecha_vencimiento)
[2025-11-02 22:49:51] ✅ Fecha string convertida: 6/6/2016 -> 2016-06-06 (Campo: fecha_susc)
[2025-11-02 22:49:51] ✅ Fecha string convertida: 3/1/2022 -> 2022-03-01 (Campo: fecha_asignacion)
[2025-11-02 22:49:51] ✅ Fecha string convertida: 1/27/2025 -> 2025-01-27 (Campo: fecha_proceso)
[2025-11-02 22:49:51] ✅ DV con valor '0' - ES VÁLIDO
[2025-11-02 22:49:51] ✅ Fecha string convertida: 1/5/2022 -> 2022-01-05 (Campo: fecha_castigo)
[2025-11-02 22:49:51] ✅ Fecha string convertida: 7/5/2021 -> 2021-07-05 (Campo: fecha_vencimiento)
[2025-11-02 22:49:51] ✅ Fecha string convertida: 1/14/2014 -> 2014-01-14 (Campo: fecha_susc)
[2025-11-02 22:49:51] ✅ Fecha string convertida: 3/1/2022 -> 2022-03-01 (Campo: fecha_asignacion)
[2025-11-02 22:49:51] ✅ Fecha string convertida: 1/27/2025 -> 2025-01-27 (Campo: fecha_proceso)
[2025-11-02 22:49:51] ✅ DV con valor '0' - ES VÁLIDO
[2025-11-02 22:49:51] ✅ Fecha string convertida: 2/5/2022 -> 2022-02-05 (Campo: fecha_castigo)
[2025-11-02 22:49:51] ✅ Fecha string convertida: 8/5/2021 -> 2021-08-05 (Campo: fecha_vencimiento)
[2025-11-02 22:49:51] ✅ Fecha string convertida: 10/27/2013 -> 2013-10-27 (Campo: fecha_susc)
[2025-11-02 22:49:51] ✅ Fecha string convertida: 4/1/2022 -> 2022-04-01 (Campo: fecha_asignacion)
[2025-11-02 22:49:51] ✅ Fecha string convertida: 1/27/2025 -> 2025-01-27 (Campo: fecha_proceso)
[2025-11-02 22:49:51] ✅ DV con valor '0' - ES VÁLIDO
[2025-11-02 22:49:51] ✅ Fecha string convertida: 2/5/2022 -> 2022-02-05 (Campo: fecha_castigo)
[2025-11-02 22:49:51] ✅ Fecha string convertida: 7/21/2022 -> 2022-07-21 (Campo: fecha_pago)
[2025-11-02 22:49:51] ✅ Fecha string convertida: 8/5/2021 -> 2021-08-05 (Campo: fecha_vencimiento)
[2025-11-02 22:49:51] ✅ Fecha string convertida: 8/24/2012 -> 2012-08-24 (Campo: fecha_susc)
[2025-11-02 22:49:51] ✅ Fecha string convertida: 4/1/2022 -> 2022-04-01 (Campo: fecha_asignacion)
[2025-11-02 22:49:51] ✅ Fecha string convertida: 1/27/2025 -> 2025-01-27 (Campo: fecha_proceso)
[2025-11-02 22:49:51] ✅ DV con valor '0' - ES VÁLIDO
[2025-11-02 22:49:51] ✅ Fecha string convertida: 2/5/2022 -> 2022-02-05 (Campo: fecha_castigo)
[2025-11-02 22:49:51] ✅ Fecha string convertida: 8/5/2021 -> 2021-08-05 (Campo: fecha_vencimiento)
[2025-11-02 22:49:51] ✅ Fecha string convertida: 9/13/2017 -> 2017-09-13 (Campo: fecha_susc)
[2025-11-02 22:49:51] ✅ Fecha string convertida: 4/1/2022 -> 2022-04-01 (Campo: fecha_asignacion)
[2025-11-02 22:49:51] ✅ Fecha string convertida: 1/27/2025 -> 2025-01-27 (Campo: fecha_proceso)
[2025-11-02 22:49:51] ✅ DV con valor '0' - ES VÁLIDO
[2025-11-02 22:49:51] ✅ Fecha string convertida: 2/15/2022 -> 2022-02-15 (Campo: fecha_castigo)
[2025-11-02 22:49:51] ✅ Fecha string convertida: 11/7/2022 -> 2022-11-07 (Campo: fecha_pago)
[2025-11-02 22:49:51] ✅ Fecha string convertida: 8/15/2021 -> 2021-08-15 (Campo: fecha_vencimiento)
[2025-11-02 22:49:51] ✅ Fecha string convertida: 11/26/2017 -> 2017-11-26 (Campo: fecha_susc)
[2025-11-02 22:49:51] ✅ Fecha string convertida: 4/1/2022 -> 2022-04-01 (Campo: fecha_asignacion)
[2025-11-02 22:49:51] ✅ Fecha string convertida: 1/27/2025 -> 2025-01-27 (Campo: fecha_proceso)
[2025-11-02 22:49:51] ✅ DV con valor '0' - ES VÁLIDO
[2025-11-02 22:49:51] ✅ Fecha string convertida: 3/5/2022 -> 2022-03-05 (Campo: fecha_castigo)
[2025-11-02 22:49:51] ✅ Fecha string convertida: 9/5/2021 -> 2021-09-05 (Campo: fecha_vencimiento)
[2025-11-02 22:49:51] ✅ Fecha string convertida: 6/12/2015 -> 2015-06-12 (Campo: fecha_susc)
[2025-11-02 22:49:51] ✅ Fecha string convertida: 5/1/2022 -> 2022-05-01 (Campo: fecha_asignacion)
[2025-11-02 22:49:51] ✅ Fecha string convertida: 1/27/2025 -> 2025-01-27 (Campo: fecha_proceso)
[2025-11-02 22:49:51] ✅ DV con valor '0' - ES VÁLIDO
[2025-11-02 22:49:51] ✅ Fecha string convertida: 3/5/2022 -> 2022-03-05 (Campo: fecha_castigo)
[2025-11-02 22:49:51] ✅ Fecha string convertida: 3/9/2023 -> 2023-03-09 (Campo: fecha_pago)
[2025-11-02 22:49:51] ✅ Fecha string convertida: 9/5/2021 -> 2021-09-05 (Campo: fecha_vencimiento)
[2025-11-02 22:49:51] ✅ Fecha string convertida: 8/9/2014 -> 2014-08-09 (Campo: fecha_susc)
[2025-11-02 22:49:51] ✅ Fecha string convertida: 5/1/2022 -> 2022-05-01 (Campo: fecha_asignacion)
[2025-11-02 22:49:51] ✅ Fecha string convertida: 1/27/2025 -> 2025-01-27 (Campo: fecha_proceso)
[2025-11-02 22:49:51] ✅ DV con valor '0' - ES VÁLIDO
[2025-11-02 22:49:51] ✅ Fecha string convertida: 3/10/2022 -> 2022-03-10 (Campo: fecha_castigo)
[2025-11-02 22:49:51] ✅ Fecha string convertida: 9/10/2021 -> 2021-09-10 (Campo: fecha_vencimiento)
[2025-11-02 22:49:51] ✅ Fecha string convertida: 9/24/2020 -> 2020-09-24 (Campo: fecha_susc)
[2025-11-02 22:49:51] ✅ Fecha string convertida: 5/1/2022 -> 2022-05-01 (Campo: fecha_asignacion)
[2025-11-02 22:49:51] ✅ Fecha string convertida: 1/27/2025 -> 2025-01-27 (Campo: fecha_proceso)
[2025-11-02 22:49:51] ✅ DV con valor '0' - ES VÁLIDO
[2025-11-02 22:49:51] ✅ Fecha string convertida: 3/10/2022 -> 2022-03-10 (Campo: fecha_castigo)
[2025-11-02 22:49:51] ✅ Fecha string convertida: 9/20/2022 -> 2022-09-20 (Campo: fecha_pago)
[2025-11-02 22:49:51] ✅ Fecha string convertida: 9/10/2021 -> 2021-09-10 (Campo: fecha_vencimiento)
[2025-11-02 22:49:51] ✅ Fecha string convertida: 1/2/1998 -> 1998-01-02 (Campo: fecha_susc)
[2025-11-02 22:49:51] ✅ Fecha string convertida: 5/1/2022 -> 2022-05-01 (Campo: fecha_asignacion)
[2025-11-02 22:49:51] ✅ Fecha string convertida: 1/27/2025 -> 2025-01-27 (Campo: fecha_proceso)
[2025-11-02 22:49:51] ✅ DV con valor '0' - ES VÁLIDO
[2025-11-02 22:49:51] ✅ Fecha string convertida: 4/5/2022 -> 2022-04-05 (Campo: fecha_castigo)
[2025-11-02 22:49:51] ✅ Fecha string convertida: 10/20/2022 -> 2022-10-20 (Campo: fecha_pago)
[2025-11-02 22:49:51] ✅ Fecha string convertida: 10/5/2021 -> 2021-10-05 (Campo: fecha_vencimiento)
[2025-11-02 22:49:51] ✅ Fecha string convertida: 7/26/2018 -> 2018-07-26 (Campo: fecha_susc)
[2025-11-02 22:49:51] ✅ Fecha string convertida: 6/1/2022 -> 2022-06-01 (Campo: fecha_asignacion)
[2025-11-02 22:49:51] ✅ Fecha string convertida: 1/27/2025 -> 2025-01-27 (Campo: fecha_proceso)
[2025-11-02 22:49:51] ✅ DV con valor '0' - ES VÁLIDO
[2025-11-02 22:49:51] ✅ Fecha string convertida: 4/5/2022 -> 2022-04-05 (Campo: fecha_castigo)
[2025-11-02 22:49:51] ✅ Fecha string convertida: 10/5/2021 -> 2021-10-05 (Campo: fecha_vencimiento)
[2025-11-02 22:49:51] ✅ Fecha string convertida: 11/10/2017 -> 2017-11-10 (Campo: fecha_susc)
[2025-11-02 22:49:51] ✅ Fecha string convertida: 6/1/2022 -> 2022-06-01 (Campo: fecha_asignacion)
[2025-11-02 22:49:51] ✅ Fecha string convertida: 1/27/2025 -> 2025-01-27 (Campo: fecha_proceso)
[2025-11-02 22:49:51] ✅ DV con valor '0' - ES VÁLIDO
[2025-11-02 22:49:51] ✅ Fecha string convertida: 4/5/2022 -> 2022-04-05 (Campo: fecha_castigo)
[2025-11-02 22:49:51] ✅ Fecha string convertida: 10/5/2021 -> 2021-10-05 (Campo: fecha_vencimiento)
[2025-11-02 22:49:51] ✅ Fecha string convertida: 8/11/2018 -> 2018-08-11 (Campo: fecha_susc)
[2025-11-02 22:49:51] ✅ Fecha string convertida: 6/1/2022 -> 2022-06-01 (Campo: fecha_asignacion)
[2025-11-02 22:49:51] ✅ Fecha string convertida: 1/27/2025 -> 2025-01-27 (Campo: fecha_proceso)
[2025-11-02 22:49:51] ✅ DV con valor '0' - ES VÁLIDO
[2025-11-02 22:49:51] ✅ Fecha string convertida: 4/5/2022 -> 2022-04-05 (Campo: fecha_castigo)
[2025-11-02 22:49:51] ✅ Fecha string convertida: 10/5/2021 -> 2021-10-05 (Campo: fecha_vencimiento)
[2025-11-02 22:49:51] ✅ Fecha string convertida: 5/11/2013 -> 2013-05-11 (Campo: fecha_susc)
[2025-11-02 22:49:51] ✅ Fecha string convertida: 6/1/2022 -> 2022-06-01 (Campo: fecha_asignacion)
[2025-11-02 22:49:51] ✅ Fecha string convertida: 1/27/2025 -> 2025-01-27 (Campo: fecha_proceso)
[2025-11-02 22:49:51] ✅ DV con valor '0' - ES VÁLIDO
[2025-11-02 22:49:51] ✅ Fecha string convertida: 4/5/2022 -> 2022-04-05 (Campo: fecha_castigo)
[2025-11-02 22:49:51] ✅ Fecha string convertida: 10/5/2021 -> 2021-10-05 (Campo: fecha_vencimiento)
[2025-11-02 22:49:51] ✅ Fecha string convertida: 3/6/2015 -> 2015-03-06 (Campo: fecha_susc)
[2025-11-02 22:49:51] ✅ Fecha string convertida: 6/1/2022 -> 2022-06-01 (Campo: fecha_asignacion)
[2025-11-02 22:49:51] ✅ Fecha string convertida: 1/27/2025 -> 2025-01-27 (Campo: fecha_proceso)
[2025-11-02 22:49:51] ✅ DV con valor '0' - ES VÁLIDO
[2025-11-02 22:49:51] ✅ Fecha string convertida: 4/5/2022 -> 2022-04-05 (Campo: fecha_castigo)
[2025-11-02 22:49:51] ✅ Fecha string convertida: 10/5/2021 -> 2021-10-05 (Campo: fecha_vencimiento)
[2025-11-02 22:49:51] ✅ Fecha string convertida: 9/17/2017 -> 2017-09-17 (Campo: fecha_susc)
[2025-11-02 22:49:51] ✅ Fecha string convertida: 6/1/2022 -> 2022-06-01 (Campo: fecha_asignacion)
[2025-11-02 22:49:51] ✅ Fecha string convertida: 1/27/2025 -> 2025-01-27 (Campo: fecha_proceso)
[2025-11-02 22:49:51] ✅ DV con valor '0' - ES VÁLIDO
[2025-11-02 22:49:51] ✅ Fecha string convertida: 4/5/2022 -> 2022-04-05 (Campo: fecha_castigo)
[2025-11-02 22:49:51] ✅ Fecha string convertida: 10/5/2021 -> 2021-10-05 (Campo: fecha_vencimiento)
[2025-11-02 22:49:51] ✅ Fecha string convertida: 12/8/2010 -> 2010-12-08 (Campo: fecha_susc)
[2025-11-02 22:49:51] ✅ Fecha string convertida: 6/1/2022 -> 2022-06-01 (Campo: fecha_asignacion)
[2025-11-02 22:49:51] ✅ Fecha string convertida: 1/27/2025 -> 2025-01-27 (Campo: fecha_proceso)
[2025-11-02 22:49:51] ✅ DV con valor '0' - ES VÁLIDO
[2025-11-02 22:49:51] ✅ Fecha string convertida: 5/5/2022 -> 2022-05-05 (Campo: fecha_castigo)
[2025-11-02 22:49:51] ✅ Fecha string convertida: 11/5/2021 -> 2021-11-05 (Campo: fecha_vencimiento)
[2025-11-02 22:49:51] ✅ Fecha string convertida: 11/25/2009 -> 2009-11-25 (Campo: fecha_susc)
[2025-11-02 22:49:51] ✅ Fecha string convertida: 7/1/2022 -> 2022-07-01 (Campo: fecha_asignacion)
[2025-11-02 22:49:51] ✅ Fecha string convertida: 1/27/2025 -> 2025-01-27 (Campo: fecha_proceso)
[2025-11-02 22:49:51] ✅ DV con valor '0' - ES VÁLIDO
[2025-11-02 22:49:51] ✅ Fecha string convertida: 5/5/2022 -> 2022-05-05 (Campo: fecha_castigo)
[2025-11-02 22:49:51] ✅ Fecha string convertida: 4/10/2023 -> 2023-04-10 (Campo: fecha_pago)
[2025-11-02 22:49:51] ✅ Fecha string convertida: 11/5/2021 -> 2021-11-05 (Campo: fecha_vencimiento)
[2025-11-02 22:49:51] ✅ Fecha string convertida: 4/26/2013 -> 2013-04-26 (Campo: fecha_susc)
[2025-11-02 22:49:51] ✅ Fecha string convertida: 7/1/2022 -> 2022-07-01 (Campo: fecha_asignacion)
[2025-11-02 22:49:51] ✅ Fecha string convertida: 1/27/2025 -> 2025-01-27 (Campo: fecha_proceso)
[2025-11-02 22:49:51] ✅ DV con valor '0' - ES VÁLIDO
[2025-11-02 22:49:51] ✅ Fecha string convertida: 5/5/2022 -> 2022-05-05 (Campo: fecha_castigo)
[2025-11-02 22:49:51] ✅ Fecha string convertida: 11/5/2021 -> 2021-11-05 (Campo: fecha_vencimiento)
[2025-11-02 22:49:51] ✅ Fecha string convertida: 6/12/2010 -> 2010-06-12 (Campo: fecha_susc)
[2025-11-02 22:49:51] ✅ Fecha string convertida: 7/1/2022 -> 2022-07-01 (Campo: fecha_asignacion)
[2025-11-02 22:49:51] ✅ Fecha string convertida: 1/27/2025 -> 2025-01-27 (Campo: fecha_proceso)
[2025-11-02 22:49:51] ✅ DV con valor '0' - ES VÁLIDO
[2025-11-02 22:49:51] ✅ Fecha string convertida: 5/5/2022 -> 2022-05-05 (Campo: fecha_castigo)
[2025-11-02 22:49:51] ✅ Fecha string convertida: 11/5/2021 -> 2021-11-05 (Campo: fecha_vencimiento)
[2025-11-02 22:49:51] ✅ Fecha string convertida: 3/7/2015 -> 2015-03-07 (Campo: fecha_susc)
[2025-11-02 22:49:51] ✅ Fecha string convertida: 7/1/2022 -> 2022-07-01 (Campo: fecha_asignacion)
[2025-11-02 22:49:51] ✅ Fecha string convertida: 1/27/2025 -> 2025-01-27 (Campo: fecha_proceso)
[2025-11-02 22:49:51] ✅ DV con valor '0' - ES VÁLIDO
[2025-11-02 22:49:51] ✅ Fecha string convertida: 5/5/2022 -> 2022-05-05 (Campo: fecha_castigo)
[2025-11-02 22:49:51] ✅ Fecha string convertida: 11/5/2021 -> 2021-11-05 (Campo: fecha_vencimiento)
[2025-11-02 22:49:51] ✅ Fecha string convertida: 9/6/2013 -> 2013-09-06 (Campo: fecha_susc)
[2025-11-02 22:49:51] ✅ Fecha string convertida: 7/1/2022 -> 2022-07-01 (Campo: fecha_asignacion)
[2025-11-02 22:49:51] ✅ Fecha string convertida: 1/27/2025 -> 2025-01-27 (Campo: fecha_proceso)
[2025-11-02 22:49:51] ✅ DV con valor '0' - ES VÁLIDO
[2025-11-02 22:49:51] ✅ Fecha string convertida: 5/5/2022 -> 2022-05-05 (Campo: fecha_castigo)
[2025-11-02 22:49:51] ✅ Fecha string convertida: 11/5/2021 -> 2021-11-05 (Campo: fecha_vencimiento)
[2025-11-02 22:49:51] ✅ Fecha string convertida: 7/18/2015 -> 2015-07-18 (Campo: fecha_susc)
[2025-11-02 22:49:51] ✅ Fecha string convertida: 7/1/2022 -> 2022-07-01 (Campo: fecha_asignacion)
[2025-11-02 22:49:51] ✅ Fecha string convertida: 1/27/2025 -> 2025-01-27 (Campo: fecha_proceso)
[2025-11-02 22:49:51] ✅ DV con valor '0' - ES VÁLIDO
[2025-11-02 22:49:51] ✅ Fecha string convertida: 5/5/2022 -> 2022-05-05 (Campo: fecha_castigo)
[2025-11-02 22:49:51] ✅ Fecha string convertida: 11/5/2021 -> 2021-11-05 (Campo: fecha_vencimiento)
[2025-11-02 22:49:51] ✅ Fecha string convertida: 6/13/2016 -> 2016-06-13 (Campo: fecha_susc)
[2025-11-02 22:49:51] ✅ Fecha string convertida: 7/1/2022 -> 2022-07-01 (Campo: fecha_asignacion)
[2025-11-02 22:49:51] ✅ Fecha string convertida: 1/27/2025 -> 2025-01-27 (Campo: fecha_proceso)
[2025-11-02 22:49:51] ✅ DV con valor '0' - ES VÁLIDO
[2025-11-02 22:49:51] ✅ Fecha string convertida: 5/5/2022 -> 2022-05-05 (Campo: fecha_castigo)
[2025-11-02 22:49:51] ✅ Fecha string convertida: 3/31/2022 -> 2022-03-31 (Campo: fecha_pago)
[2025-11-02 22:49:51] ✅ Fecha string convertida: 11/5/2021 -> 2021-11-05 (Campo: fecha_vencimiento)
[2025-11-02 22:49:51] ✅ Fecha string convertida: 11/13/2012 -> 2012-11-13 (Campo: fecha_susc)
[2025-11-02 22:49:51] ✅ Fecha string convertida: 7/1/2022 -> 2022-07-01 (Campo: fecha_asignacion)
[2025-11-02 22:49:51] ✅ Fecha string convertida: 1/27/2025 -> 2025-01-27 (Campo: fecha_proceso)
[2025-11-02 22:49:51] ✅ DV con valor '0' - ES VÁLIDO
[2025-11-02 22:49:51] ✅ Fecha string convertida: 5/5/2022 -> 2022-05-05 (Campo: fecha_castigo)
[2025-11-02 22:49:51] ✅ Fecha string convertida: 11/5/2021 -> 2021-11-05 (Campo: fecha_vencimiento)
[2025-11-02 22:49:51] ✅ Fecha string convertida: 5/10/2013 -> 2013-05-10 (Campo: fecha_susc)
[2025-11-02 22:49:51] ✅ Fecha string convertida: 4/1/2022 -> 2022-04-01 (Campo: fecha_asignacion)
[2025-11-02 22:49:51] ✅ Fecha string convertida: 1/27/2025 -> 2025-01-27 (Campo: fecha_proceso)
[2025-11-02 22:49:51] ✅ DV con valor '0' - ES VÁLIDO
[2025-11-02 22:49:51] ✅ Fecha string convertida: 5/10/2022 -> 2022-05-10 (Campo: fecha_castigo)
[2025-11-02 22:49:51] ✅ Fecha string convertida: 11/10/2021 -> 2021-11-10 (Campo: fecha_vencimiento)
[2025-11-02 22:49:51] ✅ Fecha string convertida: 3/29/2018 -> 2018-03-29 (Campo: fecha_susc)
[2025-11-02 22:49:51] ✅ Fecha string convertida: 7/1/2022 -> 2022-07-01 (Campo: fecha_asignacion)
[2025-11-02 22:49:51] ✅ Fecha string convertida: 1/27/2025 -> 2025-01-27 (Campo: fecha_proceso)
[2025-11-02 22:49:51] ✅ DV con valor '0' - ES VÁLIDO
[2025-11-02 22:49:51] ✅ Fecha string convertida: 5/10/2022 -> 2022-05-10 (Campo: fecha_castigo)
[2025-11-02 22:49:51] ✅ Fecha string convertida: 11/10/2021 -> 2021-11-10 (Campo: fecha_vencimiento)
[2025-11-02 22:49:51] ✅ Fecha string convertida: 12/8/2010 -> 2010-12-08 (Campo: fecha_susc)
[2025-11-02 22:49:51] ✅ Fecha string convertida: 7/1/2022 -> 2022-07-01 (Campo: fecha_asignacion)
[2025-11-02 22:49:51] ✅ Fecha string convertida: 1/27/2025 -> 2025-01-27 (Campo: fecha_proceso)
[2025-11-02 22:49:51] ✅ DV con valor '0' - ES VÁLIDO
[2025-11-02 22:49:51] ✅ Fecha string convertida: 5/25/2022 -> 2022-05-25 (Campo: fecha_castigo)
[2025-11-02 22:49:51] ✅ Fecha string convertida: 9/30/2022 -> 2022-09-30 (Campo: fecha_pago)
[2025-11-02 22:49:51] ✅ Fecha string convertida: 11/25/2021 -> 2021-11-25 (Campo: fecha_vencimiento)
[2025-11-02 22:49:51] ✅ Fecha string convertida: 3/15/2020 -> 2020-03-15 (Campo: fecha_susc)
[2025-11-02 22:49:51] ✅ Fecha string convertida: 4/1/2022 -> 2022-04-01 (Campo: fecha_asignacion)
[2025-11-02 22:49:51] ✅ Fecha string convertida: 1/27/2025 -> 2025-01-27 (Campo: fecha_proceso)
[2025-11-02 22:49:51] ✅ DV con valor '0' - ES VÁLIDO
[2025-11-02 22:49:51] ✅ Fecha string convertida: 7/5/2022 -> 2022-07-05 (Campo: fecha_castigo)
[2025-11-02 22:49:51] ✅ Fecha string convertida: 5/31/2022 -> 2022-05-31 (Campo: fecha_pago)
[2025-11-02 22:49:51] ✅ Fecha string convertida: 1/5/2022 -> 2022-01-05 (Campo: fecha_vencimiento)
[2025-11-02 22:49:51] ✅ Fecha string convertida: 6/4/2013 -> 2013-06-04 (Campo: fecha_susc)
[2025-11-02 22:49:51] ✅ Fecha string convertida: 9/1/2022 -> 2022-09-01 (Campo: fecha_asignacion)
[2025-11-02 22:49:51] ✅ Fecha string convertida: 1/27/2025 -> 2025-01-27 (Campo: fecha_proceso)
[2025-11-02 22:49:51] ✅ DV con valor '0' - ES VÁLIDO
[2025-11-02 22:49:51] ✅ Fecha string convertida: 7/5/2022 -> 2022-07-05 (Campo: fecha_castigo)
[2025-11-02 22:49:51] ✅ Fecha string convertida: 8/2/2023 -> 2023-08-02 (Campo: fecha_pago)
[2025-11-02 22:49:51] ✅ Fecha string convertida: 1/5/2022 -> 2022-01-05 (Campo: fecha_vencimiento)
[2025-11-02 22:49:51] ✅ Fecha string convertida: 2/4/2012 -> 2012-02-04 (Campo: fecha_susc)
[2025-11-02 22:49:51] ✅ Fecha string convertida: 9/1/2022 -> 2022-09-01 (Campo: fecha_asignacion)
[2025-11-02 22:49:51] ✅ Fecha string convertida: 1/27/2025 -> 2025-01-27 (Campo: fecha_proceso)
[2025-11-02 22:49:51] ✅ DV con valor '0' - ES VÁLIDO
[2025-11-02 22:49:51] ✅ Fecha string convertida: 7/5/2022 -> 2022-07-05 (Campo: fecha_castigo)
[2025-11-02 22:49:51] ✅ Fecha string convertida: 8/24/2022 -> 2022-08-24 (Campo: fecha_pago)
[2025-11-02 22:49:51] ✅ Fecha string convertida: 1/5/2022 -> 2022-01-05 (Campo: fecha_vencimiento)
[2025-11-02 22:49:51] ✅ Fecha string convertida: 5/11/2018 -> 2018-05-11 (Campo: fecha_susc)
[2025-11-02 22:49:51] ✅ Fecha string convertida: 9/1/2022 -> 2022-09-01 (Campo: fecha_asignacion)
[2025-11-02 22:49:51] ✅ Fecha string convertida: 1/27/2025 -> 2025-01-27 (Campo: fecha_proceso)
[2025-11-02 22:49:51] ✅ DV con valor '0' - ES VÁLIDO
[2025-11-02 22:49:51] ✅ Fecha string convertida: 7/5/2022 -> 2022-07-05 (Campo: fecha_castigo)
[2025-11-02 22:49:51] ✅ Fecha string convertida: 1/5/2022 -> 2022-01-05 (Campo: fecha_vencimiento)
[2025-11-02 22:49:51] ✅ Fecha string convertida: 2/24/2021 -> 2021-02-24 (Campo: fecha_susc)
[2025-11-02 22:49:51] ✅ Fecha string convertida: 9/1/2022 -> 2022-09-01 (Campo: fecha_asignacion)
[2025-11-02 22:49:51] ✅ Fecha string convertida: 1/27/2025 -> 2025-01-27 (Campo: fecha_proceso)
[2025-11-02 22:49:51] ✅ DV con valor '0' - ES VÁLIDO
[2025-11-02 22:49:51] ✅ Fecha string convertida: 7/5/2022 -> 2022-07-05 (Campo: fecha_castigo)
[2025-11-02 22:49:51] ✅ Fecha string convertida: 4/22/2022 -> 2022-04-22 (Campo: fecha_pago)
[2025-11-02 22:49:52] ✅ Fecha string convertida: 1/5/2022 -> 2022-01-05 (Campo: fecha_vencimiento)
[2025-11-02 22:49:52] ✅ Fecha string convertida: 2/12/2021 -> 2021-02-12 (Campo: fecha_susc)
[2025-11-02 22:49:52] ✅ Fecha string convertida: 9/1/2022 -> 2022-09-01 (Campo: fecha_asignacion)
[2025-11-02 22:49:52] ✅ Fecha string convertida: 1/27/2025 -> 2025-01-27 (Campo: fecha_proceso)
[2025-11-02 22:49:52] ✅ DV con valor '0' - ES VÁLIDO
[2025-11-02 22:49:52] ✅ Fecha string convertida: 7/5/2022 -> 2022-07-05 (Campo: fecha_castigo)
[2025-11-02 22:49:52] ✅ Fecha string convertida: 1/5/2022 -> 2022-01-05 (Campo: fecha_vencimiento)
[2025-11-02 22:49:52] ✅ Fecha string convertida: 5/10/2014 -> 2014-05-10 (Campo: fecha_susc)
[2025-11-02 22:49:52] ✅ Fecha string convertida: 9/1/2022 -> 2022-09-01 (Campo: fecha_asignacion)
[2025-11-02 22:49:52] ✅ Fecha string convertida: 1/27/2025 -> 2025-01-27 (Campo: fecha_proceso)
[2025-11-02 22:49:52] ✅ DV con valor '0' - ES VÁLIDO
[2025-11-02 22:49:52] ✅ Fecha string convertida: 7/5/2022 -> 2022-07-05 (Campo: fecha_castigo)
[2025-11-02 22:49:52] ✅ Fecha string convertida: 1/5/2022 -> 2022-01-05 (Campo: fecha_vencimiento)
[2025-11-02 22:49:52] ✅ Fecha string convertida: 9/15/2014 -> 2014-09-15 (Campo: fecha_susc)
[2025-11-02 22:49:52] ✅ Fecha string convertida: 5/1/2022 -> 2022-05-01 (Campo: fecha_asignacion)
[2025-11-02 22:49:52] ✅ Fecha string convertida: 1/27/2025 -> 2025-01-27 (Campo: fecha_proceso)
[2025-11-02 22:49:52] ✅ DV con valor '0' - ES VÁLIDO
[2025-11-02 22:49:52] ✅ Fecha string convertida: 7/5/2022 -> 2022-07-05 (Campo: fecha_castigo)
[2025-11-02 22:49:52] ✅ Fecha string convertida: 1/5/2022 -> 2022-01-05 (Campo: fecha_vencimiento)
[2025-11-02 22:49:52] ✅ Fecha string convertida: 1/30/2016 -> 2016-01-30 (Campo: fecha_susc)
[2025-11-02 22:49:52] ✅ Fecha string convertida: 9/1/2022 -> 2022-09-01 (Campo: fecha_asignacion)
[2025-11-02 22:49:52] ✅ Fecha string convertida: 1/27/2025 -> 2025-01-27 (Campo: fecha_proceso)
[2025-11-02 22:49:52] ✅ DV con valor '0' - ES VÁLIDO
[2025-11-02 22:49:52] ✅ Fecha string convertida: 7/5/2022 -> 2022-07-05 (Campo: fecha_castigo)
[2025-11-02 22:49:52] ✅ Fecha string convertida: 1/5/2022 -> 2022-01-05 (Campo: fecha_vencimiento)
[2025-11-02 22:49:52] ✅ Fecha string convertida: 4/2/2019 -> 2019-04-02 (Campo: fecha_susc)
[2025-11-02 22:49:52] ✅ Fecha string convertida: 9/1/2022 -> 2022-09-01 (Campo: fecha_asignacion)
[2025-11-02 22:49:52] ✅ Fecha string convertida: 1/27/2025 -> 2025-01-27 (Campo: fecha_proceso)
[2025-11-02 22:49:52] ✅ DV con valor '0' - ES VÁLIDO
[2025-11-02 22:49:52] ✅ Fecha string convertida: 7/5/2022 -> 2022-07-05 (Campo: fecha_castigo)
[2025-11-02 22:49:52] ✅ Fecha string convertida: 1/5/2022 -> 2022-01-05 (Campo: fecha_vencimiento)
[2025-11-02 22:49:52] ✅ Fecha string convertida: 11/11/2012 -> 2012-11-11 (Campo: fecha_susc)
[2025-11-02 22:49:52] ✅ Fecha string convertida: 9/1/2022 -> 2022-09-01 (Campo: fecha_asignacion)
[2025-11-02 22:49:52] ✅ Fecha string convertida: 1/27/2025 -> 2025-01-27 (Campo: fecha_proceso)
[2025-11-02 22:49:52] ✅ DV con valor '0' - ES VÁLIDO
[2025-11-02 22:49:52] ✅ Fecha string convertida: 8/5/2022 -> 2022-08-05 (Campo: fecha_castigo)
[2025-11-02 22:49:52] ✅ Fecha string convertida: 1/12/2022 -> 2022-01-12 (Campo: fecha_pago)
[2025-11-02 22:49:52] ✅ Fecha string convertida: 2/5/2022 -> 2022-02-05 (Campo: fecha_vencimiento)
[2025-11-02 22:49:52] ✅ Fecha string convertida: 9/11/2016 -> 2016-09-11 (Campo: fecha_susc)
[2025-11-02 22:49:52] ✅ Fecha string convertida: 10/1/2022 -> 2022-10-01 (Campo: fecha_asignacion)
[2025-11-02 22:49:52] ✅ Fecha string convertida: 1/27/2025 -> 2025-01-27 (Campo: fecha_proceso)
[2025-11-02 22:49:52] ✅ DV con valor '0' - ES VÁLIDO
[2025-11-02 22:49:52] ✅ Fecha string convertida: 8/10/2022 -> 2022-08-10 (Campo: fecha_castigo)
[2025-11-02 22:49:52] ✅ Fecha string convertida: 1/26/2022 -> 2022-01-26 (Campo: fecha_pago)
[2025-11-02 22:49:52] ✅ Fecha string convertida: 2/10/2022 -> 2022-02-10 (Campo: fecha_vencimiento)
[2025-11-02 22:49:52] ✅ Fecha string convertida: 5/28/2011 -> 2011-05-28 (Campo: fecha_susc)
[2025-11-02 22:49:52] ✅ Fecha string convertida: 10/1/2022 -> 2022-10-01 (Campo: fecha_asignacion)
[2025-11-02 22:49:52] ✅ Fecha string convertida: 1/27/2025 -> 2025-01-27 (Campo: fecha_proceso)
[2025-11-02 22:49:52] ✅ DV con valor '0' - ES VÁLIDO
[2025-11-02 22:49:52] ✅ Fecha string convertida: 8/15/2022 -> 2022-08-15 (Campo: fecha_castigo)
[2025-11-02 22:49:52] ✅ Fecha string convertida: 2/11/2022 -> 2022-02-11 (Campo: fecha_pago)
[2025-11-02 22:49:52] ✅ Fecha string convertida: 2/15/2022 -> 2022-02-15 (Campo: fecha_vencimiento)
[2025-11-02 22:49:52] ✅ Fecha string convertida: 12/15/2017 -> 2017-12-15 (Campo: fecha_susc)
[2025-11-02 22:49:52] ✅ Fecha string convertida: 10/1/2022 -> 2022-10-01 (Campo: fecha_asignacion)
[2025-11-02 22:49:52] ✅ Fecha string convertida: 1/27/2025 -> 2025-01-27 (Campo: fecha_proceso)
[2025-11-02 22:49:52] ✅ DV con valor '0' - ES VÁLIDO
[2025-11-02 22:49:52] ✅ Fecha string convertida: 8/15/2022 -> 2022-08-15 (Campo: fecha_castigo)
[2025-11-02 22:49:52] ✅ DV con valor '0' - ES VÁLIDO
[2025-11-02 22:49:52] ✅ Fecha string convertida: 1/12/2022 -> 2022-01-12 (Campo: fecha_pago)
[2025-11-02 22:49:52] ✅ Fecha string convertida: 2/15/2022 -> 2022-02-15 (Campo: fecha_vencimiento)
[2025-11-02 22:49:52] ✅ Fecha string convertida: 12/9/2016 -> 2016-12-09 (Campo: fecha_susc)
[2025-11-02 22:49:52] ✅ Fecha string convertida: 10/1/2022 -> 2022-10-01 (Campo: fecha_asignacion)
[2025-11-02 22:49:52] ✅ Fecha string convertida: 1/27/2025 -> 2025-01-27 (Campo: fecha_proceso)
[2025-11-02 22:49:52] ✅ DV con valor '0' - ES VÁLIDO
[2025-11-02 22:49:52] ✅ Fecha string convertida: 9/25/2022 -> 2022-09-25 (Campo: fecha_castigo)
[2025-11-02 22:49:52] ✅ Fecha string convertida: 3/21/2022 -> 2022-03-21 (Campo: fecha_pago)
[2025-11-02 22:49:52] ✅ Fecha string convertida: 3/25/2022 -> 2022-03-25 (Campo: fecha_vencimiento)
[2025-11-02 22:49:52] ✅ Fecha string convertida: 4/20/2007 -> 2007-04-20 (Campo: fecha_susc)
[2025-11-02 22:49:52] ✅ Fecha string convertida: 11/1/2022 -> 2022-11-01 (Campo: fecha_asignacion)
[2025-11-02 22:49:52] ✅ Fecha string convertida: 1/27/2025 -> 2025-01-27 (Campo: fecha_proceso)
[2025-11-02 22:49:52] ✅ DV con valor '0' - ES VÁLIDO
[2025-11-02 22:49:52] ✅ Fecha string convertida: 10/5/2022 -> 2022-10-05 (Campo: fecha_castigo)
[2025-11-02 22:49:52] ✅ Fecha string convertida: 3/8/2022 -> 2022-03-08 (Campo: fecha_pago)
[2025-11-02 22:49:52] ✅ Fecha string convertida: 4/5/2022 -> 2022-04-05 (Campo: fecha_vencimiento)
[2025-11-02 22:49:52] ✅ Fecha string convertida: 12/1/2001 -> 2001-12-01 (Campo: fecha_susc)
[2025-11-02 22:49:52] ✅ Fecha string convertida: 12/1/2022 -> 2022-12-01 (Campo: fecha_asignacion)
[2025-11-02 22:49:52] ✅ Fecha string convertida: 1/27/2025 -> 2025-01-27 (Campo: fecha_proceso)
[2025-11-02 22:49:52] ✅ DV con valor '0' - ES VÁLIDO
[2025-11-02 22:49:52] ✅ Fecha string convertida: 10/5/2022 -> 2022-10-05 (Campo: fecha_castigo)
[2025-11-02 22:49:52] ✅ Fecha string convertida: 1/7/2022 -> 2022-01-07 (Campo: fecha_pago)
[2025-11-02 22:49:52] ✅ Fecha string convertida: 4/5/2022 -> 2022-04-05 (Campo: fecha_vencimiento)
[2025-11-02 22:49:52] ✅ Fecha string convertida: 9/16/2017 -> 2017-09-16 (Campo: fecha_susc)
[2025-11-02 22:49:52] ✅ Fecha string convertida: 12/1/2022 -> 2022-12-01 (Campo: fecha_asignacion)
[2025-11-02 22:49:52] ✅ Fecha string convertida: 1/27/2025 -> 2025-01-27 (Campo: fecha_proceso)
[2025-11-02 22:49:52] ✅ DV con valor '0' - ES VÁLIDO
[2025-11-02 22:49:52] ✅ Fecha string convertida: 10/5/2022 -> 2022-10-05 (Campo: fecha_castigo)
[2025-11-02 22:49:52] ✅ Fecha string convertida: 3/8/2022 -> 2022-03-08 (Campo: fecha_pago)
[2025-11-02 22:49:52] ✅ Fecha string convertida: 4/5/2022 -> 2022-04-05 (Campo: fecha_vencimiento)
[2025-11-02 22:49:52] ✅ Fecha string convertida: 9/1/2010 -> 2010-09-01 (Campo: fecha_susc)
[2025-11-02 22:49:52] ✅ Fecha string convertida: 12/1/2022 -> 2022-12-01 (Campo: fecha_asignacion)
[2025-11-02 22:49:52] ✅ Fecha string convertida: 1/27/2025 -> 2025-01-27 (Campo: fecha_proceso)
[2025-11-02 22:49:52] ✅ DV con valor '0' - ES VÁLIDO
[2025-11-02 22:49:52] ✅ Fecha string convertida: 10/10/2022 -> 2022-10-10 (Campo: fecha_castigo)
[2025-11-02 22:49:52] ✅ Fecha string convertida: 3/7/2022 -> 2022-03-07 (Campo: fecha_pago)
[2025-11-02 22:49:52] ✅ Fecha string convertida: 4/10/2022 -> 2022-04-10 (Campo: fecha_vencimiento)
[2025-11-02 22:49:52] ✅ Fecha string convertida: 3/8/2018 -> 2018-03-08 (Campo: fecha_susc)
[2025-11-02 22:49:52] ✅ Fecha string convertida: 12/1/2022 -> 2022-12-01 (Campo: fecha_asignacion)
[2025-11-02 22:49:52] ✅ Fecha string convertida: 1/27/2025 -> 2025-01-27 (Campo: fecha_proceso)
[2025-11-02 22:49:52] ✅ DV con valor '0' - ES VÁLIDO
[2025-11-02 22:49:52] ✅ Fecha string convertida: 10/15/2022 -> 2022-10-15 (Campo: fecha_castigo)
[2025-11-02 22:49:52] ✅ Fecha string convertida: 6/8/2024 -> 2024-06-08 (Campo: fecha_pago)
[2025-11-02 22:49:52] ✅ Fecha string convertida: 4/15/2022 -> 2022-04-15 (Campo: fecha_vencimiento)
[2025-11-02 22:49:52] ✅ Fecha string convertida: 6/21/2017 -> 2017-06-21 (Campo: fecha_susc)
[2025-11-02 22:49:52] ✅ Fecha string convertida: 12/1/2022 -> 2022-12-01 (Campo: fecha_asignacion)
[2025-11-02 22:49:52] ✅ Fecha string convertida: 1/27/2025 -> 2025-01-27 (Campo: fecha_proceso)
[2025-11-02 22:49:52] ✅ DV con valor '0' - ES VÁLIDO
[2025-11-02 22:49:52] ✅ Fecha string convertida: 11/5/2022 -> 2022-11-05 (Campo: fecha_castigo)
[2025-11-02 22:49:52] ✅ Fecha string convertida: 3/27/2022 -> 2022-03-27 (Campo: fecha_pago)
[2025-11-02 22:49:52] ✅ Fecha string convertida: 5/5/2022 -> 2022-05-05 (Campo: fecha_vencimiento)
[2025-11-02 22:49:52] ✅ Fecha string convertida: 9/23/2016 -> 2016-09-23 (Campo: fecha_susc)
[2025-11-02 22:49:52] ✅ Fecha string convertida: 1/1/2023 -> 2023-01-01 (Campo: fecha_asignacion)
[2025-11-02 22:49:52] ✅ Fecha string convertida: 1/27/2025 -> 2025-01-27 (Campo: fecha_proceso)
[2025-11-02 22:49:52] ✅ DV con valor '0' - ES VÁLIDO
[2025-11-02 22:49:52] ✅ Fecha string convertida: 11/5/2022 -> 2022-11-05 (Campo: fecha_castigo)
[2025-11-02 22:49:52] ✅ Fecha string convertida: 3/29/2022 -> 2022-03-29 (Campo: fecha_pago)
[2025-11-02 22:49:52] ✅ Fecha string convertida: 5/5/2022 -> 2022-05-05 (Campo: fecha_vencimiento)
[2025-11-02 22:49:52] ✅ Fecha string convertida: 8/8/2019 -> 2019-08-08 (Campo: fecha_susc)
[2025-11-02 22:49:52] ✅ Fecha string convertida: 1/1/2023 -> 2023-01-01 (Campo: fecha_asignacion)
[2025-11-02 22:49:52] ✅ Fecha string convertida: 1/27/2025 -> 2025-01-27 (Campo: fecha_proceso)
[2025-11-02 22:49:52] ✅ DV con valor '0' - ES VÁLIDO
[2025-11-02 22:49:52] ✅ Fecha string convertida: 11/5/2022 -> 2022-11-05 (Campo: fecha_castigo)
[2025-11-02 22:49:52] ✅ Fecha string convertida: 4/3/2022 -> 2022-04-03 (Campo: fecha_pago)
[2025-11-02 22:49:52] ✅ Fecha string convertida: 5/5/2022 -> 2022-05-05 (Campo: fecha_vencimiento)
[2025-11-02 22:49:52] ✅ Fecha string convertida: 2/1/2021 -> 2021-02-01 (Campo: fecha_susc)
[2025-11-02 22:49:52] ✅ Fecha string convertida: 1/1/2023 -> 2023-01-01 (Campo: fecha_asignacion)
[2025-11-02 22:49:52] ✅ Fecha string convertida: 1/27/2025 -> 2025-01-27 (Campo: fecha_proceso)
[2025-11-02 22:49:52] ✅ DV con valor '0' - ES VÁLIDO
[2025-11-02 22:49:52] ✅ Fecha string convertida: 11/5/2022 -> 2022-11-05 (Campo: fecha_castigo)
[2025-11-02 22:49:52] ✅ Fecha string convertida: 1/2/2024 -> 2024-01-02 (Campo: fecha_pago)
[2025-11-02 22:49:52] ✅ Fecha string convertida: 5/5/2022 -> 2022-05-05 (Campo: fecha_vencimiento)
[2025-11-02 22:49:52] ✅ Fecha string convertida: 11/7/2014 -> 2014-11-07 (Campo: fecha_susc)
[2025-11-02 22:49:52] ✅ Fecha string convertida: 1/1/2023 -> 2023-01-01 (Campo: fecha_asignacion)
[2025-11-02 22:49:52] ✅ Fecha string convertida: 1/27/2025 -> 2025-01-27 (Campo: fecha_proceso)
[2025-11-02 22:49:52] ✅ DV con valor '0' - ES VÁLIDO
[2025-11-02 22:49:52] ✅ Fecha string convertida: 11/5/2022 -> 2022-11-05 (Campo: fecha_castigo)
[2025-11-02 22:49:52] ✅ Fecha string convertida: 3/1/2022 -> 2022-03-01 (Campo: fecha_pago)
[2025-11-02 22:49:52] ✅ Fecha string convertida: 5/5/2022 -> 2022-05-05 (Campo: fecha_vencimiento)
[2025-11-02 22:49:52] ✅ Fecha string convertida: 5/14/2016 -> 2016-05-14 (Campo: fecha_susc)
[2025-11-02 22:49:52] ✅ Fecha string convertida: 1/1/2023 -> 2023-01-01 (Campo: fecha_asignacion)
[2025-11-02 22:49:52] ✅ Fecha string convertida: 1/27/2025 -> 2025-01-27 (Campo: fecha_proceso)
[2025-11-02 22:49:52] ✅ DV con valor '0' - ES VÁLIDO
[2025-11-02 22:49:52] ✅ Fecha string convertida: 11/5/2022 -> 2022-11-05 (Campo: fecha_castigo)
[2025-11-02 22:49:52] ✅ DV con valor '0' - ES VÁLIDO
[2025-11-02 22:49:52] ✅ Fecha string convertida: 4/7/2022 -> 2022-04-07 (Campo: fecha_pago)
[2025-11-02 22:49:52] ✅ Fecha string convertida: 5/5/2022 -> 2022-05-05 (Campo: fecha_vencimiento)
[2025-11-02 22:49:52] ✅ Fecha string convertida: 2/6/2010 -> 2010-02-06 (Campo: fecha_susc)
[2025-11-02 22:49:52] ✅ Fecha string convertida: 1/1/2023 -> 2023-01-01 (Campo: fecha_asignacion)
[2025-11-02 22:49:52] ✅ Fecha string convertida: 1/27/2025 -> 2025-01-27 (Campo: fecha_proceso)
[2025-11-02 22:49:52] ✅ DV con valor '0' - ES VÁLIDO
[2025-11-02 22:49:52] ✅ Fecha string convertida: 11/5/2022 -> 2022-11-05 (Campo: fecha_castigo)
[2025-11-02 22:49:52] ✅ Fecha string convertida: 5/10/2022 -> 2022-05-10 (Campo: fecha_pago)
[2025-11-02 22:49:52] ✅ Fecha string convertida: 5/5/2022 -> 2022-05-05 (Campo: fecha_vencimiento)
[2025-11-02 22:49:52] ✅ Fecha string convertida: 6/10/2016 -> 2016-06-10 (Campo: fecha_susc)
[2025-11-02 22:49:52] ✅ Fecha string convertida: 9/1/2022 -> 2022-09-01 (Campo: fecha_asignacion)
[2025-11-02 22:49:52] ✅ Fecha string convertida: 1/27/2025 -> 2025-01-27 (Campo: fecha_proceso)
[2025-11-02 22:49:52] ✅ DV con valor '0' - ES VÁLIDO
[2025-11-02 22:49:52] ✅ Fecha string convertida: 11/5/2022 -> 2022-11-05 (Campo: fecha_castigo)
[2025-11-02 22:49:52] ✅ Fecha string convertida: 7/20/2022 -> 2022-07-20 (Campo: fecha_pago)
[2025-11-02 22:49:52] ✅ Fecha string convertida: 5/5/2022 -> 2022-05-05 (Campo: fecha_vencimiento)
[2025-11-02 22:49:52] ✅ Fecha string convertida: 5/2/2013 -> 2013-05-02 (Campo: fecha_susc)
[2025-11-02 22:49:52] ✅ Fecha string convertida: 9/1/2022 -> 2022-09-01 (Campo: fecha_asignacion)
[2025-11-02 22:49:52] ✅ Fecha string convertida: 1/27/2025 -> 2025-01-27 (Campo: fecha_proceso)
[2025-11-02 22:49:52] ✅ DV con valor '0' - ES VÁLIDO
[2025-11-02 22:49:52] ✅ Fecha string convertida: 12/5/2022 -> 2022-12-05 (Campo: fecha_castigo)
[2025-11-02 22:49:52] ✅ Fecha string convertida: 4/29/2022 -> 2022-04-29 (Campo: fecha_pago)
[2025-11-02 22:49:52] ✅ Fecha string convertida: 6/5/2022 -> 2022-06-05 (Campo: fecha_vencimiento)
[2025-11-02 22:49:52] ✅ Fecha string convertida: 11/27/2000 -> 2000-11-27 (Campo: fecha_susc)
[2025-11-02 22:49:52] ✅ Fecha string convertida: 11/1/2022 -> 2022-11-01 (Campo: fecha_asignacion)
[2025-11-02 22:49:52] ✅ Fecha string convertida: 1/27/2025 -> 2025-01-27 (Campo: fecha_proceso)
[2025-11-02 22:49:52] ✅ DV con valor '0' - ES VÁLIDO
[2025-11-02 22:49:52] ✅ Fecha string convertida: 12/5/2022 -> 2022-12-05 (Campo: fecha_castigo)
[2025-11-02 22:49:52] ✅ Fecha string convertida: 10/3/2023 -> 2023-10-03 (Campo: fecha_pago)
[2025-11-02 22:49:52] ✅ Fecha string convertida: 6/5/2022 -> 2022-06-05 (Campo: fecha_vencimiento)
[2025-11-02 22:49:52] ✅ Fecha string convertida: 9/5/2018 -> 2018-09-05 (Campo: fecha_susc)
[2025-11-02 22:49:52] ✅ Fecha string convertida: 2/1/2023 -> 2023-02-01 (Campo: fecha_asignacion)
[2025-11-02 22:49:52] ✅ Fecha string convertida: 1/27/2025 -> 2025-01-27 (Campo: fecha_proceso)
[2025-11-02 22:49:52] ✅ DV con valor '0' - ES VÁLIDO
[2025-11-02 22:49:52] ✅ Fecha string convertida: 12/25/2022 -> 2022-12-25 (Campo: fecha_castigo)
[2025-11-02 22:49:52] ✅ Fecha string convertida: 5/20/2022 -> 2022-05-20 (Campo: fecha_pago)
[2025-11-02 22:49:52] ✅ Fecha string convertida: 6/25/2022 -> 2022-06-25 (Campo: fecha_vencimiento)
[2025-11-02 22:49:52] ✅ Fecha string convertida: 7/16/2014 -> 2014-07-16 (Campo: fecha_susc)
[2025-11-02 22:49:52] ✅ Fecha string convertida: 2/1/2023 -> 2023-02-01 (Campo: fecha_asignacion)
[2025-11-02 22:49:52] ✅ Fecha string convertida: 1/27/2025 -> 2025-01-27 (Campo: fecha_proceso)
[2025-11-02 22:49:52] ✅ DV con valor '0' - ES VÁLIDO
[2025-11-02 22:49:52] ✅ Fecha string convertida: 1/5/2023 -> 2023-01-05 (Campo: fecha_castigo)
[2025-11-02 22:49:52] ✅ Fecha string convertida: 6/14/2022 -> 2022-06-14 (Campo: fecha_pago)
[2025-11-02 22:49:52] ✅ Fecha string convertida: 7/5/2022 -> 2022-07-05 (Campo: fecha_vencimiento)
[2025-11-02 22:49:52] ✅ Fecha string convertida: 3/7/2016 -> 2016-03-07 (Campo: fecha_susc)
[2025-11-02 22:49:52] ✅ Fecha string convertida: 3/1/2023 -> 2023-03-01 (Campo: fecha_asignacion)
[2025-11-02 22:49:52] ✅ Fecha string convertida: 1/27/2025 -> 2025-01-27 (Campo: fecha_proceso)
[2025-11-02 22:49:52] ✅ DV con valor '0' - ES VÁLIDO
[2025-11-02 22:49:52] ✅ Fecha string convertida: 3/10/2023 -> 2023-03-10 (Campo: fecha_castigo)
[2025-11-02 22:49:52] ✅ Fecha string convertida: 9/5/2022 -> 2022-09-05 (Campo: fecha_pago)
[2025-11-02 22:49:52] ✅ Fecha string convertida: 9/10/2022 -> 2022-09-10 (Campo: fecha_vencimiento)
[2025-11-02 22:49:52] ✅ Fecha string convertida: 10/12/2018 -> 2018-10-12 (Campo: fecha_susc)
[2025-11-02 22:49:52] ✅ Fecha string convertida: 5/1/2023 -> 2023-05-01 (Campo: fecha_asignacion)
[2025-11-02 22:49:52] ✅ Fecha string convertida: 1/27/2025 -> 2025-01-27 (Campo: fecha_proceso)
[2025-11-02 22:49:52] ✅ DV con valor '0' - ES VÁLIDO
[2025-11-02 22:49:52] ✅ Fecha string convertida: 4/5/2023 -> 2023-04-05 (Campo: fecha_castigo)
[2025-11-02 22:49:52] ✅ Fecha string convertida: 9/14/2022 -> 2022-09-14 (Campo: fecha_pago)
[2025-11-02 22:49:52] ✅ Fecha string convertida: 10/5/2022 -> 2022-10-05 (Campo: fecha_vencimiento)
[2025-11-02 22:49:52] ✅ Fecha string convertida: 7/4/2008 -> 2008-07-04 (Campo: fecha_susc)
[2025-11-02 22:49:52] ✅ Fecha string convertida: 6/1/2023 -> 2023-06-01 (Campo: fecha_asignacion)
[2025-11-02 22:49:52] ✅ Fecha string convertida: 1/27/2025 -> 2025-01-27 (Campo: fecha_proceso)
[2025-11-02 22:49:52] ✅ DV con valor '0' - ES VÁLIDO
[2025-11-02 22:49:52] ✅ Fecha string convertida: 4/10/2023 -> 2023-04-10 (Campo: fecha_castigo)
[2025-11-02 22:49:52] ✅ Fecha string convertida: 8/31/2023 -> 2023-08-31 (Campo: fecha_pago)
[2025-11-02 22:49:52] ✅ Fecha string convertida: 10/10/2022 -> 2022-10-10 (Campo: fecha_vencimiento)
[2025-11-02 22:49:52] ✅ Fecha string convertida: 12/11/2020 -> 2020-12-11 (Campo: fecha_susc)
[2025-11-02 22:49:52] ✅ Fecha string convertida: 6/1/2023 -> 2023-06-01 (Campo: fecha_asignacion)
[2025-11-02 22:49:52] ✅ Fecha string convertida: 1/27/2025 -> 2025-01-27 (Campo: fecha_proceso)
[2025-11-02 22:49:52] ✅ DV con valor '0' - ES VÁLIDO
[2025-11-02 22:49:52] ✅ Fecha string convertida: 5/5/2023 -> 2023-05-05 (Campo: fecha_castigo)
[2025-11-02 22:49:52] ✅ Fecha string convertida: 10/1/2022 -> 2022-10-01 (Campo: fecha_pago)
[2025-11-02 22:49:52] ✅ Fecha string convertida: 11/5/2022 -> 2022-11-05 (Campo: fecha_vencimiento)
[2025-11-02 22:49:52] ✅ Fecha string convertida: 12/4/1997 -> 1997-12-04 (Campo: fecha_susc)
[2025-11-02 22:49:52] ✅ Fecha string convertida: 7/1/2023 -> 2023-07-01 (Campo: fecha_asignacion)
[2025-11-02 22:49:52] ✅ Fecha string convertida: 1/27/2025 -> 2025-01-27 (Campo: fecha_proceso)
[2025-11-02 22:49:52] ✅ DV con valor '0' - ES VÁLIDO
[2025-11-02 22:49:52] ✅ Fecha string convertida: 5/5/2023 -> 2023-05-05 (Campo: fecha_castigo)
[2025-11-02 22:49:52] ✅ Fecha string convertida: 10/8/2022 -> 2022-10-08 (Campo: fecha_pago)
[2025-11-02 22:49:52] ✅ Fecha string convertida: 11/5/2022 -> 2022-11-05 (Campo: fecha_vencimiento)
[2025-11-02 22:49:52] ✅ Fecha string convertida: 8/12/2014 -> 2014-08-12 (Campo: fecha_susc)
[2025-11-02 22:49:52] ✅ Fecha string convertida: 7/1/2023 -> 2023-07-01 (Campo: fecha_asignacion)
[2025-11-02 22:49:52] ✅ Fecha string convertida: 1/27/2025 -> 2025-01-27 (Campo: fecha_proceso)
[2025-11-02 22:49:52] ✅ DV con valor '0' - ES VÁLIDO
[2025-11-02 22:49:52] ✅ Fecha string convertida: 5/15/2023 -> 2023-05-15 (Campo: fecha_castigo)
[2025-11-02 22:49:52] ✅ Fecha string convertida: 12/20/2022 -> 2022-12-20 (Campo: fecha_pago)
[2025-11-02 22:49:52] ✅ Fecha string convertida: 11/15/2022 -> 2022-11-15 (Campo: fecha_vencimiento)
[2025-11-02 22:49:52] ✅ Fecha string convertida: 4/22/2013 -> 2013-04-22 (Campo: fecha_susc)
[2025-11-02 22:49:52] ✅ Valor convertido a DECIMAL: '$ 1,196,085' -> 1196085
[2025-11-02 22:49:52] ✅ Fecha string convertida: 7/1/2023 -> 2023-07-01 (Campo: fecha_asignacion)
[2025-11-02 22:49:52] ✅ Fecha string convertida: 1/27/2025 -> 2025-01-27 (Campo: fecha_proceso)
[2025-11-02 22:49:52] ✅ DV con valor '0' - ES VÁLIDO
[2025-11-02 22:49:52] ✅ Fecha string convertida: 6/5/2023 -> 2023-06-05 (Campo: fecha_castigo)
[2025-11-02 22:49:52] ✅ Fecha string convertida: 5/10/2024 -> 2024-05-10 (Campo: fecha_pago)
[2025-11-02 22:49:52] ✅ Fecha string convertida: 12/5/2022 -> 2022-12-05 (Campo: fecha_vencimiento)
[2025-11-02 22:49:52] ✅ Fecha string convertida: 12/15/2020 -> 2020-12-15 (Campo: fecha_susc)
[2025-11-02 22:49:52] ✅ Fecha string convertida: 8/1/2023 -> 2023-08-01 (Campo: fecha_asignacion)
[2025-11-02 22:49:52] ✅ Fecha string convertida: 1/27/2025 -> 2025-01-27 (Campo: fecha_proceso)
[2025-11-02 22:49:52] ✅ DV con valor '0' - ES VÁLIDO
[2025-11-02 22:49:52] ✅ Fecha string convertida: 6/5/2023 -> 2023-06-05 (Campo: fecha_castigo)
[2025-11-02 22:49:52] ✅ Fecha string convertida: 9/4/2022 -> 2022-09-04 (Campo: fecha_pago)
[2025-11-02 22:49:52] ✅ Fecha string convertida: 12/5/2022 -> 2022-12-05 (Campo: fecha_vencimiento)
[2025-11-02 22:49:52] ✅ Fecha string convertida: 2/26/2017 -> 2017-02-26 (Campo: fecha_susc)
[2025-11-02 22:49:52] ✅ Fecha string convertida: 8/1/2023 -> 2023-08-01 (Campo: fecha_asignacion)
[2025-11-02 22:49:52] ✅ Fecha string convertida: 1/27/2025 -> 2025-01-27 (Campo: fecha_proceso)
[2025-11-02 22:49:52] ✅ DV con valor '0' - ES VÁLIDO
[2025-11-02 22:49:52] ✅ Fecha string convertida: 6/10/2023 -> 2023-06-10 (Campo: fecha_castigo)
[2025-11-02 22:49:52] ✅ Fecha string convertida: 11/17/2022 -> 2022-11-17 (Campo: fecha_pago)
[2025-11-02 22:49:52] ✅ Fecha string convertida: 12/10/2022 -> 2022-12-10 (Campo: fecha_vencimiento)
[2025-11-02 22:49:52] ✅ Fecha string convertida: 3/5/2019 -> 2019-03-05 (Campo: fecha_susc)
[2025-11-02 22:49:52] ✅ Fecha string convertida: 8/1/2023 -> 2023-08-01 (Campo: fecha_asignacion)
[2025-11-02 22:49:52] ✅ Fecha string convertida: 1/27/2025 -> 2025-01-27 (Campo: fecha_proceso)
[2025-11-02 22:49:52] ✅ DV con valor '0' - ES VÁLIDO
[2025-11-02 22:49:52] ✅ Fecha string convertida: 6/10/2023 -> 2023-06-10 (Campo: fecha_castigo)
[2025-11-02 22:49:52] ✅ Fecha string convertida: 11/26/2022 -> 2022-11-26 (Campo: fecha_pago)
[2025-11-02 22:49:52] ✅ Fecha string convertida: 12/10/2022 -> 2022-12-10 (Campo: fecha_vencimiento)
[2025-11-02 22:49:52] ✅ Fecha string convertida: 1/6/2019 -> 2019-01-06 (Campo: fecha_susc)
[2025-11-02 22:49:52] ✅ Fecha string convertida: 8/1/2023 -> 2023-08-01 (Campo: fecha_asignacion)
[2025-11-02 22:49:52] ✅ Fecha string convertida: 1/27/2025 -> 2025-01-27 (Campo: fecha_proceso)
[2025-11-02 22:49:52] ✅ DV con valor '0' - ES VÁLIDO
[2025-11-02 22:49:52] ✅ Fecha string convertida: 6/20/2023 -> 2023-06-20 (Campo: fecha_castigo)
[2025-11-02 22:49:52] ✅ Fecha string convertida: 1/17/2023 -> 2023-01-17 (Campo: fecha_pago)
[2025-11-02 22:49:52] ✅ Fecha string convertida: 12/20/2022 -> 2022-12-20 (Campo: fecha_vencimiento)
[2025-11-02 22:49:52] ✅ Fecha string convertida: 6/16/2017 -> 2017-06-16 (Campo: fecha_susc)
[2025-11-02 22:49:52] ✅ Fecha string convertida: 8/1/2023 -> 2023-08-01 (Campo: fecha_asignacion)
[2025-11-02 22:49:52] ✅ Fecha string convertida: 1/27/2025 -> 2025-01-27 (Campo: fecha_proceso)
[2025-11-02 22:49:52] ✅ DV con valor '0' - ES VÁLIDO
[2025-11-02 22:49:52] ✅ Fecha string convertida: 6/25/2023 -> 2023-06-25 (Campo: fecha_castigo)
[2025-11-02 22:49:52] ✅ Fecha string convertida: 11/20/2022 -> 2022-11-20 (Campo: fecha_pago)
[2025-11-02 22:49:52] ✅ Fecha string convertida: 12/25/2022 -> 2022-12-25 (Campo: fecha_vencimiento)
[2025-11-02 22:49:52] ✅ Fecha string convertida: 1/8/2022 -> 2022-01-08 (Campo: fecha_susc)
[2025-11-02 22:49:52] ✅ Fecha string convertida: 8/1/2023 -> 2023-08-01 (Campo: fecha_asignacion)
[2025-11-02 22:49:52] ✅ Fecha string convertida: 1/27/2025 -> 2025-01-27 (Campo: fecha_proceso)
[2025-11-02 22:49:52] ✅ DV con valor '0' - ES VÁLIDO
[2025-11-02 22:49:52] ✅ Fecha string convertida: 6/30/2023 -> 2023-06-30 (Campo: fecha_castigo)
[2025-11-02 22:49:52] ✅ Fecha string convertida: 11/23/2023 -> 2023-11-23 (Campo: fecha_pago)
[2025-11-02 22:49:52] ✅ Fecha string convertida: 12/30/2022 -> 2022-12-30 (Campo: fecha_vencimiento)
[2025-11-02 22:49:52] ✅ Fecha string convertida: 7/28/2021 -> 2021-07-28 (Campo: fecha_susc)
[2025-11-02 22:49:52] ✅ Fecha string convertida: 8/1/2023 -> 2023-08-01 (Campo: fecha_asignacion)
[2025-11-02 22:49:52] ✅ Fecha string convertida: 1/27/2025 -> 2025-01-27 (Campo: fecha_proceso)
[2025-11-02 22:49:52] ✅ DV con valor '0' - ES VÁLIDO
[2025-11-02 22:49:52] ✅ Fecha string convertida: 7/5/2023 -> 2023-07-05 (Campo: fecha_castigo)
[2025-11-02 22:49:52] ✅ Fecha string convertida: 1/19/2023 -> 2023-01-19 (Campo: fecha_pago)
[2025-11-02 22:49:52] ✅ Fecha string convertida: 1/5/2023 -> 2023-01-05 (Campo: fecha_vencimiento)
[2025-11-02 22:49:52] ✅ Fecha string convertida: 10/11/2015 -> 2015-10-11 (Campo: fecha_susc)
[2025-11-02 22:49:52] ✅ Fecha string convertida: 9/1/2023 -> 2023-09-01 (Campo: fecha_asignacion)
[2025-11-02 22:49:52] ✅ Fecha string convertida: 1/27/2025 -> 2025-01-27 (Campo: fecha_proceso)
[2025-11-02 22:49:52] ✅ DV con valor '0' - ES VÁLIDO
[2025-11-02 22:49:52] ✅ Fecha string convertida: 7/5/2023 -> 2023-07-05 (Campo: fecha_castigo)
[2025-11-02 22:49:52] ✅ Fecha string convertida: 3/4/2023 -> 2023-03-04 (Campo: fecha_pago)
[2025-11-02 22:49:52] ✅ Fecha string convertida: 1/5/2023 -> 2023-01-05 (Campo: fecha_vencimiento)
[2025-11-02 22:49:52] ✅ Fecha string convertida: 5/12/1995 -> 1995-05-12 (Campo: fecha_susc)
[2025-11-02 22:49:52] ✅ Fecha string convertida: 9/1/2023 -> 2023-09-01 (Campo: fecha_asignacion)
[2025-11-02 22:49:52] ✅ Fecha string convertida: 1/27/2025 -> 2025-01-27 (Campo: fecha_proceso)
[2025-11-02 22:49:52] ✅ DV con valor '0' - ES VÁLIDO
[2025-11-02 22:49:52] ✅ Fecha string convertida: 7/15/2023 -> 2023-07-15 (Campo: fecha_castigo)
[2025-11-02 22:49:52] ✅ Fecha string convertida: 12/10/2022 -> 2022-12-10 (Campo: fecha_pago)
[2025-11-02 22:49:52] ✅ Fecha string convertida: 1/15/2023 -> 2023-01-15 (Campo: fecha_vencimiento)
[2025-11-02 22:49:52] ✅ Fecha string convertida: 5/4/2012 -> 2012-05-04 (Campo: fecha_susc)
[2025-11-02 22:49:53] ✅ Fecha string convertida: 9/1/2023 -> 2023-09-01 (Campo: fecha_asignacion)
[2025-11-02 22:49:53] ✅ Fecha string convertida: 1/27/2025 -> 2025-01-27 (Campo: fecha_proceso)
[2025-11-02 22:49:53] ✅ DV con valor '0' - ES VÁLIDO
[2025-11-02 22:49:53] ✅ Fecha string convertida: 7/15/2023 -> 2023-07-15 (Campo: fecha_castigo)
[2025-11-02 22:49:53] ✅ Fecha string convertida: 8/26/2024 -> 2024-08-26 (Campo: fecha_pago)
[2025-11-02 22:49:53] ✅ Fecha string convertida: 1/15/2023 -> 2023-01-15 (Campo: fecha_vencimiento)
[2025-11-02 22:49:53] ✅ Fecha string convertida: 6/11/2005 -> 2005-06-11 (Campo: fecha_susc)
[2025-11-02 22:49:53] ✅ Fecha string convertida: 9/1/2023 -> 2023-09-01 (Campo: fecha_asignacion)
[2025-11-02 22:49:53] ✅ Fecha string convertida: 1/27/2025 -> 2025-01-27 (Campo: fecha_proceso)
[2025-11-02 22:49:53] ✅ DV con valor '0' - ES VÁLIDO
[2025-11-02 22:49:53] ✅ Fecha string convertida: 8/5/2023 -> 2023-08-05 (Campo: fecha_castigo)
[2025-11-02 22:49:53] ✅ Fecha string convertida: 1/23/2023 -> 2023-01-23 (Campo: fecha_pago)
[2025-11-02 22:49:53] ✅ Fecha string convertida: 2/5/2023 -> 2023-02-05 (Campo: fecha_vencimiento)
[2025-11-02 22:49:53] ✅ Fecha string convertida: 9/1/2018 -> 2018-09-01 (Campo: fecha_susc)
[2025-11-02 22:49:53] ✅ Fecha string convertida: 10/1/2023 -> 2023-10-01 (Campo: fecha_asignacion)
[2025-11-02 22:49:53] ✅ Fecha string convertida: 1/27/2025 -> 2025-01-27 (Campo: fecha_proceso)
[2025-11-02 22:49:53] ✅ DV con valor '0' - ES VÁLIDO
[2025-11-02 22:49:53] ✅ Fecha string convertida: 8/5/2023 -> 2023-08-05 (Campo: fecha_castigo)
[2025-11-02 22:49:53] ✅ Fecha string convertida: 1/6/2023 -> 2023-01-06 (Campo: fecha_pago)
[2025-11-02 22:49:53] ✅ Fecha string convertida: 2/5/2023 -> 2023-02-05 (Campo: fecha_vencimiento)
[2025-11-02 22:49:53] ✅ Fecha string convertida: 11/2/2020 -> 2020-11-02 (Campo: fecha_susc)
[2025-11-02 22:49:53] ✅ Fecha string convertida: 10/1/2023 -> 2023-10-01 (Campo: fecha_asignacion)
[2025-11-02 22:49:53] ✅ Fecha string convertida: 1/27/2025 -> 2025-01-27 (Campo: fecha_proceso)
[2025-11-02 22:49:53] ✅ DV con valor '0' - ES VÁLIDO
[2025-11-02 22:49:53] ✅ Fecha string convertida: 8/10/2023 -> 2023-08-10 (Campo: fecha_castigo)
[2025-11-02 22:49:53] ✅ Fecha string convertida: 12/30/2022 -> 2022-12-30 (Campo: fecha_pago)
[2025-11-02 22:49:53] ✅ Fecha string convertida: 2/10/2023 -> 2023-02-10 (Campo: fecha_vencimiento)
[2025-11-02 22:49:53] ✅ Fecha string convertida: 1/20/2021 -> 2021-01-20 (Campo: fecha_susc)
[2025-11-02 22:49:53] ✅ Fecha string convertida: 10/1/2023 -> 2023-10-01 (Campo: fecha_asignacion)
[2025-11-02 22:49:53] ✅ Fecha string convertida: 1/27/2025 -> 2025-01-27 (Campo: fecha_proceso)
[2025-11-02 22:49:53] ✅ DV con valor '0' - ES VÁLIDO
[2025-11-02 22:49:53] ✅ Fecha string convertida: 9/5/2023 -> 2023-09-05 (Campo: fecha_castigo)
[2025-11-02 22:49:53] ✅ Fecha string convertida: 2/4/2023 -> 2023-02-04 (Campo: fecha_pago)
[2025-11-02 22:49:53] ✅ Fecha string convertida: 3/5/2023 -> 2023-03-05 (Campo: fecha_vencimiento)
[2025-11-02 22:49:53] ✅ Fecha string convertida: 1/27/2017 -> 2017-01-27 (Campo: fecha_susc)
[2025-11-02 22:49:53] ✅ Fecha string convertida: 11/1/2023 -> 2023-11-01 (Campo: fecha_asignacion)
[2025-11-02 22:49:53] ✅ Fecha string convertida: 1/27/2025 -> 2025-01-27 (Campo: fecha_proceso)
[2025-11-02 22:49:53] ✅ DV con valor '0' - ES VÁLIDO
[2025-11-02 22:49:53] ✅ Fecha string convertida: 9/5/2023 -> 2023-09-05 (Campo: fecha_castigo)
[2025-11-02 22:49:53] ✅ Fecha string convertida: 2/21/2023 -> 2023-02-21 (Campo: fecha_pago)
[2025-11-02 22:49:53] ✅ Fecha string convertida: 3/5/2023 -> 2023-03-05 (Campo: fecha_vencimiento)
[2025-11-02 22:49:53] ✅ Fecha string convertida: 12/23/1999 -> 1999-12-23 (Campo: fecha_susc)
[2025-11-02 22:49:53] ✅ Fecha string convertida: 11/1/2023 -> 2023-11-01 (Campo: fecha_asignacion)
[2025-11-02 22:49:53] ✅ Fecha string convertida: 1/27/2025 -> 2025-01-27 (Campo: fecha_proceso)
[2025-11-02 22:49:53] ✅ DV con valor '0' - ES VÁLIDO
[2025-11-02 22:49:53] ✅ Fecha string convertida: 9/5/2023 -> 2023-09-05 (Campo: fecha_castigo)
[2025-11-02 22:49:53] ✅ Fecha string convertida: 2/2/2023 -> 2023-02-02 (Campo: fecha_pago)
[2025-11-02 22:49:53] ✅ Fecha string convertida: 3/5/2023 -> 2023-03-05 (Campo: fecha_vencimiento)
[2025-11-02 22:49:53] ✅ Fecha string convertida: 8/25/2000 -> 2000-08-25 (Campo: fecha_susc)
[2025-11-02 22:49:53] ✅ Fecha string convertida: 11/1/2023 -> 2023-11-01 (Campo: fecha_asignacion)
[2025-11-02 22:49:53] ✅ Fecha string convertida: 1/27/2025 -> 2025-01-27 (Campo: fecha_proceso)
[2025-11-02 22:49:53] ✅ DV con valor '0' - ES VÁLIDO
[2025-11-02 22:49:53] ✅ Fecha string convertida: 9/10/2023 -> 2023-09-10 (Campo: fecha_castigo)
[2025-11-02 22:49:53] ✅ Fecha string convertida: 9/2/2024 -> 2024-09-02 (Campo: fecha_pago)
[2025-11-02 22:49:53] ✅ Fecha string convertida: 3/10/2023 -> 2023-03-10 (Campo: fecha_vencimiento)
[2025-11-02 22:49:53] ✅ Fecha string convertida: 6/1/2007 -> 2007-06-01 (Campo: fecha_susc)
[2025-11-02 22:49:53] ✅ Fecha string convertida: 11/1/2023 -> 2023-11-01 (Campo: fecha_asignacion)
[2025-11-02 22:49:53] ✅ Fecha string convertida: 1/27/2025 -> 2025-01-27 (Campo: fecha_proceso)
[2025-11-02 22:49:53] ✅ DV con valor '0' - ES VÁLIDO
[2025-11-02 22:49:53] ✅ Fecha string convertida: 10/5/2023 -> 2023-10-05 (Campo: fecha_castigo)
[2025-11-02 22:49:53] ✅ Fecha string convertida: 3/20/2023 -> 2023-03-20 (Campo: fecha_pago)
[2025-11-02 22:49:53] ✅ Fecha string convertida: 4/5/2023 -> 2023-04-05 (Campo: fecha_vencimiento)
[2025-11-02 22:49:53] ✅ Fecha string convertida: 7/31/2015 -> 2015-07-31 (Campo: fecha_susc)
[2025-11-02 22:49:53] ✅ Fecha string convertida: 12/1/2023 -> 2023-12-01 (Campo: fecha_asignacion)
[2025-11-02 22:49:53] ✅ Fecha string convertida: 1/27/2025 -> 2025-01-27 (Campo: fecha_proceso)
[2025-11-02 22:49:53] ✅ DV con valor '0' - ES VÁLIDO
[2025-11-02 22:49:53] ✅ Fecha string convertida: 10/15/2023 -> 2023-10-15 (Campo: fecha_castigo)
[2025-11-02 22:49:53] ✅ Fecha string convertida: 3/15/2023 -> 2023-03-15 (Campo: fecha_pago)
[2025-11-02 22:49:53] ✅ Fecha string convertida: 4/15/2023 -> 2023-04-15 (Campo: fecha_vencimiento)
[2025-11-02 22:49:53] ✅ Fecha string convertida: 4/27/2019 -> 2019-04-27 (Campo: fecha_susc)
[2025-11-02 22:49:53] ✅ Fecha string convertida: 12/1/2023 -> 2023-12-01 (Campo: fecha_asignacion)
[2025-11-02 22:49:53] ✅ Fecha string convertida: 1/27/2025 -> 2025-01-27 (Campo: fecha_proceso)
[2025-11-02 22:49:53] ✅ DV con valor '0' - ES VÁLIDO
[2025-11-02 22:49:53] ✅ Fecha string convertida: 11/5/2023 -> 2023-11-05 (Campo: fecha_castigo)
[2025-11-02 22:49:53] ✅ Fecha string convertida: 4/1/2023 -> 2023-04-01 (Campo: fecha_pago)
[2025-11-02 22:49:53] ✅ Fecha string convertida: 5/5/2023 -> 2023-05-05 (Campo: fecha_vencimiento)
[2025-11-02 22:49:53] ✅ Fecha string convertida: 9/2/2019 -> 2019-09-02 (Campo: fecha_susc)
[2025-11-02 22:49:53] ✅ Fecha string convertida: 1/1/2024 -> 2024-01-01 (Campo: fecha_asignacion)
[2025-11-02 22:49:53] ✅ Fecha string convertida: 1/27/2025 -> 2025-01-27 (Campo: fecha_proceso)
[2025-11-02 22:49:53] ✅ DV con valor '0' - ES VÁLIDO
[2025-11-02 22:49:53] ✅ Fecha string convertida: 11/15/2023 -> 2023-11-15 (Campo: fecha_castigo)
[2025-11-02 22:49:53] ✅ Fecha string convertida: 2/22/2023 -> 2023-02-22 (Campo: fecha_pago)
[2025-11-02 22:49:53] ✅ Fecha string convertida: 5/15/2023 -> 2023-05-15 (Campo: fecha_vencimiento)
[2025-11-02 22:49:53] ✅ Fecha string convertida: 1/12/2020 -> 2020-01-12 (Campo: fecha_susc)
[2025-11-02 22:49:53] ✅ Fecha string convertida: 1/1/2024 -> 2024-01-01 (Campo: fecha_asignacion)
[2025-11-02 22:49:53] ✅ Fecha string convertida: 1/27/2025 -> 2025-01-27 (Campo: fecha_proceso)
[2025-11-02 22:49:53] ✅ DV con valor '0' - ES VÁLIDO
[2025-11-02 22:49:53] ✅ Fecha string convertida: 11/15/2023 -> 2023-11-15 (Campo: fecha_castigo)
[2025-11-02 22:49:53] ✅ Fecha string convertida: 4/12/2023 -> 2023-04-12 (Campo: fecha_pago)
[2025-11-02 22:49:53] ✅ Fecha string convertida: 5/15/2023 -> 2023-05-15 (Campo: fecha_vencimiento)
[2025-11-02 22:49:53] ✅ Fecha string convertida: 7/19/2011 -> 2011-07-19 (Campo: fecha_susc)
[2025-11-02 22:49:53] ✅ Fecha string convertida: 1/1/2024 -> 2024-01-01 (Campo: fecha_asignacion)
[2025-11-02 22:49:53] ✅ Fecha string convertida: 1/27/2025 -> 2025-01-27 (Campo: fecha_proceso)
[2025-11-02 22:49:53] ✅ DV con valor '0' - ES VÁLIDO
[2025-11-02 22:49:53] ✅ Fecha string convertida: 12/5/2023 -> 2023-12-05 (Campo: fecha_castigo)
[2025-11-02 22:49:53] ✅ Fecha string convertida: 4/25/2023 -> 2023-04-25 (Campo: fecha_pago)
[2025-11-02 22:49:53] ✅ Fecha string convertida: 6/5/2023 -> 2023-06-05 (Campo: fecha_vencimiento)
[2025-11-02 22:49:53] ✅ Fecha string convertida: 3/2/2023 -> 2023-03-02 (Campo: fecha_susc)
[2025-11-02 22:49:53] ✅ Fecha string convertida: 2/1/2024 -> 2024-02-01 (Campo: fecha_asignacion)
[2025-11-02 22:49:53] ✅ Fecha string convertida: 1/27/2025 -> 2025-01-27 (Campo: fecha_proceso)
[2025-11-02 22:49:53] ✅ DV con valor '0' - ES VÁLIDO
[2025-11-02 22:49:53] ✅ Fecha string convertida: 12/5/2023 -> 2023-12-05 (Campo: fecha_castigo)
[2025-11-02 22:49:53] ✅ Fecha string convertida: 5/10/2023 -> 2023-05-10 (Campo: fecha_pago)
[2025-11-02 22:49:53] ✅ Fecha string convertida: 6/5/2023 -> 2023-06-05 (Campo: fecha_vencimiento)
[2025-11-02 22:49:53] ✅ Fecha string convertida: 8/15/2019 -> 2019-08-15 (Campo: fecha_susc)
[2025-11-02 22:49:53] ✅ Fecha string convertida: 2/1/2024 -> 2024-02-01 (Campo: fecha_asignacion)
[2025-11-02 22:49:53] ✅ Fecha string convertida: 1/27/2025 -> 2025-01-27 (Campo: fecha_proceso)
[2025-11-02 22:49:53] ✅ DV con valor '0' - ES VÁLIDO
[2025-11-02 22:49:53] ✅ Fecha string convertida: 12/5/2023 -> 2023-12-05 (Campo: fecha_castigo)
[2025-11-02 22:49:53] ✅ Fecha string convertida: 5/22/2023 -> 2023-05-22 (Campo: fecha_pago)
[2025-11-02 22:49:53] ✅ Fecha string convertida: 6/5/2023 -> 2023-06-05 (Campo: fecha_vencimiento)
[2025-11-02 22:49:53] ✅ Fecha string convertida: 3/7/2022 -> 2022-03-07 (Campo: fecha_susc)
[2025-11-02 22:49:53] ✅ Fecha string convertida: 2/1/2024 -> 2024-02-01 (Campo: fecha_asignacion)
[2025-11-02 22:49:53] ✅ Fecha string convertida: 1/27/2025 -> 2025-01-27 (Campo: fecha_proceso)
[2025-11-02 22:49:53] ✅ DV con valor '0' - ES VÁLIDO
[2025-11-02 22:49:53] ✅ Fecha string convertida: 12/5/2023 -> 2023-12-05 (Campo: fecha_castigo)
[2025-11-02 22:49:53] ✅ Fecha string convertida: 5/8/2023 -> 2023-05-08 (Campo: fecha_pago)
[2025-11-02 22:49:53] ✅ Fecha string convertida: 6/5/2023 -> 2023-06-05 (Campo: fecha_vencimiento)
[2025-11-02 22:49:53] ✅ Fecha string convertida: 7/5/2014 -> 2014-07-05 (Campo: fecha_susc)
[2025-11-02 22:49:53] ✅ Fecha string convertida: 2/1/2024 -> 2024-02-01 (Campo: fecha_asignacion)
[2025-11-02 22:49:53] ✅ Fecha string convertida: 1/27/2025 -> 2025-01-27 (Campo: fecha_proceso)
[2025-11-02 22:49:53] ✅ DV con valor '0' - ES VÁLIDO
[2025-11-02 22:49:53] ✅ Fecha string convertida: 12/10/2023 -> 2023-12-10 (Campo: fecha_castigo)
[2025-11-02 22:49:53] ✅ Fecha string convertida: 5/30/2023 -> 2023-05-30 (Campo: fecha_pago)
[2025-11-02 22:49:53] ✅ Fecha string convertida: 6/10/2023 -> 2023-06-10 (Campo: fecha_vencimiento)
[2025-11-02 22:49:53] ✅ Fecha string convertida: 4/13/2017 -> 2017-04-13 (Campo: fecha_susc)
[2025-11-02 22:49:53] ✅ Fecha string convertida: 2/1/2024 -> 2024-02-01 (Campo: fecha_asignacion)
[2025-11-02 22:49:53] ✅ Fecha string convertida: 1/27/2025 -> 2025-01-27 (Campo: fecha_proceso)
[2025-11-02 22:49:53] ✅ DV con valor '0' - ES VÁLIDO
[2025-11-02 22:49:53] ✅ Fecha string convertida: 12/15/2023 -> 2023-12-15 (Campo: fecha_castigo)
[2025-11-02 22:49:53] ✅ Fecha string convertida: 5/17/2023 -> 2023-05-17 (Campo: fecha_pago)
[2025-11-02 22:49:53] ✅ Fecha string convertida: 6/15/2023 -> 2023-06-15 (Campo: fecha_vencimiento)
[2025-11-02 22:49:53] ✅ Fecha string convertida: 7/24/2022 -> 2022-07-24 (Campo: fecha_susc)
[2025-11-02 22:49:53] ✅ Fecha string convertida: 2/1/2024 -> 2024-02-01 (Campo: fecha_asignacion)
[2025-11-02 22:49:53] ✅ Fecha string convertida: 1/27/2025 -> 2025-01-27 (Campo: fecha_proceso)
[2025-11-02 22:49:53] ✅ DV con valor '0' - ES VÁLIDO
[2025-11-02 22:49:53] ✅ Fecha string convertida: 12/30/2023 -> 2023-12-30 (Campo: fecha_castigo)
[2025-11-02 22:49:53] ✅ Fecha string convertida: 6/5/2023 -> 2023-06-05 (Campo: fecha_pago)
[2025-11-02 22:49:53] ✅ Fecha string convertida: 6/30/2023 -> 2023-06-30 (Campo: fecha_vencimiento)
[2025-11-02 22:49:53] ✅ Fecha string convertida: 5/4/2022 -> 2022-05-04 (Campo: fecha_susc)
[2025-11-02 22:49:53] ✅ Fecha string convertida: 2/1/2024 -> 2024-02-01 (Campo: fecha_asignacion)
[2025-11-02 22:49:53] ✅ Fecha string convertida: 1/27/2025 -> 2025-01-27 (Campo: fecha_proceso)
[2025-11-02 22:49:53] ✅ DV con valor '0' - ES VÁLIDO
[2025-11-02 22:49:53] ✅ Fecha string convertida: 12/30/2023 -> 2023-12-30 (Campo: fecha_castigo)
[2025-11-02 22:49:53] ✅ Fecha string convertida: 5/22/2023 -> 2023-05-22 (Campo: fecha_pago)
[2025-11-02 22:49:53] ✅ Fecha string convertida: 6/30/2023 -> 2023-06-30 (Campo: fecha_vencimiento)
[2025-11-02 22:49:53] ✅ Fecha string convertida: 11/12/2017 -> 2017-11-12 (Campo: fecha_susc)
[2025-11-02 22:49:53] ✅ Fecha string convertida: 2/1/2024 -> 2024-02-01 (Campo: fecha_asignacion)
[2025-11-02 22:49:53] ✅ Fecha string convertida: 1/27/2025 -> 2025-01-27 (Campo: fecha_proceso)
[2025-11-02 22:49:53] ✅ DV con valor '0' - ES VÁLIDO
[2025-11-02 22:49:53] ✅ Fecha string convertida: 1/5/2024 -> 2024-01-05 (Campo: fecha_castigo)
[2025-11-02 22:49:53] ✅ Fecha string convertida: 10/25/2023 -> 2023-10-25 (Campo: fecha_pago)
[2025-11-02 22:49:53] ✅ Fecha string convertida: 7/5/2023 -> 2023-07-05 (Campo: fecha_vencimiento)
[2025-11-02 22:49:53] ✅ Fecha string convertida: 7/20/2021 -> 2021-07-20 (Campo: fecha_susc)
[2025-11-02 22:49:53] ✅ Fecha string convertida: 3/1/2024 -> 2024-03-01 (Campo: fecha_asignacion)
[2025-11-02 22:49:53] ✅ Fecha string convertida: 1/27/2025 -> 2025-01-27 (Campo: fecha_proceso)
[2025-11-02 22:49:53] ✅ DV con valor '0' - ES VÁLIDO
[2025-11-02 22:49:53] ✅ Fecha string convertida: 1/5/2024 -> 2024-01-05 (Campo: fecha_castigo)
[2025-11-02 22:49:53] ✅ Fecha string convertida: 5/15/2023 -> 2023-05-15 (Campo: fecha_pago)
[2025-11-02 22:49:53] ✅ Fecha string convertida: 7/5/2023 -> 2023-07-05 (Campo: fecha_vencimiento)
[2025-11-02 22:49:53] ✅ Fecha string convertida: 9/20/2016 -> 2016-09-20 (Campo: fecha_susc)
[2025-11-02 22:49:53] ✅ Fecha string convertida: 3/1/2024 -> 2024-03-01 (Campo: fecha_asignacion)
[2025-11-02 22:49:53] ✅ Fecha string convertida: 1/27/2025 -> 2025-01-27 (Campo: fecha_proceso)
[2025-11-02 22:49:53] ✅ DV con valor '0' - ES VÁLIDO
[2025-11-02 22:49:53] ✅ Fecha string convertida: 1/5/2024 -> 2024-01-05 (Campo: fecha_castigo)
[2025-11-02 22:49:53] ✅ DV con valor '0' - ES VÁLIDO
[2025-11-02 22:49:53] ✅ Fecha string convertida: 6/28/2023 -> 2023-06-28 (Campo: fecha_pago)
[2025-11-02 22:49:53] ✅ Fecha string convertida: 7/5/2023 -> 2023-07-05 (Campo: fecha_vencimiento)
[2025-11-02 22:49:53] ✅ Fecha string convertida: 11/25/2014 -> 2014-11-25 (Campo: fecha_susc)
[2025-11-02 22:49:53] ✅ Fecha string convertida: 3/1/2024 -> 2024-03-01 (Campo: fecha_asignacion)
[2025-11-02 22:49:53] ✅ Fecha string convertida: 1/27/2025 -> 2025-01-27 (Campo: fecha_proceso)
[2025-11-02 22:49:53] ✅ DV con valor '0' - ES VÁLIDO
[2025-11-02 22:49:53] ✅ Fecha string convertida: 1/5/2024 -> 2024-01-05 (Campo: fecha_castigo)
[2025-11-02 22:49:53] ✅ Fecha string convertida: 6/1/2023 -> 2023-06-01 (Campo: fecha_pago)
[2025-11-02 22:49:53] ✅ Fecha string convertida: 7/5/2023 -> 2023-07-05 (Campo: fecha_vencimiento)
[2025-11-02 22:49:53] ✅ Fecha string convertida: 7/14/2014 -> 2014-07-14 (Campo: fecha_susc)
[2025-11-02 22:49:53] ✅ Fecha string convertida: 3/1/2024 -> 2024-03-01 (Campo: fecha_asignacion)
[2025-11-02 22:49:53] ✅ Fecha string convertida: 1/27/2025 -> 2025-01-27 (Campo: fecha_proceso)
[2025-11-02 22:49:53] ✅ DV con valor '0' - ES VÁLIDO
[2025-11-02 22:49:53] ✅ Fecha string convertida: 1/10/2024 -> 2024-01-10 (Campo: fecha_castigo)
[2025-11-02 22:49:53] ✅ Fecha string convertida: 7/6/2023 -> 2023-07-06 (Campo: fecha_pago)
[2025-11-02 22:49:53] ✅ Fecha string convertida: 7/10/2023 -> 2023-07-10 (Campo: fecha_vencimiento)
[2025-11-02 22:49:53] ✅ Fecha string convertida: 10/13/2022 -> 2022-10-13 (Campo: fecha_susc)
[2025-11-02 22:49:53] ✅ Fecha string convertida: 3/1/2024 -> 2024-03-01 (Campo: fecha_asignacion)
[2025-11-02 22:49:53] ✅ Fecha string convertida: 1/27/2025 -> 2025-01-27 (Campo: fecha_proceso)
[2025-11-02 22:49:53] ✅ DV con valor '0' - ES VÁLIDO
[2025-11-02 22:49:53] ✅ Fecha string convertida: 1/10/2024 -> 2024-01-10 (Campo: fecha_castigo)
[2025-11-02 22:49:53] ✅ Fecha string convertida: 5/30/2023 -> 2023-05-30 (Campo: fecha_pago)
[2025-11-02 22:49:53] ✅ Fecha string convertida: 7/10/2023 -> 2023-07-10 (Campo: fecha_vencimiento)
[2025-11-02 22:49:53] ✅ Fecha string convertida: 12/21/2022 -> 2022-12-21 (Campo: fecha_susc)
[2025-11-02 22:49:53] ✅ Fecha string convertida: 3/1/2024 -> 2024-03-01 (Campo: fecha_asignacion)
[2025-11-02 22:49:53] ✅ Fecha string convertida: 1/27/2025 -> 2025-01-27 (Campo: fecha_proceso)
[2025-11-02 22:49:53] ✅ DV con valor '0' - ES VÁLIDO
[2025-11-02 22:49:53] ✅ Fecha string convertida: 1/10/2024 -> 2024-01-10 (Campo: fecha_castigo)
[2025-11-02 22:49:53] ✅ Fecha string convertida: 6/5/2023 -> 2023-06-05 (Campo: fecha_pago)
[2025-11-02 22:49:53] ✅ Fecha string convertida: 7/10/2023 -> 2023-07-10 (Campo: fecha_vencimiento)
[2025-11-02 22:49:53] ✅ Fecha string convertida: 7/4/2013 -> 2013-07-04 (Campo: fecha_susc)
[2025-11-02 22:49:53] ✅ Fecha string convertida: 3/1/2024 -> 2024-03-01 (Campo: fecha_asignacion)
[2025-11-02 22:49:53] ✅ Fecha string convertida: 1/27/2025 -> 2025-01-27 (Campo: fecha_proceso)
[2025-11-02 22:49:53] ✅ DV con valor '0' - ES VÁLIDO
[2025-11-02 22:49:53] ✅ Fecha string convertida: 1/30/2024 -> 2024-01-30 (Campo: fecha_castigo)
[2025-11-02 22:49:53] ✅ Fecha string convertida: 6/30/2023 -> 2023-06-30 (Campo: fecha_pago)
[2025-11-02 22:49:53] ✅ Fecha string convertida: 7/30/2023 -> 2023-07-30 (Campo: fecha_vencimiento)
[2025-11-02 22:49:53] ✅ Fecha string convertida: 11/10/2005 -> 2005-11-10 (Campo: fecha_susc)
[2025-11-02 22:49:53] ✅ Fecha string convertida: 3/1/2024 -> 2024-03-01 (Campo: fecha_asignacion)
[2025-11-02 22:49:53] ✅ Fecha string convertida: 1/27/2025 -> 2025-01-27 (Campo: fecha_proceso)
[2025-11-02 22:49:53] ✅ DV con valor '0' - ES VÁLIDO
[2025-11-02 22:49:53] ✅ Fecha string convertida: 2/5/2024 -> 2024-02-05 (Campo: fecha_castigo)
[2025-11-02 22:49:53] ✅ Fecha string convertida: 6/19/2023 -> 2023-06-19 (Campo: fecha_pago)
[2025-11-02 22:49:53] ✅ Fecha string convertida: 8/5/2023 -> 2023-08-05 (Campo: fecha_vencimiento)
[2025-11-02 22:49:53] ✅ Fecha string convertida: 12/4/2006 -> 2006-12-04 (Campo: fecha_susc)
[2025-11-02 22:49:53] ✅ Fecha string convertida: 4/1/2024 -> 2024-04-01 (Campo: fecha_asignacion)
[2025-11-02 22:49:53] ✅ Fecha string convertida: 1/27/2025 -> 2025-01-27 (Campo: fecha_proceso)
[2025-11-02 22:49:53] ✅ DV con valor '0' - ES VÁLIDO
[2025-11-02 22:49:53] ✅ Fecha string convertida: 2/5/2024 -> 2024-02-05 (Campo: fecha_castigo)
[2025-11-02 22:49:53] ✅ Fecha string convertida: 10/31/2023 -> 2023-10-31 (Campo: fecha_pago)
[2025-11-02 22:49:53] ✅ Fecha string convertida: 8/5/2023 -> 2023-08-05 (Campo: fecha_vencimiento)
[2025-11-02 22:49:53] ✅ Fecha string convertida: 11/28/2018 -> 2018-11-28 (Campo: fecha_susc)
[2025-11-02 22:49:53] ✅ Fecha string convertida: 4/1/2024 -> 2024-04-01 (Campo: fecha_asignacion)
[2025-11-02 22:49:53] ✅ Fecha string convertida: 1/27/2025 -> 2025-01-27 (Campo: fecha_proceso)
[2025-11-02 22:49:53] ✅ DV con valor '0' - ES VÁLIDO
[2025-11-02 22:49:53] ✅ Fecha string convertida: 2/5/2024 -> 2024-02-05 (Campo: fecha_castigo)
[2025-11-02 22:49:53] ✅ Fecha string convertida: 7/28/2023 -> 2023-07-28 (Campo: fecha_pago)
[2025-11-02 22:49:54] ✅ Fecha string convertida: 8/5/2023 -> 2023-08-05 (Campo: fecha_vencimiento)
[2025-11-02 22:49:54] ✅ Fecha string convertida: 7/8/2022 -> 2022-07-08 (Campo: fecha_susc)
[2025-11-02 22:49:54] ✅ Fecha string convertida: 4/1/2024 -> 2024-04-01 (Campo: fecha_asignacion)
[2025-11-02 22:49:54] ✅ Fecha string convertida: 1/27/2025 -> 2025-01-27 (Campo: fecha_proceso)
[2025-11-02 22:49:54] ✅ DV con valor '0' - ES VÁLIDO
[2025-11-02 22:49:54] ✅ Fecha string convertida: 2/5/2024 -> 2024-02-05 (Campo: fecha_castigo)
[2025-11-02 22:49:54] ✅ Fecha string convertida: 6/29/2023 -> 2023-06-29 (Campo: fecha_pago)
[2025-11-02 22:49:54] ✅ Fecha string convertida: 8/5/2023 -> 2023-08-05 (Campo: fecha_vencimiento)
[2025-11-02 22:49:54] ✅ Fecha string convertida: 6/4/2008 -> 2008-06-04 (Campo: fecha_susc)
[2025-11-02 22:49:54] ✅ Fecha string convertida: 4/1/2024 -> 2024-04-01 (Campo: fecha_asignacion)
[2025-11-02 22:49:54] ✅ Fecha string convertida: 1/27/2025 -> 2025-01-27 (Campo: fecha_proceso)
[2025-11-02 22:49:54] ✅ DV con valor '0' - ES VÁLIDO
[2025-11-02 22:49:54] ✅ Fecha string convertida: 2/5/2024 -> 2024-02-05 (Campo: fecha_castigo)
[2025-11-02 22:49:54] ✅ Fecha string convertida: 5/31/2023 -> 2023-05-31 (Campo: fecha_pago)
[2025-11-02 22:49:54] ✅ Fecha string convertida: 8/5/2023 -> 2023-08-05 (Campo: fecha_vencimiento)
[2025-11-02 22:49:54] ✅ Fecha string convertida: 12/19/2022 -> 2022-12-19 (Campo: fecha_susc)
[2025-11-02 22:49:54] ✅ Fecha string convertida: 4/1/2024 -> 2024-04-01 (Campo: fecha_asignacion)
[2025-11-02 22:49:54] ✅ Fecha string convertida: 1/27/2025 -> 2025-01-27 (Campo: fecha_proceso)
[2025-11-02 22:49:54] ✅ DV con valor '0' - ES VÁLIDO
[2025-11-02 22:49:54] ✅ Fecha string convertida: 2/15/2024 -> 2024-02-15 (Campo: fecha_castigo)
[2025-11-02 22:49:54] ✅ Fecha string convertida: 7/12/2023 -> 2023-07-12 (Campo: fecha_pago)
[2025-11-02 22:49:54] ✅ Fecha string convertida: 8/15/2023 -> 2023-08-15 (Campo: fecha_vencimiento)
[2025-11-02 22:49:54] ✅ Fecha string convertida: 1/21/2020 -> 2020-01-21 (Campo: fecha_susc)
[2025-11-02 22:49:54] ✅ Fecha string convertida: 4/1/2024 -> 2024-04-01 (Campo: fecha_asignacion)
[2025-11-02 22:49:54] ✅ Fecha string convertida: 1/27/2025 -> 2025-01-27 (Campo: fecha_proceso)
[2025-11-02 22:49:54] ✅ DV con valor '0' - ES VÁLIDO
[2025-11-02 22:49:54] ✅ Fecha string convertida: 2/15/2024 -> 2024-02-15 (Campo: fecha_castigo)
[2025-11-02 22:49:54] ✅ Fecha string convertida: 9/26/2023 -> 2023-09-26 (Campo: fecha_pago)
[2025-11-02 22:49:54] ✅ Fecha string convertida: 8/15/2023 -> 2023-08-15 (Campo: fecha_vencimiento)
[2025-11-02 22:49:54] ✅ Fecha string convertida: 10/12/2021 -> 2021-10-12 (Campo: fecha_susc)
[2025-11-02 22:49:54] ✅ Fecha string convertida: 4/1/2024 -> 2024-04-01 (Campo: fecha_asignacion)
[2025-11-02 22:49:54] ✅ Fecha string convertida: 1/27/2025 -> 2025-01-27 (Campo: fecha_proceso)
[2025-11-02 22:49:54] ✅ DV con valor '0' - ES VÁLIDO
[2025-11-02 22:49:54] ✅ Fecha string convertida: 3/5/2024 -> 2024-03-05 (Campo: fecha_castigo)
[2025-11-02 22:49:54] ✅ Fecha string convertida: 8/3/2023 -> 2023-08-03 (Campo: fecha_pago)
[2025-11-02 22:49:54] ✅ Fecha string convertida: 9/5/2023 -> 2023-09-05 (Campo: fecha_vencimiento)
[2025-11-02 22:49:54] ✅ Fecha string convertida: 3/2/2017 -> 2017-03-02 (Campo: fecha_susc)
[2025-11-02 22:49:54] ✅ Fecha string convertida: 5/1/2024 -> 2024-05-01 (Campo: fecha_asignacion)
[2025-11-02 22:49:54] ✅ Fecha string convertida: 1/27/2025 -> 2025-01-27 (Campo: fecha_proceso)
[2025-11-02 22:49:54] ✅ DV con valor '0' - ES VÁLIDO
[2025-11-02 22:49:54] ✅ Fecha string convertida: 4/5/2024 -> 2024-04-05 (Campo: fecha_castigo)
[2025-11-02 22:49:54] ✅ Fecha string convertida: 9/8/2023 -> 2023-09-08 (Campo: fecha_pago)
[2025-11-02 22:49:54] ✅ Fecha string convertida: 10/5/2023 -> 2023-10-05 (Campo: fecha_vencimiento)
[2025-11-02 22:49:54] ✅ Fecha string convertida: 11/9/2013 -> 2013-11-09 (Campo: fecha_susc)
[2025-11-02 22:49:54] ✅ Fecha string convertida: 6/1/2024 -> 2024-06-01 (Campo: fecha_asignacion)
[2025-11-02 22:49:54] ✅ Fecha string convertida: 1/27/2025 -> 2025-01-27 (Campo: fecha_proceso)
[2025-11-02 22:49:54] ✅ DV con valor '0' - ES VÁLIDO
[2025-11-02 22:49:54] ✅ Fecha string convertida: 4/5/2024 -> 2024-04-05 (Campo: fecha_castigo)
[2025-11-02 22:49:54] ✅ Fecha string convertida: 7/31/2023 -> 2023-07-31 (Campo: fecha_pago)
[2025-11-02 22:49:54] ✅ Fecha string convertida: 10/5/2023 -> 2023-10-05 (Campo: fecha_vencimiento)
[2025-11-02 22:49:54] ✅ Fecha string convertida: 2/28/2017 -> 2017-02-28 (Campo: fecha_susc)
[2025-11-02 22:49:54] ✅ Fecha string convertida: 6/1/2024 -> 2024-06-01 (Campo: fecha_asignacion)
[2025-11-02 22:49:54] ✅ Fecha string convertida: 1/27/2025 -> 2025-01-27 (Campo: fecha_proceso)
[2025-11-02 22:49:54] ✅ DV con valor '0' - ES VÁLIDO
[2025-11-02 22:49:54] ✅ Fecha string convertida: 4/5/2024 -> 2024-04-05 (Campo: fecha_castigo)
[2025-11-02 22:49:54] ✅ Fecha string convertida: 5/10/2023 -> 2023-05-10 (Campo: fecha_pago)
[2025-11-02 22:49:54] ✅ Fecha string convertida: 10/5/2023 -> 2023-10-05 (Campo: fecha_vencimiento)
[2025-11-02 22:49:54] ✅ Fecha string convertida: 7/17/2021 -> 2021-07-17 (Campo: fecha_susc)
[2025-11-02 22:49:54] ✅ Fecha string convertida: 6/1/2024 -> 2024-06-01 (Campo: fecha_asignacion)
[2025-11-02 22:49:54] ✅ Fecha string convertida: 1/27/2025 -> 2025-01-27 (Campo: fecha_proceso)
[2025-11-02 22:49:54] ✅ DV con valor '0' - ES VÁLIDO
[2025-11-02 22:49:54] ✅ Fecha string convertida: 5/5/2024 -> 2024-05-05 (Campo: fecha_castigo)
[2025-11-02 22:49:54] ✅ Fecha string convertida: 10/8/2023 -> 2023-10-08 (Campo: fecha_pago)
[2025-11-02 22:49:54] ✅ Fecha string convertida: 11/5/2023 -> 2023-11-05 (Campo: fecha_vencimiento)
[2025-11-02 22:49:54] ✅ Fecha string convertida: 8/21/2006 -> 2006-08-21 (Campo: fecha_susc)
[2025-11-02 22:49:54] ✅ Fecha string convertida: 7/1/2024 -> 2024-07-01 (Campo: fecha_asignacion)
[2025-11-02 22:49:54] ✅ Fecha string convertida: 1/27/2025 -> 2025-01-27 (Campo: fecha_proceso)
[2025-11-02 22:49:54] ✅ DV con valor '0' - ES VÁLIDO
[2025-11-02 22:49:54] ✅ Fecha string convertida: 5/30/2024 -> 2024-05-30 (Campo: fecha_castigo)
[2025-11-02 22:49:54] ✅ Fecha string convertida: 8/24/2023 -> 2023-08-24 (Campo: fecha_pago)
[2025-11-02 22:49:54] ✅ Fecha string convertida: 11/30/2023 -> 2023-11-30 (Campo: fecha_vencimiento)
[2025-11-02 22:49:54] ✅ Fecha string convertida: 6/15/2006 -> 2006-06-15 (Campo: fecha_susc)
[2025-11-02 22:49:54] ✅ Fecha string convertida: 7/1/2024 -> 2024-07-01 (Campo: fecha_asignacion)
[2025-11-02 22:49:54] ✅ Fecha string convertida: 1/27/2025 -> 2025-01-27 (Campo: fecha_proceso)
[2025-11-02 22:49:54] ✅ DV con valor '0' - ES VÁLIDO
[2025-11-02 22:49:54] ✅ Fecha string convertida: 6/5/2024 -> 2024-06-05 (Campo: fecha_castigo)
[2025-11-02 22:49:54] ✅ Fecha string convertida: 3/19/2024 -> 2024-03-19 (Campo: fecha_pago)
[2025-11-02 22:49:54] ✅ Fecha string convertida: 12/5/2023 -> 2023-12-05 (Campo: fecha_vencimiento)
[2025-11-02 22:49:54] ✅ Fecha string convertida: 2/7/2003 -> 2003-02-07 (Campo: fecha_susc)
[2025-11-02 22:49:54] ✅ Fecha string convertida: 8/1/2024 -> 2024-08-01 (Campo: fecha_asignacion)
[2025-11-02 22:49:54] ✅ Fecha string convertida: 1/27/2025 -> 2025-01-27 (Campo: fecha_proceso)
[2025-11-02 22:49:54] ✅ DV con valor '0' - ES VÁLIDO
[2025-11-02 22:49:54] ✅ Fecha string convertida: 6/5/2024 -> 2024-06-05 (Campo: fecha_castigo)
[2025-11-02 22:49:54] ✅ Fecha string convertida: 11/2/2023 -> 2023-11-02 (Campo: fecha_pago)
[2025-11-02 22:49:54] ✅ Fecha string convertida: 12/5/2023 -> 2023-12-05 (Campo: fecha_vencimiento)
[2025-11-02 22:49:54] ✅ Fecha string convertida: 8/8/2017 -> 2017-08-08 (Campo: fecha_susc)
[2025-11-02 22:49:54] ✅ Fecha string convertida: 8/1/2024 -> 2024-08-01 (Campo: fecha_asignacion)
[2025-11-02 22:49:54] ✅ Fecha string convertida: 1/27/2025 -> 2025-01-27 (Campo: fecha_proceso)
[2025-11-02 22:49:54] ✅ DV con valor '0' - ES VÁLIDO
[2025-11-02 22:49:54] ✅ Fecha string convertida: 6/10/2024 -> 2024-06-10 (Campo: fecha_castigo)
[2025-11-02 22:49:54] ✅ Fecha string convertida: 11/29/2024 -> 2024-11-29 (Campo: fecha_pago)
[2025-11-02 22:49:54] ✅ Fecha string convertida: 12/10/2023 -> 2023-12-10 (Campo: fecha_vencimiento)
[2025-11-02 22:49:54] ✅ Fecha string convertida: 6/29/2018 -> 2018-06-29 (Campo: fecha_susc)
[2025-11-02 22:49:54] ✅ Fecha string convertida: 8/1/2024 -> 2024-08-01 (Campo: fecha_asignacion)
[2025-11-02 22:49:54] ✅ Fecha string convertida: 1/27/2025 -> 2025-01-27 (Campo: fecha_proceso)
[2025-11-02 22:49:54] ✅ DV con valor '0' - ES VÁLIDO
[2025-11-02 22:49:54] ✅ Fecha string convertida: 7/5/2024 -> 2024-07-05 (Campo: fecha_castigo)
[2025-11-02 22:49:54] ✅ Fecha string convertida: 11/30/2023 -> 2023-11-30 (Campo: fecha_pago)
[2025-11-02 22:49:54] ✅ Fecha string convertida: 1/5/2024 -> 2024-01-05 (Campo: fecha_vencimiento)
[2025-11-02 22:49:54] ✅ Fecha string convertida: 7/25/2013 -> 2013-07-25 (Campo: fecha_susc)
[2025-11-02 22:49:54] ✅ Fecha string convertida: 9/1/2024 -> 2024-09-01 (Campo: fecha_asignacion)
[2025-11-02 22:49:54] ✅ Fecha string convertida: 1/27/2025 -> 2025-01-27 (Campo: fecha_proceso)
[2025-11-02 22:49:54] ✅ DV con valor '0' - ES VÁLIDO
[2025-11-02 22:49:54] ✅ Fecha string convertida: 7/15/2024 -> 2024-07-15 (Campo: fecha_castigo)
[2025-11-02 22:49:54] ✅ Fecha string convertida: 3/8/2024 -> 2024-03-08 (Campo: fecha_pago)
[2025-11-02 22:49:54] ✅ Fecha string convertida: 1/15/2024 -> 2024-01-15 (Campo: fecha_vencimiento)
[2025-11-02 22:49:54] ✅ Fecha string convertida: 7/5/1988 -> 1988-07-05 (Campo: fecha_susc)
[2025-11-02 22:49:54] ✅ Fecha string convertida: 9/1/2024 -> 2024-09-01 (Campo: fecha_asignacion)
[2025-11-02 22:49:54] ✅ Fecha string convertida: 1/27/2025 -> 2025-01-27 (Campo: fecha_proceso)
[2025-11-02 22:49:54] ✅ DV con valor '0' - ES VÁLIDO
[2025-11-02 22:49:54] ✅ Fecha string convertida: 8/5/2024 -> 2024-08-05 (Campo: fecha_castigo)
[2025-11-02 22:49:54] ✅ Fecha string convertida: 1/19/2024 -> 2024-01-19 (Campo: fecha_pago)
[2025-11-02 22:49:54] ✅ Fecha string convertida: 2/5/2024 -> 2024-02-05 (Campo: fecha_vencimiento)
[2025-11-02 22:49:54] ✅ Fecha string convertida: 7/10/2008 -> 2008-07-10 (Campo: fecha_susc)
[2025-11-02 22:49:54] ✅ Fecha string convertida: 10/1/2024 -> 2024-10-01 (Campo: fecha_asignacion)
[2025-11-02 22:49:54] ✅ Fecha string convertida: 1/27/2025 -> 2025-01-27 (Campo: fecha_proceso)
[2025-11-02 22:49:54] ✅ DV con valor '0' - ES VÁLIDO
[2025-11-02 22:49:54] ✅ Fecha string convertida: 8/15/2024 -> 2024-08-15 (Campo: fecha_castigo)
[2025-11-02 22:49:54] ✅ Fecha string convertida: 2/19/2024 -> 2024-02-19 (Campo: fecha_pago)
[2025-11-02 22:49:54] ✅ Fecha string convertida: 2/15/2024 -> 2024-02-15 (Campo: fecha_vencimiento)
[2025-11-02 22:49:54] ✅ Fecha string convertida: 4/1/2010 -> 2010-04-01 (Campo: fecha_susc)
[2025-11-02 22:49:54] ✅ Fecha string convertida: 10/1/2024 -> 2024-10-01 (Campo: fecha_asignacion)
[2025-11-02 22:49:54] ✅ Fecha string convertida: 1/27/2025 -> 2025-01-27 (Campo: fecha_proceso)
[2025-11-02 22:49:54] ✅ DV con valor '0' - ES VÁLIDO
[2025-11-02 22:49:54] ✅ Fecha string convertida: 9/5/2024 -> 2024-09-05 (Campo: fecha_castigo)
[2025-11-02 22:49:54] ✅ Fecha string convertida: 2/6/2024 -> 2024-02-06 (Campo: fecha_pago)
[2025-11-02 22:49:54] ✅ Fecha string convertida: 3/5/2024 -> 2024-03-05 (Campo: fecha_vencimiento)
[2025-11-02 22:49:54] ✅ Fecha string convertida: 6/1/2021 -> 2021-06-01 (Campo: fecha_susc)
[2025-11-02 22:49:54] ✅ Fecha string convertida: 11/1/2024 -> 2024-11-01 (Campo: fecha_asignacion)
[2025-11-02 22:49:54] ✅ Fecha string convertida: 1/27/2025 -> 2025-01-27 (Campo: fecha_proceso)
[2025-11-02 22:49:54] ✅ DV con valor '0' - ES VÁLIDO
[2025-11-02 22:49:54] ✅ Fecha string convertida: 9/5/2024 -> 2024-09-05 (Campo: fecha_castigo)
[2025-11-02 22:49:54] ✅ Fecha string convertida: 1/31/2024 -> 2024-01-31 (Campo: fecha_pago)
[2025-11-02 22:49:54] ✅ Fecha string convertida: 3/5/2024 -> 2024-03-05 (Campo: fecha_vencimiento)
[2025-11-02 22:49:54] ✅ Fecha string convertida: 12/9/2021 -> 2021-12-09 (Campo: fecha_susc)
[2025-11-02 22:49:54] ✅ Fecha string convertida: 11/1/2024 -> 2024-11-01 (Campo: fecha_asignacion)
[2025-11-02 22:49:54] ✅ Fecha string convertida: 1/27/2025 -> 2025-01-27 (Campo: fecha_proceso)
[2025-11-02 22:49:54] ✅ DV con valor '0' - ES VÁLIDO
[2025-11-02 22:49:54] ✅ Fecha string convertida: 9/30/2024 -> 2024-09-30 (Campo: fecha_castigo)
[2025-11-02 22:49:54] ✅ Fecha string convertida: 2/21/2024 -> 2024-02-21 (Campo: fecha_pago)
[2025-11-02 22:49:54] ✅ Fecha string convertida: 3/30/2024 -> 2024-03-30 (Campo: fecha_vencimiento)
[2025-11-02 22:49:54] ✅ Fecha string convertida: 3/27/2018 -> 2018-03-27 (Campo: fecha_susc)
[2025-11-02 22:49:54] ✅ Fecha string convertida: 11/1/2024 -> 2024-11-01 (Campo: fecha_asignacion)
[2025-11-02 22:49:54] ✅ Fecha string convertida: 1/27/2025 -> 2025-01-27 (Campo: fecha_proceso)
[2025-11-02 22:49:54] ✅ DV con valor '0' - ES VÁLIDO
[2025-11-02 22:49:54] ✅ Fecha string convertida: 10/5/2024 -> 2024-10-05 (Campo: fecha_castigo)
[2025-11-02 22:49:54] ✅ Fecha string convertida: 3/19/2024 -> 2024-03-19 (Campo: fecha_pago)
[2025-11-02 22:49:54] ✅ Fecha string convertida: 4/5/2024 -> 2024-04-05 (Campo: fecha_vencimiento)
[2025-11-02 22:49:54] ✅ Fecha string convertida: 8/7/2016 -> 2016-08-07 (Campo: fecha_susc)
[2025-11-02 22:49:54] ✅ Fecha string convertida: 12/1/2024 -> 2024-12-01 (Campo: fecha_asignacion)
[2025-11-02 22:49:54] ✅ Fecha string convertida: 1/27/2025 -> 2025-01-27 (Campo: fecha_proceso)
[2025-11-02 22:49:54] ✅ DV con valor '0' - ES VÁLIDO
[2025-11-02 22:49:54] ✅ Fecha string convertida: 10/5/2024 -> 2024-10-05 (Campo: fecha_castigo)
[2025-11-02 22:49:54] ✅ Fecha string convertida: 3/5/2024 -> 2024-03-05 (Campo: fecha_pago)
[2025-11-02 22:49:54] ✅ Fecha string convertida: 4/5/2024 -> 2024-04-05 (Campo: fecha_vencimiento)
[2025-11-02 22:49:54] ✅ Fecha string convertida: 12/16/2021 -> 2021-12-16 (Campo: fecha_susc)
[2025-11-02 22:49:54] ✅ Fecha string convertida: 12/1/2024 -> 2024-12-01 (Campo: fecha_asignacion)
[2025-11-02 22:49:54] ✅ Fecha string convertida: 1/27/2025 -> 2025-01-27 (Campo: fecha_proceso)
[2025-11-02 22:49:54] ✅ DV con valor '0' - ES VÁLIDO
[2025-11-02 22:49:54] ✅ Fecha string convertida: 10/5/2024 -> 2024-10-05 (Campo: fecha_castigo)
[2025-11-02 22:49:54] ✅ Fecha string convertida: 2/24/2024 -> 2024-02-24 (Campo: fecha_pago)
[2025-11-02 22:49:54] ✅ Fecha string convertida: 4/5/2024 -> 2024-04-05 (Campo: fecha_vencimiento)
[2025-11-02 22:49:54] ✅ Fecha string convertida: 11/26/2004 -> 2004-11-26 (Campo: fecha_susc)
[2025-11-02 22:49:54] ✅ Fecha string convertida: 12/1/2024 -> 2024-12-01 (Campo: fecha_asignacion)
[2025-11-02 22:49:54] ✅ Fecha string convertida: 1/27/2025 -> 2025-01-27 (Campo: fecha_proceso)
[2025-11-02 22:49:54] ✅ DV con valor '0' - ES VÁLIDO
[2025-11-02 22:49:54] ✅ Fecha string convertida: 10/5/2024 -> 2024-10-05 (Campo: fecha_castigo)
[2025-11-02 22:49:54] ✅ Fecha string convertida: 3/10/2024 -> 2024-03-10 (Campo: fecha_pago)
[2025-11-02 22:49:54] ✅ Fecha string convertida: 4/5/2024 -> 2024-04-05 (Campo: fecha_vencimiento)
[2025-11-02 22:49:54] ✅ Fecha string convertida: 7/3/2022 -> 2022-07-03 (Campo: fecha_susc)
[2025-11-02 22:49:54] ✅ Fecha string convertida: 12/1/2024 -> 2024-12-01 (Campo: fecha_asignacion)
[2025-11-02 22:49:54] ✅ Fecha string convertida: 1/27/2025 -> 2025-01-27 (Campo: fecha_proceso)
[2025-11-02 22:49:54] ✅ DV con valor '0' - ES VÁLIDO
[2025-11-02 22:49:54] ✅ Fecha string convertida: 10/10/2024 -> 2024-10-10 (Campo: fecha_castigo)
[2025-11-02 22:49:54] ✅ Fecha string convertida: 3/5/2024 -> 2024-03-05 (Campo: fecha_pago)
[2025-11-02 22:49:54] ✅ Fecha string convertida: 4/10/2024 -> 2024-04-10 (Campo: fecha_vencimiento)
[2025-11-02 22:49:54] ✅ Fecha string convertida: 9/14/2020 -> 2020-09-14 (Campo: fecha_susc)
[2025-11-02 22:49:54] ✅ Fecha string convertida: 12/1/2024 -> 2024-12-01 (Campo: fecha_asignacion)
[2025-11-02 22:49:54] ✅ Fecha string convertida: 1/27/2025 -> 2025-01-27 (Campo: fecha_proceso)
[2025-11-02 22:49:54] ✅ DV con valor '0' - ES VÁLIDO
[2025-11-02 22:49:54] ✅ Fecha string convertida: 10/10/2024 -> 2024-10-10 (Campo: fecha_castigo)
[2025-11-02 22:49:54] ✅ Fecha string convertida: 2/7/2024 -> 2024-02-07 (Campo: fecha_pago)
[2025-11-02 22:49:54] ✅ Fecha string convertida: 4/10/2024 -> 2024-04-10 (Campo: fecha_vencimiento)
[2025-11-02 22:49:54] ✅ Fecha string convertida: 11/24/2017 -> 2017-11-24 (Campo: fecha_susc)
[2025-11-02 22:49:54] ✅ Fecha string convertida: 12/1/2024 -> 2024-12-01 (Campo: fecha_asignacion)
[2025-11-02 22:49:54] ✅ Fecha string convertida: 1/27/2025 -> 2025-01-27 (Campo: fecha_proceso)
[2025-11-02 22:49:54] ✅ DV con valor '0' - ES VÁLIDO
[2025-11-02 22:49:54] ✅ Fecha string convertida: 10/20/2024 -> 2024-10-20 (Campo: fecha_castigo)
[2025-11-02 22:49:54] ✅ Fecha string convertida: 4/20/2024 -> 2024-04-20 (Campo: fecha_vencimiento)
[2025-11-02 22:49:54] ✅ Fecha string convertida: 12/30/2023 -> 2023-12-30 (Campo: fecha_susc)
[2025-11-02 22:49:54] ✅ Fecha string convertida: 12/1/2024 -> 2024-12-01 (Campo: fecha_asignacion)
[2025-11-02 22:49:54] ✅ Fecha string convertida: 1/27/2025 -> 2025-01-27 (Campo: fecha_proceso)
[2025-11-02 22:49:54] ✅ DV con valor '0' - ES VÁLIDO
[2025-11-02 22:49:54] ✅ Fecha string convertida: 10/20/2024 -> 2024-10-20 (Campo: fecha_castigo)
[2025-11-02 22:49:54] ✅ Fecha string convertida: 3/4/2024 -> 2024-03-04 (Campo: fecha_pago)
[2025-11-02 22:49:54] ✅ Fecha string convertida: 4/20/2024 -> 2024-04-20 (Campo: fecha_vencimiento)
[2025-11-02 22:49:54] ✅ Fecha string convertida: 7/18/2023 -> 2023-07-18 (Campo: fecha_susc)
[2025-11-02 22:49:54] ✅ Fecha string convertida: 12/1/2024 -> 2024-12-01 (Campo: fecha_asignacion)
[2025-11-02 22:49:54] ✅ Fecha string convertida: 1/27/2025 -> 2025-01-27 (Campo: fecha_proceso)
[2025-11-02 22:49:54] ✅ DV con valor '0' - ES VÁLIDO
[2025-11-02 22:49:54] ✅ Fecha string convertida: 10/20/2024 -> 2024-10-20 (Campo: fecha_castigo)
[2025-11-02 22:49:54] ✅ Fecha string convertida: 4/6/2024 -> 2024-04-06 (Campo: fecha_pago)
[2025-11-02 22:49:54] ✅ Fecha string convertida: 4/20/2024 -> 2024-04-20 (Campo: fecha_vencimiento)
[2025-11-02 22:49:54] ✅ Fecha string convertida: 10/2/2018 -> 2018-10-02 (Campo: fecha_susc)
[2025-11-02 22:49:54] ✅ Fecha string convertida: 12/1/2024 -> 2024-12-01 (Campo: fecha_asignacion)
[2025-11-02 22:49:54] ✅ Fecha string convertida: 1/27/2025 -> 2025-01-27 (Campo: fecha_proceso)
[2025-11-02 22:49:54] ✅ DV con valor '0' - ES VÁLIDO
[2025-11-02 22:49:54] ✅ Fecha string convertida: 10/25/2024 -> 2024-10-25 (Campo: fecha_castigo)
[2025-11-02 22:49:54] ✅ Fecha string convertida: 5/29/2024 -> 2024-05-29 (Campo: fecha_pago)
[2025-11-02 22:49:54] ✅ Fecha string convertida: 4/25/2024 -> 2024-04-25 (Campo: fecha_vencimiento)
[2025-11-02 22:49:54] ✅ Fecha string convertida: 8/17/1990 -> 1990-08-17 (Campo: fecha_susc)
[2025-11-02 22:49:54] ✅ Fecha string convertida: 12/1/2024 -> 2024-12-01 (Campo: fecha_asignacion)
[2025-11-02 22:49:54] ✅ Fecha string convertida: 1/27/2025 -> 2025-01-27 (Campo: fecha_proceso)
[2025-11-02 22:49:55] ✅ Fecha string convertida: 1/25/2020 -> 2020-01-25 (Campo: fecha_castigo)
[2025-11-02 22:49:55] ✅ Fecha string convertida: 8/9/2024 -> 2024-08-09 (Campo: fecha_pago)
[2025-11-02 22:49:55] ✅ Fecha string convertida: 7/25/2019 -> 2019-07-25 (Campo: fecha_vencimiento)
[2025-11-02 22:49:55] ✅ Fecha string convertida: 11/20/2013 -> 2013-11-20 (Campo: fecha_susc)
[2025-11-02 22:49:55] ✅ Fecha string convertida: 12/1/2019 -> 2019-12-01 (Campo: fecha_asignacion)
[2025-11-02 22:49:55] ✅ Fecha string convertida: 1/27/2025 -> 2025-01-27 (Campo: fecha_proceso)
[2025-11-02 22:49:55] ✅ Fecha string convertida: 4/5/2020 -> 2020-04-05 (Campo: fecha_castigo)
[2025-11-02 22:49:55] ✅ Fecha string convertida: 9/4/2024 -> 2024-09-04 (Campo: fecha_pago)
[2025-11-02 22:49:55] ✅ Fecha string convertida: 10/5/2019 -> 2019-10-05 (Campo: fecha_vencimiento)
[2025-11-02 22:49:55] ✅ Fecha string convertida: 1/23/2013 -> 2013-01-23 (Campo: fecha_susc)
[2025-11-02 22:49:55] ✅ Fecha string convertida: 6/1/2020 -> 2020-06-01 (Campo: fecha_asignacion)
[2025-11-02 22:49:55] ✅ Fecha string convertida: 1/27/2025 -> 2025-01-27 (Campo: fecha_proceso)
[2025-11-02 22:49:55] ✅ Fecha string convertida: 4/5/2020 -> 2020-04-05 (Campo: fecha_castigo)
[2025-11-02 22:49:55] ✅ Fecha string convertida: 11/3/2022 -> 2022-11-03 (Campo: fecha_pago)
[2025-11-02 22:49:55] ✅ Fecha string convertida: 10/5/2019 -> 2019-10-05 (Campo: fecha_vencimiento)
[2025-11-02 22:49:55] ✅ Fecha string convertida: 7/12/2002 -> 2002-07-12 (Campo: fecha_susc)
[2025-11-02 22:49:55] ✅ Fecha string convertida: 6/1/2020 -> 2020-06-01 (Campo: fecha_asignacion)
[2025-11-02 22:49:55] ✅ Fecha string convertida: 1/27/2025 -> 2025-01-27 (Campo: fecha_proceso)
[2025-11-02 22:49:55] ✅ Fecha string convertida: 4/5/2020 -> 2020-04-05 (Campo: fecha_castigo)
[2025-11-02 22:49:55] ✅ Fecha string convertida: 10/5/2019 -> 2019-10-05 (Campo: fecha_vencimiento)
[2025-11-02 22:49:55] ✅ Fecha string convertida: 8/5/2016 -> 2016-08-05 (Campo: fecha_susc)
[2025-11-02 22:49:55] ✅ Fecha string convertida: 6/1/2020 -> 2020-06-01 (Campo: fecha_asignacion)
[2025-11-02 22:49:55] ✅ Fecha string convertida: 1/27/2025 -> 2025-01-27 (Campo: fecha_proceso)
[2025-11-02 22:49:55] ✅ Fecha string convertida: 7/5/2020 -> 2020-07-05 (Campo: fecha_castigo)
[2025-11-02 22:49:55] ✅ Fecha string convertida: 9/6/2024 -> 2024-09-06 (Campo: fecha_pago)
[2025-11-02 22:49:55] ✅ Fecha string convertida: 1/5/2020 -> 2020-01-05 (Campo: fecha_vencimiento)
[2025-11-02 22:49:55] ✅ Fecha string convertida: 2/1/2016 -> 2016-02-01 (Campo: fecha_susc)
[2025-11-02 22:49:55] ✅ Fecha string convertida: 7/1/2020 -> 2020-07-01 (Campo: fecha_asignacion)
[2025-11-02 22:49:55] ✅ Fecha string convertida: 1/27/2025 -> 2025-01-27 (Campo: fecha_proceso)
[2025-11-02 22:49:55] ✅ Fecha string convertida: 7/5/2020 -> 2020-07-05 (Campo: fecha_castigo)
[2025-11-02 22:49:55] ✅ Fecha string convertida: 1/5/2020 -> 2020-01-05 (Campo: fecha_vencimiento)
[2025-11-02 22:49:55] ✅ Fecha string convertida: 7/21/2009 -> 2009-07-21 (Campo: fecha_susc)
[2025-11-02 22:49:55] ✅ Fecha string convertida: 9/1/2020 -> 2020-09-01 (Campo: fecha_asignacion)
[2025-11-02 22:49:55] ✅ Fecha string convertida: 1/27/2025 -> 2025-01-27 (Campo: fecha_proceso)
[2025-11-02 22:49:55] ✅ Fecha string convertida: 9/5/2020 -> 2020-09-05 (Campo: fecha_castigo)
[2025-11-02 22:49:55] ✅ Fecha string convertida: 3/5/2020 -> 2020-03-05 (Campo: fecha_vencimiento)
[2025-11-02 22:49:55] ✅ Fecha string convertida: 9/4/2013 -> 2013-09-04 (Campo: fecha_susc)
[2025-11-02 22:49:55] ✅ Fecha string convertida: 11/1/2020 -> 2020-11-01 (Campo: fecha_asignacion)
[2025-11-02 22:49:55] ✅ Fecha string convertida: 1/27/2025 -> 2025-01-27 (Campo: fecha_proceso)
[2025-11-02 22:49:55] ✅ Fecha string convertida: 10/5/2020 -> 2020-10-05 (Campo: fecha_castigo)
[2025-11-02 22:49:55] ✅ Fecha string convertida: 1/29/2023 -> 2023-01-29 (Campo: fecha_pago)
[2025-11-02 22:49:55] ✅ Fecha string convertida: 4/5/2020 -> 2020-04-05 (Campo: fecha_vencimiento)
[2025-11-02 22:49:55] ✅ Fecha string convertida: 5/12/2012 -> 2012-05-12 (Campo: fecha_susc)
[2025-11-02 22:49:55] ✅ Fecha string convertida: 12/1/2020 -> 2020-12-01 (Campo: fecha_asignacion)
[2025-11-02 22:49:55] ✅ Fecha string convertida: 1/27/2025 -> 2025-01-27 (Campo: fecha_proceso)
[2025-11-02 22:49:55] ✅ Fecha string convertida: 10/5/2020 -> 2020-10-05 (Campo: fecha_castigo)
[2025-11-02 22:49:55] ✅ Fecha string convertida: 4/5/2020 -> 2020-04-05 (Campo: fecha_vencimiento)
[2025-11-02 22:49:55] ✅ Fecha string convertida: 7/16/2014 -> 2014-07-16 (Campo: fecha_susc)
[2025-11-02 22:49:55] ✅ Fecha string convertida: 12/1/2020 -> 2020-12-01 (Campo: fecha_asignacion)
[2025-11-02 22:49:55] ✅ Fecha string convertida: 1/27/2025 -> 2025-01-27 (Campo: fecha_proceso)
[2025-11-02 22:49:55] ✅ Fecha string convertida: 1/5/2021 -> 2021-01-05 (Campo: fecha_castigo)
[2025-11-02 22:49:55] ✅ Fecha string convertida: 1/10/2023 -> 2023-01-10 (Campo: fecha_pago)
[2025-11-02 22:49:55] ✅ Fecha string convertida: 7/5/2020 -> 2020-07-05 (Campo: fecha_vencimiento)
[2025-11-02 22:49:55] ✅ Fecha string convertida: 11/6/2013 -> 2013-11-06 (Campo: fecha_susc)
[2025-11-02 22:49:55] ✅ Fecha string convertida: 3/1/2021 -> 2021-03-01 (Campo: fecha_asignacion)
[2025-11-02 22:49:55] ✅ Fecha string convertida: 1/27/2025 -> 2025-01-27 (Campo: fecha_proceso)
[2025-11-02 22:49:55] ✅ Fecha string convertida: 1/10/2021 -> 2021-01-10 (Campo: fecha_castigo)
[2025-11-02 22:49:55] ✅ Fecha string convertida: 7/10/2020 -> 2020-07-10 (Campo: fecha_vencimiento)
[2025-11-02 22:49:55] ✅ Fecha string convertida: 11/28/2003 -> 2003-11-28 (Campo: fecha_susc)
[2025-11-02 22:49:55] ✅ Fecha string convertida: 3/1/2021 -> 2021-03-01 (Campo: fecha_asignacion)
[2025-11-02 22:49:55] ✅ Fecha string convertida: 1/27/2025 -> 2025-01-27 (Campo: fecha_proceso)
[2025-11-02 22:49:55] ✅ Fecha string convertida: 2/5/2021 -> 2021-02-05 (Campo: fecha_castigo)
[2025-11-02 22:49:55] ✅ Fecha string convertida: 8/5/2020 -> 2020-08-05 (Campo: fecha_vencimiento)
[2025-11-02 22:49:55] ✅ Fecha string convertida: 12/18/2013 -> 2013-12-18 (Campo: fecha_susc)
[2025-11-02 22:49:55] ✅ Fecha string convertida: 4/1/2021 -> 2021-04-01 (Campo: fecha_asignacion)
[2025-11-02 22:49:55] ✅ Fecha string convertida: 1/27/2025 -> 2025-01-27 (Campo: fecha_proceso)
[2025-11-02 22:49:55] ✅ Fecha string convertida: 3/5/2021 -> 2021-03-05 (Campo: fecha_castigo)
[2025-11-02 22:49:55] ✅ DV con valor '0' - ES VÁLIDO
[2025-11-02 22:49:55] ✅ Fecha string convertida: 9/5/2020 -> 2020-09-05 (Campo: fecha_vencimiento)
[2025-11-02 22:49:55] ✅ Fecha string convertida: 10/18/2013 -> 2013-10-18 (Campo: fecha_susc)
[2025-11-02 22:49:55] ✅ Valor convertido a DECIMAL: '0.54' -> 0.54
[2025-11-02 22:49:55] ✅ Fecha string convertida: 5/1/2021 -> 2021-05-01 (Campo: fecha_asignacion)
[2025-11-02 22:49:55] ✅ Fecha string convertida: 1/27/2025 -> 2025-01-27 (Campo: fecha_proceso)
[2025-11-02 22:49:55] ✅ Fecha string convertida: 5/5/2021 -> 2021-05-05 (Campo: fecha_castigo)
[2025-11-02 22:49:55] ✅ Fecha string convertida: 11/5/2020 -> 2020-11-05 (Campo: fecha_vencimiento)
[2025-11-02 22:49:55] ✅ Fecha string convertida: 12/15/2016 -> 2016-12-15 (Campo: fecha_susc)
[2025-11-02 22:49:55] ✅ Fecha string convertida: 7/1/2021 -> 2021-07-01 (Campo: fecha_asignacion)
[2025-11-02 22:49:55] ✅ Fecha string convertida: 1/27/2025 -> 2025-01-27 (Campo: fecha_proceso)
[2025-11-02 22:49:55] ✅ Fecha string convertida: 5/5/2021 -> 2021-05-05 (Campo: fecha_castigo)
[2025-11-02 22:49:55] ✅ DV con valor '0' - ES VÁLIDO
[2025-11-02 22:49:55] ✅ Fecha string convertida: 11/5/2020 -> 2020-11-05 (Campo: fecha_vencimiento)
[2025-11-02 22:49:55] ✅ Fecha string convertida: 1/28/2003 -> 2003-01-28 (Campo: fecha_susc)
[2025-11-02 22:49:55] ✅ Fecha string convertida: 7/1/2021 -> 2021-07-01 (Campo: fecha_asignacion)
[2025-11-02 22:49:55] ✅ Fecha string convertida: 1/27/2025 -> 2025-01-27 (Campo: fecha_proceso)
[2025-11-02 22:49:55] ✅ Fecha string convertida: 5/25/2021 -> 2021-05-25 (Campo: fecha_castigo)
[2025-11-02 22:49:55] ✅ Fecha string convertida: 1/8/2021 -> 2021-01-08 (Campo: fecha_pago)
[2025-11-02 22:49:55] ✅ Fecha string convertida: 11/25/2020 -> 2020-11-25 (Campo: fecha_vencimiento)
[2025-11-02 22:49:55] ✅ Fecha string convertida: 2/7/2003 -> 2003-02-07 (Campo: fecha_susc)
[2025-11-02 22:49:55] ✅ Fecha string convertida: 7/1/2021 -> 2021-07-01 (Campo: fecha_asignacion)
[2025-11-02 22:49:55] ✅ Fecha string convertida: 1/27/2025 -> 2025-01-27 (Campo: fecha_proceso)
[2025-11-02 22:49:55] ✅ Fecha string convertida: 6/5/2021 -> 2021-06-05 (Campo: fecha_castigo)
[2025-11-02 22:49:55] ✅ Fecha string convertida: 8/23/2024 -> 2024-08-23 (Campo: fecha_pago)
[2025-11-02 22:49:55] ✅ Fecha string convertida: 12/5/2020 -> 2020-12-05 (Campo: fecha_vencimiento)
[2025-11-02 22:49:55] ✅ Fecha string convertida: 1/11/2017 -> 2017-01-11 (Campo: fecha_susc)
[2025-11-02 22:49:55] ✅ Fecha string convertida: 8/1/2021 -> 2021-08-01 (Campo: fecha_asignacion)
[2025-11-02 22:49:55] ✅ Fecha string convertida: 1/27/2025 -> 2025-01-27 (Campo: fecha_proceso)
[2025-11-02 22:49:55] ✅ Fecha string convertida: 7/20/2021 -> 2021-07-20 (Campo: fecha_castigo)
[2025-11-02 22:49:55] ✅ Fecha string convertida: 8/31/2022 -> 2022-08-31 (Campo: fecha_pago)
[2025-11-02 22:49:55] ✅ Fecha string convertida: 1/20/2021 -> 2021-01-20 (Campo: fecha_vencimiento)
[2025-11-02 22:49:55] ✅ Fecha string convertida: 6/8/2004 -> 2004-06-08 (Campo: fecha_susc)
[2025-11-02 22:49:55] ✅ Fecha string convertida: 9/1/2021 -> 2021-09-01 (Campo: fecha_asignacion)
[2025-11-02 22:49:55] ✅ Fecha string convertida: 1/27/2025 -> 2025-01-27 (Campo: fecha_proceso)
[2025-11-02 22:49:55] ✅ Fecha string convertida: 10/5/2021 -> 2021-10-05 (Campo: fecha_castigo)
[2025-11-02 22:49:55] ✅ Fecha string convertida: 4/5/2021 -> 2021-04-05 (Campo: fecha_vencimiento)
[2025-11-02 22:49:55] ✅ Fecha string convertida: 5/26/2003 -> 2003-05-26 (Campo: fecha_susc)
[2025-11-02 22:49:55] ✅ Fecha string convertida: 12/1/2021 -> 2021-12-01 (Campo: fecha_asignacion)
[2025-11-02 22:49:55] ✅ Fecha string convertida: 1/27/2025 -> 2025-01-27 (Campo: fecha_proceso)
[2025-11-02 22:49:55] ✅ Fecha string convertida: 10/10/2021 -> 2021-10-10 (Campo: fecha_castigo)
[2025-11-02 22:49:55] ✅ Fecha string convertida: 4/10/2021 -> 2021-04-10 (Campo: fecha_vencimiento)
[2025-11-02 22:49:55] ✅ Fecha string convertida: 11/11/1994 -> 1994-11-11 (Campo: fecha_susc)
[2025-11-02 22:49:55] ✅ Fecha string convertida: 12/1/2021 -> 2021-12-01 (Campo: fecha_asignacion)
[2025-11-02 22:49:55] ✅ Fecha string convertida: 1/27/2025 -> 2025-01-27 (Campo: fecha_proceso)
[2025-11-02 22:49:55] ✅ Fecha string convertida: 11/5/2021 -> 2021-11-05 (Campo: fecha_castigo)
[2025-11-02 22:49:55] ✅ Fecha string convertida: 2/7/2024 -> 2024-02-07 (Campo: fecha_pago)
[2025-11-02 22:49:55] ✅ Fecha string convertida: 5/5/2021 -> 2021-05-05 (Campo: fecha_vencimiento)
[2025-11-02 22:49:55] ✅ Fecha string convertida: 12/16/2013 -> 2013-12-16 (Campo: fecha_susc)
[2025-11-02 22:49:55] ✅ Fecha string convertida: 1/1/2022 -> 2022-01-01 (Campo: fecha_asignacion)
[2025-11-02 22:49:55] ✅ Fecha string convertida: 1/27/2025 -> 2025-01-27 (Campo: fecha_proceso)
[2025-11-02 22:49:55] ✅ Fecha string convertida: 11/5/2021 -> 2021-11-05 (Campo: fecha_castigo)
[2025-11-02 22:49:55] ✅ Fecha string convertida: 9/20/2022 -> 2022-09-20 (Campo: fecha_pago)
[2025-11-02 22:49:55] ✅ Fecha string convertida: 5/5/2021 -> 2021-05-05 (Campo: fecha_vencimiento)
[2025-11-02 22:49:55] ✅ Fecha string convertida: 8/27/2017 -> 2017-08-27 (Campo: fecha_susc)
[2025-11-02 22:49:55] ✅ Fecha string convertida: 1/1/2022 -> 2022-01-01 (Campo: fecha_asignacion)
[2025-11-02 22:49:55] ✅ Fecha string convertida: 1/27/2025 -> 2025-01-27 (Campo: fecha_proceso)
[2025-11-02 22:49:55] ✅ Fecha string convertida: 11/5/2021 -> 2021-11-05 (Campo: fecha_castigo)
[2025-11-02 22:49:55] ✅ Fecha string convertida: 5/5/2021 -> 2021-05-05 (Campo: fecha_vencimiento)
[2025-11-02 22:49:55] ✅ Fecha string convertida: 9/2/2013 -> 2013-09-02 (Campo: fecha_susc)
[2025-11-02 22:49:55] ✅ Fecha string convertida: 1/1/2022 -> 2022-01-01 (Campo: fecha_asignacion)
[2025-11-02 22:49:55] ✅ Fecha string convertida: 1/27/2025 -> 2025-01-27 (Campo: fecha_proceso)
[2025-11-02 22:49:55] ✅ Fecha string convertida: 1/5/2022 -> 2022-01-05 (Campo: fecha_castigo)
[2025-11-02 22:49:55] ✅ Fecha string convertida: 7/5/2021 -> 2021-07-05 (Campo: fecha_vencimiento)
[2025-11-02 22:49:55] ✅ Fecha string convertida: 6/6/2016 -> 2016-06-06 (Campo: fecha_susc)
[2025-11-02 22:49:55] ✅ Fecha string convertida: 3/1/2022 -> 2022-03-01 (Campo: fecha_asignacion)
[2025-11-02 22:49:55] ✅ Fecha string convertida: 1/27/2025 -> 2025-01-27 (Campo: fecha_proceso)
[2025-11-02 22:49:55] ✅ Fecha string convertida: 2/10/2022 -> 2022-02-10 (Campo: fecha_castigo)
[2025-11-02 22:49:55] ✅ Fecha string convertida: 8/10/2021 -> 2021-08-10 (Campo: fecha_vencimiento)
[2025-11-02 22:49:55] ✅ Fecha string convertida: 2/19/2017 -> 2017-02-19 (Campo: fecha_susc)
[2025-11-02 22:49:55] ✅ Fecha string convertida: 4/1/2022 -> 2022-04-01 (Campo: fecha_asignacion)
[2025-11-02 22:49:55] ✅ Fecha string convertida: 1/27/2025 -> 2025-01-27 (Campo: fecha_proceso)
[2025-11-02 22:49:55] ✅ Fecha string convertida: 2/25/2022 -> 2022-02-25 (Campo: fecha_castigo)
[2025-11-02 22:49:55] ✅ Fecha string convertida: 8/25/2021 -> 2021-08-25 (Campo: fecha_vencimiento)
[2025-11-02 22:49:55] ✅ Fecha string convertida: 10/19/1999 -> 1999-10-19 (Campo: fecha_susc)
[2025-11-02 22:49:55] ✅ Fecha string convertida: 4/1/2022 -> 2022-04-01 (Campo: fecha_asignacion)
[2025-11-02 22:49:55] ✅ Fecha string convertida: 1/27/2025 -> 2025-01-27 (Campo: fecha_proceso)
[2025-11-02 22:49:55] ✅ Fecha string convertida: 3/5/2022 -> 2022-03-05 (Campo: fecha_castigo)
[2025-11-02 22:49:55] ✅ Fecha string convertida: 9/5/2021 -> 2021-09-05 (Campo: fecha_vencimiento)
[2025-11-02 22:49:55] ✅ Fecha string convertida: 1/25/2019 -> 2019-01-25 (Campo: fecha_susc)
[2025-11-02 22:49:55] ✅ Fecha string convertida: 5/1/2022 -> 2022-05-01 (Campo: fecha_asignacion)
[2025-11-02 22:49:55] ✅ Fecha string convertida: 1/27/2025 -> 2025-01-27 (Campo: fecha_proceso)
[2025-11-02 22:49:56] ✅ Fecha string convertida: 3/5/2022 -> 2022-03-05 (Campo: fecha_castigo)
[2025-11-02 22:49:56] ✅ Fecha string convertida: 9/5/2021 -> 2021-09-05 (Campo: fecha_vencimiento)
[2025-11-02 22:49:56] ✅ Fecha string convertida: 1/4/1991 -> 1991-01-04 (Campo: fecha_susc)
[2025-11-02 22:49:56] ✅ Fecha string convertida: 5/1/2022 -> 2022-05-01 (Campo: fecha_asignacion)
[2025-11-02 22:49:56] ✅ Fecha string convertida: 1/27/2025 -> 2025-01-27 (Campo: fecha_proceso)
[2025-11-02 22:49:56] ✅ Fecha string convertida: 3/5/2022 -> 2022-03-05 (Campo: fecha_castigo)
[2025-11-02 22:49:56] ✅ Fecha string convertida: 2/6/2023 -> 2023-02-06 (Campo: fecha_pago)
[2025-11-02 22:49:56] ✅ Fecha string convertida: 9/5/2021 -> 2021-09-05 (Campo: fecha_vencimiento)
[2025-11-02 22:49:56] ✅ Fecha string convertida: 12/14/2011 -> 2011-12-14 (Campo: fecha_susc)
[2025-11-02 22:49:56] ✅ Fecha string convertida: 5/1/2022 -> 2022-05-01 (Campo: fecha_asignacion)
[2025-11-02 22:49:56] ✅ Fecha string convertida: 1/27/2025 -> 2025-01-27 (Campo: fecha_proceso)
[2025-11-02 22:49:56] ✅ Fecha string convertida: 3/5/2022 -> 2022-03-05 (Campo: fecha_castigo)
[2025-11-02 22:49:56] ✅ Fecha string convertida: 9/5/2021 -> 2021-09-05 (Campo: fecha_vencimiento)
[2025-11-02 22:49:56] ✅ Fecha string convertida: 12/14/2013 -> 2013-12-14 (Campo: fecha_susc)
[2025-11-02 22:49:56] ✅ Fecha string convertida: 5/1/2022 -> 2022-05-01 (Campo: fecha_asignacion)
[2025-11-02 22:49:56] ✅ Fecha string convertida: 1/27/2025 -> 2025-01-27 (Campo: fecha_proceso)
[2025-11-02 22:49:56] ✅ Fecha string convertida: 3/5/2022 -> 2022-03-05 (Campo: fecha_castigo)
[2025-11-02 22:49:56] ✅ Fecha string convertida: 9/5/2021 -> 2021-09-05 (Campo: fecha_vencimiento)
[2025-11-02 22:49:56] ✅ Fecha string convertida: 12/12/2016 -> 2016-12-12 (Campo: fecha_susc)
[2025-11-02 22:49:56] ✅ Fecha string convertida: 4/1/2022 -> 2022-04-01 (Campo: fecha_asignacion)
[2025-11-02 22:49:56] ✅ Fecha string convertida: 1/27/2025 -> 2025-01-27 (Campo: fecha_proceso)
[2025-11-02 22:49:56] ✅ Fecha string convertida: 3/15/2022 -> 2022-03-15 (Campo: fecha_castigo)
[2025-11-02 22:49:56] ✅ Fecha string convertida: 1/31/2023 -> 2023-01-31 (Campo: fecha_pago)
[2025-11-02 22:49:56] ✅ Fecha string convertida: 9/15/2021 -> 2021-09-15 (Campo: fecha_vencimiento)
[2025-11-02 22:49:56] ✅ Fecha string convertida: 8/6/2005 -> 2005-08-06 (Campo: fecha_susc)
[2025-11-02 22:49:56] ✅ Fecha string convertida: 5/1/2022 -> 2022-05-01 (Campo: fecha_asignacion)
[2025-11-02 22:49:56] ✅ Fecha string convertida: 1/27/2025 -> 2025-01-27 (Campo: fecha_proceso)
[2025-11-02 22:49:56] ✅ Fecha string convertida: 4/5/2022 -> 2022-04-05 (Campo: fecha_castigo)
[2025-11-02 22:49:56] ✅ Fecha string convertida: 10/5/2021 -> 2021-10-05 (Campo: fecha_vencimiento)
[2025-11-02 22:49:56] ✅ Fecha string convertida: 12/9/2010 -> 2010-12-09 (Campo: fecha_susc)
[2025-11-02 22:49:56] ✅ Fecha string convertida: 6/1/2022 -> 2022-06-01 (Campo: fecha_asignacion)
[2025-11-02 22:49:56] ✅ Fecha string convertida: 1/27/2025 -> 2025-01-27 (Campo: fecha_proceso)
[2025-11-02 22:49:56] ✅ Fecha string convertida: 4/5/2022 -> 2022-04-05 (Campo: fecha_castigo)
[2025-11-02 22:49:56] ✅ Fecha string convertida: 10/5/2021 -> 2021-10-05 (Campo: fecha_vencimiento)
[2025-11-02 22:49:56] ✅ Fecha string convertida: 12/24/2015 -> 2015-12-24 (Campo: fecha_susc)
[2025-11-02 22:49:56] ✅ Fecha string convertida: 6/1/2022 -> 2022-06-01 (Campo: fecha_asignacion)
[2025-11-02 22:49:56] ✅ Fecha string convertida: 1/27/2025 -> 2025-01-27 (Campo: fecha_proceso)
[2025-11-02 22:49:56] ✅ Fecha string convertida: 5/5/2022 -> 2022-05-05 (Campo: fecha_castigo)
[2025-11-02 22:49:56] ✅ Fecha string convertida: 4/2/2023 -> 2023-04-02 (Campo: fecha_pago)
[2025-11-02 22:49:56] ✅ Fecha string convertida: 11/5/2021 -> 2021-11-05 (Campo: fecha_vencimiento)
[2025-11-02 22:49:56] ✅ Fecha string convertida: 8/25/2012 -> 2012-08-25 (Campo: fecha_susc)
[2025-11-02 22:49:56] ✅ Fecha string convertida: 4/1/2022 -> 2022-04-01 (Campo: fecha_asignacion)
[2025-11-02 22:49:56] ✅ Fecha string convertida: 1/27/2025 -> 2025-01-27 (Campo: fecha_proceso)
[2025-11-02 22:49:56] ✅ Fecha string convertida: 5/5/2022 -> 2022-05-05 (Campo: fecha_castigo)
[2025-11-02 22:49:56] ✅ Fecha string convertida: 3/28/2022 -> 2022-03-28 (Campo: fecha_pago)
[2025-11-02 22:49:56] ✅ Fecha string convertida: 11/5/2021 -> 2021-11-05 (Campo: fecha_vencimiento)
[2025-11-02 22:49:56] ✅ Fecha string convertida: 12/11/2015 -> 2015-12-11 (Campo: fecha_susc)
[2025-11-02 22:49:56] ✅ Fecha string convertida: 7/1/2022 -> 2022-07-01 (Campo: fecha_asignacion)
[2025-11-02 22:49:56] ✅ Fecha string convertida: 1/27/2025 -> 2025-01-27 (Campo: fecha_proceso)
[2025-11-02 22:49:56] ✅ Fecha string convertida: 5/5/2022 -> 2022-05-05 (Campo: fecha_castigo)
[2025-11-02 22:49:56] ✅ Fecha string convertida: 11/5/2021 -> 2021-11-05 (Campo: fecha_vencimiento)
[2025-11-02 22:49:56] ✅ Fecha string convertida: 8/15/2017 -> 2017-08-15 (Campo: fecha_susc)
[2025-11-02 22:49:56] ✅ Fecha string convertida: 4/1/2022 -> 2022-04-01 (Campo: fecha_asignacion)
[2025-11-02 22:49:56] ✅ Fecha string convertida: 1/27/2025 -> 2025-01-27 (Campo: fecha_proceso)
[2025-11-02 22:49:56] ✅ Fecha string convertida: 5/10/2022 -> 2022-05-10 (Campo: fecha_castigo)
[2025-11-02 22:49:56] ✅ Fecha string convertida: 11/10/2021 -> 2021-11-10 (Campo: fecha_vencimiento)
[2025-11-02 22:49:56] ✅ Fecha string convertida: 11/7/2009 -> 2009-11-07 (Campo: fecha_susc)
[2025-11-02 22:49:56] ✅ Fecha string convertida: 7/1/2022 -> 2022-07-01 (Campo: fecha_asignacion)
[2025-11-02 22:49:56] ✅ Fecha string convertida: 1/27/2025 -> 2025-01-27 (Campo: fecha_proceso)
[2025-11-02 22:49:56] ✅ Fecha string convertida: 5/10/2022 -> 2022-05-10 (Campo: fecha_castigo)
[2025-11-02 22:49:56] ✅ Fecha string convertida: 11/10/2021 -> 2021-11-10 (Campo: fecha_vencimiento)
[2025-11-02 22:49:56] ✅ Fecha string convertida: 5/13/2019 -> 2019-05-13 (Campo: fecha_susc)
[2025-11-02 22:49:56] ✅ Fecha string convertida: 7/1/2022 -> 2022-07-01 (Campo: fecha_asignacion)
[2025-11-02 22:49:56] ✅ Fecha string convertida: 1/27/2025 -> 2025-01-27 (Campo: fecha_proceso)
[2025-11-02 22:49:56] ✅ Fecha string convertida: 7/5/2022 -> 2022-07-05 (Campo: fecha_castigo)
[2025-11-02 22:49:56] ✅ Fecha string convertida: 3/14/2023 -> 2023-03-14 (Campo: fecha_pago)
[2025-11-02 22:49:56] ✅ Fecha string convertida: 1/5/2022 -> 2022-01-05 (Campo: fecha_vencimiento)
[2025-11-02 22:49:56] ✅ Fecha string convertida: 9/21/2020 -> 2020-09-21 (Campo: fecha_susc)
[2025-11-02 22:49:56] ✅ Fecha string convertida: 9/1/2022 -> 2022-09-01 (Campo: fecha_asignacion)
[2025-11-02 22:49:56] ✅ Fecha string convertida: 1/27/2025 -> 2025-01-27 (Campo: fecha_proceso)
[2025-11-02 22:49:56] ✅ Fecha string convertida: 7/5/2022 -> 2022-07-05 (Campo: fecha_castigo)
[2025-11-02 22:49:56] ✅ Fecha string convertida: 4/29/2023 -> 2023-04-29 (Campo: fecha_pago)
[2025-11-02 22:49:56] ✅ Fecha string convertida: 1/5/2022 -> 2022-01-05 (Campo: fecha_vencimiento)
[2025-11-02 22:49:56] ✅ Fecha string convertida: 7/30/2016 -> 2016-07-30 (Campo: fecha_susc)
[2025-11-02 22:49:56] ✅ Fecha string convertida: 9/1/2022 -> 2022-09-01 (Campo: fecha_asignacion)
[2025-11-02 22:49:56] ✅ Fecha string convertida: 1/27/2025 -> 2025-01-27 (Campo: fecha_proceso)
[2025-11-02 22:49:56] ✅ Fecha string convertida: 7/5/2022 -> 2022-07-05 (Campo: fecha_castigo)
[2025-11-02 22:49:56] ✅ Fecha string convertida: 1/5/2022 -> 2022-01-05 (Campo: fecha_vencimiento)
[2025-11-02 22:49:56] ✅ Fecha string convertida: 6/16/2019 -> 2019-06-16 (Campo: fecha_susc)
[2025-11-02 22:49:56] ✅ Fecha string convertida: 9/1/2022 -> 2022-09-01 (Campo: fecha_asignacion)
[2025-11-02 22:49:56] ✅ Fecha string convertida: 1/27/2025 -> 2025-01-27 (Campo: fecha_proceso)
[2025-11-02 22:49:56] ✅ Fecha string convertida: 7/5/2022 -> 2022-07-05 (Campo: fecha_castigo)
[2025-11-02 22:49:56] ✅ Fecha string convertida: 1/5/2022 -> 2022-01-05 (Campo: fecha_vencimiento)
[2025-11-02 22:49:56] ✅ Fecha string convertida: 5/11/2013 -> 2013-05-11 (Campo: fecha_susc)
[2025-11-02 22:49:56] ✅ Fecha string convertida: 9/1/2022 -> 2022-09-01 (Campo: fecha_asignacion)
[2025-11-02 22:49:56] ✅ Fecha string convertida: 1/27/2025 -> 2025-01-27 (Campo: fecha_proceso)
[2025-11-02 22:49:56] ✅ Fecha string convertida: 7/5/2022 -> 2022-07-05 (Campo: fecha_castigo)
[2025-11-02 22:49:56] ✅ Fecha string convertida: 1/5/2022 -> 2022-01-05 (Campo: fecha_vencimiento)
[2025-11-02 22:49:56] ✅ Fecha string convertida: 6/14/2013 -> 2013-06-14 (Campo: fecha_susc)
[2025-11-02 22:49:56] ✅ Fecha string convertida: 9/1/2022 -> 2022-09-01 (Campo: fecha_asignacion)
[2025-11-02 22:49:56] ✅ Fecha string convertida: 1/27/2025 -> 2025-01-27 (Campo: fecha_proceso)
[2025-11-02 22:49:56] ✅ Fecha string convertida: 7/10/2022 -> 2022-07-10 (Campo: fecha_castigo)
[2025-11-02 22:49:56] ✅ Fecha string convertida: 1/10/2022 -> 2022-01-10 (Campo: fecha_vencimiento)
[2025-11-02 22:49:56] ✅ Fecha string convertida: 4/10/1995 -> 1995-04-10 (Campo: fecha_susc)
[2025-11-02 22:49:56] ✅ Fecha string convertida: 9/1/2022 -> 2022-09-01 (Campo: fecha_asignacion)
[2025-11-02 22:49:56] ✅ Fecha string convertida: 1/27/2025 -> 2025-01-27 (Campo: fecha_proceso)
[2025-11-02 22:49:56] ✅ Fecha string convertida: 8/5/2022 -> 2022-08-05 (Campo: fecha_castigo)
[2025-11-02 22:49:56] ✅ Fecha string convertida: 1/17/2022 -> 2022-01-17 (Campo: fecha_pago)
[2025-11-02 22:49:56] ✅ Fecha string convertida: 2/5/2022 -> 2022-02-05 (Campo: fecha_vencimiento)
[2025-11-02 22:49:56] ✅ Fecha string convertida: 8/23/2002 -> 2002-08-23 (Campo: fecha_susc)
[2025-11-02 22:49:56] ✅ Fecha string convertida: 10/1/2022 -> 2022-10-01 (Campo: fecha_asignacion)
[2025-11-02 22:49:56] ✅ Fecha string convertida: 1/27/2025 -> 2025-01-27 (Campo: fecha_proceso)
[2025-11-02 22:49:56] ✅ Fecha string convertida: 8/5/2022 -> 2022-08-05 (Campo: fecha_castigo)
[2025-11-02 22:49:56] ✅ Fecha string convertida: 1/19/2022 -> 2022-01-19 (Campo: fecha_pago)
[2025-11-02 22:49:56] ✅ Fecha string convertida: 2/5/2022 -> 2022-02-05 (Campo: fecha_vencimiento)
[2025-11-02 22:49:56] ✅ Fecha string convertida: 2/28/2017 -> 2017-02-28 (Campo: fecha_susc)
[2025-11-02 22:49:56] ✅ Fecha string convertida: 7/1/2022 -> 2022-07-01 (Campo: fecha_asignacion)
[2025-11-02 22:49:56] ✅ Fecha string convertida: 1/27/2025 -> 2025-01-27 (Campo: fecha_proceso)
[2025-11-02 22:49:56] ✅ Fecha string convertida: 8/15/2022 -> 2022-08-15 (Campo: fecha_castigo)
[2025-11-02 22:49:56] ✅ Fecha string convertida: 6/16/2022 -> 2022-06-16 (Campo: fecha_pago)
[2025-11-02 22:49:56] ✅ Fecha string convertida: 2/15/2022 -> 2022-02-15 (Campo: fecha_vencimiento)
[2025-11-02 22:49:56] ✅ Fecha string convertida: 12/20/2010 -> 2010-12-20 (Campo: fecha_susc)
[2025-11-02 22:49:56] ✅ Fecha string convertida: 10/1/2022 -> 2022-10-01 (Campo: fecha_asignacion)
[2025-11-02 22:49:56] ✅ Fecha string convertida: 1/27/2025 -> 2025-01-27 (Campo: fecha_proceso)
[2025-11-02 22:49:56] ✅ Fecha string convertida: 9/5/2022 -> 2022-09-05 (Campo: fecha_castigo)
[2025-11-02 22:49:56] ✅ DV con valor '0' - ES VÁLIDO
[2025-11-02 22:49:56] ✅ Fecha string convertida: 3/5/2022 -> 2022-03-05 (Campo: fecha_vencimiento)
[2025-11-02 22:49:56] ✅ Fecha string convertida: 3/19/2016 -> 2016-03-19 (Campo: fecha_susc)
[2025-11-02 22:49:56] ✅ Fecha string convertida: 11/1/2022 -> 2022-11-01 (Campo: fecha_asignacion)
[2025-11-02 22:49:56] ✅ Fecha string convertida: 1/27/2025 -> 2025-01-27 (Campo: fecha_proceso)
[2025-11-02 22:49:56] ✅ Fecha string convertida: 9/15/2022 -> 2022-09-15 (Campo: fecha_castigo)
[2025-11-02 22:49:56] ✅ Fecha string convertida: 2/5/2022 -> 2022-02-05 (Campo: fecha_pago)
[2025-11-02 22:49:56] ✅ Fecha string convertida: 3/15/2022 -> 2022-03-15 (Campo: fecha_vencimiento)
[2025-11-02 22:49:56] ✅ Fecha string convertida: 12/1/2017 -> 2017-12-01 (Campo: fecha_susc)
[2025-11-02 22:49:56] ✅ Fecha string convertida: 11/1/2022 -> 2022-11-01 (Campo: fecha_asignacion)
[2025-11-02 22:49:56] ✅ Fecha string convertida: 1/27/2025 -> 2025-01-27 (Campo: fecha_proceso)
[2025-11-02 22:49:56] ✅ Fecha string convertida: 10/5/2022 -> 2022-10-05 (Campo: fecha_castigo)
[2025-11-02 22:49:56] ✅ Fecha string convertida: 8/3/2022 -> 2022-08-03 (Campo: fecha_pago)
[2025-11-02 22:49:56] ✅ Fecha string convertida: 4/5/2022 -> 2022-04-05 (Campo: fecha_vencimiento)
[2025-11-02 22:49:56] ✅ Fecha string convertida: 3/16/2020 -> 2020-03-16 (Campo: fecha_susc)
[2025-11-02 22:49:56] ✅ Fecha string convertida: 12/1/2022 -> 2022-12-01 (Campo: fecha_asignacion)
[2025-11-02 22:49:56] ✅ Fecha string convertida: 1/27/2025 -> 2025-01-27 (Campo: fecha_proceso)
[2025-11-02 22:49:56] ✅ Fecha string convertida: 10/25/2022 -> 2022-10-25 (Campo: fecha_castigo)
[2025-11-02 22:49:56] ✅ Fecha string convertida: 4/25/2022 -> 2022-04-25 (Campo: fecha_vencimiento)
[2025-11-02 22:49:56] ✅ Fecha string convertida: 3/20/2019 -> 2019-03-20 (Campo: fecha_susc)
[2025-11-02 22:49:56] ✅ Fecha string convertida: 12/1/2022 -> 2022-12-01 (Campo: fecha_asignacion)
[2025-11-02 22:49:56] ✅ Fecha string convertida: 1/27/2025 -> 2025-01-27 (Campo: fecha_proceso)
[2025-11-02 22:49:56] ✅ Fecha string convertida: 11/5/2022 -> 2022-11-05 (Campo: fecha_castigo)
[2025-11-02 22:49:56] ✅ Fecha string convertida: 11/3/2024 -> 2024-11-03 (Campo: fecha_pago)
[2025-11-02 22:49:56] ✅ Fecha string convertida: 5/5/2022 -> 2022-05-05 (Campo: fecha_vencimiento)
[2025-11-02 22:49:56] ✅ Fecha string convertida: 5/17/2021 -> 2021-05-17 (Campo: fecha_susc)
[2025-11-02 22:49:56] ✅ Fecha string convertida: 1/1/2023 -> 2023-01-01 (Campo: fecha_asignacion)
[2025-11-02 22:49:56] ✅ Fecha string convertida: 1/27/2025 -> 2025-01-27 (Campo: fecha_proceso)
[2025-11-02 22:49:56] ✅ Fecha string convertida: 11/5/2022 -> 2022-11-05 (Campo: fecha_castigo)
[2025-11-02 22:49:56] ✅ Fecha string convertida: 7/29/2022 -> 2022-07-29 (Campo: fecha_pago)
[2025-11-02 22:49:56] ✅ Fecha string convertida: 5/5/2022 -> 2022-05-05 (Campo: fecha_vencimiento)
[2025-11-02 22:49:56] ✅ Fecha string convertida: 2/22/2019 -> 2019-02-22 (Campo: fecha_susc)
[2025-11-02 22:49:56] ✅ Fecha string convertida: 1/1/2023 -> 2023-01-01 (Campo: fecha_asignacion)
[2025-11-02 22:49:56] ✅ Fecha string convertida: 1/27/2025 -> 2025-01-27 (Campo: fecha_proceso)
[2025-11-02 22:49:56] ✅ Fecha string convertida: 11/5/2022 -> 2022-11-05 (Campo: fecha_castigo)
[2025-11-02 22:49:56] ✅ DV con valor '0' - ES VÁLIDO
[2025-11-02 22:49:56] ✅ Fecha string convertida: 6/3/2022 -> 2022-06-03 (Campo: fecha_pago)
[2025-11-02 22:49:56] ✅ Fecha string convertida: 5/5/2022 -> 2022-05-05 (Campo: fecha_vencimiento)
[2025-11-02 22:49:56] ✅ Fecha string convertida: 5/29/2007 -> 2007-05-29 (Campo: fecha_susc)
[2025-11-02 22:49:56] ✅ Fecha string convertida: 1/1/2023 -> 2023-01-01 (Campo: fecha_asignacion)
[2025-11-02 22:49:56] ✅ Fecha string convertida: 1/27/2025 -> 2025-01-27 (Campo: fecha_proceso)
[2025-11-02 22:49:56] ✅ Fecha string convertida: 11/5/2022 -> 2022-11-05 (Campo: fecha_castigo)
[2025-11-02 22:49:56] ✅ Fecha string convertida: 5/19/2022 -> 2022-05-19 (Campo: fecha_pago)
[2025-11-02 22:49:56] ✅ Fecha string convertida: 5/5/2022 -> 2022-05-05 (Campo: fecha_vencimiento)
[2025-11-02 22:49:56] ✅ Fecha string convertida: 2/22/2005 -> 2005-02-22 (Campo: fecha_susc)
[2025-11-02 22:49:56] ✅ Fecha string convertida: 9/1/2022 -> 2022-09-01 (Campo: fecha_asignacion)
[2025-11-02 22:49:56] ✅ Fecha string convertida: 1/27/2025 -> 2025-01-27 (Campo: fecha_proceso)
[2025-11-02 22:49:56] ✅ Fecha string convertida: 11/5/2022 -> 2022-11-05 (Campo: fecha_castigo)
[2025-11-02 22:49:56] ✅ Fecha string convertida: 4/20/2023 -> 2023-04-20 (Campo: fecha_pago)
[2025-11-02 22:49:56] ✅ Fecha string convertida: 5/5/2022 -> 2022-05-05 (Campo: fecha_vencimiento)
[2025-11-02 22:49:56] ✅ Fecha string convertida: 12/20/2018 -> 2018-12-20 (Campo: fecha_susc)
[2025-11-02 22:49:56] ✅ Fecha string convertida: 9/1/2022 -> 2022-09-01 (Campo: fecha_asignacion)
[2025-11-02 22:49:56] ✅ Fecha string convertida: 1/27/2025 -> 2025-01-27 (Campo: fecha_proceso)
[2025-11-02 22:49:56] ✅ Fecha string convertida: 11/10/2022 -> 2022-11-10 (Campo: fecha_castigo)
[2025-11-02 22:49:56] ✅ Fecha string convertida: 4/2/2022 -> 2022-04-02 (Campo: fecha_pago)
[2025-11-02 22:49:56] ✅ Fecha string convertida: 5/10/2022 -> 2022-05-10 (Campo: fecha_vencimiento)
[2025-11-02 22:49:56] ✅ Fecha string convertida: 6/18/2019 -> 2019-06-18 (Campo: fecha_susc)
[2025-11-02 22:49:56] ✅ Fecha string convertida: 1/1/2023 -> 2023-01-01 (Campo: fecha_asignacion)
[2025-11-02 22:49:56] ✅ Fecha string convertida: 1/27/2025 -> 2025-01-27 (Campo: fecha_proceso)
[2025-11-02 22:49:56] ✅ Fecha string convertida: 11/25/2022 -> 2022-11-25 (Campo: fecha_castigo)
[2025-11-02 22:49:56] ✅ Fecha string convertida: 7/31/2023 -> 2023-07-31 (Campo: fecha_pago)
[2025-11-02 22:49:56] ✅ Fecha string convertida: 5/25/2022 -> 2022-05-25 (Campo: fecha_vencimiento)
[2025-11-02 22:49:56] ✅ Fecha string convertida: 7/16/2018 -> 2018-07-16 (Campo: fecha_susc)
[2025-11-02 22:49:56] ✅ Fecha string convertida: 1/1/2023 -> 2023-01-01 (Campo: fecha_asignacion)
[2025-11-02 22:49:56] ✅ Fecha string convertida: 1/27/2025 -> 2025-01-27 (Campo: fecha_proceso)
[2025-11-02 22:49:56] ✅ Fecha string convertida: 12/5/2022 -> 2022-12-05 (Campo: fecha_castigo)
[2025-11-02 22:49:56] ✅ Fecha string convertida: 10/5/2024 -> 2024-10-05 (Campo: fecha_pago)
[2025-11-02 22:49:56] ✅ Fecha string convertida: 6/5/2022 -> 2022-06-05 (Campo: fecha_vencimiento)
[2025-11-02 22:49:56] ✅ Fecha string convertida: 12/20/2015 -> 2015-12-20 (Campo: fecha_susc)
[2025-11-02 22:49:56] ✅ Fecha string convertida: 2/1/2023 -> 2023-02-01 (Campo: fecha_asignacion)
[2025-11-02 22:49:56] ✅ Fecha string convertida: 1/27/2025 -> 2025-01-27 (Campo: fecha_proceso)
[2025-11-02 22:49:56] ✅ Fecha string convertida: 12/5/2022 -> 2022-12-05 (Campo: fecha_castigo)
[2025-11-02 22:49:56] ✅ Fecha string convertida: 6/30/2023 -> 2023-06-30 (Campo: fecha_pago)
[2025-11-02 22:49:56] ✅ Fecha string convertida: 6/5/2022 -> 2022-06-05 (Campo: fecha_vencimiento)
[2025-11-02 22:49:56] ✅ Fecha string convertida: 6/7/2016 -> 2016-06-07 (Campo: fecha_susc)
[2025-11-02 22:49:56] ✅ Fecha string convertida: 11/1/2022 -> 2022-11-01 (Campo: fecha_asignacion)
[2025-11-02 22:49:56] ✅ Fecha string convertida: 1/27/2025 -> 2025-01-27 (Campo: fecha_proceso)
[2025-11-02 22:49:56] ✅ Fecha string convertida: 12/5/2022 -> 2022-12-05 (Campo: fecha_castigo)
[2025-11-02 22:49:56] ✅ Fecha string convertida: 8/31/2023 -> 2023-08-31 (Campo: fecha_pago)
[2025-11-02 22:49:56] ✅ Fecha string convertida: 6/5/2022 -> 2022-06-05 (Campo: fecha_vencimiento)
[2025-11-02 22:49:56] ✅ Fecha string convertida: 9/24/2016 -> 2016-09-24 (Campo: fecha_susc)
[2025-11-02 22:49:56] ✅ Fecha string convertida: 2/1/2023 -> 2023-02-01 (Campo: fecha_asignacion)
[2025-11-02 22:49:56] ✅ Fecha string convertida: 1/27/2025 -> 2025-01-27 (Campo: fecha_proceso)
[2025-11-02 22:49:56] ✅ Fecha string convertida: 12/5/2022 -> 2022-12-05 (Campo: fecha_castigo)
[2025-11-02 22:49:56] ✅ Fecha string convertida: 5/16/2022 -> 2022-05-16 (Campo: fecha_pago)
[2025-11-02 22:49:56] ✅ Fecha string convertida: 6/5/2022 -> 2022-06-05 (Campo: fecha_vencimiento)
[2025-11-02 22:49:56] ✅ Fecha string convertida: 10/27/2015 -> 2015-10-27 (Campo: fecha_susc)
[2025-11-02 22:49:56] ✅ Fecha string convertida: 2/1/2023 -> 2023-02-01 (Campo: fecha_asignacion)
[2025-11-02 22:49:56] ✅ Fecha string convertida: 1/27/2025 -> 2025-01-27 (Campo: fecha_proceso)
[2025-11-02 22:49:56] ✅ Fecha string convertida: 12/5/2022 -> 2022-12-05 (Campo: fecha_castigo)
[2025-11-02 22:49:56] ✅ Fecha string convertida: 4/18/2022 -> 2022-04-18 (Campo: fecha_pago)
[2025-11-02 22:49:56] ✅ Fecha string convertida: 6/5/2022 -> 2022-06-05 (Campo: fecha_vencimiento)
[2025-11-02 22:49:56] ✅ Fecha string convertida: 12/9/2012 -> 2012-12-09 (Campo: fecha_susc)
[2025-11-02 22:49:56] ✅ Fecha string convertida: 11/1/2022 -> 2022-11-01 (Campo: fecha_asignacion)
[2025-11-02 22:49:56] ✅ Fecha string convertida: 1/27/2025 -> 2025-01-27 (Campo: fecha_proceso)
[2025-11-02 22:49:56] ✅ Fecha string convertida: 12/10/2022 -> 2022-12-10 (Campo: fecha_castigo)
[2025-11-02 22:49:56] ✅ Fecha string convertida: 9/9/2024 -> 2024-09-09 (Campo: fecha_pago)
[2025-11-02 22:49:56] ✅ Fecha string convertida: 6/10/2022 -> 2022-06-10 (Campo: fecha_vencimiento)
[2025-11-02 22:49:56] ✅ Fecha string convertida: 11/30/2019 -> 2019-11-30 (Campo: fecha_susc)
[2025-11-02 22:49:56] ✅ Fecha string convertida: 2/1/2023 -> 2023-02-01 (Campo: fecha_asignacion)
[2025-11-02 22:49:56] ✅ Fecha string convertida: 1/27/2025 -> 2025-01-27 (Campo: fecha_proceso)
[2025-11-02 22:49:56] ✅ Fecha string convertida: 1/5/2023 -> 2023-01-05 (Campo: fecha_castigo)
[2025-11-02 22:49:56] ✅ Fecha string convertida: 1/11/2024 -> 2024-01-11 (Campo: fecha_pago)
[2025-11-02 22:49:56] ✅ Fecha string convertida: 7/5/2022 -> 2022-07-05 (Campo: fecha_vencimiento)
[2025-11-02 22:49:56] ✅ Fecha string convertida: 10/2/2012 -> 2012-10-02 (Campo: fecha_susc)
[2025-11-02 22:49:56] ✅ Fecha string convertida: 10/1/2022 -> 2022-10-01 (Campo: fecha_asignacion)
[2025-11-02 22:49:56] ✅ Fecha string convertida: 1/27/2025 -> 2025-01-27 (Campo: fecha_proceso)
[2025-11-02 22:49:56] ✅ Fecha string convertida: 1/5/2023 -> 2023-01-05 (Campo: fecha_castigo)
[2025-11-02 22:49:56] ✅ Fecha string convertida: 10/25/2022 -> 2022-10-25 (Campo: fecha_pago)
[2025-11-02 22:49:56] ✅ Fecha string convertida: 7/5/2022 -> 2022-07-05 (Campo: fecha_vencimiento)
[2025-11-02 22:49:56] ✅ Fecha string convertida: 5/4/2014 -> 2014-05-04 (Campo: fecha_susc)
[2025-11-02 22:49:56] ✅ Fecha string convertida: 10/1/2022 -> 2022-10-01 (Campo: fecha_asignacion)
[2025-11-02 22:49:56] ✅ Fecha string convertida: 1/27/2025 -> 2025-01-27 (Campo: fecha_proceso)
[2025-11-02 22:49:56] ✅ Fecha string convertida: 2/5/2023 -> 2023-02-05 (Campo: fecha_castigo)
[2025-11-02 22:49:56] ✅ Fecha string convertida: 8/10/2022 -> 2022-08-10 (Campo: fecha_pago)
[2025-11-02 22:49:56] ✅ Fecha string convertida: 8/5/2022 -> 2022-08-05 (Campo: fecha_vencimiento)
[2025-11-02 22:49:56] ✅ Fecha string convertida: 11/25/2013 -> 2013-11-25 (Campo: fecha_susc)
[2025-11-02 22:49:56] ✅ Fecha string convertida: 4/1/2023 -> 2023-04-01 (Campo: fecha_asignacion)
[2025-11-02 22:49:56] ✅ Fecha string convertida: 1/27/2025 -> 2025-01-27 (Campo: fecha_proceso)
[2025-11-02 22:49:56] ✅ Fecha string convertida: 3/20/2023 -> 2023-03-20 (Campo: fecha_castigo)
[2025-11-02 22:49:56] ✅ Fecha string convertida: 8/19/2022 -> 2022-08-19 (Campo: fecha_pago)
[2025-11-02 22:49:56] ✅ Fecha string convertida: 9/20/2022 -> 2022-09-20 (Campo: fecha_vencimiento)
[2025-11-02 22:49:56] ✅ Fecha string convertida: 5/24/2013 -> 2013-05-24 (Campo: fecha_susc)
[2025-11-02 22:49:56] ✅ Fecha string convertida: 5/1/2023 -> 2023-05-01 (Campo: fecha_asignacion)
[2025-11-02 22:49:56] ✅ Fecha string convertida: 1/27/2025 -> 2025-01-27 (Campo: fecha_proceso)
[2025-11-02 22:49:57] ✅ Fecha string convertida: 4/5/2023 -> 2023-04-05 (Campo: fecha_castigo)
[2025-11-02 22:49:57] ✅ Fecha string convertida: 3/29/2024 -> 2024-03-29 (Campo: fecha_pago)
[2025-11-02 22:49:57] ✅ Fecha string convertida: 10/5/2022 -> 2022-10-05 (Campo: fecha_vencimiento)
[2025-11-02 22:49:57] ✅ Fecha string convertida: 10/20/2018 -> 2018-10-20 (Campo: fecha_susc)
[2025-11-02 22:49:57] ✅ Fecha string convertida: 6/1/2023 -> 2023-06-01 (Campo: fecha_asignacion)
[2025-11-02 22:49:57] ✅ Fecha string convertida: 1/27/2025 -> 2025-01-27 (Campo: fecha_proceso)
[2025-11-02 22:49:57] ✅ Fecha string convertida: 4/5/2023 -> 2023-04-05 (Campo: fecha_castigo)
[2025-11-02 22:49:57] ✅ Fecha string convertida: 10/6/2022 -> 2022-10-06 (Campo: fecha_pago)
[2025-11-02 22:49:57] ✅ Fecha string convertida: 10/5/2022 -> 2022-10-05 (Campo: fecha_vencimiento)
[2025-11-02 22:49:57] ✅ Fecha string convertida: 3/16/2018 -> 2018-03-16 (Campo: fecha_susc)
[2025-11-02 22:49:57] ✅ Fecha string convertida: 6/1/2023 -> 2023-06-01 (Campo: fecha_asignacion)
[2025-11-02 22:49:57] ✅ Fecha string convertida: 1/27/2025 -> 2025-01-27 (Campo: fecha_proceso)
[2025-11-02 22:49:57] ✅ Fecha string convertida: 4/5/2023 -> 2023-04-05 (Campo: fecha_castigo)
[2025-11-02 22:49:57] ✅ Fecha string convertida: 10/28/2022 -> 2022-10-28 (Campo: fecha_pago)
[2025-11-02 22:49:57] ✅ Fecha string convertida: 10/5/2022 -> 2022-10-05 (Campo: fecha_vencimiento)
[2025-11-02 22:49:57] ✅ Fecha string convertida: 3/26/2016 -> 2016-03-26 (Campo: fecha_susc)
[2025-11-02 22:49:57] ✅ Fecha string convertida: 6/1/2023 -> 2023-06-01 (Campo: fecha_asignacion)
[2025-11-02 22:49:57] ✅ Fecha string convertida: 1/27/2025 -> 2025-01-27 (Campo: fecha_proceso)
[2025-11-02 22:49:57] ✅ Fecha string convertida: 4/5/2023 -> 2023-04-05 (Campo: fecha_castigo)
[2025-11-02 22:49:57] ✅ Fecha string convertida: 8/26/2022 -> 2022-08-26 (Campo: fecha_pago)
[2025-11-02 22:49:57] ✅ Fecha string convertida: 10/5/2022 -> 2022-10-05 (Campo: fecha_vencimiento)
[2025-11-02 22:49:57] ✅ Fecha string convertida: 3/5/2018 -> 2018-03-05 (Campo: fecha_susc)
[2025-11-02 22:49:57] ✅ Fecha string convertida: 6/1/2023 -> 2023-06-01 (Campo: fecha_asignacion)
[2025-11-02 22:49:57] ✅ Fecha string convertida: 1/27/2025 -> 2025-01-27 (Campo: fecha_proceso)
[2025-11-02 22:49:57] ✅ Fecha string convertida: 4/10/2023 -> 2023-04-10 (Campo: fecha_castigo)
[2025-11-02 22:49:57] ✅ Fecha string convertida: 2/29/2024 -> 2024-02-29 (Campo: fecha_pago)
[2025-11-02 22:49:57] ✅ Fecha string convertida: 10/10/2022 -> 2022-10-10 (Campo: fecha_vencimiento)
[2025-11-02 22:49:57] ✅ Fecha string convertida: 6/1/2021 -> 2021-06-01 (Campo: fecha_susc)
[2025-11-02 22:49:57] ✅ Fecha string convertida: 6/1/2023 -> 2023-06-01 (Campo: fecha_asignacion)
[2025-11-02 22:49:57] ✅ Fecha string convertida: 1/27/2025 -> 2025-01-27 (Campo: fecha_proceso)
[2025-11-02 22:49:57] ✅ Fecha string convertida: 4/15/2023 -> 2023-04-15 (Campo: fecha_castigo)
[2025-11-02 22:49:57] ✅ Fecha string convertida: 9/17/2022 -> 2022-09-17 (Campo: fecha_pago)
[2025-11-02 22:49:57] ✅ Fecha string convertida: 10/15/2022 -> 2022-10-15 (Campo: fecha_vencimiento)
[2025-11-02 22:49:57] ✅ Fecha string convertida: 9/3/2020 -> 2020-09-03 (Campo: fecha_susc)
[2025-11-02 22:49:57] ✅ Fecha string convertida: 6/1/2023 -> 2023-06-01 (Campo: fecha_asignacion)
[2025-11-02 22:49:57] ✅ Fecha string convertida: 1/27/2025 -> 2025-01-27 (Campo: fecha_proceso)
[2025-11-02 22:49:57] ✅ Fecha string convertida: 4/15/2023 -> 2023-04-15 (Campo: fecha_castigo)
[2025-11-02 22:49:57] ✅ Fecha string convertida: 10/24/2022 -> 2022-10-24 (Campo: fecha_pago)
[2025-11-02 22:49:57] ✅ Fecha string convertida: 10/15/2022 -> 2022-10-15 (Campo: fecha_vencimiento)
[2025-11-02 22:49:57] ✅ Fecha string convertida: 1/18/2019 -> 2019-01-18 (Campo: fecha_susc)
[2025-11-02 22:49:57] ✅ Fecha string convertida: 6/1/2023 -> 2023-06-01 (Campo: fecha_asignacion)
[2025-11-02 22:49:57] ✅ Fecha string convertida: 1/27/2025 -> 2025-01-27 (Campo: fecha_proceso)
[2025-11-02 22:49:57] ✅ Fecha string convertida: 5/5/2023 -> 2023-05-05 (Campo: fecha_castigo)
[2025-11-02 22:49:57] ✅ Fecha string convertida: 10/2/2022 -> 2022-10-02 (Campo: fecha_pago)
[2025-11-02 22:49:57] ✅ Fecha string convertida: 11/5/2022 -> 2022-11-05 (Campo: fecha_vencimiento)
[2025-11-02 22:49:57] ✅ Fecha string convertida: 3/8/2012 -> 2012-03-08 (Campo: fecha_susc)
[2025-11-02 22:49:57] ✅ Fecha string convertida: 7/1/2023 -> 2023-07-01 (Campo: fecha_asignacion)
[2025-11-02 22:49:57] ✅ Fecha string convertida: 1/27/2025 -> 2025-01-27 (Campo: fecha_proceso)
[2025-11-02 22:49:57] ✅ Fecha string convertida: 5/5/2023 -> 2023-05-05 (Campo: fecha_castigo)
[2025-11-02 22:49:57] ✅ Fecha string convertida: 10/10/2022 -> 2022-10-10 (Campo: fecha_pago)
[2025-11-02 22:49:57] ✅ Fecha string convertida: 11/5/2022 -> 2022-11-05 (Campo: fecha_vencimiento)
[2025-11-02 22:49:57] ✅ Fecha string convertida: 1/9/2022 -> 2022-01-09 (Campo: fecha_susc)
[2025-11-02 22:49:57] ✅ Fecha string convertida: 7/1/2023 -> 2023-07-01 (Campo: fecha_asignacion)
[2025-11-02 22:49:57] ✅ Fecha string convertida: 1/27/2025 -> 2025-01-27 (Campo: fecha_proceso)
[2025-11-02 22:49:57] ✅ Fecha string convertida: 5/25/2023 -> 2023-05-25 (Campo: fecha_castigo)
[2025-11-02 22:49:57] ✅ Fecha string convertida: 10/5/2022 -> 2022-10-05 (Campo: fecha_pago)
[2025-11-02 22:49:57] ✅ Fecha string convertida: 11/25/2022 -> 2022-11-25 (Campo: fecha_vencimiento)
[2025-11-02 22:49:57] ✅ Fecha string convertida: 3/31/2004 -> 2004-03-31 (Campo: fecha_susc)
[2025-11-02 22:49:57] ✅ Fecha string convertida: 7/1/2023 -> 2023-07-01 (Campo: fecha_asignacion)
[2025-11-02 22:49:57] ✅ Fecha string convertida: 1/27/2025 -> 2025-01-27 (Campo: fecha_proceso)
[2025-11-02 22:49:57] ✅ Fecha string convertida: 6/5/2023 -> 2023-06-05 (Campo: fecha_castigo)
[2025-11-02 22:49:57] ✅ Fecha string convertida: 12/4/2022 -> 2022-12-04 (Campo: fecha_pago)
[2025-11-02 22:49:57] ✅ Fecha string convertida: 12/5/2022 -> 2022-12-05 (Campo: fecha_vencimiento)
[2025-11-02 22:49:57] ✅ Fecha string convertida: 4/22/2018 -> 2018-04-22 (Campo: fecha_susc)
[2025-11-02 22:49:57] ✅ Fecha string convertida: 8/1/2023 -> 2023-08-01 (Campo: fecha_asignacion)
[2025-11-02 22:49:57] ✅ Fecha string convertida: 1/27/2025 -> 2025-01-27 (Campo: fecha_proceso)
[2025-11-02 22:49:57] ✅ Fecha string convertida: 6/15/2023 -> 2023-06-15 (Campo: fecha_castigo)
[2025-11-02 22:49:57] ✅ Fecha string convertida: 11/7/2022 -> 2022-11-07 (Campo: fecha_pago)
[2025-11-02 22:49:57] ✅ Fecha string convertida: 12/15/2022 -> 2022-12-15 (Campo: fecha_vencimiento)
[2025-11-02 22:49:57] ✅ Fecha string convertida: 7/16/2016 -> 2016-07-16 (Campo: fecha_susc)
[2025-11-02 22:49:57] ✅ Fecha string convertida: 8/1/2023 -> 2023-08-01 (Campo: fecha_asignacion)
[2025-11-02 22:49:57] ✅ Fecha string convertida: 1/27/2025 -> 2025-01-27 (Campo: fecha_proceso)
[2025-11-02 22:49:57] ✅ Fecha string convertida: 7/5/2023 -> 2023-07-05 (Campo: fecha_castigo)
[2025-11-02 22:49:57] ✅ Fecha string convertida: 12/20/2022 -> 2022-12-20 (Campo: fecha_pago)
[2025-11-02 22:49:57] ✅ Fecha string convertida: 1/5/2023 -> 2023-01-05 (Campo: fecha_vencimiento)
[2025-11-02 22:49:57] ✅ Fecha string convertida: 7/31/2015 -> 2015-07-31 (Campo: fecha_susc)
[2025-11-02 22:49:57] ✅ Fecha string convertida: 9/1/2023 -> 2023-09-01 (Campo: fecha_asignacion)
[2025-11-02 22:49:57] ✅ Fecha string convertida: 1/27/2025 -> 2025-01-27 (Campo: fecha_proceso)
[2025-11-02 22:49:57] ✅ Fecha string convertida: 7/5/2023 -> 2023-07-05 (Campo: fecha_castigo)
[2025-11-02 22:49:57] ✅ Fecha string convertida: 11/28/2022 -> 2022-11-28 (Campo: fecha_pago)
[2025-11-02 22:49:57] ✅ Fecha string convertida: 1/5/2023 -> 2023-01-05 (Campo: fecha_vencimiento)
[2025-11-02 22:49:57] ✅ Fecha string convertida: 7/29/2010 -> 2010-07-29 (Campo: fecha_susc)
[2025-11-02 22:49:57] ✅ Fecha string convertida: 9/1/2023 -> 2023-09-01 (Campo: fecha_asignacion)
[2025-11-02 22:49:57] ✅ Fecha string convertida: 1/27/2025 -> 2025-01-27 (Campo: fecha_proceso)
[2025-11-02 22:49:57] ✅ Fecha string convertida: 8/5/2023 -> 2023-08-05 (Campo: fecha_castigo)
[2025-11-02 22:49:57] ✅ Fecha string convertida: 11/30/2022 -> 2022-11-30 (Campo: fecha_pago)
[2025-11-02 22:49:57] ✅ Fecha string convertida: 2/5/2023 -> 2023-02-05 (Campo: fecha_vencimiento)
[2025-11-02 22:49:57] ✅ Fecha string convertida: 2/17/2019 -> 2019-02-17 (Campo: fecha_susc)
[2025-11-02 22:49:57] ✅ Fecha string convertida: 10/1/2023 -> 2023-10-01 (Campo: fecha_asignacion)
[2025-11-02 22:49:57] ✅ Fecha string convertida: 1/27/2025 -> 2025-01-27 (Campo: fecha_proceso)
[2025-11-02 22:49:57] ✅ Fecha string convertida: 8/10/2023 -> 2023-08-10 (Campo: fecha_castigo)
[2025-11-02 22:49:57] ✅ Fecha string convertida: 1/12/2023 -> 2023-01-12 (Campo: fecha_pago)
[2025-11-02 22:49:57] ✅ Fecha string convertida: 2/10/2023 -> 2023-02-10 (Campo: fecha_vencimiento)
[2025-11-02 22:49:57] ✅ Fecha string convertida: 9/8/2018 -> 2018-09-08 (Campo: fecha_susc)
[2025-11-02 22:49:57] ✅ Fecha string convertida: 10/1/2023 -> 2023-10-01 (Campo: fecha_asignacion)
[2025-11-02 22:49:57] ✅ Fecha string convertida: 1/27/2025 -> 2025-01-27 (Campo: fecha_proceso)
[2025-11-02 22:49:57] ✅ Fecha string convertida: 9/5/2023 -> 2023-09-05 (Campo: fecha_castigo)
[2025-11-02 22:49:57] ✅ Fecha string convertida: 2/18/2023 -> 2023-02-18 (Campo: fecha_pago)
[2025-11-02 22:49:57] ✅ Fecha string convertida: 3/5/2023 -> 2023-03-05 (Campo: fecha_vencimiento)
[2025-11-02 22:49:57] ✅ Fecha string convertida: 11/9/2017 -> 2017-11-09 (Campo: fecha_susc)
[2025-11-02 22:49:57] ✅ Fecha string convertida: 11/1/2023 -> 2023-11-01 (Campo: fecha_asignacion)
[2025-11-02 22:49:57] ✅ Fecha string convertida: 1/27/2025 -> 2025-01-27 (Campo: fecha_proceso)
[2025-11-02 22:49:57] ✅ Fecha string convertida: 9/5/2023 -> 2023-09-05 (Campo: fecha_castigo)
[2025-11-02 22:49:57] ✅ DV con valor '0' - ES VÁLIDO
[2025-11-02 22:49:57] ✅ Fecha string convertida: 2/8/2023 -> 2023-02-08 (Campo: fecha_pago)
[2025-11-02 22:49:57] ✅ Fecha string convertida: 3/5/2023 -> 2023-03-05 (Campo: fecha_vencimiento)
[2025-11-02 22:49:57] ✅ Fecha string convertida: 9/23/2012 -> 2012-09-23 (Campo: fecha_susc)
[2025-11-02 22:49:57] ✅ Fecha string convertida: 11/1/2023 -> 2023-11-01 (Campo: fecha_asignacion)
[2025-11-02 22:49:57] ✅ Fecha string convertida: 1/27/2025 -> 2025-01-27 (Campo: fecha_proceso)
[2025-11-02 22:49:57] ✅ Fecha string convertida: 9/5/2023 -> 2023-09-05 (Campo: fecha_castigo)
[2025-11-02 22:49:57] ✅ Fecha string convertida: 2/6/2023 -> 2023-02-06 (Campo: fecha_pago)
[2025-11-02 22:49:57] ✅ Fecha string convertida: 3/5/2023 -> 2023-03-05 (Campo: fecha_vencimiento)
[2025-11-02 22:49:57] ✅ Fecha string convertida: 2/5/2014 -> 2014-02-05 (Campo: fecha_susc)
[2025-11-02 22:49:57] ✅ Fecha string convertida: 11/1/2023 -> 2023-11-01 (Campo: fecha_asignacion)
[2025-11-02 22:49:57] ✅ Fecha string convertida: 1/27/2025 -> 2025-01-27 (Campo: fecha_proceso)
[2025-11-02 22:49:57] ✅ Fecha string convertida: 9/5/2023 -> 2023-09-05 (Campo: fecha_castigo)
[2025-11-02 22:49:57] ✅ Fecha string convertida: 3/7/2023 -> 2023-03-07 (Campo: fecha_pago)
[2025-11-02 22:49:57] ✅ Fecha string convertida: 3/5/2023 -> 2023-03-05 (Campo: fecha_vencimiento)
[2025-11-02 22:49:57] ✅ Fecha string convertida: 5/15/2017 -> 2017-05-15 (Campo: fecha_susc)
[2025-11-02 22:49:57] ✅ Fecha string convertida: 11/1/2023 -> 2023-11-01 (Campo: fecha_asignacion)
[2025-11-02 22:49:57] ✅ Fecha string convertida: 1/27/2025 -> 2025-01-27 (Campo: fecha_proceso)
[2025-11-02 22:49:57] ✅ Fecha string convertida: 9/25/2023 -> 2023-09-25 (Campo: fecha_castigo)
[2025-11-02 22:49:57] ✅ Fecha string convertida: 3/3/2023 -> 2023-03-03 (Campo: fecha_pago)
[2025-11-02 22:49:57] ✅ Fecha string convertida: 3/25/2023 -> 2023-03-25 (Campo: fecha_vencimiento)
[2025-11-02 22:49:57] ✅ Fecha string convertida: 12/21/2010 -> 2010-12-21 (Campo: fecha_susc)
[2025-11-02 22:49:57] ✅ Fecha string convertida: 11/1/2023 -> 2023-11-01 (Campo: fecha_asignacion)
[2025-11-02 22:49:57] ✅ Fecha string convertida: 1/27/2025 -> 2025-01-27 (Campo: fecha_proceso)
[2025-11-02 22:49:57] ✅ Fecha string convertida: 10/5/2023 -> 2023-10-05 (Campo: fecha_castigo)
[2025-11-02 22:49:57] ✅ Fecha string convertida: 2/27/2023 -> 2023-02-27 (Campo: fecha_pago)
[2025-11-02 22:49:57] ✅ Fecha string convertida: 4/5/2023 -> 2023-04-05 (Campo: fecha_vencimiento)
[2025-11-02 22:49:57] ✅ Fecha string convertida: 6/10/2005 -> 2005-06-10 (Campo: fecha_susc)
[2025-11-02 22:49:57] ✅ Fecha string convertida: 12/1/2023 -> 2023-12-01 (Campo: fecha_asignacion)
[2025-11-02 22:49:57] ✅ Fecha string convertida: 1/27/2025 -> 2025-01-27 (Campo: fecha_proceso)
[2025-11-02 22:49:57] ✅ Fecha string convertida: 10/5/2023 -> 2023-10-05 (Campo: fecha_castigo)
[2025-11-02 22:49:57] ✅ Fecha string convertida: 11/12/2024 -> 2024-11-12 (Campo: fecha_pago)
[2025-11-02 22:49:57] ✅ Fecha string convertida: 4/5/2023 -> 2023-04-05 (Campo: fecha_vencimiento)
[2025-11-02 22:49:57] ✅ Fecha string convertida: 7/14/2005 -> 2005-07-14 (Campo: fecha_susc)
[2025-11-02 22:49:57] ✅ Fecha string convertida: 12/1/2023 -> 2023-12-01 (Campo: fecha_asignacion)
[2025-11-02 22:49:57] ✅ Fecha string convertida: 1/27/2025 -> 2025-01-27 (Campo: fecha_proceso)
[2025-11-02 22:49:57] ✅ Fecha string convertida: 11/5/2023 -> 2023-11-05 (Campo: fecha_castigo)
[2025-11-02 22:49:57] ✅ Fecha string convertida: 3/25/2023 -> 2023-03-25 (Campo: fecha_pago)
[2025-11-02 22:49:57] ✅ Fecha string convertida: 5/5/2023 -> 2023-05-05 (Campo: fecha_vencimiento)
[2025-11-02 22:49:57] ✅ Fecha string convertida: 6/15/2022 -> 2022-06-15 (Campo: fecha_susc)
[2025-11-02 22:49:57] ✅ Fecha string convertida: 1/1/2024 -> 2024-01-01 (Campo: fecha_asignacion)
[2025-11-02 22:49:57] ✅ Fecha string convertida: 1/27/2025 -> 2025-01-27 (Campo: fecha_proceso)
[2025-11-02 22:49:57] ✅ Fecha string convertida: 11/5/2023 -> 2023-11-05 (Campo: fecha_castigo)
[2025-11-02 22:49:57] ✅ Fecha string convertida: 4/4/2023 -> 2023-04-04 (Campo: fecha_pago)
[2025-11-02 22:49:57] ✅ Fecha string convertida: 5/5/2023 -> 2023-05-05 (Campo: fecha_vencimiento)
[2025-11-02 22:49:57] ✅ Fecha string convertida: 10/23/2015 -> 2015-10-23 (Campo: fecha_susc)
[2025-11-02 22:49:57] ✅ Fecha string convertida: 1/1/2024 -> 2024-01-01 (Campo: fecha_asignacion)
[2025-11-02 22:49:57] ✅ Fecha string convertida: 1/27/2025 -> 2025-01-27 (Campo: fecha_proceso)
[2025-11-02 22:49:57] ✅ Fecha string convertida: 11/5/2023 -> 2023-11-05 (Campo: fecha_castigo)
[2025-11-02 22:49:57] ✅ Fecha string convertida: 5/13/2023 -> 2023-05-13 (Campo: fecha_pago)
[2025-11-02 22:49:57] ✅ Fecha string convertida: 5/5/2023 -> 2023-05-05 (Campo: fecha_vencimiento)
[2025-11-02 22:49:57] ✅ Fecha string convertida: 6/2/2016 -> 2016-06-02 (Campo: fecha_susc)
[2025-11-02 22:49:57] ✅ Fecha string convertida: 1/1/2024 -> 2024-01-01 (Campo: fecha_asignacion)
[2025-11-02 22:49:57] ✅ Fecha string convertida: 1/27/2025 -> 2025-01-27 (Campo: fecha_proceso)
[2025-11-02 22:49:57] ✅ Fecha string convertida: 11/10/2023 -> 2023-11-10 (Campo: fecha_castigo)
[2025-11-02 22:49:57] ✅ Fecha string convertida: 4/15/2023 -> 2023-04-15 (Campo: fecha_pago)
[2025-11-02 22:49:57] ✅ Fecha string convertida: 5/10/2023 -> 2023-05-10 (Campo: fecha_vencimiento)
[2025-11-02 22:49:57] ✅ Fecha string convertida: 2/27/2008 -> 2008-02-27 (Campo: fecha_susc)
[2025-11-02 22:49:57] ✅ Fecha string convertida: 1/1/2024 -> 2024-01-01 (Campo: fecha_asignacion)
[2025-11-02 22:49:57] ✅ Fecha string convertida: 1/27/2025 -> 2025-01-27 (Campo: fecha_proceso)
[2025-11-02 22:49:57] ✅ Fecha string convertida: 11/10/2023 -> 2023-11-10 (Campo: fecha_castigo)
[2025-11-02 22:49:57] ✅ Fecha string convertida: 1/14/2023 -> 2023-01-14 (Campo: fecha_pago)
[2025-11-02 22:49:57] ✅ Fecha string convertida: 5/10/2023 -> 2023-05-10 (Campo: fecha_vencimiento)
[2025-11-02 22:49:57] ✅ Fecha string convertida: 3/9/2019 -> 2019-03-09 (Campo: fecha_susc)
[2025-11-02 22:49:57] ✅ Fecha string convertida: 1/1/2024 -> 2024-01-01 (Campo: fecha_asignacion)
[2025-11-02 22:49:57] ✅ Fecha string convertida: 1/27/2025 -> 2025-01-27 (Campo: fecha_proceso)
[2025-11-02 22:49:57] ✅ Fecha string convertida: 11/20/2023 -> 2023-11-20 (Campo: fecha_castigo)
[2025-11-02 22:49:57] ✅ Fecha string convertida: 3/20/2023 -> 2023-03-20 (Campo: fecha_pago)
[2025-11-02 22:49:57] ✅ Fecha string convertida: 5/20/2023 -> 2023-05-20 (Campo: fecha_vencimiento)
[2025-11-02 22:49:57] ✅ Fecha string convertida: 11/10/2022 -> 2022-11-10 (Campo: fecha_susc)
[2025-11-02 22:49:57] ✅ Fecha string convertida: 1/1/2024 -> 2024-01-01 (Campo: fecha_asignacion)
[2025-11-02 22:49:57] ✅ Fecha string convertida: 1/27/2025 -> 2025-01-27 (Campo: fecha_proceso)
[2025-11-02 22:49:57] ✅ Fecha string convertida: 12/5/2023 -> 2023-12-05 (Campo: fecha_castigo)
[2025-11-02 22:49:57] ✅ Fecha string convertida: 5/15/2023 -> 2023-05-15 (Campo: fecha_pago)
[2025-11-02 22:49:57] ✅ Fecha string convertida: 6/5/2023 -> 2023-06-05 (Campo: fecha_vencimiento)
[2025-11-02 22:49:57] ✅ Fecha string convertida: 8/4/2022 -> 2022-08-04 (Campo: fecha_susc)
[2025-11-02 22:49:57] ✅ Fecha string convertida: 2/1/2024 -> 2024-02-01 (Campo: fecha_asignacion)
[2025-11-02 22:49:57] ✅ Fecha string convertida: 1/27/2025 -> 2025-01-27 (Campo: fecha_proceso)
[2025-11-02 22:49:57] ✅ Fecha string convertida: 12/5/2023 -> 2023-12-05 (Campo: fecha_castigo)
[2025-11-02 22:49:57] ✅ Fecha string convertida: 5/9/2023 -> 2023-05-09 (Campo: fecha_pago)
[2025-11-02 22:49:57] ✅ Fecha string convertida: 6/5/2023 -> 2023-06-05 (Campo: fecha_vencimiento)
[2025-11-02 22:49:57] ✅ Fecha string convertida: 5/6/2019 -> 2019-05-06 (Campo: fecha_susc)
[2025-11-02 22:49:57] ✅ Valor convertido a DECIMAL: '$ 293,634' -> 293634
[2025-11-02 22:49:57] ✅ Fecha string convertida: 2/1/2024 -> 2024-02-01 (Campo: fecha_asignacion)
[2025-11-02 22:49:57] ✅ Fecha string convertida: 1/27/2025 -> 2025-01-27 (Campo: fecha_proceso)
[2025-11-02 22:49:57] ✅ Fecha string convertida: 12/5/2023 -> 2023-12-05 (Campo: fecha_castigo)
[2025-11-02 22:49:57] ✅ Fecha string convertida: 5/8/2023 -> 2023-05-08 (Campo: fecha_pago)
[2025-11-02 22:49:57] ✅ Fecha string convertida: 6/5/2023 -> 2023-06-05 (Campo: fecha_vencimiento)
[2025-11-02 22:49:57] ✅ Fecha string convertida: 8/24/2021 -> 2021-08-24 (Campo: fecha_susc)
[2025-11-02 22:49:57] ✅ Fecha string convertida: 2/1/2024 -> 2024-02-01 (Campo: fecha_asignacion)
[2025-11-02 22:49:57] ✅ Fecha string convertida: 1/27/2025 -> 2025-01-27 (Campo: fecha_proceso)
[2025-11-02 22:49:57] ✅ Fecha string convertida: 12/5/2023 -> 2023-12-05 (Campo: fecha_castigo)
[2025-11-02 22:49:57] ✅ Fecha string convertida: 5/7/2023 -> 2023-05-07 (Campo: fecha_pago)
[2025-11-02 22:49:57] ✅ Fecha string convertida: 6/5/2023 -> 2023-06-05 (Campo: fecha_vencimiento)
[2025-11-02 22:49:57] ✅ Fecha string convertida: 10/7/2019 -> 2019-10-07 (Campo: fecha_susc)
[2025-11-02 22:49:57] ✅ Fecha string convertida: 2/1/2024 -> 2024-02-01 (Campo: fecha_asignacion)
[2025-11-02 22:49:57] ✅ Fecha string convertida: 1/27/2025 -> 2025-01-27 (Campo: fecha_proceso)
[2025-11-02 22:49:57] ✅ Fecha string convertida: 12/5/2023 -> 2023-12-05 (Campo: fecha_castigo)
[2025-11-02 22:49:57] ✅ Fecha string convertida: 5/9/2023 -> 2023-05-09 (Campo: fecha_pago)
[2025-11-02 22:49:57] ✅ Fecha string convertida: 6/5/2023 -> 2023-06-05 (Campo: fecha_vencimiento)
[2025-11-02 22:49:57] ✅ Fecha string convertida: 9/6/2021 -> 2021-09-06 (Campo: fecha_susc)
[2025-11-02 22:49:57] ✅ Fecha string convertida: 2/1/2024 -> 2024-02-01 (Campo: fecha_asignacion)
[2025-11-02 22:49:57] ✅ Fecha string convertida: 1/27/2025 -> 2025-01-27 (Campo: fecha_proceso)
[2025-11-02 22:49:57] ✅ Fecha string convertida: 12/5/2023 -> 2023-12-05 (Campo: fecha_castigo)
[2025-11-02 22:49:57] ✅ Fecha string convertida: 5/19/2023 -> 2023-05-19 (Campo: fecha_pago)
[2025-11-02 22:49:57] ✅ Fecha string convertida: 6/5/2023 -> 2023-06-05 (Campo: fecha_vencimiento)
[2025-11-02 22:49:57] ✅ Fecha string convertida: 8/21/2002 -> 2002-08-21 (Campo: fecha_susc)
[2025-11-02 22:49:57] ✅ Fecha string convertida: 2/1/2024 -> 2024-02-01 (Campo: fecha_asignacion)
[2025-11-02 22:49:57] ✅ Fecha string convertida: 1/27/2025 -> 2025-01-27 (Campo: fecha_proceso)
[2025-11-02 22:49:57] ✅ Fecha string convertida: 12/5/2023 -> 2023-12-05 (Campo: fecha_castigo)
[2025-11-02 22:49:57] ✅ Fecha string convertida: 6/6/2023 -> 2023-06-06 (Campo: fecha_pago)
[2025-11-02 22:49:57] ✅ Fecha string convertida: 6/5/2023 -> 2023-06-05 (Campo: fecha_vencimiento)
[2025-11-02 22:49:57] ✅ Fecha string convertida: 1/19/2004 -> 2004-01-19 (Campo: fecha_susc)
[2025-11-02 22:49:57] ✅ Fecha string convertida: 2/1/2024 -> 2024-02-01 (Campo: fecha_asignacion)
[2025-11-02 22:49:57] ✅ Fecha string convertida: 1/27/2025 -> 2025-01-27 (Campo: fecha_proceso)
[2025-11-02 22:49:57] ✅ Fecha string convertida: 12/5/2023 -> 2023-12-05 (Campo: fecha_castigo)
[2025-11-02 22:49:57] ✅ Fecha string convertida: 5/3/2023 -> 2023-05-03 (Campo: fecha_pago)
[2025-11-02 22:49:57] ✅ Fecha string convertida: 6/5/2023 -> 2023-06-05 (Campo: fecha_vencimiento)
[2025-11-02 22:49:57] ✅ Fecha string convertida: 5/23/2006 -> 2006-05-23 (Campo: fecha_susc)
[2025-11-02 22:49:57] ✅ Fecha string convertida: 2/1/2024 -> 2024-02-01 (Campo: fecha_asignacion)
[2025-11-02 22:49:57] ✅ Fecha string convertida: 1/27/2025 -> 2025-01-27 (Campo: fecha_proceso)
[2025-11-02 22:49:57] ✅ Fecha string convertida: 12/15/2023 -> 2023-12-15 (Campo: fecha_castigo)
[2025-11-02 22:49:57] ✅ Fecha string convertida: 6/14/2023 -> 2023-06-14 (Campo: fecha_pago)
[2025-11-02 22:49:57] ✅ Fecha string convertida: 6/15/2023 -> 2023-06-15 (Campo: fecha_vencimiento)
[2025-11-02 22:49:57] ✅ Fecha string convertida: 11/5/2008 -> 2008-11-05 (Campo: fecha_susc)
[2025-11-02 22:49:57] ✅ Fecha string convertida: 2/1/2024 -> 2024-02-01 (Campo: fecha_asignacion)
[2025-11-02 22:49:57] ✅ Fecha string convertida: 1/27/2025 -> 2025-01-27 (Campo: fecha_proceso)
[2025-11-02 22:49:57] ✅ Fecha string convertida: 12/15/2023 -> 2023-12-15 (Campo: fecha_castigo)
[2025-11-02 22:49:57] ✅ Fecha string convertida: 5/15/2023 -> 2023-05-15 (Campo: fecha_pago)
[2025-11-02 22:49:57] ✅ Fecha string convertida: 6/15/2023 -> 2023-06-15 (Campo: fecha_vencimiento)
[2025-11-02 22:49:57] ✅ Fecha string convertida: 3/4/2021 -> 2021-03-04 (Campo: fecha_susc)
[2025-11-02 22:49:57] ✅ Fecha string convertida: 2/1/2024 -> 2024-02-01 (Campo: fecha_asignacion)
[2025-11-02 22:49:57] ✅ Fecha string convertida: 1/27/2025 -> 2025-01-27 (Campo: fecha_proceso)
[2025-11-02 22:49:57] ✅ Fecha string convertida: 12/15/2023 -> 2023-12-15 (Campo: fecha_castigo)
[2025-11-02 22:49:57] ✅ Fecha string convertida: 5/13/2023 -> 2023-05-13 (Campo: fecha_pago)
[2025-11-02 22:49:57] ✅ Fecha string convertida: 6/15/2023 -> 2023-06-15 (Campo: fecha_vencimiento)
[2025-11-02 22:49:57] ✅ Fecha string convertida: 6/24/2022 -> 2022-06-24 (Campo: fecha_susc)
[2025-11-02 22:49:57] ✅ Fecha string convertida: 2/1/2024 -> 2024-02-01 (Campo: fecha_asignacion)
[2025-11-02 22:49:57] ✅ Fecha string convertida: 1/27/2025 -> 2025-01-27 (Campo: fecha_proceso)
[2025-11-02 22:49:57] ✅ Fecha string convertida: 12/20/2023 -> 2023-12-20 (Campo: fecha_castigo)
[2025-11-02 22:49:57] ✅ Fecha string convertida: 6/1/2023 -> 2023-06-01 (Campo: fecha_pago)
[2025-11-02 22:49:57] ✅ Fecha string convertida: 6/20/2023 -> 2023-06-20 (Campo: fecha_vencimiento)
[2025-11-02 22:49:57] ✅ Fecha string convertida: 7/30/2018 -> 2018-07-30 (Campo: fecha_susc)
[2025-11-02 22:49:57] ✅ Fecha string convertida: 2/1/2024 -> 2024-02-01 (Campo: fecha_asignacion)
[2025-11-02 22:49:57] ✅ Fecha string convertida: 1/27/2025 -> 2025-01-27 (Campo: fecha_proceso)
[2025-11-02 22:49:57] ✅ Fecha string convertida: 12/20/2023 -> 2023-12-20 (Campo: fecha_castigo)
[2025-11-02 22:49:57] ✅ Fecha string convertida: 4/30/2023 -> 2023-04-30 (Campo: fecha_pago)
[2025-11-02 22:49:57] ✅ Fecha string convertida: 6/20/2023 -> 2023-06-20 (Campo: fecha_vencimiento)
[2025-11-02 22:49:57] ✅ Fecha string convertida: 1/31/2018 -> 2018-01-31 (Campo: fecha_susc)
[2025-11-02 22:49:57] ✅ Fecha string convertida: 2/1/2024 -> 2024-02-01 (Campo: fecha_asignacion)
[2025-11-02 22:49:57] ✅ Fecha string convertida: 1/27/2025 -> 2025-01-27 (Campo: fecha_proceso)
[2025-11-02 22:49:57] ✅ Fecha string convertida: 1/5/2024 -> 2024-01-05 (Campo: fecha_castigo)
[2025-11-02 22:49:57] ✅ Fecha string convertida: 5/28/2023 -> 2023-05-28 (Campo: fecha_pago)
[2025-11-02 22:49:57] ✅ Fecha string convertida: 7/5/2023 -> 2023-07-05 (Campo: fecha_vencimiento)
[2025-11-02 22:49:57] ✅ Fecha string convertida: 6/3/2017 -> 2017-06-03 (Campo: fecha_susc)
[2025-11-02 22:49:57] ✅ Fecha string convertida: 3/1/2024 -> 2024-03-01 (Campo: fecha_asignacion)
[2025-11-02 22:49:57] ✅ Fecha string convertida: 1/27/2025 -> 2025-01-27 (Campo: fecha_proceso)
[2025-11-02 22:49:57] ✅ Fecha string convertida: 1/5/2024 -> 2024-01-05 (Campo: fecha_castigo)
[2025-11-02 22:49:57] ✅ Fecha string convertida: 7/7/2023 -> 2023-07-07 (Campo: fecha_pago)
[2025-11-02 22:49:57] ✅ Fecha string convertida: 7/5/2023 -> 2023-07-05 (Campo: fecha_vencimiento)
[2025-11-02 22:49:57] ✅ Fecha string convertida: 12/2/2017 -> 2017-12-02 (Campo: fecha_susc)
[2025-11-02 22:49:57] ✅ Fecha string convertida: 3/1/2024 -> 2024-03-01 (Campo: fecha_asignacion)
[2025-11-02 22:49:57] ✅ Fecha string convertida: 1/27/2025 -> 2025-01-27 (Campo: fecha_proceso)
[2025-11-02 22:49:57] ✅ Fecha string convertida: 1/5/2024 -> 2024-01-05 (Campo: fecha_castigo)
[2025-11-02 22:49:57] ✅ Fecha string convertida: 5/30/2023 -> 2023-05-30 (Campo: fecha_pago)
[2025-11-02 22:49:57] ✅ Fecha string convertida: 7/5/2023 -> 2023-07-05 (Campo: fecha_vencimiento)
[2025-11-02 22:49:57] ✅ Fecha string convertida: 2/28/2022 -> 2022-02-28 (Campo: fecha_susc)
[2025-11-02 22:49:57] ✅ Fecha string convertida: 3/1/2024 -> 2024-03-01 (Campo: fecha_asignacion)
[2025-11-02 22:49:57] ✅ Fecha string convertida: 1/27/2025 -> 2025-01-27 (Campo: fecha_proceso)
[2025-11-02 22:49:57] ✅ Fecha string convertida: 1/5/2024 -> 2024-01-05 (Campo: fecha_castigo)
[2025-11-02 22:49:57] ✅ Fecha string convertida: 6/2/2023 -> 2023-06-02 (Campo: fecha_pago)
[2025-11-02 22:49:57] ✅ Fecha string convertida: 7/5/2023 -> 2023-07-05 (Campo: fecha_vencimiento)
[2025-11-02 22:49:57] ✅ Fecha string convertida: 12/23/2016 -> 2016-12-23 (Campo: fecha_susc)
[2025-11-02 22:49:57] ✅ Fecha string convertida: 3/1/2024 -> 2024-03-01 (Campo: fecha_asignacion)
[2025-11-02 22:49:57] ✅ Fecha string convertida: 1/27/2025 -> 2025-01-27 (Campo: fecha_proceso)
[2025-11-02 22:49:57] ✅ Fecha string convertida: 1/10/2024 -> 2024-01-10 (Campo: fecha_castigo)
[2025-11-02 22:49:57] ✅ Fecha string convertida: 9/14/2023 -> 2023-09-14 (Campo: fecha_pago)
[2025-11-02 22:49:57] ✅ Fecha string convertida: 7/10/2023 -> 2023-07-10 (Campo: fecha_vencimiento)
[2025-11-02 22:49:57] ✅ Fecha string convertida: 10/19/2020 -> 2020-10-19 (Campo: fecha_susc)
[2025-11-02 22:49:57] ✅ Fecha string convertida: 3/1/2024 -> 2024-03-01 (Campo: fecha_asignacion)
[2025-11-02 22:49:57] ✅ Fecha string convertida: 1/27/2025 -> 2025-01-27 (Campo: fecha_proceso)
[2025-11-02 22:49:57] ✅ Fecha string convertida: 1/15/2024 -> 2024-01-15 (Campo: fecha_castigo)
[2025-11-02 22:49:57] ✅ Fecha string convertida: 5/8/2023 -> 2023-05-08 (Campo: fecha_pago)
[2025-11-02 22:49:57] ✅ Fecha string convertida: 7/15/2023 -> 2023-07-15 (Campo: fecha_vencimiento)
[2025-11-02 22:49:57] ✅ Fecha string convertida: 9/21/2021 -> 2021-09-21 (Campo: fecha_susc)
[2025-11-02 22:49:57] ✅ Fecha string convertida: 3/1/2024 -> 2024-03-01 (Campo: fecha_asignacion)
[2025-11-02 22:49:57] ✅ Fecha string convertida: 1/27/2025 -> 2025-01-27 (Campo: fecha_proceso)
[2025-11-02 22:49:57] ✅ Fecha string convertida: 1/25/2024 -> 2024-01-25 (Campo: fecha_castigo)
[2025-11-02 22:49:57] ✅ Fecha string convertida: 6/10/2023 -> 2023-06-10 (Campo: fecha_pago)
[2025-11-02 22:49:57] ✅ Fecha string convertida: 7/25/2023 -> 2023-07-25 (Campo: fecha_vencimiento)
[2025-11-02 22:49:57] ✅ Fecha string convertida: 5/22/2019 -> 2019-05-22 (Campo: fecha_susc)
[2025-11-02 22:49:58] ✅ Fecha string convertida: 3/1/2024 -> 2024-03-01 (Campo: fecha_asignacion)
[2025-11-02 22:49:58] ✅ Fecha string convertida: 1/27/2025 -> 2025-01-27 (Campo: fecha_proceso)
[2025-11-02 22:49:58] ✅ Fecha string convertida: 2/5/2024 -> 2024-02-05 (Campo: fecha_castigo)
[2025-11-02 22:49:58] ✅ Fecha string convertida: 8/5/2023 -> 2023-08-05 (Campo: fecha_vencimiento)
[2025-11-02 22:49:58] ✅ Fecha string convertida: 7/15/2023 -> 2023-07-15 (Campo: fecha_susc)
[2025-11-02 22:49:58] ✅ Fecha string convertida: 4/1/2024 -> 2024-04-01 (Campo: fecha_asignacion)
[2025-11-02 22:49:58] ✅ Fecha string convertida: 1/27/2025 -> 2025-01-27 (Campo: fecha_proceso)
[2025-11-02 22:49:58] ✅ Fecha string convertida: 2/5/2024 -> 2024-02-05 (Campo: fecha_castigo)
[2025-11-02 22:49:58] ✅ Fecha string convertida: 7/5/2023 -> 2023-07-05 (Campo: fecha_pago)
[2025-11-02 22:49:58] ✅ Fecha string convertida: 8/5/2023 -> 2023-08-05 (Campo: fecha_vencimiento)
[2025-11-02 22:49:58] ✅ Fecha string convertida: 4/24/2015 -> 2015-04-24 (Campo: fecha_susc)
[2025-11-02 22:49:58] ✅ Fecha string convertida: 4/1/2024 -> 2024-04-01 (Campo: fecha_asignacion)
[2025-11-02 22:49:58] ✅ Fecha string convertida: 1/27/2025 -> 2025-01-27 (Campo: fecha_proceso)
[2025-11-02 22:49:58] ✅ Fecha string convertida: 2/5/2024 -> 2024-02-05 (Campo: fecha_castigo)
[2025-11-02 22:49:58] ✅ Fecha string convertida: 7/13/2023 -> 2023-07-13 (Campo: fecha_pago)
[2025-11-02 22:49:58] ✅ Fecha string convertida: 8/5/2023 -> 2023-08-05 (Campo: fecha_vencimiento)
[2025-11-02 22:49:58] ✅ Fecha string convertida: 9/1/2021 -> 2021-09-01 (Campo: fecha_susc)
[2025-11-02 22:49:58] ✅ Fecha string convertida: 4/1/2024 -> 2024-04-01 (Campo: fecha_asignacion)
[2025-11-02 22:49:58] ✅ Fecha string convertida: 1/27/2025 -> 2025-01-27 (Campo: fecha_proceso)
[2025-11-02 22:49:58] ✅ Fecha string convertida: 2/5/2024 -> 2024-02-05 (Campo: fecha_castigo)
[2025-11-02 22:49:58] ✅ Fecha string convertida: 4/20/2023 -> 2023-04-20 (Campo: fecha_pago)
[2025-11-02 22:49:58] ✅ Fecha string convertida: 8/5/2023 -> 2023-08-05 (Campo: fecha_vencimiento)
[2025-11-02 22:49:58] ✅ Fecha string convertida: 7/1/1997 -> 1997-07-01 (Campo: fecha_susc)
[2025-11-02 22:49:58] ✅ Fecha string convertida: 4/1/2024 -> 2024-04-01 (Campo: fecha_asignacion)
[2025-11-02 22:49:58] ✅ Fecha string convertida: 1/27/2025 -> 2025-01-27 (Campo: fecha_proceso)
[2025-11-02 22:49:58] ✅ Fecha string convertida: 2/5/2024 -> 2024-02-05 (Campo: fecha_castigo)
[2025-11-02 22:49:58] ✅ Fecha string convertida: 7/2/2023 -> 2023-07-02 (Campo: fecha_pago)
[2025-11-02 22:49:58] ✅ Fecha string convertida: 8/5/2023 -> 2023-08-05 (Campo: fecha_vencimiento)
[2025-11-02 22:49:58] ✅ Fecha string convertida: 8/8/2021 -> 2021-08-08 (Campo: fecha_susc)
[2025-11-02 22:49:58] ✅ Fecha string convertida: 4/1/2024 -> 2024-04-01 (Campo: fecha_asignacion)
[2025-11-02 22:49:58] ✅ Fecha string convertida: 1/27/2025 -> 2025-01-27 (Campo: fecha_proceso)
[2025-11-02 22:49:58] ✅ Fecha string convertida: 2/5/2024 -> 2024-02-05 (Campo: fecha_castigo)
[2025-11-02 22:49:58] ✅ Fecha string convertida: 8/5/2023 -> 2023-08-05 (Campo: fecha_vencimiento)
[2025-11-02 22:49:58] ✅ Fecha string convertida: 7/16/2023 -> 2023-07-16 (Campo: fecha_susc)
[2025-11-02 22:49:58] ✅ Fecha string convertida: 4/1/2024 -> 2024-04-01 (Campo: fecha_asignacion)
[2025-11-02 22:49:58] ✅ Fecha string convertida: 1/27/2025 -> 2025-01-27 (Campo: fecha_proceso)
[2025-11-02 22:49:58] ✅ Fecha string convertida: 2/5/2024 -> 2024-02-05 (Campo: fecha_castigo)
[2025-11-02 22:49:58] ✅ Fecha string convertida: 8/29/2023 -> 2023-08-29 (Campo: fecha_pago)
[2025-11-02 22:49:58] ✅ Fecha string convertida: 8/5/2023 -> 2023-08-05 (Campo: fecha_vencimiento)
[2025-11-02 22:49:58] ✅ Fecha string convertida: 1/13/2012 -> 2012-01-13 (Campo: fecha_susc)
[2025-11-02 22:49:58] ✅ Fecha string convertida: 4/1/2024 -> 2024-04-01 (Campo: fecha_asignacion)
[2025-11-02 22:49:58] ✅ Fecha string convertida: 1/27/2025 -> 2025-01-27 (Campo: fecha_proceso)
[2025-11-02 22:49:58] ✅ Fecha string convertida: 2/5/2024 -> 2024-02-05 (Campo: fecha_castigo)
[2025-11-02 22:49:58] ✅ Fecha string convertida: 7/8/2023 -> 2023-07-08 (Campo: fecha_pago)
[2025-11-02 22:49:58] ✅ Fecha string convertida: 8/5/2023 -> 2023-08-05 (Campo: fecha_vencimiento)
[2025-11-02 22:49:58] ✅ Fecha string convertida: 11/25/2009 -> 2009-11-25 (Campo: fecha_susc)
[2025-11-02 22:49:58] ✅ Fecha string convertida: 4/1/2024 -> 2024-04-01 (Campo: fecha_asignacion)
[2025-11-02 22:49:58] ✅ Fecha string convertida: 1/27/2025 -> 2025-01-27 (Campo: fecha_proceso)
[2025-11-02 22:49:58] ✅ Fecha string convertida: 2/10/2024 -> 2024-02-10 (Campo: fecha_castigo)
[2025-11-02 22:49:58] ✅ Fecha string convertida: 7/24/2023 -> 2023-07-24 (Campo: fecha_pago)
[2025-11-02 22:49:58] ✅ Fecha string convertida: 8/10/2023 -> 2023-08-10 (Campo: fecha_vencimiento)
[2025-11-02 22:49:58] ✅ Fecha string convertida: 3/20/2018 -> 2018-03-20 (Campo: fecha_susc)
[2025-11-02 22:49:58] ✅ Fecha string convertida: 4/1/2024 -> 2024-04-01 (Campo: fecha_asignacion)
[2025-11-02 22:49:58] ✅ Fecha string convertida: 1/27/2025 -> 2025-01-27 (Campo: fecha_proceso)
[2025-11-02 22:49:58] ✅ Fecha string convertida: 2/25/2024 -> 2024-02-25 (Campo: fecha_castigo)
[2025-11-02 22:49:58] ✅ Fecha string convertida: 9/6/2023 -> 2023-09-06 (Campo: fecha_pago)
[2025-11-02 22:49:58] ✅ Fecha string convertida: 8/25/2023 -> 2023-08-25 (Campo: fecha_vencimiento)
[2025-11-02 22:49:58] ✅ Fecha string convertida: 3/20/2019 -> 2019-03-20 (Campo: fecha_susc)
[2025-11-02 22:49:58] ✅ Fecha string convertida: 4/1/2024 -> 2024-04-01 (Campo: fecha_asignacion)
[2025-11-02 22:49:58] ✅ Fecha string convertida: 1/27/2025 -> 2025-01-27 (Campo: fecha_proceso)
[2025-11-02 22:49:58] ✅ Fecha string convertida: 3/5/2024 -> 2024-03-05 (Campo: fecha_castigo)
[2025-11-02 22:49:58] ✅ Fecha string convertida: 8/8/2023 -> 2023-08-08 (Campo: fecha_pago)
[2025-11-02 22:49:58] ✅ Fecha string convertida: 9/5/2023 -> 2023-09-05 (Campo: fecha_vencimiento)
[2025-11-02 22:49:58] ✅ Fecha string convertida: 12/11/2013 -> 2013-12-11 (Campo: fecha_susc)
[2025-11-02 22:49:58] ✅ Fecha string convertida: 5/1/2024 -> 2024-05-01 (Campo: fecha_asignacion)
[2025-11-02 22:49:58] ✅ Fecha string convertida: 1/27/2025 -> 2025-01-27 (Campo: fecha_proceso)
[2025-11-02 22:49:58] ✅ Fecha string convertida: 3/5/2024 -> 2024-03-05 (Campo: fecha_castigo)
[2025-11-02 22:49:58] ✅ Fecha string convertida: 10/16/2023 -> 2023-10-16 (Campo: fecha_pago)
[2025-11-02 22:49:58] ✅ Fecha string convertida: 9/5/2023 -> 2023-09-05 (Campo: fecha_vencimiento)
[2025-11-02 22:49:58] ✅ Fecha string convertida: 11/16/2014 -> 2014-11-16 (Campo: fecha_susc)
[2025-11-02 22:49:58] ✅ Fecha string convertida: 5/1/2024 -> 2024-05-01 (Campo: fecha_asignacion)
[2025-11-02 22:49:58] ✅ Fecha string convertida: 1/27/2025 -> 2025-01-27 (Campo: fecha_proceso)
[2025-11-02 22:49:58] ✅ Fecha string convertida: 3/5/2024 -> 2024-03-05 (Campo: fecha_castigo)
[2025-11-02 22:49:58] ✅ Fecha string convertida: 7/28/2023 -> 2023-07-28 (Campo: fecha_pago)
[2025-11-02 22:49:58] ✅ Fecha string convertida: 9/5/2023 -> 2023-09-05 (Campo: fecha_vencimiento)
[2025-11-02 22:49:58] ✅ Fecha string convertida: 1/23/2017 -> 2017-01-23 (Campo: fecha_susc)
[2025-11-02 22:49:58] ✅ Fecha string convertida: 5/1/2024 -> 2024-05-01 (Campo: fecha_asignacion)
[2025-11-02 22:49:58] ✅ Fecha string convertida: 1/27/2025 -> 2025-01-27 (Campo: fecha_proceso)
[2025-11-02 22:49:58] ✅ Fecha string convertida: 3/5/2024 -> 2024-03-05 (Campo: fecha_castigo)
[2025-11-02 22:49:58] ✅ Fecha string convertida: 8/5/2023 -> 2023-08-05 (Campo: fecha_pago)
[2025-11-02 22:49:58] ✅ Fecha string convertida: 9/5/2023 -> 2023-09-05 (Campo: fecha_vencimiento)
[2025-11-02 22:49:58] ✅ Fecha string convertida: 3/24/2000 -> 2000-03-24 (Campo: fecha_susc)
[2025-11-02 22:49:58] ✅ Fecha string convertida: 5/1/2024 -> 2024-05-01 (Campo: fecha_asignacion)
[2025-11-02 22:49:58] ✅ Fecha string convertida: 1/27/2025 -> 2025-01-27 (Campo: fecha_proceso)
[2025-11-02 22:49:58] ✅ Fecha string convertida: 3/5/2024 -> 2024-03-05 (Campo: fecha_castigo)
[2025-11-02 22:49:58] ✅ Fecha string convertida: 10/26/2024 -> 2024-10-26 (Campo: fecha_pago)
[2025-11-02 22:49:58] ✅ Fecha string convertida: 9/5/2023 -> 2023-09-05 (Campo: fecha_vencimiento)
[2025-11-02 22:49:58] ✅ Fecha string convertida: 6/13/2015 -> 2015-06-13 (Campo: fecha_susc)
[2025-11-02 22:49:58] ✅ Fecha string convertida: 5/1/2024 -> 2024-05-01 (Campo: fecha_asignacion)
[2025-11-02 22:49:58] ✅ Fecha string convertida: 1/27/2025 -> 2025-01-27 (Campo: fecha_proceso)
[2025-11-02 22:49:58] ✅ Fecha string convertida: 3/20/2024 -> 2024-03-20 (Campo: fecha_castigo)
[2025-11-02 22:49:58] ✅ Fecha string convertida: 8/7/2023 -> 2023-08-07 (Campo: fecha_pago)
[2025-11-02 22:49:58] ✅ Fecha string convertida: 9/20/2023 -> 2023-09-20 (Campo: fecha_vencimiento)
[2025-11-02 22:49:58] ✅ Fecha string convertida: 8/30/2001 -> 2001-08-30 (Campo: fecha_susc)
[2025-11-02 22:49:58] ✅ Fecha string convertida: 5/1/2024 -> 2024-05-01 (Campo: fecha_asignacion)
[2025-11-02 22:49:58] ✅ Fecha string convertida: 1/27/2025 -> 2025-01-27 (Campo: fecha_proceso)
[2025-11-02 22:49:58] ✅ Fecha string convertida: 4/5/2024 -> 2024-04-05 (Campo: fecha_castigo)
[2025-11-02 22:49:58] ✅ Fecha string convertida: 9/6/2023 -> 2023-09-06 (Campo: fecha_pago)
[2025-11-02 22:49:58] ✅ Fecha string convertida: 10/5/2023 -> 2023-10-05 (Campo: fecha_vencimiento)
[2025-11-02 22:49:58] ✅ Fecha string convertida: 1/4/2022 -> 2022-01-04 (Campo: fecha_susc)
[2025-11-02 22:49:58] ✅ Fecha string convertida: 6/1/2024 -> 2024-06-01 (Campo: fecha_asignacion)
[2025-11-02 22:49:58] ✅ Fecha string convertida: 1/27/2025 -> 2025-01-27 (Campo: fecha_proceso)
[2025-11-02 22:49:58] ✅ Fecha string convertida: 4/10/2024 -> 2024-04-10 (Campo: fecha_castigo)
[2025-11-02 22:49:58] ✅ Fecha string convertida: 9/3/2023 -> 2023-09-03 (Campo: fecha_pago)
[2025-11-02 22:49:58] ✅ Fecha string convertida: 10/10/2023 -> 2023-10-10 (Campo: fecha_vencimiento)
[2025-11-02 22:49:58] ✅ Fecha string convertida: 7/22/1999 -> 1999-07-22 (Campo: fecha_susc)
[2025-11-02 22:49:58] ✅ Fecha string convertida: 6/1/2024 -> 2024-06-01 (Campo: fecha_asignacion)
[2025-11-02 22:49:58] ✅ Fecha string convertida: 1/27/2025 -> 2025-01-27 (Campo: fecha_proceso)
[2025-11-02 22:49:58] ✅ Fecha string convertida: 4/20/2024 -> 2024-04-20 (Campo: fecha_castigo)
[2025-11-02 22:49:58] ✅ DV con valor '0' - ES VÁLIDO
[2025-11-02 22:49:58] ✅ Fecha string convertida: 8/5/2023 -> 2023-08-05 (Campo: fecha_pago)
[2025-11-02 22:49:58] ✅ Fecha string convertida: 10/20/2023 -> 2023-10-20 (Campo: fecha_vencimiento)
[2025-11-02 22:49:58] ✅ Fecha string convertida: 12/7/2006 -> 2006-12-07 (Campo: fecha_susc)
[2025-11-02 22:49:58] ✅ Fecha string convertida: 6/1/2024 -> 2024-06-01 (Campo: fecha_asignacion)
[2025-11-02 22:49:58] ✅ Fecha string convertida: 1/27/2025 -> 2025-01-27 (Campo: fecha_proceso)
[2025-11-02 22:49:58] ✅ Fecha string convertida: 5/5/2024 -> 2024-05-05 (Campo: fecha_castigo)
[2025-11-02 22:49:58] ✅ Fecha string convertida: 11/21/2023 -> 2023-11-21 (Campo: fecha_pago)
[2025-11-02 22:49:58] ✅ Fecha string convertida: 11/5/2023 -> 2023-11-05 (Campo: fecha_vencimiento)
[2025-11-02 22:49:58] ✅ Fecha string convertida: 4/17/2008 -> 2008-04-17 (Campo: fecha_susc)
[2025-11-02 22:49:58] ✅ Fecha string convertida: 7/1/2024 -> 2024-07-01 (Campo: fecha_asignacion)
[2025-11-02 22:49:58] ✅ Fecha string convertida: 1/27/2025 -> 2025-01-27 (Campo: fecha_proceso)
[2025-11-02 22:49:58] ✅ Fecha string convertida: 5/30/2024 -> 2024-05-30 (Campo: fecha_castigo)
[2025-11-02 22:49:58] ✅ Fecha string convertida: 11/2/2023 -> 2023-11-02 (Campo: fecha_pago)
[2025-11-02 22:49:58] ✅ Fecha string convertida: 11/30/2023 -> 2023-11-30 (Campo: fecha_vencimiento)
[2025-11-02 22:49:58] ✅ Fecha string convertida: 9/25/2006 -> 2006-09-25 (Campo: fecha_susc)
[2025-11-02 22:49:58] ✅ Fecha string convertida: 7/1/2024 -> 2024-07-01 (Campo: fecha_asignacion)
[2025-11-02 22:49:58] ✅ Fecha string convertida: 1/27/2025 -> 2025-01-27 (Campo: fecha_proceso)
[2025-11-02 22:49:58] ✅ Fecha string convertida: 6/5/2024 -> 2024-06-05 (Campo: fecha_castigo)
[2025-11-02 22:49:58] ✅ Fecha string convertida: 3/21/2024 -> 2024-03-21 (Campo: fecha_pago)
[2025-11-02 22:49:58] ✅ Fecha string convertida: 12/5/2023 -> 2023-12-05 (Campo: fecha_vencimiento)
[2025-11-02 22:49:58] ✅ Fecha string convertida: 4/19/2015 -> 2015-04-19 (Campo: fecha_susc)
[2025-11-02 22:49:58] ✅ Fecha string convertida: 8/1/2024 -> 2024-08-01 (Campo: fecha_asignacion)
[2025-11-02 22:49:58] ✅ Fecha string convertida: 1/27/2025 -> 2025-01-27 (Campo: fecha_proceso)
[2025-11-02 22:49:58] ✅ Fecha string convertida: 6/5/2024 -> 2024-06-05 (Campo: fecha_castigo)
[2025-11-02 22:49:58] ✅ Fecha string convertida: 10/20/2023 -> 2023-10-20 (Campo: fecha_pago)
[2025-11-02 22:49:58] ✅ Fecha string convertida: 12/5/2023 -> 2023-12-05 (Campo: fecha_vencimiento)
[2025-11-02 22:49:58] ✅ Fecha string convertida: 10/12/2019 -> 2019-10-12 (Campo: fecha_susc)
[2025-11-02 22:49:58] ✅ Fecha string convertida: 8/1/2024 -> 2024-08-01 (Campo: fecha_asignacion)
[2025-11-02 22:49:58] ✅ Fecha string convertida: 1/27/2025 -> 2025-01-27 (Campo: fecha_proceso)
[2025-11-02 22:49:58] ✅ Fecha string convertida: 6/5/2024 -> 2024-06-05 (Campo: fecha_castigo)
[2025-11-02 22:49:58] ✅ Fecha string convertida: 10/25/2023 -> 2023-10-25 (Campo: fecha_pago)
[2025-11-02 22:49:58] ✅ Fecha string convertida: 12/5/2023 -> 2023-12-05 (Campo: fecha_vencimiento)
[2025-11-02 22:49:58] ✅ Fecha string convertida: 10/9/2009 -> 2009-10-09 (Campo: fecha_susc)
[2025-11-02 22:49:58] ✅ Fecha string convertida: 8/1/2024 -> 2024-08-01 (Campo: fecha_asignacion)
[2025-11-02 22:49:58] ✅ Fecha string convertida: 1/27/2025 -> 2025-01-27 (Campo: fecha_proceso)
[2025-11-02 22:49:58] ✅ Fecha string convertida: 6/5/2024 -> 2024-06-05 (Campo: fecha_castigo)
[2025-11-02 22:49:58] ✅ Fecha string convertida: 11/11/2023 -> 2023-11-11 (Campo: fecha_pago)
[2025-11-02 22:49:58] ✅ Fecha string convertida: 12/5/2023 -> 2023-12-05 (Campo: fecha_vencimiento)
[2025-11-02 22:49:58] ✅ Fecha string convertida: 11/14/2003 -> 2003-11-14 (Campo: fecha_susc)
[2025-11-02 22:49:58] ✅ Fecha string convertida: 8/1/2024 -> 2024-08-01 (Campo: fecha_asignacion)
[2025-11-02 22:49:58] ✅ Fecha string convertida: 1/27/2025 -> 2025-01-27 (Campo: fecha_proceso)
[2025-11-02 22:49:58] ✅ Fecha string convertida: 6/15/2024 -> 2024-06-15 (Campo: fecha_castigo)
[2025-11-02 22:49:58] ✅ Fecha string convertida: 2/12/2024 -> 2024-02-12 (Campo: fecha_pago)
[2025-11-02 22:49:58] ✅ Fecha string convertida: 12/15/2023 -> 2023-12-15 (Campo: fecha_vencimiento)
[2025-11-02 22:49:58] ✅ Fecha string convertida: 6/15/2006 -> 2006-06-15 (Campo: fecha_susc)
[2025-11-02 22:49:58] ✅ Fecha string convertida: 8/1/2024 -> 2024-08-01 (Campo: fecha_asignacion)
[2025-11-02 22:49:58] ✅ Fecha string convertida: 1/27/2025 -> 2025-01-27 (Campo: fecha_proceso)
[2025-11-02 22:49:58] ✅ Fecha string convertida: 7/5/2024 -> 2024-07-05 (Campo: fecha_castigo)
[2025-11-02 22:49:58] ✅ Fecha string convertida: 11/21/2023 -> 2023-11-21 (Campo: fecha_pago)
[2025-11-02 22:49:58] ✅ Fecha string convertida: 1/5/2024 -> 2024-01-05 (Campo: fecha_vencimiento)
[2025-11-02 22:49:58] ✅ Fecha string convertida: 4/12/2003 -> 2003-04-12 (Campo: fecha_susc)
[2025-11-02 22:49:58] ✅ Fecha string convertida: 9/1/2024 -> 2024-09-01 (Campo: fecha_asignacion)
[2025-11-02 22:49:58] ✅ Fecha string convertida: 1/27/2025 -> 2025-01-27 (Campo: fecha_proceso)
[2025-11-02 22:49:58] ✅ Fecha string convertida: 7/5/2024 -> 2024-07-05 (Campo: fecha_castigo)
[2025-11-02 22:49:58] ✅ Fecha string convertida: 12/4/2023 -> 2023-12-04 (Campo: fecha_pago)
[2025-11-02 22:49:58] ✅ Fecha string convertida: 1/5/2024 -> 2024-01-05 (Campo: fecha_vencimiento)
[2025-11-02 22:49:58] ✅ Fecha string convertida: 3/13/2011 -> 2011-03-13 (Campo: fecha_susc)
[2025-11-02 22:49:58] ✅ Fecha string convertida: 9/1/2024 -> 2024-09-01 (Campo: fecha_asignacion)
[2025-11-02 22:49:58] ✅ Fecha string convertida: 1/27/2025 -> 2025-01-27 (Campo: fecha_proceso)
[2025-11-02 22:49:58] ✅ Fecha string convertida: 7/5/2024 -> 2024-07-05 (Campo: fecha_castigo)
[2025-11-02 22:49:58] ✅ Fecha string convertida: 11/28/2023 -> 2023-11-28 (Campo: fecha_pago)
[2025-11-02 22:49:58] ✅ Fecha string convertida: 1/5/2024 -> 2024-01-05 (Campo: fecha_vencimiento)
[2025-11-02 22:49:58] ✅ Fecha string convertida: 6/8/2016 -> 2016-06-08 (Campo: fecha_susc)
[2025-11-02 22:49:58] ✅ Fecha string convertida: 9/1/2024 -> 2024-09-01 (Campo: fecha_asignacion)
[2025-11-02 22:49:58] ✅ Fecha string convertida: 1/27/2025 -> 2025-01-27 (Campo: fecha_proceso)
[2025-11-02 22:49:58] ✅ Fecha string convertida: 7/5/2024 -> 2024-07-05 (Campo: fecha_castigo)
[2025-11-02 22:49:58] ✅ Fecha string convertida: 1/5/2024 -> 2024-01-05 (Campo: fecha_pago)
[2025-11-02 22:49:58] ✅ Fecha string convertida: 1/5/2024 -> 2024-01-05 (Campo: fecha_vencimiento)
[2025-11-02 22:49:58] ✅ Fecha string convertida: 7/25/2023 -> 2023-07-25 (Campo: fecha_susc)
[2025-11-02 22:49:58] ✅ Fecha string convertida: 9/1/2024 -> 2024-09-01 (Campo: fecha_asignacion)
[2025-11-02 22:49:58] ✅ Fecha string convertida: 1/27/2025 -> 2025-01-27 (Campo: fecha_proceso)
[2025-11-02 22:49:58] ✅ Fecha string convertida: 7/5/2024 -> 2024-07-05 (Campo: fecha_castigo)
[2025-11-02 22:49:58] ✅ Fecha string convertida: 12/5/2023 -> 2023-12-05 (Campo: fecha_pago)
[2025-11-02 22:49:58] ✅ Fecha string convertida: 1/5/2024 -> 2024-01-05 (Campo: fecha_vencimiento)
[2025-11-02 22:49:58] ✅ Fecha string convertida: 3/2/2014 -> 2014-03-02 (Campo: fecha_susc)
[2025-11-02 22:49:58] ✅ Fecha string convertida: 9/1/2024 -> 2024-09-01 (Campo: fecha_asignacion)
[2025-11-02 22:49:58] ✅ Fecha string convertida: 1/27/2025 -> 2025-01-27 (Campo: fecha_proceso)
[2025-11-02 22:49:58] ✅ Fecha string convertida: 7/10/2024 -> 2024-07-10 (Campo: fecha_castigo)
[2025-11-02 22:49:58] ✅ Fecha string convertida: 12/8/2023 -> 2023-12-08 (Campo: fecha_pago)
[2025-11-02 22:49:58] ✅ Fecha string convertida: 1/10/2024 -> 2024-01-10 (Campo: fecha_vencimiento)
[2025-11-02 22:49:58] ✅ Fecha string convertida: 11/5/2020 -> 2020-11-05 (Campo: fecha_susc)
[2025-11-02 22:49:58] ✅ Fecha string convertida: 9/1/2024 -> 2024-09-01 (Campo: fecha_asignacion)
[2025-11-02 22:49:58] ✅ Fecha string convertida: 1/27/2025 -> 2025-01-27 (Campo: fecha_proceso)
[2025-11-02 22:49:58] ✅ Fecha string convertida: 7/20/2024 -> 2024-07-20 (Campo: fecha_castigo)
[2025-11-02 22:49:58] ✅ Fecha string convertida: 2/16/2024 -> 2024-02-16 (Campo: fecha_pago)
[2025-11-02 22:49:58] ✅ Fecha string convertida: 1/20/2024 -> 2024-01-20 (Campo: fecha_vencimiento)
[2025-11-02 22:49:58] ✅ Fecha string convertida: 5/27/2017 -> 2017-05-27 (Campo: fecha_susc)
[2025-11-02 22:49:58] ✅ Fecha string convertida: 9/1/2024 -> 2024-09-01 (Campo: fecha_asignacion)
[2025-11-02 22:49:58] ✅ Fecha string convertida: 1/27/2025 -> 2025-01-27 (Campo: fecha_proceso)
[2025-11-02 22:49:58] ✅ Fecha string convertida: 8/5/2024 -> 2024-08-05 (Campo: fecha_castigo)
[2025-11-02 22:49:58] ✅ Fecha string convertida: 12/13/2023 -> 2023-12-13 (Campo: fecha_pago)
[2025-11-02 22:49:58] ✅ Fecha string convertida: 2/5/2024 -> 2024-02-05 (Campo: fecha_vencimiento)
[2025-11-02 22:49:58] ✅ Fecha string convertida: 5/2/2016 -> 2016-05-02 (Campo: fecha_susc)
[2025-11-02 22:49:58] ✅ Fecha string convertida: 10/1/2024 -> 2024-10-01 (Campo: fecha_asignacion)
[2025-11-02 22:49:58] ✅ Fecha string convertida: 1/27/2025 -> 2025-01-27 (Campo: fecha_proceso)
[2025-11-02 22:49:58] ✅ Fecha string convertida: 8/5/2024 -> 2024-08-05 (Campo: fecha_castigo)
[2025-11-02 22:49:58] ✅ Fecha string convertida: 1/8/2024 -> 2024-01-08 (Campo: fecha_pago)
[2025-11-02 22:49:58] ✅ Fecha string convertida: 2/5/2024 -> 2024-02-05 (Campo: fecha_vencimiento)
[2025-11-02 22:49:58] ✅ Fecha string convertida: 7/8/2013 -> 2013-07-08 (Campo: fecha_susc)
[2025-11-02 22:49:58] ✅ Fecha string convertida: 10/1/2024 -> 2024-10-01 (Campo: fecha_asignacion)
[2025-11-02 22:49:58] ✅ Fecha string convertida: 1/27/2025 -> 2025-01-27 (Campo: fecha_proceso)
[2025-11-02 22:49:58] ✅ Fecha string convertida: 8/10/2024 -> 2024-08-10 (Campo: fecha_castigo)
[2025-11-02 22:49:58] ✅ Fecha string convertida: 4/1/2024 -> 2024-04-01 (Campo: fecha_pago)
[2025-11-02 22:49:58] ✅ Fecha string convertida: 2/10/2024 -> 2024-02-10 (Campo: fecha_vencimiento)
[2025-11-02 22:49:58] ✅ Fecha string convertida: 11/30/2017 -> 2017-11-30 (Campo: fecha_susc)
[2025-11-02 22:49:58] ✅ Fecha string convertida: 10/1/2024 -> 2024-10-01 (Campo: fecha_asignacion)
[2025-11-02 22:49:58] ✅ Fecha string convertida: 1/27/2025 -> 2025-01-27 (Campo: fecha_proceso)
[2025-11-02 22:49:58] ✅ Fecha string convertida: 8/29/2024 -> 2024-08-29 (Campo: fecha_castigo)
[2025-11-02 22:49:58] ✅ Fecha string convertida: 5/9/2024 -> 2024-05-09 (Campo: fecha_pago)
[2025-11-02 22:49:58] ✅ Fecha string convertida: 2/29/2024 -> 2024-02-29 (Campo: fecha_vencimiento)
[2025-11-02 22:49:58] ✅ Fecha string convertida: 6/20/1999 -> 1999-06-20 (Campo: fecha_susc)
[2025-11-02 22:49:58] ✅ Fecha string convertida: 10/1/2024 -> 2024-10-01 (Campo: fecha_asignacion)
[2025-11-02 22:49:58] ✅ Fecha string convertida: 1/27/2025 -> 2025-01-27 (Campo: fecha_proceso)
[2025-11-02 22:49:58] ✅ Fecha string convertida: 10/5/2024 -> 2024-10-05 (Campo: fecha_castigo)
[2025-11-02 22:49:58] ✅ Fecha string convertida: 3/8/2024 -> 2024-03-08 (Campo: fecha_pago)
[2025-11-02 22:49:58] ✅ Fecha string convertida: 4/5/2024 -> 2024-04-05 (Campo: fecha_vencimiento)
[2025-11-02 22:49:58] ✅ Fecha string convertida: 6/5/2022 -> 2022-06-05 (Campo: fecha_susc)
[2025-11-02 22:49:58] ✅ Fecha string convertida: 12/1/2024 -> 2024-12-01 (Campo: fecha_asignacion)
[2025-11-02 22:49:58] ✅ Fecha string convertida: 1/27/2025 -> 2025-01-27 (Campo: fecha_proceso)
[2025-11-02 22:49:58] ✅ Fecha string convertida: 10/5/2024 -> 2024-10-05 (Campo: fecha_castigo)
[2025-11-02 22:49:58] ✅ Fecha string convertida: 4/5/2024 -> 2024-04-05 (Campo: fecha_pago)
[2025-11-02 22:49:58] ✅ Fecha string convertida: 4/5/2024 -> 2024-04-05 (Campo: fecha_vencimiento)
[2025-11-02 22:49:58] ✅ Fecha string convertida: 1/27/2024 -> 2024-01-27 (Campo: fecha_susc)
[2025-11-02 22:49:58] ✅ Fecha string convertida: 12/1/2024 -> 2024-12-01 (Campo: fecha_asignacion)
[2025-11-02 22:49:58] ✅ Fecha string convertida: 1/27/2025 -> 2025-01-27 (Campo: fecha_proceso)
[2025-11-02 22:49:58] ✅ Fecha string convertida: 10/5/2024 -> 2024-10-05 (Campo: fecha_castigo)
[2025-11-02 22:49:58] ✅ Fecha string convertida: 3/1/2024 -> 2024-03-01 (Campo: fecha_pago)
[2025-11-02 22:49:58] ✅ Fecha string convertida: 4/5/2024 -> 2024-04-05 (Campo: fecha_vencimiento)
[2025-11-02 22:49:58] ✅ Fecha string convertida: 12/11/2023 -> 2023-12-11 (Campo: fecha_susc)
[2025-11-02 22:49:58] ✅ Fecha string convertida: 12/1/2024 -> 2024-12-01 (Campo: fecha_asignacion)
[2025-11-02 22:49:58] ✅ Fecha string convertida: 1/27/2025 -> 2025-01-27 (Campo: fecha_proceso)
[2025-11-02 22:49:58] ✅ Fecha string convertida: 10/5/2024 -> 2024-10-05 (Campo: fecha_castigo)
[2025-11-02 22:49:58] ✅ Fecha string convertida: 6/1/2024 -> 2024-06-01 (Campo: fecha_pago)
[2025-11-02 22:49:58] ✅ Fecha string convertida: 4/5/2024 -> 2024-04-05 (Campo: fecha_vencimiento)
[2025-11-02 22:49:58] ✅ Fecha string convertida: 1/18/2023 -> 2023-01-18 (Campo: fecha_susc)
[2025-11-02 22:49:58] ✅ Fecha string convertida: 12/1/2024 -> 2024-12-01 (Campo: fecha_asignacion)
[2025-11-02 22:49:58] ✅ Fecha string convertida: 1/27/2025 -> 2025-01-27 (Campo: fecha_proceso)
[2025-11-02 22:49:58] ✅ Fecha string convertida: 10/5/2024 -> 2024-10-05 (Campo: fecha_castigo)
[2025-11-02 22:49:58] ✅ Fecha string convertida: 3/7/2024 -> 2024-03-07 (Campo: fecha_pago)
[2025-11-02 22:49:58] ✅ Fecha string convertida: 4/5/2024 -> 2024-04-05 (Campo: fecha_vencimiento)
[2025-11-02 22:49:58] ✅ Fecha string convertida: 9/15/2019 -> 2019-09-15 (Campo: fecha_susc)
[2025-11-02 22:49:58] ✅ Fecha string convertida: 12/1/2024 -> 2024-12-01 (Campo: fecha_asignacion)
[2025-11-02 22:49:58] ✅ Fecha string convertida: 1/27/2025 -> 2025-01-27 (Campo: fecha_proceso)
[2025-11-02 22:49:58] ✅ Fecha string convertida: 10/5/2024 -> 2024-10-05 (Campo: fecha_castigo)
[2025-11-02 22:49:58] ✅ Fecha string convertida: 2/23/2024 -> 2024-02-23 (Campo: fecha_pago)
[2025-11-02 22:49:58] ✅ Fecha string convertida: 4/5/2024 -> 2024-04-05 (Campo: fecha_vencimiento)
[2025-11-02 22:49:58] ✅ Fecha string convertida: 12/14/2010 -> 2010-12-14 (Campo: fecha_susc)
[2025-11-02 22:49:58] ✅ Fecha string convertida: 12/1/2024 -> 2024-12-01 (Campo: fecha_asignacion)
[2025-11-02 22:49:58] ✅ Fecha string convertida: 1/27/2025 -> 2025-01-27 (Campo: fecha_proceso)
[2025-11-02 22:49:58] ✅ Fecha string convertida: 10/5/2024 -> 2024-10-05 (Campo: fecha_castigo)
[2025-11-02 22:49:58] ✅ Fecha string convertida: 3/5/2024 -> 2024-03-05 (Campo: fecha_pago)
[2025-11-02 22:49:58] ✅ Fecha string convertida: 4/5/2024 -> 2024-04-05 (Campo: fecha_vencimiento)
[2025-11-02 22:49:58] ✅ Fecha string convertida: 10/15/2023 -> 2023-10-15 (Campo: fecha_susc)
[2025-11-02 22:49:58] ✅ Fecha string convertida: 12/1/2024 -> 2024-12-01 (Campo: fecha_asignacion)
[2025-11-02 22:49:58] ✅ Fecha string convertida: 1/27/2025 -> 2025-01-27 (Campo: fecha_proceso)
[2025-11-02 22:49:58] ✅ Fecha string convertida: 10/10/2024 -> 2024-10-10 (Campo: fecha_castigo)
[2025-11-02 22:49:58] ✅ Fecha string convertida: 4/17/2024 -> 2024-04-17 (Campo: fecha_pago)
[2025-11-02 22:49:58] ✅ Fecha string convertida: 4/10/2024 -> 2024-04-10 (Campo: fecha_vencimiento)
[2025-11-02 22:49:58] ✅ Fecha string convertida: 9/14/2021 -> 2021-09-14 (Campo: fecha_susc)
[2025-11-02 22:49:58] ✅ Fecha string convertida: 12/1/2024 -> 2024-12-01 (Campo: fecha_asignacion)
[2025-11-02 22:49:58] ✅ Fecha string convertida: 1/27/2025 -> 2025-01-27 (Campo: fecha_proceso)
[2025-11-02 22:49:58] ✅ Fecha string convertida: 10/15/2024 -> 2024-10-15 (Campo: fecha_castigo)
[2025-11-02 22:49:58] ✅ Fecha string convertida: 3/27/2024 -> 2024-03-27 (Campo: fecha_pago)
[2025-11-02 22:49:58] ✅ Fecha string convertida: 4/15/2024 -> 2024-04-15 (Campo: fecha_vencimiento)
[2025-11-02 22:49:58] ✅ Fecha string convertida: 4/22/2022 -> 2022-04-22 (Campo: fecha_susc)
[2025-11-02 22:49:58] ✅ Fecha string convertida: 12/1/2024 -> 2024-12-01 (Campo: fecha_asignacion)
[2025-11-02 22:49:58] ✅ Fecha string convertida: 1/27/2025 -> 2025-01-27 (Campo: fecha_proceso)
[2025-11-02 22:49:58] ✅ Fecha string convertida: 10/15/2024 -> 2024-10-15 (Campo: fecha_castigo)
[2025-11-02 22:49:58] ✅ Fecha string convertida: 4/9/2024 -> 2024-04-09 (Campo: fecha_pago)
[2025-11-02 22:49:58] ✅ Fecha string convertida: 4/15/2024 -> 2024-04-15 (Campo: fecha_vencimiento)
[2025-11-02 22:49:58] ✅ Fecha string convertida: 9/2/2010 -> 2010-09-02 (Campo: fecha_susc)
[2025-11-02 22:49:58] ✅ Fecha string convertida: 12/1/2024 -> 2024-12-01 (Campo: fecha_asignacion)
[2025-11-02 22:49:58] ✅ Fecha string convertida: 1/27/2025 -> 2025-01-27 (Campo: fecha_proceso)
[2025-11-02 22:49:58] ✅ Fecha string convertida: 10/25/2024 -> 2024-10-25 (Campo: fecha_castigo)
[2025-11-02 22:49:58] ✅ Fecha string convertida: 4/4/2024 -> 2024-04-04 (Campo: fecha_pago)
[2025-11-02 22:49:58] ✅ Fecha string convertida: 4/25/2024 -> 2024-04-25 (Campo: fecha_vencimiento)
[2025-11-02 22:49:58] ✅ Fecha string convertida: 4/20/2007 -> 2007-04-20 (Campo: fecha_susc)
[2025-11-02 22:49:58] ✅ Fecha string convertida: 12/1/2024 -> 2024-12-01 (Campo: fecha_asignacion)
[2025-11-02 22:49:58] ✅ Fecha string convertida: 1/27/2025 -> 2025-01-27 (Campo: fecha_proceso)
[2025-11-02 22:49:58] ✅ Fecha string convertida: 10/25/2024 -> 2024-10-25 (Campo: fecha_castigo)
[2025-11-02 22:49:58] ✅ Fecha string convertida: 7/18/2024 -> 2024-07-18 (Campo: fecha_pago)
[2025-11-02 22:49:58] ✅ Fecha string convertida: 4/25/2024 -> 2024-04-25 (Campo: fecha_vencimiento)
[2025-11-02 22:49:58] ✅ Fecha string convertida: 8/19/2007 -> 2007-08-19 (Campo: fecha_susc)
[2025-11-02 22:49:58] ✅ Fecha string convertida: 12/1/2024 -> 2024-12-01 (Campo: fecha_asignacion)
[2025-11-02 22:49:58] ✅ Fecha string convertida: 1/27/2025 -> 2025-01-27 (Campo: fecha_proceso)
[2025-11-02 22:49:58] ✅ Fecha string convertida: 12/20/2019 -> 2019-12-20 (Campo: fecha_castigo)
[2025-11-02 22:49:58] ✅ Fecha string convertida: 6/20/2019 -> 2019-06-20 (Campo: fecha_vencimiento)
[2025-11-02 22:49:58] ✅ Fecha string convertida: 2/22/2012 -> 2012-02-22 (Campo: fecha_susc)
[2025-11-02 22:49:58] ✅ Fecha string convertida: 2/1/2020 -> 2020-02-01 (Campo: fecha_asignacion)
[2025-11-02 22:49:59] ✅ Fecha string convertida: 1/27/2025 -> 2025-01-27 (Campo: fecha_proceso)
[2025-11-02 22:49:59] ✅ Fecha string convertida: 3/10/2020 -> 2020-03-10 (Campo: fecha_castigo)
[2025-11-02 22:49:59] ✅ Fecha string convertida: 10/4/2022 -> 2022-10-04 (Campo: fecha_pago)
[2025-11-02 22:49:59] ✅ Fecha string convertida: 9/10/2019 -> 2019-09-10 (Campo: fecha_vencimiento)
[2025-11-02 22:49:59] ✅ Fecha string convertida: 4/20/2017 -> 2017-04-20 (Campo: fecha_susc)
[2025-11-02 22:49:59] ✅ Fecha string convertida: 5/1/2020 -> 2020-05-01 (Campo: fecha_asignacion)
[2025-11-02 22:49:59] ✅ Fecha string convertida: 1/27/2025 -> 2025-01-27 (Campo: fecha_proceso)
[2025-11-02 22:49:59] ✅ Fecha string convertida: 6/5/2020 -> 2020-06-05 (Campo: fecha_castigo)
[2025-11-02 22:49:59] ✅ Fecha string convertida: 8/18/2024 -> 2024-08-18 (Campo: fecha_pago)
[2025-11-02 22:49:59] ✅ Fecha string convertida: 12/5/2019 -> 2019-12-05 (Campo: fecha_vencimiento)
[2025-11-02 22:49:59] ✅ Fecha string convertida: 4/30/2007 -> 2007-04-30 (Campo: fecha_susc)
[2025-11-02 22:49:59] ✅ Fecha string convertida: 7/1/2020 -> 2020-07-01 (Campo: fecha_asignacion)
[2025-11-02 22:49:59] ✅ Fecha string convertida: 1/27/2025 -> 2025-01-27 (Campo: fecha_proceso)
[2025-11-02 22:49:59] ✅ Fecha string convertida: 6/15/2020 -> 2020-06-15 (Campo: fecha_castigo)
[2025-11-02 22:49:59] ✅ Fecha string convertida: 8/27/2024 -> 2024-08-27 (Campo: fecha_pago)
[2025-11-02 22:49:59] ✅ Fecha string convertida: 12/15/2019 -> 2019-12-15 (Campo: fecha_vencimiento)
[2025-11-02 22:49:59] ✅ Fecha string convertida: 2/10/2018 -> 2018-02-10 (Campo: fecha_susc)
[2025-11-02 22:49:59] ✅ Fecha string convertida: 8/1/2020 -> 2020-08-01 (Campo: fecha_asignacion)
[2025-11-02 22:49:59] ✅ Fecha string convertida: 1/27/2025 -> 2025-01-27 (Campo: fecha_proceso)
[2025-11-02 22:49:59] ✅ Fecha string convertida: 7/5/2020 -> 2020-07-05 (Campo: fecha_castigo)
[2025-11-02 22:49:59] ✅ Fecha string convertida: 11/4/2024 -> 2024-11-04 (Campo: fecha_pago)
[2025-11-02 22:49:59] ✅ Fecha string convertida: 1/5/2020 -> 2020-01-05 (Campo: fecha_vencimiento)
[2025-11-02 22:49:59] ✅ Fecha string convertida: 11/16/2015 -> 2015-11-16 (Campo: fecha_susc)
[2025-11-02 22:49:59] ✅ Fecha string convertida: 9/1/2020 -> 2020-09-01 (Campo: fecha_asignacion)
[2025-11-02 22:49:59] ✅ Fecha string convertida: 1/27/2025 -> 2025-01-27 (Campo: fecha_proceso)
[2025-11-02 22:49:59] ✅ Fecha string convertida: 9/5/2020 -> 2020-09-05 (Campo: fecha_castigo)
[2025-11-02 22:49:59] ✅ Fecha string convertida: 3/5/2020 -> 2020-03-05 (Campo: fecha_vencimiento)
[2025-11-02 22:49:59] ✅ Fecha string convertida: 6/8/2011 -> 2011-06-08 (Campo: fecha_susc)
[2025-11-02 22:49:59] ✅ Fecha string convertida: 11/1/2020 -> 2020-11-01 (Campo: fecha_asignacion)
[2025-11-02 22:49:59] ✅ Fecha string convertida: 1/27/2025 -> 2025-01-27 (Campo: fecha_proceso)
[2025-11-02 22:49:59] ✅ Fecha string convertida: 12/5/2020 -> 2020-12-05 (Campo: fecha_castigo)
[2025-11-02 22:49:59] ✅ Fecha string convertida: 5/24/2023 -> 2023-05-24 (Campo: fecha_pago)
[2025-11-02 22:49:59] ✅ Fecha string convertida: 6/5/2020 -> 2020-06-05 (Campo: fecha_vencimiento)
[2025-11-02 22:49:59] ✅ Fecha string convertida: 4/7/2016 -> 2016-04-07 (Campo: fecha_susc)
[2025-11-02 22:49:59] ✅ Fecha string convertida: 2/1/2021 -> 2021-02-01 (Campo: fecha_asignacion)
[2025-11-02 22:49:59] ✅ Fecha string convertida: 1/27/2025 -> 2025-01-27 (Campo: fecha_proceso)
[2025-11-02 22:49:59] ✅ Fecha string convertida: 1/10/2021 -> 2021-01-10 (Campo: fecha_castigo)
[2025-11-02 22:49:59] ✅ Fecha string convertida: 7/10/2020 -> 2020-07-10 (Campo: fecha_vencimiento)
[2025-11-02 22:49:59] ✅ Fecha string convertida: 2/21/2013 -> 2013-02-21 (Campo: fecha_susc)
[2025-11-02 22:49:59] ✅ Fecha string convertida: 3/1/2021 -> 2021-03-01 (Campo: fecha_asignacion)
[2025-11-02 22:49:59] ✅ Fecha string convertida: 1/27/2025 -> 2025-01-27 (Campo: fecha_proceso)
[2025-11-02 22:49:59] ✅ Fecha string convertida: 1/10/2021 -> 2021-01-10 (Campo: fecha_castigo)
[2025-11-02 22:49:59] ✅ DV con valor '0' - ES VÁLIDO
[2025-11-02 22:49:59] ✅ Fecha string convertida: 7/10/2020 -> 2020-07-10 (Campo: fecha_vencimiento)
[2025-11-02 22:49:59] ✅ Fecha string convertida: 12/19/2010 -> 2010-12-19 (Campo: fecha_susc)
[2025-11-02 22:49:59] ✅ Fecha string convertida: 3/1/2021 -> 2021-03-01 (Campo: fecha_asignacion)
[2025-11-02 22:49:59] ✅ Fecha string convertida: 1/27/2025 -> 2025-01-27 (Campo: fecha_proceso)
[2025-11-02 22:49:59] ✅ Fecha string convertida: 3/5/2021 -> 2021-03-05 (Campo: fecha_castigo)
[2025-11-02 22:49:59] ✅ Fecha string convertida: 9/5/2020 -> 2020-09-05 (Campo: fecha_vencimiento)
[2025-11-02 22:49:59] ✅ Fecha string convertida: 1/10/2005 -> 2005-01-10 (Campo: fecha_susc)
[2025-11-02 22:49:59] ✅ Fecha string convertida: 5/1/2021 -> 2021-05-01 (Campo: fecha_asignacion)
[2025-11-02 22:49:59] ✅ Fecha string convertida: 1/27/2025 -> 2025-01-27 (Campo: fecha_proceso)
[2025-11-02 22:49:59] ✅ Fecha string convertida: 3/5/2021 -> 2021-03-05 (Campo: fecha_castigo)
[2025-11-02 22:49:59] ✅ Fecha string convertida: 9/5/2020 -> 2020-09-05 (Campo: fecha_vencimiento)
[2025-11-02 22:49:59] ✅ Fecha string convertida: 3/1/2016 -> 2016-03-01 (Campo: fecha_susc)
[2025-11-02 22:49:59] ✅ Fecha string convertida: 5/1/2021 -> 2021-05-01 (Campo: fecha_asignacion)
[2025-11-02 22:49:59] ✅ Fecha string convertida: 1/27/2025 -> 2025-01-27 (Campo: fecha_proceso)
[2025-11-02 22:49:59] ✅ Fecha string convertida: 4/5/2021 -> 2021-04-05 (Campo: fecha_castigo)
[2025-11-02 22:49:59] ✅ Fecha string convertida: 10/5/2020 -> 2020-10-05 (Campo: fecha_vencimiento)
[2025-11-02 22:49:59] ✅ Fecha string convertida: 12/22/2017 -> 2017-12-22 (Campo: fecha_susc)
[2025-11-02 22:49:59] ✅ Fecha string convertida: 6/1/2021 -> 2021-06-01 (Campo: fecha_asignacion)
[2025-11-02 22:49:59] ✅ Fecha string convertida: 1/27/2025 -> 2025-01-27 (Campo: fecha_proceso)
[2025-11-02 22:49:59] ✅ Fecha string convertida: 10/5/2021 -> 2021-10-05 (Campo: fecha_castigo)
[2025-11-02 22:49:59] ✅ Fecha string convertida: 4/30/2022 -> 2022-04-30 (Campo: fecha_pago)
[2025-11-02 22:49:59] ✅ Fecha string convertida: 4/5/2021 -> 2021-04-05 (Campo: fecha_vencimiento)
[2025-11-02 22:49:59] ✅ Fecha string convertida: 5/29/2015 -> 2015-05-29 (Campo: fecha_susc)
[2025-11-02 22:49:59] ✅ Fecha string convertida: 12/1/2021 -> 2021-12-01 (Campo: fecha_asignacion)
[2025-11-02 22:49:59] ✅ Fecha string convertida: 1/27/2025 -> 2025-01-27 (Campo: fecha_proceso)
[2025-11-02 22:49:59] ✅ Fecha string convertida: 11/10/2021 -> 2021-11-10 (Campo: fecha_castigo)
[2025-11-02 22:49:59] ✅ Fecha string convertida: 5/10/2021 -> 2021-05-10 (Campo: fecha_vencimiento)
[2025-11-02 22:49:59] ✅ Fecha string convertida: 12/18/2018 -> 2018-12-18 (Campo: fecha_susc)
[2025-11-02 22:49:59] ✅ Fecha string convertida: 1/1/2022 -> 2022-01-01 (Campo: fecha_asignacion)
[2025-11-02 22:49:59] ✅ Fecha string convertida: 1/27/2025 -> 2025-01-27 (Campo: fecha_proceso)
[2025-11-02 22:49:59] ✅ Fecha string convertida: 12/5/2021 -> 2021-12-05 (Campo: fecha_castigo)
[2025-11-02 22:49:59] ✅ Fecha string convertida: 6/5/2021 -> 2021-06-05 (Campo: fecha_vencimiento)
[2025-11-02 22:49:59] ✅ Fecha string convertida: 3/18/2018 -> 2018-03-18 (Campo: fecha_susc)
[2025-11-02 22:49:59] ✅ Fecha string convertida: 2/1/2022 -> 2022-02-01 (Campo: fecha_asignacion)
[2025-11-02 22:49:59] ✅ Fecha string convertida: 1/27/2025 -> 2025-01-27 (Campo: fecha_proceso)
[2025-11-02 22:49:59] ✅ Fecha string convertida: 1/5/2022 -> 2022-01-05 (Campo: fecha_castigo)
[2025-11-02 22:49:59] ✅ Fecha string convertida: 7/5/2021 -> 2021-07-05 (Campo: fecha_vencimiento)
[2025-11-02 22:49:59] ✅ Fecha string convertida: 5/7/2015 -> 2015-05-07 (Campo: fecha_susc)
[2025-11-02 22:49:59] ✅ Fecha string convertida: 3/1/2022 -> 2022-03-01 (Campo: fecha_asignacion)
[2025-11-02 22:49:59] ✅ Fecha string convertida: 1/27/2025 -> 2025-01-27 (Campo: fecha_proceso)
[2025-11-02 22:49:59] ✅ Fecha string convertida: 1/15/2022 -> 2022-01-15 (Campo: fecha_castigo)
[2025-11-02 22:49:59] ✅ DV con valor '0' - ES VÁLIDO
[2025-11-02 22:49:59] ✅ Fecha string convertida: 7/15/2021 -> 2021-07-15 (Campo: fecha_vencimiento)
[2025-11-02 22:49:59] ✅ Fecha string convertida: 11/7/2010 -> 2010-11-07 (Campo: fecha_susc)
[2025-11-02 22:49:59] ✅ Fecha string convertida: 3/1/2022 -> 2022-03-01 (Campo: fecha_asignacion)
[2025-11-02 22:49:59] ✅ Fecha string convertida: 1/27/2025 -> 2025-01-27 (Campo: fecha_proceso)
[2025-11-02 22:49:59] ✅ Fecha string convertida: 2/5/2022 -> 2022-02-05 (Campo: fecha_castigo)
[2025-11-02 22:49:59] ✅ Fecha string convertida: 8/5/2021 -> 2021-08-05 (Campo: fecha_vencimiento)
[2025-11-02 22:49:59] ✅ Fecha string convertida: 5/7/2016 -> 2016-05-07 (Campo: fecha_susc)
[2025-11-02 22:49:59] ✅ Fecha string convertida: 4/1/2022 -> 2022-04-01 (Campo: fecha_asignacion)
[2025-11-02 22:49:59] ✅ Fecha string convertida: 1/27/2025 -> 2025-01-27 (Campo: fecha_proceso)
[2025-11-02 22:49:59] ✅ Fecha string convertida: 2/5/2022 -> 2022-02-05 (Campo: fecha_castigo)
[2025-11-02 22:49:59] ✅ Fecha string convertida: 8/5/2021 -> 2021-08-05 (Campo: fecha_vencimiento)
[2025-11-02 22:49:59] ✅ Fecha string convertida: 1/29/2021 -> 2021-01-29 (Campo: fecha_susc)
[2025-11-02 22:49:59] ✅ Valor convertido a DECIMAL: '0.66' -> 0.66
[2025-11-02 22:49:59] ✅ Fecha string convertida: 4/1/2022 -> 2022-04-01 (Campo: fecha_asignacion)
[2025-11-02 22:49:59] ✅ Fecha string convertida: 1/27/2025 -> 2025-01-27 (Campo: fecha_proceso)
[2025-11-02 22:49:59] ✅ Fecha string convertida: 2/5/2022 -> 2022-02-05 (Campo: fecha_castigo)
[2025-11-02 22:49:59] ✅ Fecha string convertida: 8/5/2021 -> 2021-08-05 (Campo: fecha_vencimiento)
[2025-11-02 22:49:59] ✅ Fecha string convertida: 11/15/2020 -> 2020-11-15 (Campo: fecha_susc)
[2025-11-02 22:49:59] ✅ Fecha string convertida: 4/1/2022 -> 2022-04-01 (Campo: fecha_asignacion)
[2025-11-02 22:49:59] ✅ Fecha string convertida: 1/27/2025 -> 2025-01-27 (Campo: fecha_proceso)
[2025-11-02 22:49:59] ✅ Fecha string convertida: 2/5/2022 -> 2022-02-05 (Campo: fecha_castigo)
[2025-11-02 22:49:59] ✅ Fecha string convertida: 8/5/2021 -> 2021-08-05 (Campo: fecha_vencimiento)
[2025-11-02 22:49:59] ✅ Fecha string convertida: 7/18/2015 -> 2015-07-18 (Campo: fecha_susc)
[2025-11-02 22:49:59] ✅ Fecha string convertida: 4/1/2022 -> 2022-04-01 (Campo: fecha_asignacion)
[2025-11-02 22:49:59] ✅ Fecha string convertida: 1/27/2025 -> 2025-01-27 (Campo: fecha_proceso)
[2025-11-02 22:49:59] ✅ Fecha string convertida: 3/10/2022 -> 2022-03-10 (Campo: fecha_castigo)
[2025-11-02 22:49:59] ✅ Fecha string convertida: 9/10/2021 -> 2021-09-10 (Campo: fecha_vencimiento)
[2025-11-02 22:49:59] ✅ Fecha string convertida: 12/9/2017 -> 2017-12-09 (Campo: fecha_susc)
[2025-11-02 22:49:59] ✅ Fecha string convertida: 4/1/2022 -> 2022-04-01 (Campo: fecha_asignacion)
[2025-11-02 22:49:59] ✅ Fecha string convertida: 1/27/2025 -> 2025-01-27 (Campo: fecha_proceso)
[2025-11-02 22:49:59] ✅ Fecha string convertida: 3/15/2022 -> 2022-03-15 (Campo: fecha_castigo)
[2025-11-02 22:49:59] ✅ Fecha string convertida: 9/15/2021 -> 2021-09-15 (Campo: fecha_vencimiento)
[2025-11-02 22:49:59] ✅ Fecha string convertida: 8/21/2019 -> 2019-08-21 (Campo: fecha_susc)
[2025-11-02 22:49:59] ✅ Fecha string convertida: 5/1/2022 -> 2022-05-01 (Campo: fecha_asignacion)
[2025-11-02 22:49:59] ✅ Fecha string convertida: 1/27/2025 -> 2025-01-27 (Campo: fecha_proceso)
[2025-11-02 22:49:59] ✅ Fecha string convertida: 3/30/2022 -> 2022-03-30 (Campo: fecha_castigo)
[2025-11-02 22:49:59] ✅ Fecha string convertida: 10/27/2022 -> 2022-10-27 (Campo: fecha_pago)
[2025-11-02 22:49:59] ✅ Fecha string convertida: 9/30/2021 -> 2021-09-30 (Campo: fecha_vencimiento)
[2025-11-02 22:49:59] ✅ Fecha string convertida: 12/20/2007 -> 2007-12-20 (Campo: fecha_susc)
[2025-11-02 22:49:59] ✅ Fecha string convertida: 1/1/2022 -> 2022-01-01 (Campo: fecha_asignacion)
[2025-11-02 22:49:59] ✅ Fecha string convertida: 1/27/2025 -> 2025-01-27 (Campo: fecha_proceso)
[2025-11-02 22:49:59] ✅ Fecha string convertida: 4/5/2022 -> 2022-04-05 (Campo: fecha_castigo)
[2025-11-02 22:49:59] ✅ Fecha string convertida: 2/2/2022 -> 2022-02-02 (Campo: fecha_pago)
[2025-11-02 22:49:59] ✅ Fecha string convertida: 10/5/2021 -> 2021-10-05 (Campo: fecha_vencimiento)
[2025-11-02 22:49:59] ✅ Fecha string convertida: 1/8/2016 -> 2016-01-08 (Campo: fecha_susc)
[2025-11-02 22:49:59] ✅ Fecha string convertida: 6/1/2022 -> 2022-06-01 (Campo: fecha_asignacion)
[2025-11-02 22:49:59] ✅ Fecha string convertida: 1/27/2025 -> 2025-01-27 (Campo: fecha_proceso)
[2025-11-02 22:49:59] ✅ Fecha string convertida: 4/10/2022 -> 2022-04-10 (Campo: fecha_castigo)
[2025-11-02 22:49:59] ✅ Fecha string convertida: 10/10/2021 -> 2021-10-10 (Campo: fecha_vencimiento)
[2025-11-02 22:49:59] ✅ Fecha string convertida: 6/17/2008 -> 2008-06-17 (Campo: fecha_susc)
[2025-11-02 22:49:59] ✅ Fecha string convertida: 6/1/2022 -> 2022-06-01 (Campo: fecha_asignacion)
[2025-11-02 22:49:59] ✅ Fecha string convertida: 1/27/2025 -> 2025-01-27 (Campo: fecha_proceso)
[2025-11-02 22:49:59] ✅ Fecha string convertida: 5/5/2022 -> 2022-05-05 (Campo: fecha_castigo)
[2025-11-02 22:49:59] ✅ Fecha string convertida: 6/29/2023 -> 2023-06-29 (Campo: fecha_pago)
[2025-11-02 22:49:59] ✅ Fecha string convertida: 11/5/2021 -> 2021-11-05 (Campo: fecha_vencimiento)
[2025-11-02 22:49:59] ✅ Fecha string convertida: 4/7/2005 -> 2005-04-07 (Campo: fecha_susc)
[2025-11-02 22:49:59] ✅ Fecha string convertida: 7/1/2022 -> 2022-07-01 (Campo: fecha_asignacion)
[2025-11-02 22:49:59] ✅ Fecha string convertida: 1/27/2025 -> 2025-01-27 (Campo: fecha_proceso)
[2025-11-02 22:49:59] ✅ Fecha string convertida: 5/5/2022 -> 2022-05-05 (Campo: fecha_castigo)
[2025-11-02 22:49:59] ✅ Fecha string convertida: 6/29/2023 -> 2023-06-29 (Campo: fecha_pago)
[2025-11-02 22:49:59] ✅ Fecha string convertida: 11/5/2021 -> 2021-11-05 (Campo: fecha_vencimiento)
[2025-11-02 22:49:59] ✅ Fecha string convertida: 9/14/2016 -> 2016-09-14 (Campo: fecha_susc)
[2025-11-02 22:49:59] ✅ Fecha string convertida: 7/1/2022 -> 2022-07-01 (Campo: fecha_asignacion)
[2025-11-02 22:49:59] ✅ Fecha string convertida: 1/27/2025 -> 2025-01-27 (Campo: fecha_proceso)
[2025-11-02 22:49:59] ✅ Fecha string convertida: 5/15/2022 -> 2022-05-15 (Campo: fecha_castigo)
[2025-11-02 22:49:59] ✅ Fecha string convertida: 12/2/2022 -> 2022-12-02 (Campo: fecha_pago)
[2025-11-02 22:49:59] ✅ Fecha string convertida: 11/15/2021 -> 2021-11-15 (Campo: fecha_vencimiento)
[2025-11-02 22:49:59] ✅ Fecha string convertida: 1/16/2021 -> 2021-01-16 (Campo: fecha_susc)
[2025-11-02 22:49:59] ✅ Fecha string convertida: 7/1/2022 -> 2022-07-01 (Campo: fecha_asignacion)
[2025-11-02 22:49:59] ✅ Fecha string convertida: 1/27/2025 -> 2025-01-27 (Campo: fecha_proceso)
[2025-11-02 22:49:59] ✅ Fecha string convertida: 7/5/2022 -> 2022-07-05 (Campo: fecha_castigo)
[2025-11-02 22:49:59] ✅ Fecha string convertida: 10/5/2024 -> 2024-10-05 (Campo: fecha_pago)
[2025-11-02 22:49:59] ✅ Fecha string convertida: 1/5/2022 -> 2022-01-05 (Campo: fecha_vencimiento)
[2025-11-02 22:49:59] ✅ Fecha string convertida: 11/24/2015 -> 2015-11-24 (Campo: fecha_susc)
[2025-11-02 22:49:59] ✅ Fecha string convertida: 9/1/2022 -> 2022-09-01 (Campo: fecha_asignacion)
[2025-11-02 22:49:59] ✅ Fecha string convertida: 1/27/2025 -> 2025-01-27 (Campo: fecha_proceso)
[2025-11-02 22:49:59] ✅ Fecha string convertida: 7/5/2022 -> 2022-07-05 (Campo: fecha_castigo)
[2025-11-02 22:49:59] ✅ Fecha string convertida: 6/30/2023 -> 2023-06-30 (Campo: fecha_pago)
[2025-11-02 22:49:59] ✅ Fecha string convertida: 1/5/2022 -> 2022-01-05 (Campo: fecha_vencimiento)
[2025-11-02 22:49:59] ✅ Fecha string convertida: 2/28/2015 -> 2015-02-28 (Campo: fecha_susc)
[2025-11-02 22:49:59] ✅ Fecha string convertida: 9/1/2022 -> 2022-09-01 (Campo: fecha_asignacion)
[2025-11-02 22:49:59] ✅ Fecha string convertida: 1/27/2025 -> 2025-01-27 (Campo: fecha_proceso)
[2025-11-02 22:49:59] ✅ Fecha string convertida: 7/5/2022 -> 2022-07-05 (Campo: fecha_castigo)
[2025-11-02 22:49:59] ✅ Fecha string convertida: 1/5/2022 -> 2022-01-05 (Campo: fecha_vencimiento)
[2025-11-02 22:49:59] ✅ Fecha string convertida: 7/16/2017 -> 2017-07-16 (Campo: fecha_susc)
[2025-11-02 22:49:59] ✅ Fecha string convertida: 9/1/2022 -> 2022-09-01 (Campo: fecha_asignacion)
[2025-11-02 22:49:59] ✅ Fecha string convertida: 1/27/2025 -> 2025-01-27 (Campo: fecha_proceso)
[2025-11-02 22:49:59] ✅ Fecha string convertida: 7/5/2022 -> 2022-07-05 (Campo: fecha_castigo)
[2025-11-02 22:49:59] ✅ Fecha string convertida: 12/11/2022 -> 2022-12-11 (Campo: fecha_pago)
[2025-11-02 22:49:59] ✅ Fecha string convertida: 1/5/2022 -> 2022-01-05 (Campo: fecha_vencimiento)
[2025-11-02 22:49:59] ✅ Fecha string convertida: 5/14/2016 -> 2016-05-14 (Campo: fecha_susc)
[2025-11-02 22:49:59] ✅ Fecha string convertida: 5/1/2022 -> 2022-05-01 (Campo: fecha_asignacion)
[2025-11-02 22:49:59] ✅ Fecha string convertida: 1/27/2025 -> 2025-01-27 (Campo: fecha_proceso)
[2025-11-02 22:49:59] ✅ Fecha string convertida: 7/10/2022 -> 2022-07-10 (Campo: fecha_castigo)
[2025-11-02 22:49:59] ✅ Fecha string convertida: 9/29/2024 -> 2024-09-29 (Campo: fecha_pago)
[2025-11-02 22:49:59] ✅ Fecha string convertida: 1/10/2022 -> 2022-01-10 (Campo: fecha_vencimiento)
[2025-11-02 22:49:59] ✅ Fecha string convertida: 10/13/2017 -> 2017-10-13 (Campo: fecha_susc)
[2025-11-02 22:49:59] ✅ Fecha string convertida: 9/1/2022 -> 2022-09-01 (Campo: fecha_asignacion)
[2025-11-02 22:49:59] ✅ Fecha string convertida: 1/27/2025 -> 2025-01-27 (Campo: fecha_proceso)
[2025-11-02 22:49:59] ✅ Fecha string convertida: 7/10/2022 -> 2022-07-10 (Campo: fecha_castigo)
[2025-11-02 22:49:59] ✅ Fecha string convertida: 1/10/2022 -> 2022-01-10 (Campo: fecha_vencimiento)
[2025-11-02 22:49:59] ✅ Fecha string convertida: 7/28/2018 -> 2018-07-28 (Campo: fecha_susc)
[2025-11-02 22:49:59] ✅ Fecha string convertida: 9/1/2022 -> 2022-09-01 (Campo: fecha_asignacion)
[2025-11-02 22:49:59] ✅ Fecha string convertida: 1/27/2025 -> 2025-01-27 (Campo: fecha_proceso)
[2025-11-02 22:49:59] ✅ Fecha string convertida: 8/5/2022 -> 2022-08-05 (Campo: fecha_castigo)
[2025-11-02 22:49:59] ✅ Fecha string convertida: 11/29/2024 -> 2024-11-29 (Campo: fecha_pago)
[2025-11-02 22:49:59] ✅ Fecha string convertida: 2/5/2022 -> 2022-02-05 (Campo: fecha_vencimiento)
[2025-11-02 22:49:59] ✅ Fecha string convertida: 4/14/2015 -> 2015-04-14 (Campo: fecha_susc)
[2025-11-02 22:49:59] ✅ Fecha string convertida: 6/1/2022 -> 2022-06-01 (Campo: fecha_asignacion)
[2025-11-02 22:49:59] ✅ Fecha string convertida: 1/27/2025 -> 2025-01-27 (Campo: fecha_proceso)
[2025-11-02 22:49:59] ✅ Fecha string convertida: 8/5/2022 -> 2022-08-05 (Campo: fecha_castigo)
[2025-11-02 22:49:59] ✅ Fecha string convertida: 1/14/2022 -> 2022-01-14 (Campo: fecha_pago)
[2025-11-02 22:49:59] ✅ Fecha string convertida: 2/5/2022 -> 2022-02-05 (Campo: fecha_vencimiento)
[2025-11-02 22:49:59] ✅ Fecha string convertida: 8/23/2019 -> 2019-08-23 (Campo: fecha_susc)
[2025-11-02 22:49:59] ✅ Fecha string convertida: 10/1/2022 -> 2022-10-01 (Campo: fecha_asignacion)
[2025-11-02 22:49:59] ✅ Fecha string convertida: 1/27/2025 -> 2025-01-27 (Campo: fecha_proceso)
[2025-11-02 22:49:59] ✅ Fecha string convertida: 8/5/2022 -> 2022-08-05 (Campo: fecha_castigo)
[2025-11-02 22:49:59] ✅ DV con valor '0' - ES VÁLIDO
[2025-11-02 22:49:59] ✅ Fecha string convertida: 1/17/2022 -> 2022-01-17 (Campo: fecha_pago)
[2025-11-02 22:49:59] ✅ Fecha string convertida: 2/5/2022 -> 2022-02-05 (Campo: fecha_vencimiento)
[2025-11-02 22:49:59] ✅ Fecha string convertida: 12/26/2014 -> 2014-12-26 (Campo: fecha_susc)
[2025-11-02 22:49:59] ✅ Fecha string convertida: 10/1/2022 -> 2022-10-01 (Campo: fecha_asignacion)
[2025-11-02 22:49:59] ✅ Fecha string convertida: 1/27/2025 -> 2025-01-27 (Campo: fecha_proceso)
[2025-11-02 22:49:59] ✅ Fecha string convertida: 8/5/2022 -> 2022-08-05 (Campo: fecha_castigo)
[2025-11-02 22:49:59] ✅ Fecha string convertida: 1/5/2022 -> 2022-01-05 (Campo: fecha_pago)
[2025-11-02 22:49:59] ✅ Fecha string convertida: 2/5/2022 -> 2022-02-05 (Campo: fecha_vencimiento)
[2025-11-02 22:49:59] ✅ Fecha string convertida: 11/17/2012 -> 2012-11-17 (Campo: fecha_susc)
[2025-11-02 22:49:59] ✅ Fecha string convertida: 10/1/2022 -> 2022-10-01 (Campo: fecha_asignacion)
[2025-11-02 22:49:59] ✅ Fecha string convertida: 1/27/2025 -> 2025-01-27 (Campo: fecha_proceso)
[2025-11-02 22:49:59] ✅ Fecha string convertida: 8/10/2022 -> 2022-08-10 (Campo: fecha_castigo)
[2025-11-02 22:49:59] ✅ DV con valor '0' - ES VÁLIDO
[2025-11-02 22:49:59] ✅ Fecha string convertida: 3/7/2024 -> 2024-03-07 (Campo: fecha_pago)
[2025-11-02 22:49:59] ✅ Fecha string convertida: 2/10/2022 -> 2022-02-10 (Campo: fecha_vencimiento)
[2025-11-02 22:49:59] ✅ Fecha string convertida: 1/31/2001 -> 2001-01-31 (Campo: fecha_susc)
[2025-11-02 22:49:59] ✅ Fecha string convertida: 10/1/2022 -> 2022-10-01 (Campo: fecha_asignacion)
[2025-11-02 22:49:59] ✅ Fecha string convertida: 1/27/2025 -> 2025-01-27 (Campo: fecha_proceso)
[2025-11-02 22:49:59] ✅ Fecha string convertida: 8/10/2022 -> 2022-08-10 (Campo: fecha_castigo)
[2025-11-02 22:49:59] ✅ Fecha string convertida: 2/10/2022 -> 2022-02-10 (Campo: fecha_pago)
[2025-11-02 22:49:59] ✅ Fecha string convertida: 2/10/2022 -> 2022-02-10 (Campo: fecha_vencimiento)
[2025-11-02 22:49:59] ✅ Fecha string convertida: 12/4/2020 -> 2020-12-04 (Campo: fecha_susc)
[2025-11-02 22:49:59] ✅ Fecha string convertida: 10/1/2022 -> 2022-10-01 (Campo: fecha_asignacion)
[2025-11-02 22:49:59] ✅ Fecha string convertida: 1/27/2025 -> 2025-01-27 (Campo: fecha_proceso)
[2025-11-02 22:49:59] ✅ Fecha string convertida: 8/10/2022 -> 2022-08-10 (Campo: fecha_castigo)
[2025-11-02 22:49:59] ✅ Fecha string convertida: 1/18/2022 -> 2022-01-18 (Campo: fecha_pago)
[2025-11-02 22:49:59] ✅ Fecha string convertida: 2/10/2022 -> 2022-02-10 (Campo: fecha_vencimiento)
[2025-11-02 22:49:59] ✅ Fecha string convertida: 12/21/2020 -> 2020-12-21 (Campo: fecha_susc)
[2025-11-02 22:49:59] ✅ Fecha string convertida: 10/1/2022 -> 2022-10-01 (Campo: fecha_asignacion)
[2025-11-02 22:49:59] ✅ Fecha string convertida: 1/27/2025 -> 2025-01-27 (Campo: fecha_proceso)
[2025-11-02 22:49:59] ✅ Fecha string convertida: 8/10/2022 -> 2022-08-10 (Campo: fecha_castigo)
[2025-11-02 22:49:59] ✅ Fecha string convertida: 1/10/2022 -> 2022-01-10 (Campo: fecha_pago)
[2025-11-02 22:49:59] ✅ Fecha string convertida: 2/10/2022 -> 2022-02-10 (Campo: fecha_vencimiento)
[2025-11-02 22:49:59] ✅ Fecha string convertida: 7/27/2017 -> 2017-07-27 (Campo: fecha_susc)
[2025-11-02 22:49:59] ✅ Fecha string convertida: 10/1/2022 -> 2022-10-01 (Campo: fecha_asignacion)
[2025-11-02 22:49:59] ✅ Fecha string convertida: 1/27/2025 -> 2025-01-27 (Campo: fecha_proceso)
[2025-11-02 22:49:59] ✅ Fecha string convertida: 8/25/2022 -> 2022-08-25 (Campo: fecha_castigo)
[2025-11-02 22:49:59] ✅ Fecha string convertida: 3/22/2023 -> 2023-03-22 (Campo: fecha_pago)
[2025-11-02 22:49:59] ✅ Fecha string convertida: 2/25/2022 -> 2022-02-25 (Campo: fecha_vencimiento)
[2025-11-02 22:49:59] ✅ Fecha string convertida: 5/25/2021 -> 2021-05-25 (Campo: fecha_susc)
[2025-11-02 22:49:59] ✅ Fecha string convertida: 10/1/2022 -> 2022-10-01 (Campo: fecha_asignacion)
[2025-11-02 22:49:59] ✅ Fecha string convertida: 1/27/2025 -> 2025-01-27 (Campo: fecha_proceso)
[2025-11-02 22:49:59] ✅ Fecha string convertida: 9/5/2022 -> 2022-09-05 (Campo: fecha_castigo)
[2025-11-02 22:49:59] ✅ Fecha string convertida: 7/9/2023 -> 2023-07-09 (Campo: fecha_pago)
[2025-11-02 22:49:59] ✅ Fecha string convertida: 3/5/2022 -> 2022-03-05 (Campo: fecha_vencimiento)
[2025-11-02 22:49:59] ✅ Fecha string convertida: 5/5/2013 -> 2013-05-05 (Campo: fecha_susc)
[2025-11-02 22:49:59] ✅ Fecha string convertida: 11/1/2022 -> 2022-11-01 (Campo: fecha_asignacion)
[2025-11-02 22:49:59] ✅ Fecha string convertida: 1/27/2025 -> 2025-01-27 (Campo: fecha_proceso)
[2025-11-02 22:49:59] ✅ Fecha string convertida: 10/5/2022 -> 2022-10-05 (Campo: fecha_castigo)
[2025-11-02 22:49:59] ✅ Fecha string convertida: 5/11/2022 -> 2022-05-11 (Campo: fecha_pago)
[2025-11-02 22:49:59] ✅ Fecha string convertida: 4/5/2022 -> 2022-04-05 (Campo: fecha_vencimiento)
[2025-11-02 22:49:59] ✅ Fecha string convertida: 7/9/2018 -> 2018-07-09 (Campo: fecha_susc)
[2025-11-02 22:49:59] ✅ Fecha string convertida: 12/1/2022 -> 2022-12-01 (Campo: fecha_asignacion)
[2025-11-02 22:49:59] ✅ Fecha string convertida: 1/27/2025 -> 2025-01-27 (Campo: fecha_proceso)
[2025-11-02 22:49:59] ✅ Fecha string convertida: 10/5/2022 -> 2022-10-05 (Campo: fecha_castigo)
[2025-11-02 22:49:59] ✅ Fecha string convertida: 4/14/2022 -> 2022-04-14 (Campo: fecha_pago)
[2025-11-02 22:49:59] ✅ Fecha string convertida: 4/5/2022 -> 2022-04-05 (Campo: fecha_vencimiento)
[2025-11-02 22:49:59] ✅ Fecha string convertida: 2/28/2019 -> 2019-02-28 (Campo: fecha_susc)
[2025-11-02 22:49:59] ✅ Fecha string convertida: 12/1/2022 -> 2022-12-01 (Campo: fecha_asignacion)
[2025-11-02 22:49:59] ✅ Fecha string convertida: 1/27/2025 -> 2025-01-27 (Campo: fecha_proceso)
[2025-11-02 22:49:59] ✅ Fecha string convertida: 10/5/2022 -> 2022-10-05 (Campo: fecha_castigo)
[2025-11-02 22:49:59] ✅ Fecha string convertida: 2/6/2024 -> 2024-02-06 (Campo: fecha_pago)
[2025-11-02 22:49:59] ✅ Fecha string convertida: 4/5/2022 -> 2022-04-05 (Campo: fecha_vencimiento)
[2025-11-02 22:49:59] ✅ Fecha string convertida: 12/12/2015 -> 2015-12-12 (Campo: fecha_susc)
[2025-11-02 22:49:59] ✅ Fecha string convertida: 12/1/2022 -> 2022-12-01 (Campo: fecha_asignacion)
[2025-11-02 22:49:59] ✅ Fecha string convertida: 1/27/2025 -> 2025-01-27 (Campo: fecha_proceso)
[2025-11-02 22:49:59] ✅ Fecha string convertida: 10/5/2022 -> 2022-10-05 (Campo: fecha_castigo)
[2025-11-02 22:49:59] ✅ Fecha string convertida: 3/5/2022 -> 2022-03-05 (Campo: fecha_pago)
[2025-11-02 22:49:59] ✅ Fecha string convertida: 4/5/2022 -> 2022-04-05 (Campo: fecha_vencimiento)
[2025-11-02 22:49:59] ✅ Fecha string convertida: 7/15/2016 -> 2016-07-15 (Campo: fecha_susc)
[2025-11-02 22:49:59] ✅ Fecha string convertida: 12/1/2022 -> 2022-12-01 (Campo: fecha_asignacion)
[2025-11-02 22:49:59] ✅ Fecha string convertida: 1/27/2025 -> 2025-01-27 (Campo: fecha_proceso)
[2025-11-02 22:49:59] ✅ Fecha string convertida: 10/10/2022 -> 2022-10-10 (Campo: fecha_castigo)
[2025-11-02 22:49:59] ✅ Fecha string convertida: 2/3/2022 -> 2022-02-03 (Campo: fecha_pago)
[2025-11-02 22:49:59] ✅ Fecha string convertida: 4/10/2022 -> 2022-04-10 (Campo: fecha_vencimiento)
[2025-11-02 22:49:59] ✅ Fecha string convertida: 6/15/2019 -> 2019-06-15 (Campo: fecha_susc)
[2025-11-02 22:49:59] ✅ Fecha string convertida: 12/1/2022 -> 2022-12-01 (Campo: fecha_asignacion)
[2025-11-02 22:49:59] ✅ Fecha string convertida: 1/27/2025 -> 2025-01-27 (Campo: fecha_proceso)
[2025-11-02 22:49:59] ✅ Fecha string convertida: 10/25/2022 -> 2022-10-25 (Campo: fecha_castigo)
[2025-11-02 22:49:59] ✅ Fecha string convertida: 3/22/2022 -> 2022-03-22 (Campo: fecha_pago)
[2025-11-02 22:49:59] ✅ Fecha string convertida: 4/25/2022 -> 2022-04-25 (Campo: fecha_vencimiento)
[2025-11-02 22:49:59] ✅ Fecha string convertida: 12/11/2011 -> 2011-12-11 (Campo: fecha_susc)
[2025-11-02 22:49:59] ✅ Fecha string convertida: 12/1/2022 -> 2022-12-01 (Campo: fecha_asignacion)
[2025-11-02 22:49:59] ✅ Fecha string convertida: 1/27/2025 -> 2025-01-27 (Campo: fecha_proceso)
[2025-11-02 22:49:59] ✅ Fecha string convertida: 11/5/2022 -> 2022-11-05 (Campo: fecha_castigo)
[2025-11-02 22:49:59] ✅ Fecha string convertida: 11/7/2024 -> 2024-11-07 (Campo: fecha_pago)
[2025-11-02 22:49:59] ✅ Fecha string convertida: 5/5/2022 -> 2022-05-05 (Campo: fecha_vencimiento)
[2025-11-02 22:49:59] ✅ Fecha string convertida: 12/11/2016 -> 2016-12-11 (Campo: fecha_susc)
[2025-11-02 22:49:59] ✅ Fecha string convertida: 1/1/2023 -> 2023-01-01 (Campo: fecha_asignacion)
[2025-11-02 22:49:59] ✅ Fecha string convertida: 1/27/2025 -> 2025-01-27 (Campo: fecha_proceso)
[2025-11-02 22:49:59] ✅ Fecha string convertida: 11/5/2022 -> 2022-11-05 (Campo: fecha_castigo)
[2025-11-02 22:50:00] ✅ Fecha string convertida: 5/31/2023 -> 2023-05-31 (Campo: fecha_pago)
[2025-11-02 22:50:00] ✅ Fecha string convertida: 5/5/2022 -> 2022-05-05 (Campo: fecha_vencimiento)
[2025-11-02 22:50:00] ✅ Fecha string convertida: 8/25/2011 -> 2011-08-25 (Campo: fecha_susc)
[2025-11-02 22:50:00] ✅ Fecha string convertida: 1/1/2023 -> 2023-01-01 (Campo: fecha_asignacion)
[2025-11-02 22:50:00] ✅ Fecha string convertida: 1/27/2025 -> 2025-01-27 (Campo: fecha_proceso)
[2025-11-02 22:50:00] ✅ Fecha string convertida: 11/5/2022 -> 2022-11-05 (Campo: fecha_castigo)
[2025-11-02 22:50:00] ✅ Fecha string convertida: 6/10/2023 -> 2023-06-10 (Campo: fecha_pago)
[2025-11-02 22:50:00] ✅ Fecha string convertida: 5/5/2022 -> 2022-05-05 (Campo: fecha_vencimiento)
[2025-11-02 22:50:00] ✅ Fecha string convertida: 12/17/2015 -> 2015-12-17 (Campo: fecha_susc)
[2025-11-02 22:50:00] ✅ Fecha string convertida: 1/1/2023 -> 2023-01-01 (Campo: fecha_asignacion)
[2025-11-02 22:50:00] ✅ Fecha string convertida: 1/27/2025 -> 2025-01-27 (Campo: fecha_proceso)
[2025-11-02 22:50:00] ✅ Fecha string convertida: 11/5/2022 -> 2022-11-05 (Campo: fecha_castigo)
[2025-11-02 22:50:00] ✅ Fecha string convertida: 5/5/2022 -> 2022-05-05 (Campo: fecha_pago)
[2025-11-02 22:50:00] ✅ Fecha string convertida: 5/5/2022 -> 2022-05-05 (Campo: fecha_vencimiento)
[2025-11-02 22:50:00] ✅ Fecha string convertida: 9/29/2018 -> 2018-09-29 (Campo: fecha_susc)
[2025-11-02 22:50:00] ✅ Fecha string convertida: 1/1/2023 -> 2023-01-01 (Campo: fecha_asignacion)
[2025-11-02 22:50:00] ✅ Fecha string convertida: 1/27/2025 -> 2025-01-27 (Campo: fecha_proceso)
[2025-11-02 22:50:00] ✅ Fecha string convertida: 11/5/2022 -> 2022-11-05 (Campo: fecha_castigo)
[2025-11-02 22:50:00] ✅ Fecha string convertida: 2/3/2022 -> 2022-02-03 (Campo: fecha_pago)
[2025-11-02 22:50:00] ✅ Fecha string convertida: 5/5/2022 -> 2022-05-05 (Campo: fecha_vencimiento)
[2025-11-02 22:50:00] ✅ Fecha string convertida: 4/21/2018 -> 2018-04-21 (Campo: fecha_susc)
[2025-11-02 22:50:00] ✅ Fecha string convertida: 1/1/2023 -> 2023-01-01 (Campo: fecha_asignacion)
[2025-11-02 22:50:00] ✅ Fecha string convertida: 1/27/2025 -> 2025-01-27 (Campo: fecha_proceso)
[2025-11-02 22:50:00] ✅ Fecha string convertida: 11/5/2022 -> 2022-11-05 (Campo: fecha_castigo)
[2025-11-02 22:50:00] ✅ Fecha string convertida: 7/1/2022 -> 2022-07-01 (Campo: fecha_pago)
[2025-11-02 22:50:00] ✅ Fecha string convertida: 5/5/2022 -> 2022-05-05 (Campo: fecha_vencimiento)
[2025-11-02 22:50:00] ✅ Fecha string convertida: 4/2/2016 -> 2016-04-02 (Campo: fecha_susc)
[2025-11-02 22:50:00] ✅ Fecha string convertida: 1/1/2023 -> 2023-01-01 (Campo: fecha_asignacion)
[2025-11-02 22:50:00] ✅ Fecha string convertida: 1/27/2025 -> 2025-01-27 (Campo: fecha_proceso)
[2025-11-02 22:50:00] ✅ Fecha string convertida: 11/10/2022 -> 2022-11-10 (Campo: fecha_castigo)
[2025-11-02 22:50:00] ✅ Fecha string convertida: 8/9/2022 -> 2022-08-09 (Campo: fecha_pago)
[2025-11-02 22:50:00] ✅ Fecha string convertida: 5/10/2022 -> 2022-05-10 (Campo: fecha_vencimiento)
[2025-11-02 22:50:00] ✅ Fecha string convertida: 11/30/2018 -> 2018-11-30 (Campo: fecha_susc)
[2025-11-02 22:50:00] ✅ Fecha string convertida: 1/1/2023 -> 2023-01-01 (Campo: fecha_asignacion)
[2025-11-02 22:50:00] ✅ Fecha string convertida: 1/27/2025 -> 2025-01-27 (Campo: fecha_proceso)
[2025-11-02 22:50:00] ✅ Fecha string convertida: 11/15/2022 -> 2022-11-15 (Campo: fecha_castigo)
[2025-11-02 22:50:00] ✅ Fecha string convertida: 3/6/2022 -> 2022-03-06 (Campo: fecha_pago)
[2025-11-02 22:50:00] ✅ Fecha string convertida: 5/15/2022 -> 2022-05-15 (Campo: fecha_vencimiento)
[2025-11-02 22:50:00] ✅ Fecha string convertida: 4/26/2013 -> 2013-04-26 (Campo: fecha_susc)
[2025-11-02 22:50:00] ✅ Fecha string convertida: 9/1/2022 -> 2022-09-01 (Campo: fecha_asignacion)
[2025-11-02 22:50:00] ✅ Fecha string convertida: 1/27/2025 -> 2025-01-27 (Campo: fecha_proceso)
[2025-11-02 22:50:00] ✅ Fecha string convertida: 11/25/2022 -> 2022-11-25 (Campo: fecha_castigo)
[2025-11-02 22:50:00] ✅ Fecha string convertida: 5/9/2022 -> 2022-05-09 (Campo: fecha_pago)
[2025-11-02 22:50:00] ✅ Fecha string convertida: 5/25/2022 -> 2022-05-25 (Campo: fecha_vencimiento)
[2025-11-02 22:50:00] ✅ Fecha string convertida: 8/7/2017 -> 2017-08-07 (Campo: fecha_susc)
[2025-11-02 22:50:00] ✅ Fecha string convertida: 1/1/2023 -> 2023-01-01 (Campo: fecha_asignacion)
[2025-11-02 22:50:00] ✅ Fecha string convertida: 1/27/2025 -> 2025-01-27 (Campo: fecha_proceso)
[2025-11-02 22:50:00] ✅ Fecha string convertida: 11/25/2022 -> 2022-11-25 (Campo: fecha_castigo)
[2025-11-02 22:50:00] ✅ Fecha string convertida: 7/9/2022 -> 2022-07-09 (Campo: fecha_pago)
[2025-11-02 22:50:00] ✅ Fecha string convertida: 5/25/2022 -> 2022-05-25 (Campo: fecha_vencimiento)
[2025-11-02 22:50:00] ✅ Fecha string convertida: 3/22/2006 -> 2006-03-22 (Campo: fecha_susc)
[2025-11-02 22:50:00] ✅ Fecha string convertida: 9/1/2022 -> 2022-09-01 (Campo: fecha_asignacion)
[2025-11-02 22:50:00] ✅ Fecha string convertida: 1/27/2025 -> 2025-01-27 (Campo: fecha_proceso)
[2025-11-02 22:50:00] ✅ Fecha string convertida: 12/5/2022 -> 2022-12-05 (Campo: fecha_castigo)
[2025-11-02 22:50:00] ✅ Fecha string convertida: 7/6/2022 -> 2022-07-06 (Campo: fecha_pago)
[2025-11-02 22:50:00] ✅ Fecha string convertida: 6/5/2022 -> 2022-06-05 (Campo: fecha_vencimiento)
[2025-11-02 22:50:00] ✅ Fecha string convertida: 11/24/2020 -> 2020-11-24 (Campo: fecha_susc)
[2025-11-02 22:50:00] ✅ Fecha string convertida: 2/1/2023 -> 2023-02-01 (Campo: fecha_asignacion)
[2025-11-02 22:50:00] ✅ Fecha string convertida: 1/27/2025 -> 2025-01-27 (Campo: fecha_proceso)
[2025-11-02 22:50:00] ✅ Fecha string convertida: 12/5/2022 -> 2022-12-05 (Campo: fecha_castigo)
[2025-11-02 22:50:00] ✅ Fecha string convertida: 5/23/2022 -> 2022-05-23 (Campo: fecha_pago)
[2025-11-02 22:50:00] ✅ Fecha string convertida: 6/5/2022 -> 2022-06-05 (Campo: fecha_vencimiento)
[2025-11-02 22:50:00] ✅ Fecha string convertida: 12/26/2016 -> 2016-12-26 (Campo: fecha_susc)
[2025-11-02 22:50:00] ✅ Fecha string convertida: 2/1/2023 -> 2023-02-01 (Campo: fecha_asignacion)
[2025-11-02 22:50:00] ✅ Fecha string convertida: 1/27/2025 -> 2025-01-27 (Campo: fecha_proceso)
[2025-11-02 22:50:00] ✅ Fecha string convertida: 12/10/2022 -> 2022-12-10 (Campo: fecha_castigo)
[2025-11-02 22:50:00] ✅ Fecha string convertida: 5/18/2022 -> 2022-05-18 (Campo: fecha_pago)
[2025-11-02 22:50:00] ✅ Fecha string convertida: 6/10/2022 -> 2022-06-10 (Campo: fecha_vencimiento)
[2025-11-02 22:50:00] ✅ Fecha string convertida: 9/30/2004 -> 2004-09-30 (Campo: fecha_susc)
[2025-11-02 22:50:00] ✅ Fecha string convertida: 2/1/2023 -> 2023-02-01 (Campo: fecha_asignacion)
[2025-11-02 22:50:00] ✅ Fecha string convertida: 1/27/2025 -> 2025-01-27 (Campo: fecha_proceso)
[2025-11-02 22:50:00] ✅ Fecha string convertida: 12/15/2022 -> 2022-12-15 (Campo: fecha_castigo)
[2025-11-02 22:50:00] ✅ Fecha string convertida: 7/2/2022 -> 2022-07-02 (Campo: fecha_pago)
[2025-11-02 22:50:00] ✅ Fecha string convertida: 6/15/2022 -> 2022-06-15 (Campo: fecha_vencimiento)
[2025-11-02 22:50:00] ✅ Fecha string convertida: 4/24/2018 -> 2018-04-24 (Campo: fecha_susc)
[2025-11-02 22:50:00] ✅ Fecha string convertida: 10/1/2022 -> 2022-10-01 (Campo: fecha_asignacion)
[2025-11-02 22:50:00] ✅ Fecha string convertida: 1/27/2025 -> 2025-01-27 (Campo: fecha_proceso)
[2025-11-02 22:50:00] ✅ Fecha string convertida: 12/15/2022 -> 2022-12-15 (Campo: fecha_castigo)
[2025-11-02 22:50:00] ✅ Fecha string convertida: 5/25/2022 -> 2022-05-25 (Campo: fecha_pago)
[2025-11-02 22:50:00] ✅ Fecha string convertida: 6/15/2022 -> 2022-06-15 (Campo: fecha_vencimiento)
[2025-11-02 22:50:00] ✅ Fecha string convertida: 9/8/2008 -> 2008-09-08 (Campo: fecha_susc)
[2025-11-02 22:50:00] ✅ Fecha string convertida: 2/1/2023 -> 2023-02-01 (Campo: fecha_asignacion)
[2025-11-02 22:50:00] ✅ Fecha string convertida: 1/27/2025 -> 2025-01-27 (Campo: fecha_proceso)
[2025-11-02 22:50:00] ✅ Fecha string convertida: 1/5/2023 -> 2023-01-05 (Campo: fecha_castigo)
[2025-11-02 22:50:00] ✅ Fecha string convertida: 6/10/2024 -> 2024-06-10 (Campo: fecha_pago)
[2025-11-02 22:50:00] ✅ Fecha string convertida: 7/5/2022 -> 2022-07-05 (Campo: fecha_vencimiento)
[2025-11-02 22:50:00] ✅ Fecha string convertida: 9/9/2011 -> 2011-09-09 (Campo: fecha_susc)
[2025-11-02 22:50:00] ✅ Fecha string convertida: 3/1/2023 -> 2023-03-01 (Campo: fecha_asignacion)
[2025-11-02 22:50:00] ✅ Fecha string convertida: 1/27/2025 -> 2025-01-27 (Campo: fecha_proceso)
[2025-11-02 22:50:00] ✅ Fecha string convertida: 1/10/2023 -> 2023-01-10 (Campo: fecha_castigo)
[2025-11-02 22:50:00] ✅ Fecha string convertida: 6/14/2022 -> 2022-06-14 (Campo: fecha_pago)
[2025-11-02 22:50:00] ✅ Fecha string convertida: 7/10/2022 -> 2022-07-10 (Campo: fecha_vencimiento)
[2025-11-02 22:50:00] ✅ Fecha string convertida: 8/30/2017 -> 2017-08-30 (Campo: fecha_susc)
[2025-11-02 22:50:00] ✅ Fecha string convertida: 3/1/2023 -> 2023-03-01 (Campo: fecha_asignacion)
[2025-11-02 22:50:00] ✅ Fecha string convertida: 1/27/2025 -> 2025-01-27 (Campo: fecha_proceso)
[2025-11-02 22:50:00] ✅ Fecha string convertida: 2/15/2023 -> 2023-02-15 (Campo: fecha_castigo)
[2025-11-02 22:50:00] ✅ Fecha string convertida: 5/16/2022 -> 2022-05-16 (Campo: fecha_pago)
[2025-11-02 22:50:00] ✅ Fecha string convertida: 8/15/2022 -> 2022-08-15 (Campo: fecha_vencimiento)
[2025-11-02 22:50:00] ✅ Fecha string convertida: 2/1/2018 -> 2018-02-01 (Campo: fecha_susc)
[2025-11-02 22:50:00] ✅ Fecha string convertida: 4/1/2023 -> 2023-04-01 (Campo: fecha_asignacion)
[2025-11-02 22:50:00] ✅ Fecha string convertida: 1/27/2025 -> 2025-01-27 (Campo: fecha_proceso)
[2025-11-02 22:50:00] ✅ Fecha string convertida: 4/5/2023 -> 2023-04-05 (Campo: fecha_castigo)
[2025-11-02 22:50:00] ✅ Fecha string convertida: 9/21/2024 -> 2024-09-21 (Campo: fecha_pago)
[2025-11-02 22:50:00] ✅ Fecha string convertida: 10/5/2022 -> 2022-10-05 (Campo: fecha_vencimiento)
[2025-11-02 22:50:00] ✅ Fecha string convertida: 5/13/2010 -> 2010-05-13 (Campo: fecha_susc)
[2025-11-02 22:50:00] ✅ Fecha string convertida: 6/1/2023 -> 2023-06-01 (Campo: fecha_asignacion)
[2025-11-02 22:50:00] ✅ Fecha string convertida: 1/27/2025 -> 2025-01-27 (Campo: fecha_proceso)
[2025-11-02 22:50:00] ✅ Fecha string convertida: 4/5/2023 -> 2023-04-05 (Campo: fecha_castigo)
[2025-11-02 22:50:00] ✅ Fecha string convertida: 10/3/2022 -> 2022-10-03 (Campo: fecha_pago)
[2025-11-02 22:50:00] ✅ Fecha string convertida: 10/5/2022 -> 2022-10-05 (Campo: fecha_vencimiento)
[2025-11-02 22:50:00] ✅ Fecha string convertida: 7/19/2014 -> 2014-07-19 (Campo: fecha_susc)
[2025-11-02 22:50:00] ✅ Fecha string convertida: 6/1/2023 -> 2023-06-01 (Campo: fecha_asignacion)
[2025-11-02 22:50:00] ✅ Fecha string convertida: 1/27/2025 -> 2025-01-27 (Campo: fecha_proceso)
[2025-11-02 22:50:00] ✅ Fecha string convertida: 5/5/2023 -> 2023-05-05 (Campo: fecha_castigo)
[2025-11-02 22:50:00] ✅ Fecha string convertida: 9/22/2022 -> 2022-09-22 (Campo: fecha_pago)
[2025-11-02 22:50:00] ✅ Fecha string convertida: 11/5/2022 -> 2022-11-05 (Campo: fecha_vencimiento)
[2025-11-02 22:50:00] ✅ Fecha string convertida: 11/20/2000 -> 2000-11-20 (Campo: fecha_susc)
[2025-11-02 22:50:00] ✅ Fecha string convertida: 7/1/2023 -> 2023-07-01 (Campo: fecha_asignacion)
[2025-11-02 22:50:00] ✅ Fecha string convertida: 1/27/2025 -> 2025-01-27 (Campo: fecha_proceso)
[2025-11-02 22:50:00] ✅ Fecha string convertida: 6/5/2023 -> 2023-06-05 (Campo: fecha_castigo)
[2025-11-02 22:50:00] ✅ Fecha string convertida: 11/3/2022 -> 2022-11-03 (Campo: fecha_pago)
[2025-11-02 22:50:00] ✅ Fecha string convertida: 12/5/2022 -> 2022-12-05 (Campo: fecha_vencimiento)
[2025-11-02 22:50:00] ✅ Fecha string convertida: 4/9/2016 -> 2016-04-09 (Campo: fecha_susc)
[2025-11-02 22:50:00] ✅ Fecha string convertida: 8/1/2023 -> 2023-08-01 (Campo: fecha_asignacion)
[2025-11-02 22:50:00] ✅ Fecha string convertida: 1/27/2025 -> 2025-01-27 (Campo: fecha_proceso)
[2025-11-02 22:50:00] ✅ Fecha string convertida: 6/5/2023 -> 2023-06-05 (Campo: fecha_castigo)
[2025-11-02 22:50:00] ✅ Fecha string convertida: 11/10/2022 -> 2022-11-10 (Campo: fecha_pago)
[2025-11-02 22:50:00] ✅ Fecha string convertida: 12/5/2022 -> 2022-12-05 (Campo: fecha_vencimiento)
[2025-11-02 22:50:00] ✅ Fecha string convertida: 12/11/2018 -> 2018-12-11 (Campo: fecha_susc)
[2025-11-02 22:50:00] ✅ Fecha string convertida: 8/1/2023 -> 2023-08-01 (Campo: fecha_asignacion)
[2025-11-02 22:50:00] ✅ Fecha string convertida: 1/27/2025 -> 2025-01-27 (Campo: fecha_proceso)
[2025-11-02 22:50:00] ✅ Fecha string convertida: 6/15/2023 -> 2023-06-15 (Campo: fecha_castigo)
[2025-11-02 22:50:00] ✅ Fecha string convertida: 11/3/2022 -> 2022-11-03 (Campo: fecha_pago)
[2025-11-02 22:50:00] ✅ Fecha string convertida: 12/15/2022 -> 2022-12-15 (Campo: fecha_vencimiento)
[2025-11-02 22:50:00] ✅ Fecha string convertida: 9/23/2020 -> 2020-09-23 (Campo: fecha_susc)
[2025-11-02 22:50:00] ✅ Fecha string convertida: 8/1/2023 -> 2023-08-01 (Campo: fecha_asignacion)
[2025-11-02 22:50:00] 🔍 MATERNO PROBLEMA - Forzando string vacío para materno
[2025-11-02 22:50:00] ✅ Fecha string convertida: 1/27/2025 -> 2025-01-27 (Campo: fecha_proceso)
[2025-11-02 22:50:00] ✅ Fecha string convertida: 6/25/2023 -> 2023-06-25 (Campo: fecha_castigo)
[2025-11-02 22:50:00] ✅ Fecha string convertida: 11/23/2022 -> 2022-11-23 (Campo: fecha_pago)
[2025-11-02 22:50:00] ✅ Fecha string convertida: 12/25/2022 -> 2022-12-25 (Campo: fecha_vencimiento)
[2025-11-02 22:50:00] ✅ Fecha string convertida: 5/25/2018 -> 2018-05-25 (Campo: fecha_susc)
[2025-11-02 22:50:00] ✅ Fecha string convertida: 8/1/2023 -> 2023-08-01 (Campo: fecha_asignacion)
[2025-11-02 22:50:00] ✅ Fecha string convertida: 1/27/2025 -> 2025-01-27 (Campo: fecha_proceso)
[2025-11-02 22:50:00] ✅ Fecha string convertida: 7/5/2023 -> 2023-07-05 (Campo: fecha_castigo)
[2025-11-02 22:50:00] ✅ Fecha string convertida: 1/3/2023 -> 2023-01-03 (Campo: fecha_pago)
[2025-11-02 22:50:00] ✅ Fecha string convertida: 1/5/2023 -> 2023-01-05 (Campo: fecha_vencimiento)
[2025-11-02 22:50:00] ✅ Fecha string convertida: 9/28/2019 -> 2019-09-28 (Campo: fecha_susc)
[2025-11-02 22:50:00] ✅ Fecha string convertida: 9/1/2023 -> 2023-09-01 (Campo: fecha_asignacion)
[2025-11-02 22:50:00] ✅ Fecha string convertida: 1/27/2025 -> 2025-01-27 (Campo: fecha_proceso)
[2025-11-02 22:50:00] ✅ Fecha string convertida: 7/5/2023 -> 2023-07-05 (Campo: fecha_castigo)
[2025-11-02 22:50:00] ✅ Fecha string convertida: 12/17/2022 -> 2022-12-17 (Campo: fecha_pago)
[2025-11-02 22:50:00] ✅ Fecha string convertida: 1/5/2023 -> 2023-01-05 (Campo: fecha_vencimiento)
[2025-11-02 22:50:00] ✅ Fecha string convertida: 9/24/1993 -> 1993-09-24 (Campo: fecha_susc)
[2025-11-02 22:50:00] ✅ Fecha string convertida: 9/1/2023 -> 2023-09-01 (Campo: fecha_asignacion)
[2025-11-02 22:50:00] ✅ Fecha string convertida: 1/27/2025 -> 2025-01-27 (Campo: fecha_proceso)
[2025-11-02 22:50:00] ✅ Fecha string convertida: 7/5/2023 -> 2023-07-05 (Campo: fecha_castigo)
[2025-11-02 22:50:00] ✅ Fecha string convertida: 4/14/2023 -> 2023-04-14 (Campo: fecha_pago)
[2025-11-02 22:50:00] ✅ Fecha string convertida: 1/5/2023 -> 2023-01-05 (Campo: fecha_vencimiento)
[2025-11-02 22:50:00] ✅ Fecha string convertida: 3/10/2011 -> 2011-03-10 (Campo: fecha_susc)
[2025-11-02 22:50:00] ✅ Fecha string convertida: 9/1/2023 -> 2023-09-01 (Campo: fecha_asignacion)
[2025-11-02 22:50:00] ✅ Fecha string convertida: 1/27/2025 -> 2025-01-27 (Campo: fecha_proceso)
[2025-11-02 22:50:00] ✅ Fecha string convertida: 7/5/2023 -> 2023-07-05 (Campo: fecha_castigo)
[2025-11-02 22:50:00] ✅ Fecha string convertida: 11/28/2022 -> 2022-11-28 (Campo: fecha_pago)
[2025-11-02 22:50:00] ✅ Fecha string convertida: 1/5/2023 -> 2023-01-05 (Campo: fecha_vencimiento)
[2025-11-02 22:50:00] ✅ Fecha string convertida: 9/13/2007 -> 2007-09-13 (Campo: fecha_susc)
[2025-11-02 22:50:00] ✅ Fecha string convertida: 9/1/2023 -> 2023-09-01 (Campo: fecha_asignacion)
[2025-11-02 22:50:00] ✅ Fecha string convertida: 1/27/2025 -> 2025-01-27 (Campo: fecha_proceso)
[2025-11-02 22:50:00] ✅ Fecha string convertida: 7/30/2023 -> 2023-07-30 (Campo: fecha_castigo)
[2025-11-02 22:50:00] ✅ Fecha string convertida: 9/14/2024 -> 2024-09-14 (Campo: fecha_pago)
[2025-11-02 22:50:00] ✅ Fecha string convertida: 1/30/2023 -> 2023-01-30 (Campo: fecha_vencimiento)
[2025-11-02 22:50:00] ✅ Fecha string convertida: 4/5/2007 -> 2007-04-05 (Campo: fecha_susc)
[2025-11-02 22:50:00] ✅ Fecha string convertida: 9/1/2023 -> 2023-09-01 (Campo: fecha_asignacion)
[2025-11-02 22:50:00] ✅ Fecha string convertida: 1/27/2025 -> 2025-01-27 (Campo: fecha_proceso)
[2025-11-02 22:50:00] ✅ Fecha string convertida: 8/5/2023 -> 2023-08-05 (Campo: fecha_castigo)
[2025-11-02 22:50:00] ✅ Fecha string convertida: 12/23/2022 -> 2022-12-23 (Campo: fecha_pago)
[2025-11-02 22:50:00] ✅ Fecha string convertida: 2/5/2023 -> 2023-02-05 (Campo: fecha_vencimiento)
[2025-11-02 22:50:00] ✅ Fecha string convertida: 5/16/2019 -> 2019-05-16 (Campo: fecha_susc)
[2025-11-02 22:50:00] ✅ Fecha string convertida: 10/1/2023 -> 2023-10-01 (Campo: fecha_asignacion)
[2025-11-02 22:50:00] ✅ Fecha string convertida: 1/27/2025 -> 2025-01-27 (Campo: fecha_proceso)
[2025-11-02 22:50:00] ✅ Fecha string convertida: 8/5/2023 -> 2023-08-05 (Campo: fecha_castigo)
[2025-11-02 22:50:00] ✅ Fecha string convertida: 1/13/2023 -> 2023-01-13 (Campo: fecha_pago)
[2025-11-02 22:50:00] ✅ Fecha string convertida: 2/5/2023 -> 2023-02-05 (Campo: fecha_vencimiento)
[2025-11-02 22:50:00] ✅ Fecha string convertida: 6/10/2016 -> 2016-06-10 (Campo: fecha_susc)
[2025-11-02 22:50:00] ✅ Fecha string convertida: 10/1/2023 -> 2023-10-01 (Campo: fecha_asignacion)
[2025-11-02 22:50:00] ✅ Fecha string convertida: 1/27/2025 -> 2025-01-27 (Campo: fecha_proceso)
[2025-11-02 22:50:00] ✅ Fecha string convertida: 8/5/2023 -> 2023-08-05 (Campo: fecha_castigo)
[2025-11-02 22:50:00] ✅ Fecha string convertida: 2/2/2023 -> 2023-02-02 (Campo: fecha_pago)
[2025-11-02 22:50:00] ✅ Fecha string convertida: 2/5/2023 -> 2023-02-05 (Campo: fecha_vencimiento)
[2025-11-02 22:50:00] ✅ Fecha string convertida: 8/24/2019 -> 2019-08-24 (Campo: fecha_susc)
[2025-11-02 22:50:00] ✅ Fecha string convertida: 10/1/2023 -> 2023-10-01 (Campo: fecha_asignacion)
[2025-11-02 22:50:00] ✅ Fecha string convertida: 1/27/2025 -> 2025-01-27 (Campo: fecha_proceso)
[2025-11-02 22:50:00] ✅ Fecha string convertida: 8/5/2023 -> 2023-08-05 (Campo: fecha_castigo)
[2025-11-02 22:50:00] ✅ Fecha string convertida: 1/1/2023 -> 2023-01-01 (Campo: fecha_pago)
[2025-11-02 22:50:00] ✅ Fecha string convertida: 2/5/2023 -> 2023-02-05 (Campo: fecha_vencimiento)
[2025-11-02 22:50:00] ✅ Fecha string convertida: 3/21/2018 -> 2018-03-21 (Campo: fecha_susc)
[2025-11-02 22:50:00] ✅ Fecha string convertida: 10/1/2023 -> 2023-10-01 (Campo: fecha_asignacion)
[2025-11-02 22:50:00] ✅ Fecha string convertida: 1/27/2025 -> 2025-01-27 (Campo: fecha_proceso)
[2025-11-02 22:50:00] ✅ Fecha string convertida: 8/5/2023 -> 2023-08-05 (Campo: fecha_castigo)
[2025-11-02 22:50:00] ✅ Fecha string convertida: 1/2/2023 -> 2023-01-02 (Campo: fecha_pago)
[2025-11-02 22:50:00] ✅ Fecha string convertida: 2/5/2023 -> 2023-02-05 (Campo: fecha_vencimiento)
[2025-11-02 22:50:00] ✅ Fecha string convertida: 3/7/2019 -> 2019-03-07 (Campo: fecha_susc)
[2025-11-02 22:50:00] ✅ Fecha string convertida: 10/1/2023 -> 2023-10-01 (Campo: fecha_asignacion)
[2025-11-02 22:50:00] ✅ Fecha string convertida: 1/27/2025 -> 2025-01-27 (Campo: fecha_proceso)
[2025-11-02 22:50:00] ✅ Fecha string convertida: 8/10/2023 -> 2023-08-10 (Campo: fecha_castigo)
[2025-11-02 22:50:00] ✅ Fecha string convertida: 2/10/2023 -> 2023-02-10 (Campo: fecha_vencimiento)
[2025-11-02 22:50:00] ✅ Fecha string convertida: 11/9/2020 -> 2020-11-09 (Campo: fecha_susc)
[2025-11-02 22:50:00] ✅ Fecha string convertida: 10/1/2023 -> 2023-10-01 (Campo: fecha_asignacion)
[2025-11-02 22:50:00] ✅ Fecha string convertida: 1/27/2025 -> 2025-01-27 (Campo: fecha_proceso)
[2025-11-02 22:50:00] ✅ Fecha string convertida: 8/25/2023 -> 2023-08-25 (Campo: fecha_castigo)
[2025-11-02 22:50:00] ✅ Fecha string convertida: 1/4/2023 -> 2023-01-04 (Campo: fecha_pago)
[2025-11-02 22:50:00] ✅ Fecha string convertida: 2/25/2023 -> 2023-02-25 (Campo: fecha_vencimiento)
[2025-11-02 22:50:00] ✅ Fecha string convertida: 10/23/2011 -> 2011-10-23 (Campo: fecha_susc)
[2025-11-02 22:50:00] ✅ Fecha string convertida: 10/1/2023 -> 2023-10-01 (Campo: fecha_asignacion)
[2025-11-02 22:50:00] ✅ Fecha string convertida: 1/27/2025 -> 2025-01-27 (Campo: fecha_proceso)
[2025-11-02 22:50:00] ✅ Fecha string convertida: 9/5/2023 -> 2023-09-05 (Campo: fecha_castigo)
[2025-11-02 22:50:00] ✅ Fecha string convertida: 6/5/2023 -> 2023-06-05 (Campo: fecha_pago)
[2025-11-02 22:50:00] ✅ Fecha string convertida: 3/5/2023 -> 2023-03-05 (Campo: fecha_vencimiento)
[2025-11-02 22:50:00] ✅ Fecha string convertida: 12/1/2015 -> 2015-12-01 (Campo: fecha_susc)
[2025-11-02 22:50:00] ✅ Fecha string convertida: 11/1/2023 -> 2023-11-01 (Campo: fecha_asignacion)
[2025-11-02 22:50:00] ✅ Fecha string convertida: 1/27/2025 -> 2025-01-27 (Campo: fecha_proceso)
[2025-11-02 22:50:00] ✅ Fecha string convertida: 9/5/2023 -> 2023-09-05 (Campo: fecha_castigo)
[2025-11-02 22:50:00] ✅ Fecha string convertida: 4/5/2023 -> 2023-04-05 (Campo: fecha_pago)
[2025-11-02 22:50:00] ✅ Fecha string convertida: 3/5/2023 -> 2023-03-05 (Campo: fecha_vencimiento)
[2025-11-02 22:50:00] ✅ Fecha string convertida: 7/22/2013 -> 2013-07-22 (Campo: fecha_susc)
[2025-11-02 22:50:00] ✅ Fecha string convertida: 11/1/2023 -> 2023-11-01 (Campo: fecha_asignacion)
[2025-11-02 22:50:00] ✅ Fecha string convertida: 1/27/2025 -> 2025-01-27 (Campo: fecha_proceso)
[2025-11-02 22:50:00] ✅ Fecha string convertida: 9/10/2023 -> 2023-09-10 (Campo: fecha_castigo)
[2025-11-02 22:50:00] ✅ Fecha string convertida: 1/31/2023 -> 2023-01-31 (Campo: fecha_pago)
[2025-11-02 22:50:00] ✅ Fecha string convertida: 3/10/2023 -> 2023-03-10 (Campo: fecha_vencimiento)
[2025-11-02 22:50:00] ✅ Fecha string convertida: 3/16/2002 -> 2002-03-16 (Campo: fecha_susc)
[2025-11-02 22:50:00] ✅ Fecha string convertida: 11/1/2023 -> 2023-11-01 (Campo: fecha_asignacion)
[2025-11-02 22:50:00] ✅ Fecha string convertida: 1/27/2025 -> 2025-01-27 (Campo: fecha_proceso)
[2025-11-02 22:50:00] ✅ Fecha string convertida: 10/5/2023 -> 2023-10-05 (Campo: fecha_castigo)
[2025-11-02 22:50:00] ✅ Fecha string convertida: 2/24/2023 -> 2023-02-24 (Campo: fecha_pago)
[2025-11-02 22:50:00] ✅ Fecha string convertida: 4/5/2023 -> 2023-04-05 (Campo: fecha_vencimiento)
[2025-11-02 22:50:00] ✅ Fecha string convertida: 12/29/2020 -> 2020-12-29 (Campo: fecha_susc)
[2025-11-02 22:50:00] ✅ Fecha string convertida: 12/1/2023 -> 2023-12-01 (Campo: fecha_asignacion)
[2025-11-02 22:50:00] ✅ Fecha string convertida: 1/27/2025 -> 2025-01-27 (Campo: fecha_proceso)
[2025-11-02 22:50:00] ✅ Fecha string convertida: 10/15/2023 -> 2023-10-15 (Campo: fecha_castigo)
[2025-11-02 22:50:00] ✅ DV con valor '0' - ES VÁLIDO
[2025-11-02 22:50:00] ✅ Fecha string convertida: 4/1/2023 -> 2023-04-01 (Campo: fecha_pago)
[2025-11-02 22:50:00] ✅ Fecha string convertida: 4/15/2023 -> 2023-04-15 (Campo: fecha_vencimiento)
[2025-11-02 22:50:00] ✅ Fecha string convertida: 6/24/2011 -> 2011-06-24 (Campo: fecha_susc)
[2025-11-02 22:50:00] ✅ Fecha string convertida: 12/1/2023 -> 2023-12-01 (Campo: fecha_asignacion)
[2025-11-02 22:50:00] ✅ Fecha string convertida: 1/27/2025 -> 2025-01-27 (Campo: fecha_proceso)
[2025-11-02 22:50:00] ✅ Fecha string convertida: 10/15/2023 -> 2023-10-15 (Campo: fecha_castigo)
[2025-11-02 22:50:00] ✅ Fecha string convertida: 7/31/2023 -> 2023-07-31 (Campo: fecha_pago)
[2025-11-02 22:50:00] ✅ Fecha string convertida: 4/15/2023 -> 2023-04-15 (Campo: fecha_vencimiento)
[2025-11-02 22:50:00] ✅ Fecha string convertida: 1/27/2001 -> 2001-01-27 (Campo: fecha_susc)
[2025-11-02 22:50:00] ✅ Fecha string convertida: 12/1/2023 -> 2023-12-01 (Campo: fecha_asignacion)
[2025-11-02 22:50:00] ✅ Fecha string convertida: 1/27/2025 -> 2025-01-27 (Campo: fecha_proceso)
[2025-11-02 22:50:00] ✅ Fecha string convertida: 11/5/2023 -> 2023-11-05 (Campo: fecha_castigo)
[2025-11-02 22:50:00] ✅ Fecha string convertida: 4/6/2023 -> 2023-04-06 (Campo: fecha_pago)
[2025-11-02 22:50:00] ✅ Fecha string convertida: 5/5/2023 -> 2023-05-05 (Campo: fecha_vencimiento)
[2025-11-02 22:50:00] ✅ Fecha string convertida: 3/16/2019 -> 2019-03-16 (Campo: fecha_susc)
[2025-11-02 22:50:00] ✅ Fecha string convertida: 1/1/2024 -> 2024-01-01 (Campo: fecha_asignacion)
[2025-11-02 22:50:00] ✅ Fecha string convertida: 1/27/2025 -> 2025-01-27 (Campo: fecha_proceso)
[2025-11-02 22:50:00] ✅ Fecha string convertida: 11/5/2023 -> 2023-11-05 (Campo: fecha_castigo)
[2025-11-02 22:50:00] ✅ Fecha string convertida: 3/4/2023 -> 2023-03-04 (Campo: fecha_pago)
[2025-11-02 22:50:00] ✅ Fecha string convertida: 5/5/2023 -> 2023-05-05 (Campo: fecha_vencimiento)
[2025-11-02 22:50:00] ✅ Fecha string convertida: 9/7/2017 -> 2017-09-07 (Campo: fecha_susc)
[2025-11-02 22:50:00] ✅ Fecha string convertida: 1/1/2024 -> 2024-01-01 (Campo: fecha_asignacion)
[2025-11-02 22:50:00] ✅ Fecha string convertida: 1/27/2025 -> 2025-01-27 (Campo: fecha_proceso)
[2025-11-02 22:50:00] ✅ Fecha string convertida: 11/5/2023 -> 2023-11-05 (Campo: fecha_castigo)
[2025-11-02 22:50:00] ✅ Fecha string convertida: 1/27/2023 -> 2023-01-27 (Campo: fecha_pago)
[2025-11-02 22:50:00] ✅ Fecha string convertida: 5/5/2023 -> 2023-05-05 (Campo: fecha_vencimiento)
[2025-11-02 22:50:00] ✅ Fecha string convertida: 4/23/2013 -> 2013-04-23 (Campo: fecha_susc)
[2025-11-02 22:50:00] ✅ Fecha string convertida: 1/1/2024 -> 2024-01-01 (Campo: fecha_asignacion)
[2025-11-02 22:50:00] ✅ Fecha string convertida: 1/27/2025 -> 2025-01-27 (Campo: fecha_proceso)
[2025-11-02 22:50:00] ✅ Fecha string convertida: 11/5/2023 -> 2023-11-05 (Campo: fecha_castigo)
[2025-11-02 22:50:00] ✅ Fecha string convertida: 4/8/2023 -> 2023-04-08 (Campo: fecha_pago)
[2025-11-02 22:50:00] ✅ Fecha string convertida: 5/5/2023 -> 2023-05-05 (Campo: fecha_vencimiento)
[2025-11-02 22:50:00] ✅ Fecha string convertida: 4/7/2019 -> 2019-04-07 (Campo: fecha_susc)
[2025-11-02 22:50:00] ✅ Fecha string convertida: 1/1/2024 -> 2024-01-01 (Campo: fecha_asignacion)
[2025-11-02 22:50:00] ✅ Fecha string convertida: 1/27/2025 -> 2025-01-27 (Campo: fecha_proceso)
[2025-11-02 22:50:00] ✅ Fecha string convertida: 11/5/2023 -> 2023-11-05 (Campo: fecha_castigo)
[2025-11-02 22:50:00] ✅ Fecha string convertida: 3/29/2023 -> 2023-03-29 (Campo: fecha_pago)
[2025-11-02 22:50:00] ✅ Fecha string convertida: 5/5/2023 -> 2023-05-05 (Campo: fecha_vencimiento)
[2025-11-02 22:50:00] ✅ Fecha string convertida: 4/2/2022 -> 2022-04-02 (Campo: fecha_susc)
[2025-11-02 22:50:00] ✅ Fecha string convertida: 1/1/2024 -> 2024-01-01 (Campo: fecha_asignacion)
[2025-11-02 22:50:00] ✅ Fecha string convertida: 1/27/2025 -> 2025-01-27 (Campo: fecha_proceso)
[2025-11-02 22:50:00] ✅ Fecha string convertida: 11/5/2023 -> 2023-11-05 (Campo: fecha_castigo)
[2025-11-02 22:50:00] ✅ Fecha string convertida: 5/5/2023 -> 2023-05-05 (Campo: fecha_vencimiento)
[2025-11-02 22:50:00] ✅ Fecha string convertida: 12/22/2017 -> 2017-12-22 (Campo: fecha_susc)
[2025-11-02 22:50:00] ✅ Fecha string convertida: 1/1/2024 -> 2024-01-01 (Campo: fecha_asignacion)
[2025-11-02 22:50:01] ✅ Fecha string convertida: 1/27/2025 -> 2025-01-27 (Campo: fecha_proceso)
[2025-11-02 22:50:01] ✅ Fecha string convertida: 11/15/2023 -> 2023-11-15 (Campo: fecha_castigo)
[2025-11-02 22:50:01] ✅ Fecha string convertida: 4/10/2023 -> 2023-04-10 (Campo: fecha_pago)
[2025-11-02 22:50:01] ✅ Fecha string convertida: 5/15/2023 -> 2023-05-15 (Campo: fecha_vencimiento)
[2025-11-02 22:50:01] ✅ Fecha string convertida: 3/11/2021 -> 2021-03-11 (Campo: fecha_susc)
[2025-11-02 22:50:01] ✅ Fecha string convertida: 1/1/2024 -> 2024-01-01 (Campo: fecha_asignacion)
[2025-11-02 22:50:01] ✅ Fecha string convertida: 1/27/2025 -> 2025-01-27 (Campo: fecha_proceso)
[2025-11-02 22:50:01] ✅ Fecha string convertida: 11/15/2023 -> 2023-11-15 (Campo: fecha_castigo)
[2025-11-02 22:50:01] ✅ Fecha string convertida: 5/21/2023 -> 2023-05-21 (Campo: fecha_pago)
[2025-11-02 22:50:01] ✅ Fecha string convertida: 5/15/2023 -> 2023-05-15 (Campo: fecha_vencimiento)
[2025-11-02 22:50:01] ✅ Fecha string convertida: 7/12/2006 -> 2006-07-12 (Campo: fecha_susc)
[2025-11-02 22:50:01] ✅ Fecha string convertida: 1/1/2024 -> 2024-01-01 (Campo: fecha_asignacion)
[2025-11-02 22:50:01] ✅ Fecha string convertida: 1/27/2025 -> 2025-01-27 (Campo: fecha_proceso)
[2025-11-02 22:50:01] ✅ Fecha string convertida: 11/25/2023 -> 2023-11-25 (Campo: fecha_castigo)
[2025-11-02 22:50:01] ✅ DV con valor '0' - ES VÁLIDO
[2025-11-02 22:50:01] ✅ Fecha string convertida: 3/27/2023 -> 2023-03-27 (Campo: fecha_pago)
[2025-11-02 22:50:01] ✅ Fecha string convertida: 5/25/2023 -> 2023-05-25 (Campo: fecha_vencimiento)
[2025-11-02 22:50:01] ✅ Fecha string convertida: 5/9/2007 -> 2007-05-09 (Campo: fecha_susc)
[2025-11-02 22:50:01] ✅ Fecha string convertida: 1/1/2024 -> 2024-01-01 (Campo: fecha_asignacion)
[2025-11-02 22:50:01] ✅ Fecha string convertida: 1/27/2025 -> 2025-01-27 (Campo: fecha_proceso)
[2025-11-02 22:50:01] ✅ Fecha string convertida: 11/25/2023 -> 2023-11-25 (Campo: fecha_castigo)
[2025-11-02 22:50:01] ✅ Fecha string convertida: 6/23/2023 -> 2023-06-23 (Campo: fecha_pago)
[2025-11-02 22:50:01] ✅ Fecha string convertida: 5/25/2023 -> 2023-05-25 (Campo: fecha_vencimiento)
[2025-11-02 22:50:01] ✅ Valor convertido a INT: '556' -> 556
[2025-11-02 22:50:01] ✅ Fecha string convertida: 4/13/2017 -> 2017-04-13 (Campo: fecha_susc)
[2025-11-02 22:50:01] ✅ Fecha string convertida: 1/1/2024 -> 2024-01-01 (Campo: fecha_asignacion)
[2025-11-02 22:50:01] ✅ Fecha string convertida: 1/27/2025 -> 2025-01-27 (Campo: fecha_proceso)
[2025-11-02 22:50:01] ✅ Fecha string convertida: 12/5/2023 -> 2023-12-05 (Campo: fecha_castigo)
[2025-11-02 22:50:01] ✅ Fecha string convertida: 4/13/2023 -> 2023-04-13 (Campo: fecha_pago)
[2025-11-02 22:50:01] ✅ Fecha string convertida: 6/5/2023 -> 2023-06-05 (Campo: fecha_vencimiento)
[2025-11-02 22:50:01] ✅ Fecha string convertida: 10/27/2019 -> 2019-10-27 (Campo: fecha_susc)
[2025-11-02 22:50:01] ✅ Fecha string convertida: 2/1/2024 -> 2024-02-01 (Campo: fecha_asignacion)
[2025-11-02 22:50:01] ✅ Fecha string convertida: 1/27/2025 -> 2025-01-27 (Campo: fecha_proceso)
[2025-11-02 22:50:01] ✅ Fecha string convertida: 12/5/2023 -> 2023-12-05 (Campo: fecha_castigo)
[2025-11-02 22:50:01] ✅ Fecha string convertida: 5/4/2023 -> 2023-05-04 (Campo: fecha_pago)
[2025-11-02 22:50:01] ✅ Fecha string convertida: 6/5/2023 -> 2023-06-05 (Campo: fecha_vencimiento)
[2025-11-02 22:50:01] ✅ Fecha string convertida: 11/8/2020 -> 2020-11-08 (Campo: fecha_susc)
[2025-11-02 22:50:01] ✅ Fecha string convertida: 2/1/2024 -> 2024-02-01 (Campo: fecha_asignacion)
[2025-11-02 22:50:01] ✅ Fecha string convertida: 1/27/2025 -> 2025-01-27 (Campo: fecha_proceso)
[2025-11-02 22:50:01] ✅ Fecha string convertida: 12/5/2023 -> 2023-12-05 (Campo: fecha_castigo)
[2025-11-02 22:50:01] ✅ Fecha string convertida: 6/18/2023 -> 2023-06-18 (Campo: fecha_pago)
[2025-11-02 22:50:01] ✅ Fecha string convertida: 6/5/2023 -> 2023-06-05 (Campo: fecha_vencimiento)
[2025-11-02 22:50:01] ✅ Fecha string convertida: 8/24/2013 -> 2013-08-24 (Campo: fecha_susc)
[2025-11-02 22:50:01] ✅ Fecha string convertida: 2/1/2024 -> 2024-02-01 (Campo: fecha_asignacion)
[2025-11-02 22:50:01] ✅ Fecha string convertida: 1/27/2025 -> 2025-01-27 (Campo: fecha_proceso)
[2025-11-02 22:50:01] ✅ Fecha string convertida: 12/5/2023 -> 2023-12-05 (Campo: fecha_castigo)
[2025-11-02 22:50:01] ✅ Fecha string convertida: 5/3/2023 -> 2023-05-03 (Campo: fecha_pago)
[2025-11-02 22:50:01] ✅ Fecha string convertida: 6/5/2023 -> 2023-06-05 (Campo: fecha_vencimiento)
[2025-11-02 22:50:01] ✅ Fecha string convertida: 12/6/2015 -> 2015-12-06 (Campo: fecha_susc)
[2025-11-02 22:50:01] ✅ Fecha string convertida: 2/1/2024 -> 2024-02-01 (Campo: fecha_asignacion)
[2025-11-02 22:50:01] ✅ Fecha string convertida: 1/27/2025 -> 2025-01-27 (Campo: fecha_proceso)
[2025-11-02 22:50:01] ✅ Fecha string convertida: 12/5/2023 -> 2023-12-05 (Campo: fecha_castigo)
[2025-11-02 22:50:01] ✅ Fecha string convertida: 6/6/2023 -> 2023-06-06 (Campo: fecha_pago)
[2025-11-02 22:50:01] ✅ Fecha string convertida: 6/5/2023 -> 2023-06-05 (Campo: fecha_vencimiento)
[2025-11-02 22:50:01] ✅ Fecha string convertida: 12/29/2018 -> 2018-12-29 (Campo: fecha_susc)
[2025-11-02 22:50:01] ✅ Fecha string convertida: 2/1/2024 -> 2024-02-01 (Campo: fecha_asignacion)
[2025-11-02 22:50:01] ✅ Fecha string convertida: 1/27/2025 -> 2025-01-27 (Campo: fecha_proceso)
[2025-11-02 22:50:01] ✅ Fecha string convertida: 12/5/2023 -> 2023-12-05 (Campo: fecha_castigo)
[2025-11-02 22:50:01] ✅ Fecha string convertida: 4/29/2023 -> 2023-04-29 (Campo: fecha_pago)
[2025-11-02 22:50:01] ✅ Fecha string convertida: 6/5/2023 -> 2023-06-05 (Campo: fecha_vencimiento)
[2025-11-02 22:50:01] ✅ Fecha string convertida: 2/24/2022 -> 2022-02-24 (Campo: fecha_susc)
[2025-11-02 22:50:01] ✅ Fecha string convertida: 2/1/2024 -> 2024-02-01 (Campo: fecha_asignacion)
[2025-11-02 22:50:01] ✅ Fecha string convertida: 1/27/2025 -> 2025-01-27 (Campo: fecha_proceso)
[2025-11-02 22:50:01] ✅ Fecha string convertida: 12/5/2023 -> 2023-12-05 (Campo: fecha_castigo)
[2025-11-02 22:50:01] ✅ Fecha string convertida: 7/31/2023 -> 2023-07-31 (Campo: fecha_pago)
[2025-11-02 22:50:01] ✅ Fecha string convertida: 6/5/2023 -> 2023-06-05 (Campo: fecha_vencimiento)
[2025-11-02 22:50:01] ✅ Fecha string convertida: 4/17/2021 -> 2021-04-17 (Campo: fecha_susc)
[2025-11-02 22:50:01] ✅ Fecha string convertida: 2/1/2024 -> 2024-02-01 (Campo: fecha_asignacion)
[2025-11-02 22:50:01] ✅ Fecha string convertida: 1/27/2025 -> 2025-01-27 (Campo: fecha_proceso)
[2025-11-02 22:50:01] ✅ Fecha string convertida: 12/10/2023 -> 2023-12-10 (Campo: fecha_castigo)
[2025-11-02 22:50:01] ✅ Fecha string convertida: 5/4/2023 -> 2023-05-04 (Campo: fecha_pago)
[2025-11-02 22:50:01] ✅ Fecha string convertida: 6/10/2023 -> 2023-06-10 (Campo: fecha_vencimiento)
[2025-11-02 22:50:01] ✅ Fecha string convertida: 8/27/2019 -> 2019-08-27 (Campo: fecha_susc)
[2025-11-02 22:50:01] ✅ Fecha string convertida: 2/1/2024 -> 2024-02-01 (Campo: fecha_asignacion)
[2025-11-02 22:50:01] ✅ Fecha string convertida: 1/27/2025 -> 2025-01-27 (Campo: fecha_proceso)
[2025-11-02 22:50:01] ✅ Fecha string convertida: 12/10/2023 -> 2023-12-10 (Campo: fecha_castigo)
[2025-11-02 22:50:01] ✅ Fecha string convertida: 5/23/2023 -> 2023-05-23 (Campo: fecha_pago)
[2025-11-02 22:50:01] ✅ Fecha string convertida: 6/10/2023 -> 2023-06-10 (Campo: fecha_vencimiento)
[2025-11-02 22:50:01] ✅ Fecha string convertida: 11/18/1998 -> 1998-11-18 (Campo: fecha_susc)
[2025-11-02 22:50:01] ✅ Fecha string convertida: 2/1/2024 -> 2024-02-01 (Campo: fecha_asignacion)
[2025-11-02 22:50:01] ✅ Fecha string convertida: 1/27/2025 -> 2025-01-27 (Campo: fecha_proceso)
[2025-11-02 22:50:01] ✅ Fecha string convertida: 12/10/2023 -> 2023-12-10 (Campo: fecha_castigo)
[2025-11-02 22:50:01] ✅ Fecha string convertida: 5/13/2023 -> 2023-05-13 (Campo: fecha_pago)
[2025-11-02 22:50:01] ✅ Fecha string convertida: 6/10/2023 -> 2023-06-10 (Campo: fecha_vencimiento)
[2025-11-02 22:50:01] ✅ Fecha string convertida: 12/17/2022 -> 2022-12-17 (Campo: fecha_susc)
[2025-11-02 22:50:01] ✅ Fecha string convertida: 2/1/2024 -> 2024-02-01 (Campo: fecha_asignacion)
[2025-11-02 22:50:01] ✅ Fecha string convertida: 1/27/2025 -> 2025-01-27 (Campo: fecha_proceso)
[2025-11-02 22:50:01] ✅ Fecha string convertida: 12/15/2023 -> 2023-12-15 (Campo: fecha_castigo)
[2025-11-02 22:50:01] ✅ Fecha string convertida: 5/1/2023 -> 2023-05-01 (Campo: fecha_pago)
[2025-11-02 22:50:01] ✅ Fecha string convertida: 6/15/2023 -> 2023-06-15 (Campo: fecha_vencimiento)
[2025-11-02 22:50:01] ✅ Fecha string convertida: 7/1/2019 -> 2019-07-01 (Campo: fecha_susc)
[2025-11-02 22:50:01] ✅ Fecha string convertida: 2/1/2024 -> 2024-02-01 (Campo: fecha_asignacion)
[2025-11-02 22:50:01] ✅ Fecha string convertida: 1/27/2025 -> 2025-01-27 (Campo: fecha_proceso)
[2025-11-02 22:50:01] ✅ Fecha string convertida: 12/15/2023 -> 2023-12-15 (Campo: fecha_castigo)
[2025-11-02 22:50:01] ✅ DV con valor '0' - ES VÁLIDO
[2025-11-02 22:50:01] ✅ Fecha string convertida: 5/11/2023 -> 2023-05-11 (Campo: fecha_pago)
[2025-11-02 22:50:01] ✅ Fecha string convertida: 6/15/2023 -> 2023-06-15 (Campo: fecha_vencimiento)
[2025-11-02 22:50:01] ✅ Fecha string convertida: 4/20/2006 -> 2006-04-20 (Campo: fecha_susc)
[2025-11-02 22:50:01] ✅ Fecha string convertida: 2/1/2024 -> 2024-02-01 (Campo: fecha_asignacion)
[2025-11-02 22:50:01] ✅ Fecha string convertida: 1/27/2025 -> 2025-01-27 (Campo: fecha_proceso)
[2025-11-02 22:50:01] ✅ Fecha string convertida: 12/15/2023 -> 2023-12-15 (Campo: fecha_castigo)
[2025-11-02 22:50:01] ✅ Fecha string convertida: 6/8/2023 -> 2023-06-08 (Campo: fecha_pago)
[2025-11-02 22:50:01] ✅ Fecha string convertida: 6/15/2023 -> 2023-06-15 (Campo: fecha_vencimiento)
[2025-11-02 22:50:01] ✅ Fecha string convertida: 5/22/2018 -> 2018-05-22 (Campo: fecha_susc)
[2025-11-02 22:50:01] ✅ Fecha string convertida: 2/1/2024 -> 2024-02-01 (Campo: fecha_asignacion)
[2025-11-02 22:50:01] ✅ Fecha string convertida: 1/27/2025 -> 2025-01-27 (Campo: fecha_proceso)
[2025-11-02 22:50:01] ✅ Fecha string convertida: 12/20/2023 -> 2023-12-20 (Campo: fecha_castigo)
[2025-11-02 22:50:01] ✅ Fecha string convertida: 5/21/2023 -> 2023-05-21 (Campo: fecha_pago)
[2025-11-02 22:50:01] ✅ Fecha string convertida: 6/20/2023 -> 2023-06-20 (Campo: fecha_vencimiento)
[2025-11-02 22:50:01] ✅ Fecha string convertida: 8/7/2021 -> 2021-08-07 (Campo: fecha_susc)
[2025-11-02 22:50:01] ✅ Fecha string convertida: 2/1/2024 -> 2024-02-01 (Campo: fecha_asignacion)
[2025-11-02 22:50:01] ✅ Fecha string convertida: 1/27/2025 -> 2025-01-27 (Campo: fecha_proceso)
[2025-11-02 22:50:01] ✅ Fecha string convertida: 12/30/2023 -> 2023-12-30 (Campo: fecha_castigo)
[2025-11-02 22:50:01] ✅ Fecha string convertida: 6/10/2023 -> 2023-06-10 (Campo: fecha_pago)
[2025-11-02 22:50:01] ✅ Fecha string convertida: 6/30/2023 -> 2023-06-30 (Campo: fecha_vencimiento)
[2025-11-02 22:50:01] ✅ Fecha string convertida: 5/17/2006 -> 2006-05-17 (Campo: fecha_susc)
[2025-11-02 22:50:01] ✅ Fecha string convertida: 2/1/2024 -> 2024-02-01 (Campo: fecha_asignacion)
[2025-11-02 22:50:01] ✅ Fecha string convertida: 1/27/2025 -> 2025-01-27 (Campo: fecha_proceso)
[2025-11-02 22:50:01] ✅ Fecha string convertida: 1/5/2024 -> 2024-01-05 (Campo: fecha_castigo)
[2025-11-02 22:50:01] ✅ Fecha string convertida: 5/29/2023 -> 2023-05-29 (Campo: fecha_pago)
[2025-11-02 22:50:01] ✅ Fecha string convertida: 7/5/2023 -> 2023-07-05 (Campo: fecha_vencimiento)
[2025-11-02 22:50:01] ✅ Fecha string convertida: 7/29/2022 -> 2022-07-29 (Campo: fecha_susc)
[2025-11-02 22:50:01] ✅ Fecha string convertida: 3/1/2024 -> 2024-03-01 (Campo: fecha_asignacion)
[2025-11-02 22:50:01] ✅ Fecha string convertida: 1/27/2025 -> 2025-01-27 (Campo: fecha_proceso)
[2025-11-02 22:50:01] ✅ Fecha string convertida: 1/5/2024 -> 2024-01-05 (Campo: fecha_castigo)
[2025-11-02 22:50:01] ✅ Fecha string convertida: 6/16/2023 -> 2023-06-16 (Campo: fecha_pago)
[2025-11-02 22:50:01] ✅ Fecha string convertida: 7/5/2023 -> 2023-07-05 (Campo: fecha_vencimiento)
[2025-11-02 22:50:01] ✅ Fecha string convertida: 8/29/2021 -> 2021-08-29 (Campo: fecha_susc)
[2025-11-02 22:50:01] ✅ Fecha string convertida: 3/1/2024 -> 2024-03-01 (Campo: fecha_asignacion)
[2025-11-02 22:50:01] ✅ Fecha string convertida: 1/27/2025 -> 2025-01-27 (Campo: fecha_proceso)
[2025-11-02 22:50:01] ✅ Fecha string convertida: 1/5/2024 -> 2024-01-05 (Campo: fecha_castigo)
[2025-11-02 22:50:01] ✅ Fecha string convertida: 2/26/2024 -> 2024-02-26 (Campo: fecha_pago)
[2025-11-02 22:50:01] ✅ Fecha string convertida: 7/5/2023 -> 2023-07-05 (Campo: fecha_vencimiento)
[2025-11-02 22:50:01] ✅ Fecha string convertida: 8/26/2018 -> 2018-08-26 (Campo: fecha_susc)
[2025-11-02 22:50:01] ✅ Fecha string convertida: 3/1/2024 -> 2024-03-01 (Campo: fecha_asignacion)
[2025-11-02 22:50:01] ✅ Fecha string convertida: 1/27/2025 -> 2025-01-27 (Campo: fecha_proceso)
[2025-11-02 22:50:01] ✅ Fecha string convertida: 1/5/2024 -> 2024-01-05 (Campo: fecha_castigo)
[2025-11-02 22:50:01] ✅ Fecha string convertida: 7/28/2023 -> 2023-07-28 (Campo: fecha_pago)
[2025-11-02 22:50:01] ✅ Fecha string convertida: 7/5/2023 -> 2023-07-05 (Campo: fecha_vencimiento)
[2025-11-02 22:50:01] ✅ Fecha string convertida: 3/5/2016 -> 2016-03-05 (Campo: fecha_susc)
[2025-11-02 22:50:01] ✅ Fecha string convertida: 3/1/2024 -> 2024-03-01 (Campo: fecha_asignacion)
[2025-11-02 22:50:01] ✅ Fecha string convertida: 1/27/2025 -> 2025-01-27 (Campo: fecha_proceso)
[2025-11-02 22:50:01] ✅ Fecha string convertida: 1/10/2024 -> 2024-01-10 (Campo: fecha_castigo)
[2025-11-02 22:50:01] ✅ Fecha string convertida: 6/30/2023 -> 2023-06-30 (Campo: fecha_pago)
[2025-11-02 22:50:01] ✅ Fecha string convertida: 7/10/2023 -> 2023-07-10 (Campo: fecha_vencimiento)
[2025-11-02 22:50:01] ✅ Fecha string convertida: 4/28/2019 -> 2019-04-28 (Campo: fecha_susc)
[2025-11-02 22:50:01] ✅ Fecha string convertida: 3/1/2024 -> 2024-03-01 (Campo: fecha_asignacion)
[2025-11-02 22:50:01] ✅ Fecha string convertida: 1/27/2025 -> 2025-01-27 (Campo: fecha_proceso)
[2025-11-02 22:50:01] ✅ Fecha string convertida: 1/30/2024 -> 2024-01-30 (Campo: fecha_castigo)
[2025-11-02 22:50:01] ✅ Fecha string convertida: 4/30/2024 -> 2024-04-30 (Campo: fecha_pago)
[2025-11-02 22:50:01] ✅ Fecha string convertida: 7/30/2023 -> 2023-07-30 (Campo: fecha_vencimiento)
[2025-11-02 22:50:01] ✅ Fecha string convertida: 9/14/2021 -> 2021-09-14 (Campo: fecha_susc)
[2025-11-02 22:50:01] ✅ Fecha string convertida: 3/1/2024 -> 2024-03-01 (Campo: fecha_asignacion)
[2025-11-02 22:50:01] ✅ Fecha string convertida: 1/27/2025 -> 2025-01-27 (Campo: fecha_proceso)
[2025-11-02 22:50:01] ✅ Fecha string convertida: 2/5/2024 -> 2024-02-05 (Campo: fecha_castigo)
[2025-11-02 22:50:01] ✅ Fecha string convertida: 7/17/2023 -> 2023-07-17 (Campo: fecha_pago)
[2025-11-02 22:50:01] ✅ Fecha string convertida: 8/5/2023 -> 2023-08-05 (Campo: fecha_vencimiento)
[2025-11-02 22:50:01] ✅ Fecha string convertida: 1/7/2010 -> 2010-01-07 (Campo: fecha_susc)
[2025-11-02 22:50:01] ✅ Fecha string convertida: 4/1/2024 -> 2024-04-01 (Campo: fecha_asignacion)
[2025-11-02 22:50:01] ✅ Fecha string convertida: 1/27/2025 -> 2025-01-27 (Campo: fecha_proceso)
[2025-11-02 22:50:01] ✅ Fecha string convertida: 2/5/2024 -> 2024-02-05 (Campo: fecha_castigo)
[2025-11-02 22:50:01] ✅ Fecha string convertida: 6/10/2023 -> 2023-06-10 (Campo: fecha_pago)
[2025-11-02 22:50:01] ✅ Fecha string convertida: 8/5/2023 -> 2023-08-05 (Campo: fecha_vencimiento)
[2025-11-02 22:50:01] ✅ Fecha string convertida: 8/12/2013 -> 2013-08-12 (Campo: fecha_susc)
[2025-11-02 22:50:01] ✅ Fecha string convertida: 4/1/2024 -> 2024-04-01 (Campo: fecha_asignacion)
[2025-11-02 22:50:01] ✅ Fecha string convertida: 1/27/2025 -> 2025-01-27 (Campo: fecha_proceso)
[2025-11-02 22:50:01] ✅ Fecha string convertida: 2/5/2024 -> 2024-02-05 (Campo: fecha_castigo)
[2025-11-02 22:50:01] ✅ Fecha string convertida: 7/6/2023 -> 2023-07-06 (Campo: fecha_pago)
[2025-11-02 22:50:01] ✅ Fecha string convertida: 8/5/2023 -> 2023-08-05 (Campo: fecha_vencimiento)
[2025-11-02 22:50:01] ✅ Fecha string convertida: 12/16/2022 -> 2022-12-16 (Campo: fecha_susc)
[2025-11-02 22:50:01] ✅ Fecha string convertida: 4/1/2024 -> 2024-04-01 (Campo: fecha_asignacion)
[2025-11-02 22:50:01] ✅ Fecha string convertida: 1/27/2025 -> 2025-01-27 (Campo: fecha_proceso)
[2025-11-02 22:50:01] ✅ Fecha string convertida: 2/10/2024 -> 2024-02-10 (Campo: fecha_castigo)
[2025-11-02 22:50:01] ✅ Fecha string convertida: 8/7/2023 -> 2023-08-07 (Campo: fecha_pago)
[2025-11-02 22:50:01] ✅ Fecha string convertida: 8/10/2023 -> 2023-08-10 (Campo: fecha_vencimiento)
[2025-11-02 22:50:01] ✅ Fecha string convertida: 12/21/2007 -> 2007-12-21 (Campo: fecha_susc)
[2025-11-02 22:50:01] ✅ Fecha string convertida: 4/1/2024 -> 2024-04-01 (Campo: fecha_asignacion)
[2025-11-02 22:50:01] ✅ Fecha string convertida: 1/27/2025 -> 2025-01-27 (Campo: fecha_proceso)
[2025-11-02 22:50:01] ✅ Fecha string convertida: 2/10/2024 -> 2024-02-10 (Campo: fecha_castigo)
[2025-11-02 22:50:01] ✅ Fecha string convertida: 7/3/2023 -> 2023-07-03 (Campo: fecha_pago)
[2025-11-02 22:50:01] ✅ Fecha string convertida: 8/10/2023 -> 2023-08-10 (Campo: fecha_vencimiento)
[2025-11-02 22:50:01] ✅ Fecha string convertida: 12/17/2022 -> 2022-12-17 (Campo: fecha_susc)
[2025-11-02 22:50:01] ✅ Fecha string convertida: 4/1/2024 -> 2024-04-01 (Campo: fecha_asignacion)
[2025-11-02 22:50:01] ✅ Fecha string convertida: 1/27/2025 -> 2025-01-27 (Campo: fecha_proceso)
[2025-11-02 22:50:01] ✅ Fecha string convertida: 2/10/2024 -> 2024-02-10 (Campo: fecha_castigo)
[2025-11-02 22:50:01] ✅ Fecha string convertida: 7/6/2023 -> 2023-07-06 (Campo: fecha_pago)
[2025-11-02 22:50:01] ✅ Fecha string convertida: 8/10/2023 -> 2023-08-10 (Campo: fecha_vencimiento)
[2025-11-02 22:50:01] ✅ Fecha string convertida: 6/14/2021 -> 2021-06-14 (Campo: fecha_susc)
[2025-11-02 22:50:01] ✅ Fecha string convertida: 4/1/2024 -> 2024-04-01 (Campo: fecha_asignacion)
[2025-11-02 22:50:01] ✅ Fecha string convertida: 1/27/2025 -> 2025-01-27 (Campo: fecha_proceso)
[2025-11-02 22:50:01] ✅ Fecha string convertida: 2/10/2024 -> 2024-02-10 (Campo: fecha_castigo)
[2025-11-02 22:50:01] ✅ Fecha string convertida: 8/19/2023 -> 2023-08-19 (Campo: fecha_pago)
[2025-11-02 22:50:01] ✅ Fecha string convertida: 8/10/2023 -> 2023-08-10 (Campo: fecha_vencimiento)
[2025-11-02 22:50:01] ✅ Fecha string convertida: 8/25/2021 -> 2021-08-25 (Campo: fecha_susc)
[2025-11-02 22:50:01] ✅ Fecha string convertida: 4/1/2024 -> 2024-04-01 (Campo: fecha_asignacion)
[2025-11-02 22:50:01] ✅ Fecha string convertida: 1/27/2025 -> 2025-01-27 (Campo: fecha_proceso)
[2025-11-02 22:50:01] ✅ Fecha string convertida: 2/20/2024 -> 2024-02-20 (Campo: fecha_castigo)
[2025-11-02 22:50:01] ✅ Fecha string convertida: 7/6/2023 -> 2023-07-06 (Campo: fecha_pago)
[2025-11-02 22:50:01] ✅ Fecha string convertida: 8/20/2023 -> 2023-08-20 (Campo: fecha_vencimiento)
[2025-11-02 22:50:01] ✅ Fecha string convertida: 9/26/2021 -> 2021-09-26 (Campo: fecha_susc)
[2025-11-02 22:50:01] ✅ Fecha string convertida: 4/1/2024 -> 2024-04-01 (Campo: fecha_asignacion)
[2025-11-02 22:50:01] ✅ Fecha string convertida: 1/27/2025 -> 2025-01-27 (Campo: fecha_proceso)
[2025-11-02 22:50:01] ✅ Fecha string convertida: 2/25/2024 -> 2024-02-25 (Campo: fecha_castigo)
[2025-11-02 22:50:01] ✅ Fecha string convertida: 8/25/2023 -> 2023-08-25 (Campo: fecha_vencimiento)
[2025-11-02 22:50:01] ✅ Fecha string convertida: 7/22/2023 -> 2023-07-22 (Campo: fecha_susc)
[2025-11-02 22:50:01] ✅ Fecha string convertida: 4/1/2024 -> 2024-04-01 (Campo: fecha_asignacion)
[2025-11-02 22:50:01] ✅ Fecha string convertida: 1/27/2025 -> 2025-01-27 (Campo: fecha_proceso)
[2025-11-02 22:50:01] ✅ Fecha string convertida: 2/25/2024 -> 2024-02-25 (Campo: fecha_castigo)
[2025-11-02 22:50:01] ✅ Fecha string convertida: 7/11/2023 -> 2023-07-11 (Campo: fecha_pago)
[2025-11-02 22:50:01] ✅ Fecha string convertida: 8/25/2023 -> 2023-08-25 (Campo: fecha_vencimiento)
[2025-11-02 22:50:01] ✅ Fecha string convertida: 10/30/2006 -> 2006-10-30 (Campo: fecha_susc)
[2025-11-02 22:50:01] ✅ Fecha string convertida: 4/1/2024 -> 2024-04-01 (Campo: fecha_asignacion)
[2025-11-02 22:50:01] ✅ Fecha string convertida: 1/27/2025 -> 2025-01-27 (Campo: fecha_proceso)
[2025-11-02 22:50:01] ✅ Fecha string convertida: 4/5/2024 -> 2024-04-05 (Campo: fecha_castigo)
[2025-11-02 22:50:01] ✅ Fecha string convertida: 12/20/2023 -> 2023-12-20 (Campo: fecha_pago)
[2025-11-02 22:50:01] ✅ Fecha string convertida: 10/5/2023 -> 2023-10-05 (Campo: fecha_vencimiento)
[2025-11-02 22:50:01] ✅ Fecha string convertida: 1/2/2016 -> 2016-01-02 (Campo: fecha_susc)
[2025-11-02 22:50:01] ✅ Fecha string convertida: 6/1/2024 -> 2024-06-01 (Campo: fecha_asignacion)
[2025-11-02 22:50:01] ✅ Fecha string convertida: 1/27/2025 -> 2025-01-27 (Campo: fecha_proceso)
[2025-11-02 22:50:01] ✅ Fecha string convertida: 4/5/2024 -> 2024-04-05 (Campo: fecha_castigo)
[2025-11-02 22:50:01] ✅ Fecha string convertida: 1/24/2024 -> 2024-01-24 (Campo: fecha_pago)
[2025-11-02 22:50:01] ✅ Fecha string convertida: 10/5/2023 -> 2023-10-05 (Campo: fecha_vencimiento)
[2025-11-02 22:50:01] ✅ Fecha string convertida: 1/10/2017 -> 2017-01-10 (Campo: fecha_susc)
[2025-11-02 22:50:01] ✅ Fecha string convertida: 6/1/2024 -> 2024-06-01 (Campo: fecha_asignacion)
[2025-11-02 22:50:01] ✅ Fecha string convertida: 1/27/2025 -> 2025-01-27 (Campo: fecha_proceso)
[2025-11-02 22:50:01] ✅ Fecha string convertida: 4/10/2024 -> 2024-04-10 (Campo: fecha_castigo)
[2025-11-02 22:50:01] ✅ Fecha string convertida: 9/1/2023 -> 2023-09-01 (Campo: fecha_pago)
[2025-11-02 22:50:01] ✅ Fecha string convertida: 10/10/2023 -> 2023-10-10 (Campo: fecha_vencimiento)
[2025-11-02 22:50:01] ✅ Fecha string convertida: 7/6/2000 -> 2000-07-06 (Campo: fecha_susc)
[2025-11-02 22:50:01] ✅ Fecha string convertida: 6/1/2024 -> 2024-06-01 (Campo: fecha_asignacion)
[2025-11-02 22:50:01] ✅ Fecha string convertida: 1/27/2025 -> 2025-01-27 (Campo: fecha_proceso)
[2025-11-02 22:50:01] ✅ Fecha string convertida: 4/10/2024 -> 2024-04-10 (Campo: fecha_castigo)
[2025-11-02 22:50:01] ✅ Fecha string convertida: 9/22/2023 -> 2023-09-22 (Campo: fecha_pago)
[2025-11-02 22:50:01] ✅ Fecha string convertida: 10/10/2023 -> 2023-10-10 (Campo: fecha_vencimiento)
[2025-11-02 22:50:01] ✅ Fecha string convertida: 5/16/2019 -> 2019-05-16 (Campo: fecha_susc)
[2025-11-02 22:50:01] ✅ Fecha string convertida: 6/1/2024 -> 2024-06-01 (Campo: fecha_asignacion)
[2025-11-02 22:50:01] 🔍 MATERNO PROBLEMA - Forzando string vacío para materno
[2025-11-02 22:50:01] ✅ Fecha string convertida: 1/27/2025 -> 2025-01-27 (Campo: fecha_proceso)
[2025-11-02 22:50:01] ✅ Fecha string convertida: 5/5/2024 -> 2024-05-05 (Campo: fecha_castigo)
[2025-11-02 22:50:01] ✅ Fecha string convertida: 12/1/2023 -> 2023-12-01 (Campo: fecha_pago)
[2025-11-02 22:50:01] ✅ Fecha string convertida: 11/5/2023 -> 2023-11-05 (Campo: fecha_vencimiento)
[2025-11-02 22:50:01] ✅ Fecha string convertida: 5/19/2014 -> 2014-05-19 (Campo: fecha_susc)
[2025-11-02 22:50:01] ✅ Fecha string convertida: 7/1/2024 -> 2024-07-01 (Campo: fecha_asignacion)
[2025-11-02 22:50:01] ✅ Fecha string convertida: 1/27/2025 -> 2025-01-27 (Campo: fecha_proceso)
[2025-11-02 22:50:01] ✅ Fecha string convertida: 5/5/2024 -> 2024-05-05 (Campo: fecha_castigo)
[2025-11-02 22:50:01] ✅ Fecha string convertida: 10/5/2023 -> 2023-10-05 (Campo: fecha_pago)
[2025-11-02 22:50:01] ✅ Fecha string convertida: 11/5/2023 -> 2023-11-05 (Campo: fecha_vencimiento)
[2025-11-02 22:50:01] ✅ Fecha string convertida: 7/18/2013 -> 2013-07-18 (Campo: fecha_susc)
[2025-11-02 22:50:01] ✅ Fecha string convertida: 7/1/2024 -> 2024-07-01 (Campo: fecha_asignacion)
[2025-11-02 22:50:01] ✅ Fecha string convertida: 1/27/2025 -> 2025-01-27 (Campo: fecha_proceso)
[2025-11-02 22:50:01] ✅ Fecha string convertida: 6/5/2024 -> 2024-06-05 (Campo: fecha_castigo)
[2025-11-02 22:50:01] ✅ Fecha string convertida: 11/2/2023 -> 2023-11-02 (Campo: fecha_pago)
[2025-11-02 22:50:01] ✅ Fecha string convertida: 12/5/2023 -> 2023-12-05 (Campo: fecha_vencimiento)
[2025-11-02 22:50:01] ✅ Fecha string convertida: 6/16/2014 -> 2014-06-16 (Campo: fecha_susc)
[2025-11-02 22:50:01] ✅ Fecha string convertida: 8/1/2024 -> 2024-08-01 (Campo: fecha_asignacion)
[2025-11-02 22:50:01] ✅ Fecha string convertida: 1/27/2025 -> 2025-01-27 (Campo: fecha_proceso)
[2025-11-02 22:50:01] ✅ Fecha string convertida: 6/5/2024 -> 2024-06-05 (Campo: fecha_castigo)
[2025-11-02 22:50:01] ✅ Fecha string convertida: 12/29/2023 -> 2023-12-29 (Campo: fecha_pago)
[2025-11-02 22:50:01] ✅ Fecha string convertida: 12/5/2023 -> 2023-12-05 (Campo: fecha_vencimiento)
[2025-11-02 22:50:01] ✅ Fecha string convertida: 6/5/2013 -> 2013-06-05 (Campo: fecha_susc)
[2025-11-02 22:50:01] ✅ Fecha string convertida: 8/1/2024 -> 2024-08-01 (Campo: fecha_asignacion)
[2025-11-02 22:50:01] ✅ Fecha string convertida: 1/27/2025 -> 2025-01-27 (Campo: fecha_proceso)
[2025-11-02 22:50:01] ✅ Fecha string convertida: 6/5/2024 -> 2024-06-05 (Campo: fecha_castigo)
[2025-11-02 22:50:01] ✅ Fecha string convertida: 3/15/2024 -> 2024-03-15 (Campo: fecha_pago)
[2025-11-02 22:50:01] ✅ Fecha string convertida: 12/5/2023 -> 2023-12-05 (Campo: fecha_vencimiento)
[2025-11-02 22:50:01] ✅ Fecha string convertida: 6/29/2021 -> 2021-06-29 (Campo: fecha_susc)
[2025-11-02 22:50:01] ✅ Fecha string convertida: 8/1/2024 -> 2024-08-01 (Campo: fecha_asignacion)
[2025-11-02 22:50:01] ✅ Fecha string convertida: 1/27/2025 -> 2025-01-27 (Campo: fecha_proceso)
[2025-11-02 22:50:01] ✅ Fecha string convertida: 7/5/2024 -> 2024-07-05 (Campo: fecha_castigo)
[2025-11-02 22:50:01] ✅ Fecha string convertida: 12/8/2023 -> 2023-12-08 (Campo: fecha_pago)
[2025-11-02 22:50:01] ✅ Fecha string convertida: 1/5/2024 -> 2024-01-05 (Campo: fecha_vencimiento)
[2025-11-02 22:50:01] ✅ Fecha string convertida: 6/3/2016 -> 2016-06-03 (Campo: fecha_susc)
[2025-11-02 22:50:01] ✅ Fecha string convertida: 9/1/2024 -> 2024-09-01 (Campo: fecha_asignacion)
[2025-11-02 22:50:01] ✅ Fecha string convertida: 1/27/2025 -> 2025-01-27 (Campo: fecha_proceso)
[2025-11-02 22:50:01] ✅ Fecha string convertida: 7/5/2024 -> 2024-07-05 (Campo: fecha_castigo)
[2025-11-02 22:50:01] ✅ Fecha string convertida: 10/7/2023 -> 2023-10-07 (Campo: fecha_pago)
[2025-11-02 22:50:01] ✅ Fecha string convertida: 1/5/2024 -> 2024-01-05 (Campo: fecha_vencimiento)
[2025-11-02 22:50:01] ✅ Fecha string convertida: 7/27/2017 -> 2017-07-27 (Campo: fecha_susc)
[2025-11-02 22:50:01] ✅ Fecha string convertida: 9/1/2024 -> 2024-09-01 (Campo: fecha_asignacion)
[2025-11-02 22:50:02] ✅ Fecha string convertida: 1/27/2025 -> 2025-01-27 (Campo: fecha_proceso)
[2025-11-02 22:50:02] ✅ Fecha string convertida: 7/5/2024 -> 2024-07-05 (Campo: fecha_castigo)
[2025-11-02 22:50:02] ✅ Fecha string convertida: 1/8/2024 -> 2024-01-08 (Campo: fecha_pago)
[2025-11-02 22:50:02] ✅ Fecha string convertida: 1/5/2024 -> 2024-01-05 (Campo: fecha_vencimiento)
[2025-11-02 22:50:02] ✅ Fecha string convertida: 7/22/2021 -> 2021-07-22 (Campo: fecha_susc)
[2025-11-02 22:50:02] ✅ Fecha string convertida: 9/1/2024 -> 2024-09-01 (Campo: fecha_asignacion)
[2025-11-02 22:50:02] ✅ Fecha string convertida: 1/27/2025 -> 2025-01-27 (Campo: fecha_proceso)
[2025-11-02 22:50:02] ✅ Fecha string convertida: 7/5/2024 -> 2024-07-05 (Campo: fecha_castigo)
[2025-11-02 22:50:02] ✅ Fecha string convertida: 11/30/2023 -> 2023-11-30 (Campo: fecha_pago)
[2025-11-02 22:50:02] ✅ Fecha string convertida: 1/5/2024 -> 2024-01-05 (Campo: fecha_vencimiento)
[2025-11-02 22:50:02] ✅ Fecha string convertida: 5/7/2016 -> 2016-05-07 (Campo: fecha_susc)
[2025-11-02 22:50:02] ✅ Fecha string convertida: 9/1/2024 -> 2024-09-01 (Campo: fecha_asignacion)
[2025-11-02 22:50:02] ✅ Fecha string convertida: 1/27/2025 -> 2025-01-27 (Campo: fecha_proceso)
[2025-11-02 22:50:02] ✅ Fecha string convertida: 8/5/2024 -> 2024-08-05 (Campo: fecha_castigo)
[2025-11-02 22:50:02] ✅ Fecha string convertida: 8/29/2023 -> 2023-08-29 (Campo: fecha_pago)
[2025-11-02 22:50:02] ✅ Fecha string convertida: 2/5/2024 -> 2024-02-05 (Campo: fecha_vencimiento)
[2025-11-02 22:50:02] ✅ Fecha string convertida: 11/11/2022 -> 2022-11-11 (Campo: fecha_susc)
[2025-11-02 22:50:02] ✅ Fecha string convertida: 10/1/2024 -> 2024-10-01 (Campo: fecha_asignacion)
[2025-11-02 22:50:02] ✅ Fecha string convertida: 1/27/2025 -> 2025-01-27 (Campo: fecha_proceso)
[2025-11-02 22:50:02] ✅ Fecha string convertida: 8/5/2024 -> 2024-08-05 (Campo: fecha_castigo)
[2025-11-02 22:50:02] ✅ Fecha string convertida: 2/19/2024 -> 2024-02-19 (Campo: fecha_pago)
[2025-11-02 22:50:02] ✅ Fecha string convertida: 2/5/2024 -> 2024-02-05 (Campo: fecha_vencimiento)
[2025-11-02 22:50:02] ✅ Fecha string convertida: 1/19/2021 -> 2021-01-19 (Campo: fecha_susc)
[2025-11-02 22:50:02] ✅ Fecha string convertida: 10/1/2024 -> 2024-10-01 (Campo: fecha_asignacion)
[2025-11-02 22:50:02] ✅ Fecha string convertida: 1/27/2025 -> 2025-01-27 (Campo: fecha_proceso)
[2025-11-02 22:50:02] ✅ Fecha string convertida: 10/5/2024 -> 2024-10-05 (Campo: fecha_castigo)
[2025-11-02 22:50:02] ✅ Fecha string convertida: 3/4/2024 -> 2024-03-04 (Campo: fecha_pago)
[2025-11-02 22:50:02] ✅ Fecha string convertida: 4/5/2024 -> 2024-04-05 (Campo: fecha_vencimiento)
[2025-11-02 22:50:02] ✅ Fecha string convertida: 11/1/2018 -> 2018-11-01 (Campo: fecha_susc)
[2025-11-02 22:50:02] ✅ Fecha string convertida: 12/1/2024 -> 2024-12-01 (Campo: fecha_asignacion)
[2025-11-02 22:50:02] ✅ Fecha string convertida: 1/27/2025 -> 2025-01-27 (Campo: fecha_proceso)
[2025-11-02 22:50:02] ✅ Fecha string convertida: 10/5/2024 -> 2024-10-05 (Campo: fecha_castigo)
[2025-11-02 22:50:02] ✅ Fecha string convertida: 3/21/2024 -> 2024-03-21 (Campo: fecha_pago)
[2025-11-02 22:50:02] ✅ Fecha string convertida: 4/5/2024 -> 2024-04-05 (Campo: fecha_vencimiento)
[2025-11-02 22:50:02] ✅ Fecha string convertida: 1/3/2015 -> 2015-01-03 (Campo: fecha_susc)
[2025-11-02 22:50:02] ✅ Fecha string convertida: 12/1/2024 -> 2024-12-01 (Campo: fecha_asignacion)
[2025-11-02 22:50:02] ✅ Fecha string convertida: 1/27/2025 -> 2025-01-27 (Campo: fecha_proceso)
[2025-11-02 22:50:02] ✅ Fecha string convertida: 10/5/2024 -> 2024-10-05 (Campo: fecha_castigo)
[2025-11-02 22:50:02] ✅ Fecha string convertida: 3/18/2024 -> 2024-03-18 (Campo: fecha_pago)
[2025-11-02 22:50:02] ✅ Fecha string convertida: 4/5/2024 -> 2024-04-05 (Campo: fecha_vencimiento)
[2025-11-02 22:50:02] ✅ Fecha string convertida: 12/10/2012 -> 2012-12-10 (Campo: fecha_susc)
[2025-11-02 22:50:02] ✅ Fecha string convertida: 12/1/2024 -> 2024-12-01 (Campo: fecha_asignacion)
[2025-11-02 22:50:02] ✅ Fecha string convertida: 1/27/2025 -> 2025-01-27 (Campo: fecha_proceso)
[2025-11-02 22:50:02] ✅ Fecha string convertida: 10/5/2024 -> 2024-10-05 (Campo: fecha_castigo)
[2025-11-02 22:50:02] ✅ DV con valor '0' - ES VÁLIDO
[2025-11-02 22:50:02] ✅ Fecha string convertida: 3/16/2024 -> 2024-03-16 (Campo: fecha_pago)
[2025-11-02 22:50:02] ✅ Fecha string convertida: 4/5/2024 -> 2024-04-05 (Campo: fecha_vencimiento)
[2025-11-02 22:50:02] ✅ Fecha string convertida: 12/18/2016 -> 2016-12-18 (Campo: fecha_susc)
[2025-11-02 22:50:02] ✅ Fecha string convertida: 12/1/2024 -> 2024-12-01 (Campo: fecha_asignacion)
[2025-11-02 22:50:02] ✅ Fecha string convertida: 1/27/2025 -> 2025-01-27 (Campo: fecha_proceso)
[2025-11-02 22:50:02] ✅ Fecha string convertida: 10/5/2024 -> 2024-10-05 (Campo: fecha_castigo)
[2025-11-02 22:50:02] ✅ Fecha string convertida: 1/17/2024 -> 2024-01-17 (Campo: fecha_pago)
[2025-11-02 22:50:02] ✅ Fecha string convertida: 4/5/2024 -> 2024-04-05 (Campo: fecha_vencimiento)
[2025-11-02 22:50:02] ✅ Fecha string convertida: 12/13/2023 -> 2023-12-13 (Campo: fecha_susc)
[2025-11-02 22:50:02] ✅ Fecha string convertida: 12/1/2024 -> 2024-12-01 (Campo: fecha_asignacion)
[2025-11-02 22:50:02] ✅ Fecha string convertida: 1/27/2025 -> 2025-01-27 (Campo: fecha_proceso)
[2025-11-02 22:50:02] ✅ Fecha string convertida: 10/5/2024 -> 2024-10-05 (Campo: fecha_castigo)
[2025-11-02 22:50:02] ✅ Fecha string convertida: 3/2/2024 -> 2024-03-02 (Campo: fecha_pago)
[2025-11-02 22:50:02] ✅ Fecha string convertida: 4/5/2024 -> 2024-04-05 (Campo: fecha_vencimiento)
[2025-11-02 22:50:02] ✅ Fecha string convertida: 10/16/2017 -> 2017-10-16 (Campo: fecha_susc)
[2025-11-02 22:50:02] ✅ Fecha string convertida: 12/1/2024 -> 2024-12-01 (Campo: fecha_asignacion)
[2025-11-02 22:50:02] ✅ Fecha string convertida: 1/27/2025 -> 2025-01-27 (Campo: fecha_proceso)
[2025-11-02 22:50:02] ✅ Fecha string convertida: 10/5/2024 -> 2024-10-05 (Campo: fecha_castigo)
[2025-11-02 22:50:02] ✅ Fecha string convertida: 3/5/2024 -> 2024-03-05 (Campo: fecha_pago)
[2025-11-02 22:50:02] ✅ Fecha string convertida: 4/5/2024 -> 2024-04-05 (Campo: fecha_vencimiento)
[2025-11-02 22:50:02] ✅ Fecha string convertida: 12/29/2022 -> 2022-12-29 (Campo: fecha_susc)
[2025-11-02 22:50:02] ✅ Fecha string convertida: 12/1/2024 -> 2024-12-01 (Campo: fecha_asignacion)
[2025-11-02 22:50:02] ✅ Fecha string convertida: 1/27/2025 -> 2025-01-27 (Campo: fecha_proceso)
[2025-11-02 22:50:02] ✅ Fecha string convertida: 10/5/2024 -> 2024-10-05 (Campo: fecha_castigo)
[2025-11-02 22:50:02] ✅ Fecha string convertida: 3/1/2024 -> 2024-03-01 (Campo: fecha_pago)
[2025-11-02 22:50:02] ✅ Fecha string convertida: 4/5/2024 -> 2024-04-05 (Campo: fecha_vencimiento)
[2025-11-02 22:50:02] ✅ Fecha string convertida: 9/14/2023 -> 2023-09-14 (Campo: fecha_susc)
[2025-11-02 22:50:02] ✅ Fecha string convertida: 12/1/2024 -> 2024-12-01 (Campo: fecha_asignacion)
[2025-11-02 22:50:02] ✅ Fecha string convertida: 1/27/2025 -> 2025-01-27 (Campo: fecha_proceso)
[2025-11-02 22:50:02] ✅ Fecha string convertida: 10/5/2024 -> 2024-10-05 (Campo: fecha_castigo)
[2025-11-02 22:50:02] ✅ Fecha string convertida: 6/17/2024 -> 2024-06-17 (Campo: fecha_pago)
[2025-11-02 22:50:02] ✅ Fecha string convertida: 4/5/2024 -> 2024-04-05 (Campo: fecha_vencimiento)
[2025-11-02 22:50:02] ✅ Fecha string convertida: 2/5/2021 -> 2021-02-05 (Campo: fecha_susc)
[2025-11-02 22:50:02] ✅ Fecha string convertida: 12/1/2024 -> 2024-12-01 (Campo: fecha_asignacion)
[2025-11-02 22:50:02] ✅ Fecha string convertida: 1/27/2025 -> 2025-01-27 (Campo: fecha_proceso)
[2025-11-02 22:50:02] ✅ Fecha string convertida: 10/10/2024 -> 2024-10-10 (Campo: fecha_castigo)
[2025-11-02 22:50:02] ✅ Fecha string convertida: 3/23/2024 -> 2024-03-23 (Campo: fecha_pago)
[2025-11-02 22:50:02] ✅ Fecha string convertida: 4/10/2024 -> 2024-04-10 (Campo: fecha_vencimiento)
[2025-11-02 22:50:02] ✅ Fecha string convertida: 1/4/2006 -> 2006-01-04 (Campo: fecha_susc)
[2025-11-02 22:50:02] ✅ Fecha string convertida: 12/1/2024 -> 2024-12-01 (Campo: fecha_asignacion)
[2025-11-02 22:50:02] ✅ Fecha string convertida: 1/27/2025 -> 2025-01-27 (Campo: fecha_proceso)
[2025-11-02 22:50:02] ✅ Fecha string convertida: 10/10/2024 -> 2024-10-10 (Campo: fecha_castigo)
[2025-11-02 22:50:02] ✅ Fecha string convertida: 1/24/2024 -> 2024-01-24 (Campo: fecha_pago)
[2025-11-02 22:50:02] ✅ Fecha string convertida: 4/10/2024 -> 2024-04-10 (Campo: fecha_vencimiento)
[2025-11-02 22:50:02] ✅ Fecha string convertida: 6/5/2023 -> 2023-06-05 (Campo: fecha_susc)
[2025-11-02 22:50:02] ✅ Fecha string convertida: 12/1/2024 -> 2024-12-01 (Campo: fecha_asignacion)
[2025-11-02 22:50:02] ✅ Fecha string convertida: 1/27/2025 -> 2025-01-27 (Campo: fecha_proceso)
[2025-11-02 22:50:02] ✅ Fecha string convertida: 10/10/2024 -> 2024-10-10 (Campo: fecha_castigo)
[2025-11-02 22:50:02] ✅ Fecha string convertida: 3/4/2024 -> 2024-03-04 (Campo: fecha_pago)
[2025-11-02 22:50:02] ✅ Fecha string convertida: 4/10/2024 -> 2024-04-10 (Campo: fecha_vencimiento)
[2025-11-02 22:50:02] ✅ Fecha string convertida: 10/24/2023 -> 2023-10-24 (Campo: fecha_susc)
[2025-11-02 22:50:02] ✅ Fecha string convertida: 12/1/2024 -> 2024-12-01 (Campo: fecha_asignacion)
[2025-11-02 22:50:02] ✅ Fecha string convertida: 1/27/2025 -> 2025-01-27 (Campo: fecha_proceso)
[2025-11-02 22:50:02] ✅ Fecha string convertida: 10/10/2024 -> 2024-10-10 (Campo: fecha_castigo)
[2025-11-02 22:50:02] ✅ Fecha string convertida: 3/11/2024 -> 2024-03-11 (Campo: fecha_pago)
[2025-11-02 22:50:02] ✅ Fecha string convertida: 4/10/2024 -> 2024-04-10 (Campo: fecha_vencimiento)
[2025-11-02 22:50:02] ✅ Fecha string convertida: 6/13/2010 -> 2010-06-13 (Campo: fecha_susc)
[2025-11-02 22:50:02] ✅ Fecha string convertida: 12/1/2024 -> 2024-12-01 (Campo: fecha_asignacion)
[2025-11-02 22:50:02] ✅ Fecha string convertida: 1/27/2025 -> 2025-01-27 (Campo: fecha_proceso)
[2025-11-02 22:50:02] ✅ Fecha string convertida: 10/15/2024 -> 2024-10-15 (Campo: fecha_castigo)
[2025-11-02 22:50:02] ✅ Fecha string convertida: 3/15/2024 -> 2024-03-15 (Campo: fecha_pago)
[2025-11-02 22:50:02] ✅ Fecha string convertida: 4/15/2024 -> 2024-04-15 (Campo: fecha_vencimiento)
[2025-11-02 22:50:02] ✅ Fecha string convertida: 12/10/2019 -> 2019-12-10 (Campo: fecha_susc)
[2025-11-02 22:50:02] ✅ Fecha string convertida: 12/1/2024 -> 2024-12-01 (Campo: fecha_asignacion)
[2025-11-02 22:50:02] ✅ Fecha string convertida: 1/27/2025 -> 2025-01-27 (Campo: fecha_proceso)
[2025-11-02 22:50:02] ✅ Fecha string convertida: 10/25/2024 -> 2024-10-25 (Campo: fecha_castigo)
[2025-11-02 22:50:02] ✅ Fecha string convertida: 3/22/2024 -> 2024-03-22 (Campo: fecha_pago)
[2025-11-02 22:50:02] ✅ Fecha string convertida: 4/25/2024 -> 2024-04-25 (Campo: fecha_vencimiento)
[2025-11-02 22:50:02] ✅ Fecha string convertida: 11/27/2023 -> 2023-11-27 (Campo: fecha_susc)
[2025-11-02 22:50:02] ✅ Fecha string convertida: 12/1/2024 -> 2024-12-01 (Campo: fecha_asignacion)
[2025-11-02 22:50:02] ✅ Fecha string convertida: 1/27/2025 -> 2025-01-27 (Campo: fecha_proceso)
[2025-11-02 22:50:02] ✅ Fecha string convertida: 10/25/2024 -> 2024-10-25 (Campo: fecha_castigo)
[2025-11-02 22:50:02] ✅ Fecha string convertida: 4/10/2024 -> 2024-04-10 (Campo: fecha_pago)
[2025-11-02 22:50:02] ✅ Fecha string convertida: 4/25/2024 -> 2024-04-25 (Campo: fecha_vencimiento)
[2025-11-02 22:50:02] ✅ Fecha string convertida: 8/1/2017 -> 2017-08-01 (Campo: fecha_susc)
[2025-11-02 22:50:02] ✅ Fecha string convertida: 12/1/2024 -> 2024-12-01 (Campo: fecha_asignacion)
[2025-11-02 22:50:02] ✅ Fecha string convertida: 1/27/2025 -> 2025-01-27 (Campo: fecha_proceso)
[2025-11-02 22:50:02] ✅ Fecha string convertida: 10/30/2024 -> 2024-10-30 (Campo: fecha_castigo)
[2025-11-02 22:50:02] ✅ DV con valor '0' - ES VÁLIDO
[2025-11-02 22:50:02] ✅ Fecha string convertida: 3/30/2024 -> 2024-03-30 (Campo: fecha_pago)
[2025-11-02 22:50:02] ✅ Fecha string convertida: 4/30/2024 -> 2024-04-30 (Campo: fecha_vencimiento)
[2025-11-02 22:50:02] ✅ Fecha string convertida: 7/28/2023 -> 2023-07-28 (Campo: fecha_susc)
[2025-11-02 22:50:02] ✅ Fecha string convertida: 12/1/2024 -> 2024-12-01 (Campo: fecha_asignacion)
[2025-11-02 22:50:02] ✅ Fecha string convertida: 1/27/2025 -> 2025-01-27 (Campo: fecha_proceso)
[2025-11-02 22:50:02] ✅ Fecha string convertida: 9/30/2019 -> 2019-09-30 (Campo: fecha_castigo)
[2025-11-02 22:50:02] ✅ Fecha string convertida: 4/21/2023 -> 2023-04-21 (Campo: fecha_pago)
[2025-11-02 22:50:02] ✅ Fecha string convertida: 3/30/2019 -> 2019-03-30 (Campo: fecha_vencimiento)
[2025-11-02 22:50:02] ✅ Fecha string convertida: 5/12/1995 -> 1995-05-12 (Campo: fecha_susc)
[2025-11-02 22:50:02] ✅ Fecha string convertida: 9/1/2019 -> 2019-09-01 (Campo: fecha_asignacion)
[2025-11-02 22:50:02] ✅ Fecha string convertida: 1/27/2025 -> 2025-01-27 (Campo: fecha_proceso)
[2025-11-02 22:50:02] ✅ Fecha string convertida: 12/5/2019 -> 2019-12-05 (Campo: fecha_castigo)
[2025-11-02 22:50:02] ✅ Fecha string convertida: 12/26/2023 -> 2023-12-26 (Campo: fecha_pago)
[2025-11-02 22:50:02] ✅ Fecha string convertida: 6/5/2019 -> 2019-06-05 (Campo: fecha_vencimiento)
[2025-11-02 22:50:02] ✅ Fecha string convertida: 7/25/2003 -> 2003-07-25 (Campo: fecha_susc)
[2025-11-02 22:50:02] ✅ Fecha string convertida: 1/1/2019 -> 2019-01-01 (Campo: fecha_asignacion)
[2025-11-02 22:50:02] ✅ Fecha string convertida: 1/27/2025 -> 2025-01-27 (Campo: fecha_proceso)
[2025-11-02 22:50:02] ✅ Fecha string convertida: 3/30/2020 -> 2020-03-30 (Campo: fecha_castigo)
[2025-11-02 22:50:02] ✅ Fecha string convertida: 10/5/2024 -> 2024-10-05 (Campo: fecha_pago)
[2025-11-02 22:50:02] ✅ Fecha string convertida: 9/30/2019 -> 2019-09-30 (Campo: fecha_vencimiento)
[2025-11-02 22:50:02] ✅ Fecha string convertida: 9/15/1999 -> 1999-09-15 (Campo: fecha_susc)
[2025-11-02 22:50:02] ✅ Fecha string convertida: 2/1/2020 -> 2020-02-01 (Campo: fecha_asignacion)
[2025-11-02 22:50:02] ✅ Fecha string convertida: 1/27/2025 -> 2025-01-27 (Campo: fecha_proceso)
[2025-11-02 22:50:02] ✅ Fecha string convertida: 7/5/2020 -> 2020-07-05 (Campo: fecha_castigo)
[2025-11-02 22:50:02] ✅ Fecha string convertida: 1/5/2020 -> 2020-01-05 (Campo: fecha_vencimiento)
[2025-11-02 22:50:02] ✅ Fecha string convertida: 2/22/2012 -> 2012-02-22 (Campo: fecha_susc)
[2025-11-02 22:50:02] ✅ Fecha string convertida: 9/1/2020 -> 2020-09-01 (Campo: fecha_asignacion)
[2025-11-02 22:50:02] 📈 Progreso: 500 filas procesadas de 2984 | Exitosas: 500 | Errores: 0
[2025-11-02 22:50:02] ✅ Fecha string convertida: 1/27/2025 -> 2025-01-27 (Campo: fecha_proceso)
[2025-11-02 22:50:02] ✅ Fecha string convertida: 7/5/2020 -> 2020-07-05 (Campo: fecha_castigo)
[2025-11-02 22:50:02] ✅ Fecha string convertida: 1/5/2020 -> 2020-01-05 (Campo: fecha_vencimiento)
[2025-11-02 22:50:02] ✅ Fecha string convertida: 12/21/2017 -> 2017-12-21 (Campo: fecha_susc)
[2025-11-02 22:50:02] ✅ Fecha string convertida: 9/1/2020 -> 2020-09-01 (Campo: fecha_asignacion)
[2025-11-02 22:50:02] ✅ Fecha string convertida: 1/27/2025 -> 2025-01-27 (Campo: fecha_proceso)
[2025-11-02 22:50:02] ✅ Fecha string convertida: 9/25/2020 -> 2020-09-25 (Campo: fecha_castigo)
[2025-11-02 22:50:02] ✅ Fecha string convertida: 3/25/2020 -> 2020-03-25 (Campo: fecha_vencimiento)
[2025-11-02 22:50:02] ✅ Fecha string convertida: 12/19/2006 -> 2006-12-19 (Campo: fecha_susc)
[2025-11-02 22:50:02] ✅ Fecha string convertida: 11/1/2020 -> 2020-11-01 (Campo: fecha_asignacion)
[2025-11-02 22:50:02] ✅ Fecha string convertida: 1/27/2025 -> 2025-01-27 (Campo: fecha_proceso)
[2025-11-02 22:50:02] ✅ Fecha string convertida: 10/5/2020 -> 2020-10-05 (Campo: fecha_castigo)
[2025-11-02 22:50:02] ✅ Fecha string convertida: 8/9/2023 -> 2023-08-09 (Campo: fecha_pago)
[2025-11-02 22:50:02] ✅ Fecha string convertida: 4/5/2020 -> 2020-04-05 (Campo: fecha_vencimiento)
[2025-11-02 22:50:02] ✅ Fecha string convertida: 10/29/2012 -> 2012-10-29 (Campo: fecha_susc)
[2025-11-02 22:50:02] ✅ Fecha string convertida: 12/1/2020 -> 2020-12-01 (Campo: fecha_asignacion)
[2025-11-02 22:50:02] ✅ Fecha string convertida: 1/27/2025 -> 2025-01-27 (Campo: fecha_proceso)
[2025-11-02 22:50:02] ✅ Fecha string convertida: 10/5/2020 -> 2020-10-05 (Campo: fecha_castigo)
[2025-11-02 22:50:02] ✅ Fecha string convertida: 11/18/2022 -> 2022-11-18 (Campo: fecha_pago)
[2025-11-02 22:50:02] ✅ Fecha string convertida: 4/5/2020 -> 2020-04-05 (Campo: fecha_vencimiento)
[2025-11-02 22:50:02] ✅ Fecha string convertida: 8/15/2016 -> 2016-08-15 (Campo: fecha_susc)
[2025-11-02 22:50:02] ✅ Fecha string convertida: 12/1/2020 -> 2020-12-01 (Campo: fecha_asignacion)
[2025-11-02 22:50:02] ✅ Fecha string convertida: 1/27/2025 -> 2025-01-27 (Campo: fecha_proceso)
[2025-11-02 22:50:02] ✅ Fecha string convertida: 10/5/2020 -> 2020-10-05 (Campo: fecha_castigo)
[2025-11-02 22:50:02] ✅ Fecha string convertida: 4/5/2020 -> 2020-04-05 (Campo: fecha_vencimiento)
[2025-11-02 22:50:02] ✅ Fecha string convertida: 10/17/2016 -> 2016-10-17 (Campo: fecha_susc)
[2025-11-02 22:50:02] ✅ Fecha string convertida: 12/1/2020 -> 2020-12-01 (Campo: fecha_asignacion)
[2025-11-02 22:50:02] ✅ Fecha string convertida: 1/27/2025 -> 2025-01-27 (Campo: fecha_proceso)
[2025-11-02 22:50:02] ✅ Fecha string convertida: 11/10/2020 -> 2020-11-10 (Campo: fecha_castigo)
[2025-11-02 22:50:02] ✅ Fecha string convertida: 5/10/2020 -> 2020-05-10 (Campo: fecha_vencimiento)
[2025-11-02 22:50:02] ✅ Fecha string convertida: 8/7/2014 -> 2014-08-07 (Campo: fecha_susc)
[2025-11-02 22:50:02] ✅ Fecha string convertida: 1/1/2021 -> 2021-01-01 (Campo: fecha_asignacion)
[2025-11-02 22:50:02] ✅ Fecha string convertida: 1/27/2025 -> 2025-01-27 (Campo: fecha_proceso)
[2025-11-02 22:50:02] ✅ Fecha string convertida: 12/5/2020 -> 2020-12-05 (Campo: fecha_castigo)
[2025-11-02 22:50:02] ✅ Fecha string convertida: 12/4/2023 -> 2023-12-04 (Campo: fecha_pago)
[2025-11-02 22:50:02] ✅ Fecha string convertida: 6/5/2020 -> 2020-06-05 (Campo: fecha_vencimiento)
[2025-11-02 22:50:02] ✅ Fecha string convertida: 11/17/2006 -> 2006-11-17 (Campo: fecha_susc)
[2025-11-02 22:50:02] ✅ Fecha string convertida: 2/1/2021 -> 2021-02-01 (Campo: fecha_asignacion)
[2025-11-02 22:50:02] ✅ Fecha string convertida: 1/27/2025 -> 2025-01-27 (Campo: fecha_proceso)
[2025-11-02 22:50:02] ✅ Fecha string convertida: 12/5/2020 -> 2020-12-05 (Campo: fecha_castigo)
[2025-11-02 22:50:02] ✅ Fecha string convertida: 6/5/2020 -> 2020-06-05 (Campo: fecha_vencimiento)
[2025-11-02 22:50:02] ✅ Fecha string convertida: 7/19/2014 -> 2014-07-19 (Campo: fecha_susc)
[2025-11-02 22:50:02] ✅ Fecha string convertida: 2/1/2021 -> 2021-02-01 (Campo: fecha_asignacion)
[2025-11-02 22:50:02] ✅ Fecha string convertida: 1/27/2025 -> 2025-01-27 (Campo: fecha_proceso)
[2025-11-02 22:50:02] ✅ Fecha string convertida: 12/5/2020 -> 2020-12-05 (Campo: fecha_castigo)
[2025-11-02 22:50:02] ✅ Fecha string convertida: 6/5/2020 -> 2020-06-05 (Campo: fecha_vencimiento)
[2025-11-02 22:50:02] ✅ Fecha string convertida: 12/16/2014 -> 2014-12-16 (Campo: fecha_susc)
[2025-11-02 22:50:02] ✅ Fecha string convertida: 2/1/2021 -> 2021-02-01 (Campo: fecha_asignacion)
[2025-11-02 22:50:02] ✅ Fecha string convertida: 1/27/2025 -> 2025-01-27 (Campo: fecha_proceso)
[2025-11-02 22:50:02] ✅ Fecha string convertida: 12/5/2020 -> 2020-12-05 (Campo: fecha_castigo)
[2025-11-02 22:50:02] ✅ Fecha string convertida: 11/27/2022 -> 2022-11-27 (Campo: fecha_pago)
[2025-11-02 22:50:02] ✅ Fecha string convertida: 6/5/2020 -> 2020-06-05 (Campo: fecha_vencimiento)
[2025-11-02 22:50:02] ✅ Fecha string convertida: 7/16/2014 -> 2014-07-16 (Campo: fecha_susc)
[2025-11-02 22:50:02] ✅ Fecha string convertida: 2/1/2021 -> 2021-02-01 (Campo: fecha_asignacion)
[2025-11-02 22:50:02] ✅ Fecha string convertida: 1/27/2025 -> 2025-01-27 (Campo: fecha_proceso)
[2025-11-02 22:50:02] ✅ Fecha string convertida: 3/25/2021 -> 2021-03-25 (Campo: fecha_castigo)
[2025-11-02 22:50:02] ✅ Fecha string convertida: 2/15/2023 -> 2023-02-15 (Campo: fecha_pago)
[2025-11-02 22:50:02] ✅ Fecha string convertida: 9/25/2020 -> 2020-09-25 (Campo: fecha_vencimiento)
[2025-11-02 22:50:02] ✅ Fecha string convertida: 5/27/2012 -> 2012-05-27 (Campo: fecha_susc)
[2025-11-02 22:50:02] ✅ Fecha string convertida: 5/1/2021 -> 2021-05-01 (Campo: fecha_asignacion)
[2025-11-02 22:50:02] ✅ Fecha string convertida: 1/27/2025 -> 2025-01-27 (Campo: fecha_proceso)
[2025-11-02 22:50:02] ✅ Fecha string convertida: 4/5/2021 -> 2021-04-05 (Campo: fecha_castigo)
[2025-11-02 22:50:02] ✅ Fecha string convertida: 10/5/2020 -> 2020-10-05 (Campo: fecha_vencimiento)
[2025-11-02 22:50:02] ✅ Fecha string convertida: 11/25/2019 -> 2019-11-25 (Campo: fecha_susc)
[2025-11-02 22:50:02] ✅ Fecha string convertida: 6/1/2021 -> 2021-06-01 (Campo: fecha_asignacion)
[2025-11-02 22:50:02] ✅ Fecha string convertida: 1/27/2025 -> 2025-01-27 (Campo: fecha_proceso)
[2025-11-02 22:50:02] ✅ Fecha string convertida: 4/5/2021 -> 2021-04-05 (Campo: fecha_castigo)
[2025-11-02 22:50:02] ✅ Fecha string convertida: 10/5/2020 -> 2020-10-05 (Campo: fecha_vencimiento)
[2025-11-02 22:50:02] ✅ Fecha string convertida: 3/12/2010 -> 2010-03-12 (Campo: fecha_susc)
[2025-11-02 22:50:02] ✅ Fecha string convertida: 6/1/2021 -> 2021-06-01 (Campo: fecha_asignacion)
[2025-11-02 22:50:02] ✅ Fecha string convertida: 1/27/2025 -> 2025-01-27 (Campo: fecha_proceso)
[2025-11-02 22:50:02] ✅ Fecha string convertida: 4/5/2021 -> 2021-04-05 (Campo: fecha_castigo)
[2025-11-02 22:50:02] ✅ Fecha string convertida: 10/5/2020 -> 2020-10-05 (Campo: fecha_vencimiento)
[2025-11-02 22:50:02] ✅ Fecha string convertida: 5/10/1999 -> 1999-05-10 (Campo: fecha_susc)
[2025-11-02 22:50:02] ✅ Fecha string convertida: 6/1/2021 -> 2021-06-01 (Campo: fecha_asignacion)
[2025-11-02 22:50:02] ✅ Fecha string convertida: 1/27/2025 -> 2025-01-27 (Campo: fecha_proceso)
[2025-11-02 22:50:02] ✅ Fecha string convertida: 9/5/2021 -> 2021-09-05 (Campo: fecha_castigo)
[2025-11-02 22:50:02] ✅ Fecha string convertida: 3/5/2021 -> 2021-03-05 (Campo: fecha_vencimiento)
[2025-11-02 22:50:02] ✅ Fecha string convertida: 6/18/2017 -> 2017-06-18 (Campo: fecha_susc)
[2025-11-02 22:50:02] ✅ Fecha string convertida: 11/1/2021 -> 2021-11-01 (Campo: fecha_asignacion)
[2025-11-02 22:50:02] ✅ Fecha string convertida: 1/27/2025 -> 2025-01-27 (Campo: fecha_proceso)
[2025-11-02 22:50:02] ✅ Fecha string convertida: 10/10/2021 -> 2021-10-10 (Campo: fecha_castigo)
[2025-11-02 22:50:02] ✅ Fecha string convertida: 4/22/2023 -> 2023-04-22 (Campo: fecha_pago)
[2025-11-02 22:50:02] ✅ Fecha string convertida: 4/10/2021 -> 2021-04-10 (Campo: fecha_vencimiento)
[2025-11-02 22:50:02] ✅ Fecha string convertida: 12/1/2019 -> 2019-12-01 (Campo: fecha_susc)
[2025-11-02 22:50:02] ✅ Fecha string convertida: 12/1/2021 -> 2021-12-01 (Campo: fecha_asignacion)
[2025-11-02 22:50:02] ✅ Fecha string convertida: 1/27/2025 -> 2025-01-27 (Campo: fecha_proceso)
[2025-11-02 22:50:02] ✅ Fecha string convertida: 12/30/2021 -> 2021-12-30 (Campo: fecha_castigo)
[2025-11-02 22:50:02] ✅ Fecha string convertida: 6/30/2021 -> 2021-06-30 (Campo: fecha_vencimiento)
[2025-11-02 22:50:02] ✅ Fecha string convertida: 3/22/2019 -> 2019-03-22 (Campo: fecha_susc)
[2025-11-02 22:50:02] ✅ Fecha string convertida: 2/1/2022 -> 2022-02-01 (Campo: fecha_asignacion)
[2025-11-02 22:50:02] ✅ Fecha string convertida: 1/27/2025 -> 2025-01-27 (Campo: fecha_proceso)
[2025-11-02 22:50:02] ✅ Fecha string convertida: 2/5/2022 -> 2022-02-05 (Campo: fecha_castigo)
[2025-11-02 22:50:02] ✅ Fecha string convertida: 8/5/2021 -> 2021-08-05 (Campo: fecha_vencimiento)
[2025-11-02 22:50:02] ✅ Fecha string convertida: 6/9/2010 -> 2010-06-09 (Campo: fecha_susc)
[2025-11-02 22:50:02] ✅ Fecha string convertida: 4/1/2022 -> 2022-04-01 (Campo: fecha_asignacion)
[2025-11-02 22:50:02] ✅ Fecha string convertida: 1/27/2025 -> 2025-01-27 (Campo: fecha_proceso)
[2025-11-02 22:50:02] ✅ Fecha string convertida: 2/5/2022 -> 2022-02-05 (Campo: fecha_castigo)
[2025-11-02 22:50:02] ✅ Valor convertido a DECIMAL: '$ 1,665,496' -> 1665496
[2025-11-02 22:50:02] ✅ Fecha string convertida: 8/5/2021 -> 2021-08-05 (Campo: fecha_vencimiento)
[2025-11-02 22:50:02] ✅ Fecha string convertida: 6/29/2019 -> 2019-06-29 (Campo: fecha_susc)
[2025-11-02 22:50:02] ✅ Fecha string convertida: 4/1/2022 -> 2022-04-01 (Campo: fecha_asignacion)
[2025-11-02 22:50:02] ✅ Fecha string convertida: 1/27/2025 -> 2025-01-27 (Campo: fecha_proceso)
[2025-11-02 22:50:02] ✅ Fecha string convertida: 2/15/2022 -> 2022-02-15 (Campo: fecha_castigo)
[2025-11-02 22:50:02] ✅ Fecha string convertida: 10/17/2022 -> 2022-10-17 (Campo: fecha_pago)
[2025-11-02 22:50:02] ✅ Fecha string convertida: 8/15/2021 -> 2021-08-15 (Campo: fecha_vencimiento)
[2025-11-02 22:50:02] ✅ Fecha string convertida: 10/20/2006 -> 2006-10-20 (Campo: fecha_susc)
[2025-11-02 22:50:02] ✅ Fecha string convertida: 4/1/2022 -> 2022-04-01 (Campo: fecha_asignacion)
[2025-11-02 22:50:02] ✅ Fecha string convertida: 1/27/2025 -> 2025-01-27 (Campo: fecha_proceso)
[2025-11-02 22:50:02] ✅ Fecha string convertida: 3/5/2022 -> 2022-03-05 (Campo: fecha_castigo)
[2025-11-02 22:50:02] ✅ Fecha string convertida: 3/3/2023 -> 2023-03-03 (Campo: fecha_pago)
[2025-11-02 22:50:02] ✅ Fecha string convertida: 9/5/2021 -> 2021-09-05 (Campo: fecha_vencimiento)
[2025-11-02 22:50:02] ✅ Fecha string convertida: 12/19/2013 -> 2013-12-19 (Campo: fecha_susc)
[2025-11-02 22:50:02] ✅ Fecha string convertida: 5/1/2022 -> 2022-05-01 (Campo: fecha_asignacion)
[2025-11-02 22:50:02] ✅ Fecha string convertida: 1/27/2025 -> 2025-01-27 (Campo: fecha_proceso)
[2025-11-02 22:50:02] ✅ Fecha string convertida: 3/5/2022 -> 2022-03-05 (Campo: fecha_castigo)
[2025-11-02 22:50:02] ✅ Fecha string convertida: 9/5/2021 -> 2021-09-05 (Campo: fecha_vencimiento)
[2025-11-02 22:50:02] ✅ Fecha string convertida: 8/15/2016 -> 2016-08-15 (Campo: fecha_susc)
[2025-11-02 22:50:02] ✅ Fecha string convertida: 5/1/2022 -> 2022-05-01 (Campo: fecha_asignacion)
[2025-11-02 22:50:02] ✅ Fecha string convertida: 1/27/2025 -> 2025-01-27 (Campo: fecha_proceso)
[2025-11-02 22:50:02] ✅ Fecha string convertida: 3/5/2022 -> 2022-03-05 (Campo: fecha_castigo)
[2025-11-02 22:50:02] ✅ Fecha string convertida: 8/31/2022 -> 2022-08-31 (Campo: fecha_pago)
[2025-11-02 22:50:02] ✅ Fecha string convertida: 9/5/2021 -> 2021-09-05 (Campo: fecha_vencimiento)
[2025-11-02 22:50:02] ✅ Fecha string convertida: 4/12/2013 -> 2013-04-12 (Campo: fecha_susc)
[2025-11-02 22:50:02] ✅ Fecha string convertida: 5/1/2022 -> 2022-05-01 (Campo: fecha_asignacion)
[2025-11-02 22:50:02] ✅ Fecha string convertida: 1/27/2025 -> 2025-01-27 (Campo: fecha_proceso)
[2025-11-02 22:50:02] ✅ Fecha string convertida: 3/5/2022 -> 2022-03-05 (Campo: fecha_castigo)
[2025-11-02 22:50:02] ✅ Fecha string convertida: 9/5/2021 -> 2021-09-05 (Campo: fecha_vencimiento)
[2025-11-02 22:50:02] ✅ Fecha string convertida: 5/21/2015 -> 2015-05-21 (Campo: fecha_susc)
[2025-11-02 22:50:02] ✅ Fecha string convertida: 1/1/2022 -> 2022-01-01 (Campo: fecha_asignacion)
[2025-11-02 22:50:02] ✅ Fecha string convertida: 1/27/2025 -> 2025-01-27 (Campo: fecha_proceso)
[2025-11-02 22:50:02] ✅ Fecha string convertida: 3/10/2022 -> 2022-03-10 (Campo: fecha_castigo)
[2025-11-02 22:50:02] ✅ Fecha string convertida: 9/10/2021 -> 2021-09-10 (Campo: fecha_vencimiento)
[2025-11-02 22:50:02] ✅ Fecha string convertida: 5/8/2016 -> 2016-05-08 (Campo: fecha_susc)
[2025-11-02 22:50:02] ✅ Fecha string convertida: 5/1/2022 -> 2022-05-01 (Campo: fecha_asignacion)
[2025-11-02 22:50:02] ✅ Fecha string convertida: 1/27/2025 -> 2025-01-27 (Campo: fecha_proceso)
[2025-11-02 22:50:02] ✅ Fecha string convertida: 3/15/2022 -> 2022-03-15 (Campo: fecha_castigo)
[2025-11-02 22:50:02] ✅ Fecha string convertida: 8/18/2022 -> 2022-08-18 (Campo: fecha_pago)
[2025-11-02 22:50:02] ✅ Fecha string convertida: 9/15/2021 -> 2021-09-15 (Campo: fecha_vencimiento)
[2025-11-02 22:50:02] ✅ Fecha string convertida: 9/25/2016 -> 2016-09-25 (Campo: fecha_susc)
[2025-11-02 22:50:02] ✅ Fecha string convertida: 1/1/2022 -> 2022-01-01 (Campo: fecha_asignacion)
[2025-11-02 22:50:02] ✅ Fecha string convertida: 1/27/2025 -> 2025-01-27 (Campo: fecha_proceso)
[2025-11-02 22:50:02] ✅ Fecha string convertida: 3/30/2022 -> 2022-03-30 (Campo: fecha_castigo)
[2025-11-02 22:50:02] ✅ Fecha string convertida: 9/30/2021 -> 2021-09-30 (Campo: fecha_vencimiento)
[2025-11-02 22:50:02] ✅ Fecha string convertida: 4/28/2018 -> 2018-04-28 (Campo: fecha_susc)
[2025-11-02 22:50:02] ✅ Fecha string convertida: 5/1/2022 -> 2022-05-01 (Campo: fecha_asignacion)
[2025-11-02 22:50:02] ✅ Fecha string convertida: 1/27/2025 -> 2025-01-27 (Campo: fecha_proceso)
[2025-11-02 22:50:02] ✅ Fecha string convertida: 4/5/2022 -> 2022-04-05 (Campo: fecha_castigo)
[2025-11-02 22:50:02] ✅ Fecha string convertida: 11/28/2022 -> 2022-11-28 (Campo: fecha_pago)
[2025-11-02 22:50:02] ✅ Fecha string convertida: 10/5/2021 -> 2021-10-05 (Campo: fecha_vencimiento)
[2025-11-02 22:50:03] ✅ Fecha string convertida: 7/14/2010 -> 2010-07-14 (Campo: fecha_susc)
[2025-11-02 22:50:03] ✅ Fecha string convertida: 6/1/2022 -> 2022-06-01 (Campo: fecha_asignacion)
[2025-11-02 22:50:03] ✅ Fecha string convertida: 1/27/2025 -> 2025-01-27 (Campo: fecha_proceso)
[2025-11-02 22:50:03] ✅ Fecha string convertida: 4/15/2022 -> 2022-04-15 (Campo: fecha_castigo)
[2025-11-02 22:50:03] ✅ Fecha string convertida: 10/15/2021 -> 2021-10-15 (Campo: fecha_vencimiento)
[2025-11-02 22:50:03] ✅ Fecha string convertida: 10/7/2020 -> 2020-10-07 (Campo: fecha_susc)
[2025-11-02 22:50:03] ✅ Fecha string convertida: 6/1/2022 -> 2022-06-01 (Campo: fecha_asignacion)
[2025-11-02 22:50:03] ✅ Fecha string convertida: 1/27/2025 -> 2025-01-27 (Campo: fecha_proceso)
[2025-11-02 22:50:03] ✅ Fecha string convertida: 5/5/2022 -> 2022-05-05 (Campo: fecha_castigo)
[2025-11-02 22:50:03] ✅ Fecha string convertida: 12/1/2022 -> 2022-12-01 (Campo: fecha_pago)
[2025-11-02 22:50:03] ✅ Fecha string convertida: 11/5/2021 -> 2021-11-05 (Campo: fecha_vencimiento)
[2025-11-02 22:50:03] ✅ Fecha string convertida: 5/6/2014 -> 2014-05-06 (Campo: fecha_susc)
[2025-11-02 22:50:03] ✅ Fecha string convertida: 4/1/2022 -> 2022-04-01 (Campo: fecha_asignacion)
[2025-11-02 22:50:03] ✅ Fecha string convertida: 1/27/2025 -> 2025-01-27 (Campo: fecha_proceso)
[2025-11-02 22:50:03] ✅ Fecha string convertida: 5/10/2022 -> 2022-05-10 (Campo: fecha_castigo)
[2025-11-02 22:50:03] ✅ Fecha string convertida: 4/15/2023 -> 2023-04-15 (Campo: fecha_pago)
[2025-11-02 22:50:03] ✅ Fecha string convertida: 11/10/2021 -> 2021-11-10 (Campo: fecha_vencimiento)
[2025-11-02 22:50:03] ✅ Fecha string convertida: 2/9/2009 -> 2009-02-09 (Campo: fecha_susc)
[2025-11-02 22:50:03] ✅ Fecha string convertida: 7/1/2022 -> 2022-07-01 (Campo: fecha_asignacion)
[2025-11-02 22:50:03] ✅ Fecha string convertida: 1/27/2025 -> 2025-01-27 (Campo: fecha_proceso)
[2025-11-02 22:50:03] ✅ Fecha string convertida: 7/5/2022 -> 2022-07-05 (Campo: fecha_castigo)
[2025-11-02 22:50:03] ✅ Fecha string convertida: 6/11/2023 -> 2023-06-11 (Campo: fecha_pago)
[2025-11-02 22:50:03] ✅ Fecha string convertida: 1/5/2022 -> 2022-01-05 (Campo: fecha_vencimiento)
[2025-11-02 22:50:03] ✅ Fecha string convertida: 9/13/2014 -> 2014-09-13 (Campo: fecha_susc)
[2025-11-02 22:50:03] ✅ Fecha string convertida: 9/1/2022 -> 2022-09-01 (Campo: fecha_asignacion)
[2025-11-02 22:50:03] ✅ Fecha string convertida: 1/27/2025 -> 2025-01-27 (Campo: fecha_proceso)
[2025-11-02 22:50:03] ✅ Fecha string convertida: 7/5/2022 -> 2022-07-05 (Campo: fecha_castigo)
[2025-11-02 22:50:03] ✅ Fecha string convertida: 1/5/2022 -> 2022-01-05 (Campo: fecha_vencimiento)
[2025-11-02 22:50:03] ✅ Fecha string convertida: 11/8/2014 -> 2014-11-08 (Campo: fecha_susc)
[2025-11-02 22:50:03] ✅ Fecha string convertida: 9/1/2022 -> 2022-09-01 (Campo: fecha_asignacion)
[2025-11-02 22:50:03] ✅ Fecha string convertida: 1/27/2025 -> 2025-01-27 (Campo: fecha_proceso)
[2025-11-02 22:50:03] ✅ Fecha string convertida: 7/5/2022 -> 2022-07-05 (Campo: fecha_castigo)
[2025-11-02 22:50:03] ✅ Fecha string convertida: 1/5/2022 -> 2022-01-05 (Campo: fecha_vencimiento)
[2025-11-02 22:50:03] ✅ Fecha string convertida: 11/13/2016 -> 2016-11-13 (Campo: fecha_susc)
[2025-11-02 22:50:03] ✅ Fecha string convertida: 9/1/2022 -> 2022-09-01 (Campo: fecha_asignacion)
[2025-11-02 22:50:03] ✅ Fecha string convertida: 1/27/2025 -> 2025-01-27 (Campo: fecha_proceso)
[2025-11-02 22:50:03] ✅ Fecha string convertida: 7/5/2022 -> 2022-07-05 (Campo: fecha_castigo)
[2025-11-02 22:50:03] ✅ Fecha string convertida: 1/5/2022 -> 2022-01-05 (Campo: fecha_vencimiento)
[2025-11-02 22:50:03] ✅ Fecha string convertida: 8/18/2014 -> 2014-08-18 (Campo: fecha_susc)
[2025-11-02 22:50:03] ✅ Fecha string convertida: 6/1/2022 -> 2022-06-01 (Campo: fecha_asignacion)
[2025-11-02 22:50:03] ✅ Fecha string convertida: 1/27/2025 -> 2025-01-27 (Campo: fecha_proceso)
[2025-11-02 22:50:03] ✅ Fecha string convertida: 7/5/2022 -> 2022-07-05 (Campo: fecha_castigo)
[2025-11-02 22:50:03] ✅ Fecha string convertida: 1/16/2023 -> 2023-01-16 (Campo: fecha_pago)
[2025-11-02 22:50:03] ✅ Fecha string convertida: 1/5/2022 -> 2022-01-05 (Campo: fecha_vencimiento)
[2025-11-02 22:50:03] ✅ Fecha string convertida: 8/13/2013 -> 2013-08-13 (Campo: fecha_susc)
[2025-11-02 22:50:03] ✅ Fecha string convertida: 6/1/2022 -> 2022-06-01 (Campo: fecha_asignacion)
[2025-11-02 22:50:03] ✅ Fecha string convertida: 1/27/2025 -> 2025-01-27 (Campo: fecha_proceso)
[2025-11-02 22:50:03] ✅ Fecha string convertida: 8/5/2022 -> 2022-08-05 (Campo: fecha_castigo)
[2025-11-02 22:50:03] ✅ Fecha string convertida: 5/26/2023 -> 2023-05-26 (Campo: fecha_pago)
[2025-11-02 22:50:03] ✅ Fecha string convertida: 2/5/2022 -> 2022-02-05 (Campo: fecha_vencimiento)
[2025-11-02 22:50:03] ✅ Fecha string convertida: 10/24/2016 -> 2016-10-24 (Campo: fecha_susc)
[2025-11-02 22:50:03] ✅ Fecha string convertida: 10/1/2022 -> 2022-10-01 (Campo: fecha_asignacion)
[2025-11-02 22:50:03] ✅ Fecha string convertida: 1/27/2025 -> 2025-01-27 (Campo: fecha_proceso)
[2025-11-02 22:50:03] ✅ Fecha string convertida: 8/5/2022 -> 2022-08-05 (Campo: fecha_castigo)
[2025-11-02 22:50:03] ✅ Fecha string convertida: 1/8/2022 -> 2022-01-08 (Campo: fecha_pago)
[2025-11-02 22:50:03] ✅ Fecha string convertida: 2/5/2022 -> 2022-02-05 (Campo: fecha_vencimiento)
[2025-11-02 22:50:03] ✅ Fecha string convertida: 6/26/2016 -> 2016-06-26 (Campo: fecha_susc)
[2025-11-02 22:50:03] ✅ Fecha string convertida: 10/1/2022 -> 2022-10-01 (Campo: fecha_asignacion)
[2025-11-02 22:50:03] ✅ Fecha string convertida: 1/27/2025 -> 2025-01-27 (Campo: fecha_proceso)
[2025-11-02 22:50:03] ✅ Fecha string convertida: 8/5/2022 -> 2022-08-05 (Campo: fecha_castigo)
[2025-11-02 22:50:03] ✅ Fecha string convertida: 2/26/2022 -> 2022-02-26 (Campo: fecha_pago)
[2025-11-02 22:50:03] ✅ Fecha string convertida: 2/5/2022 -> 2022-02-05 (Campo: fecha_vencimiento)
[2025-11-02 22:50:03] ✅ Fecha string convertida: 3/4/2016 -> 2016-03-04 (Campo: fecha_susc)
[2025-11-02 22:50:03] ✅ Fecha string convertida: 10/1/2022 -> 2022-10-01 (Campo: fecha_asignacion)
[2025-11-02 22:50:03] ✅ Fecha string convertida: 1/27/2025 -> 2025-01-27 (Campo: fecha_proceso)
[2025-11-02 22:50:03] ✅ Fecha string convertida: 8/10/2022 -> 2022-08-10 (Campo: fecha_castigo)
[2025-11-02 22:50:03] ✅ Fecha string convertida: 1/2/2022 -> 2022-01-02 (Campo: fecha_pago)
[2025-11-02 22:50:03] ✅ Fecha string convertida: 2/10/2022 -> 2022-02-10 (Campo: fecha_vencimiento)
[2025-11-02 22:50:03] ✅ Fecha string convertida: 8/19/2020 -> 2020-08-19 (Campo: fecha_susc)
[2025-11-02 22:50:03] ✅ Fecha string convertida: 10/1/2022 -> 2022-10-01 (Campo: fecha_asignacion)
[2025-11-02 22:50:03] ✅ Fecha string convertida: 1/27/2025 -> 2025-01-27 (Campo: fecha_proceso)
[2025-11-02 22:50:03] ✅ Fecha string convertida: 8/10/2022 -> 2022-08-10 (Campo: fecha_castigo)
[2025-11-02 22:50:03] ✅ Fecha string convertida: 10/11/2023 -> 2023-10-11 (Campo: fecha_pago)
[2025-11-02 22:50:03] ✅ Fecha string convertida: 2/10/2022 -> 2022-02-10 (Campo: fecha_vencimiento)
[2025-11-02 22:50:03] ✅ Fecha string convertida: 3/22/2019 -> 2019-03-22 (Campo: fecha_susc)
[2025-11-02 22:50:03] ✅ Fecha string convertida: 10/1/2022 -> 2022-10-01 (Campo: fecha_asignacion)
[2025-11-02 22:50:03] ✅ Fecha string convertida: 1/27/2025 -> 2025-01-27 (Campo: fecha_proceso)
[2025-11-02 22:50:03] ✅ Fecha string convertida: 9/5/2022 -> 2022-09-05 (Campo: fecha_castigo)
[2025-11-02 22:50:03] ✅ Fecha string convertida: 3/5/2022 -> 2022-03-05 (Campo: fecha_vencimiento)
[2025-11-02 22:50:03] ✅ Fecha string convertida: 11/13/2017 -> 2017-11-13 (Campo: fecha_susc)
[2025-11-02 22:50:03] ✅ Fecha string convertida: 11/1/2022 -> 2022-11-01 (Campo: fecha_asignacion)
[2025-11-02 22:50:03] ✅ Fecha string convertida: 1/27/2025 -> 2025-01-27 (Campo: fecha_proceso)
[2025-11-02 22:50:03] ✅ Fecha string convertida: 9/5/2022 -> 2022-09-05 (Campo: fecha_castigo)
[2025-11-02 22:50:03] ✅ Fecha string convertida: 5/10/2022 -> 2022-05-10 (Campo: fecha_pago)
[2025-11-02 22:50:03] ✅ Fecha string convertida: 3/5/2022 -> 2022-03-05 (Campo: fecha_vencimiento)
[2025-11-02 22:50:03] ✅ Fecha string convertida: 5/12/2017 -> 2017-05-12 (Campo: fecha_susc)
[2025-11-02 22:50:03] ✅ Fecha string convertida: 11/1/2022 -> 2022-11-01 (Campo: fecha_asignacion)
[2025-11-02 22:50:03] ✅ Fecha string convertida: 1/27/2025 -> 2025-01-27 (Campo: fecha_proceso)
[2025-11-02 22:50:03] ✅ Fecha string convertida: 10/5/2022 -> 2022-10-05 (Campo: fecha_castigo)
[2025-11-02 22:50:03] ✅ Fecha string convertida: 9/30/2022 -> 2022-09-30 (Campo: fecha_pago)
[2025-11-02 22:50:03] ✅ Fecha string convertida: 4/5/2022 -> 2022-04-05 (Campo: fecha_vencimiento)
[2025-11-02 22:50:03] ✅ Fecha string convertida: 10/23/2006 -> 2006-10-23 (Campo: fecha_susc)
[2025-11-02 22:50:03] ✅ Fecha string convertida: 12/1/2022 -> 2022-12-01 (Campo: fecha_asignacion)
[2025-11-02 22:50:03] ✅ Fecha string convertida: 1/27/2025 -> 2025-01-27 (Campo: fecha_proceso)
[2025-11-02 22:50:03] ✅ Fecha string convertida: 10/5/2022 -> 2022-10-05 (Campo: fecha_castigo)
[2025-11-02 22:50:03] ✅ Fecha string convertida: 3/13/2022 -> 2022-03-13 (Campo: fecha_pago)
[2025-11-02 22:50:03] ✅ Fecha string convertida: 4/5/2022 -> 2022-04-05 (Campo: fecha_vencimiento)
[2025-11-02 22:50:03] ✅ Fecha string convertida: 12/6/2016 -> 2016-12-06 (Campo: fecha_susc)
[2025-11-02 22:50:03] ✅ Fecha string convertida: 12/1/2022 -> 2022-12-01 (Campo: fecha_asignacion)
[2025-11-02 22:50:03] ✅ Fecha string convertida: 1/27/2025 -> 2025-01-27 (Campo: fecha_proceso)
[2025-11-02 22:50:03] ✅ Fecha string convertida: 10/5/2022 -> 2022-10-05 (Campo: fecha_castigo)
[2025-11-02 22:50:03] ✅ Fecha string convertida: 4/5/2022 -> 2022-04-05 (Campo: fecha_vencimiento)
[2025-11-02 22:50:03] ✅ Fecha string convertida: 4/14/2008 -> 2008-04-14 (Campo: fecha_susc)
[2025-11-02 22:50:03] ✅ Fecha string convertida: 12/1/2022 -> 2022-12-01 (Campo: fecha_asignacion)
[2025-11-02 22:50:03] ✅ Fecha string convertida: 1/27/2025 -> 2025-01-27 (Campo: fecha_proceso)
[2025-11-02 22:50:03] ✅ Fecha string convertida: 10/10/2022 -> 2022-10-10 (Campo: fecha_castigo)
[2025-11-02 22:50:03] ✅ Fecha string convertida: 7/31/2023 -> 2023-07-31 (Campo: fecha_pago)
[2025-11-02 22:50:03] ✅ Fecha string convertida: 4/10/2022 -> 2022-04-10 (Campo: fecha_vencimiento)
[2025-11-02 22:50:03] ✅ Fecha string convertida: 6/26/2008 -> 2008-06-26 (Campo: fecha_susc)
[2025-11-02 22:50:03] ✅ Fecha string convertida: 12/1/2022 -> 2022-12-01 (Campo: fecha_asignacion)
[2025-11-02 22:50:03] ✅ Fecha string convertida: 1/27/2025 -> 2025-01-27 (Campo: fecha_proceso)
[2025-11-02 22:50:03] ✅ Fecha string convertida: 10/10/2022 -> 2022-10-10 (Campo: fecha_castigo)
[2025-11-02 22:50:03] ✅ Fecha string convertida: 12/1/2024 -> 2024-12-01 (Campo: fecha_pago)
[2025-11-02 22:50:03] ✅ Fecha string convertida: 4/10/2022 -> 2022-04-10 (Campo: fecha_vencimiento)
[2025-11-02 22:50:03] ✅ Fecha string convertida: 11/21/2012 -> 2012-11-21 (Campo: fecha_susc)
[2025-11-02 22:50:03] ✅ Fecha string convertida: 12/1/2022 -> 2022-12-01 (Campo: fecha_asignacion)
[2025-11-02 22:50:03] ✅ Fecha string convertida: 1/27/2025 -> 2025-01-27 (Campo: fecha_proceso)
[2025-11-02 22:50:03] ✅ Fecha string convertida: 10/10/2022 -> 2022-10-10 (Campo: fecha_castigo)
[2025-11-02 22:50:03] ✅ Fecha string convertida: 3/2/2022 -> 2022-03-02 (Campo: fecha_pago)
[2025-11-02 22:50:03] ✅ Fecha string convertida: 4/10/2022 -> 2022-04-10 (Campo: fecha_vencimiento)
[2025-11-02 22:50:03] ✅ Fecha string convertida: 5/26/2017 -> 2017-05-26 (Campo: fecha_susc)
[2025-11-02 22:50:03] ✅ Fecha string convertida: 12/1/2022 -> 2022-12-01 (Campo: fecha_asignacion)
[2025-11-02 22:50:03] ✅ Fecha string convertida: 1/27/2025 -> 2025-01-27 (Campo: fecha_proceso)
[2025-11-02 22:50:03] ✅ Fecha string convertida: 10/10/2022 -> 2022-10-10 (Campo: fecha_castigo)
[2025-11-02 22:50:03] ✅ Fecha string convertida: 7/7/2022 -> 2022-07-07 (Campo: fecha_pago)
[2025-11-02 22:50:03] ✅ Fecha string convertida: 4/10/2022 -> 2022-04-10 (Campo: fecha_vencimiento)
[2025-11-02 22:50:03] ✅ Fecha string convertida: 7/3/1990 -> 1990-07-03 (Campo: fecha_susc)
[2025-11-02 22:50:03] ✅ Fecha string convertida: 12/1/2022 -> 2022-12-01 (Campo: fecha_asignacion)
[2025-11-02 22:50:03] ✅ Fecha string convertida: 1/27/2025 -> 2025-01-27 (Campo: fecha_proceso)
[2025-11-02 22:50:03] ✅ Fecha string convertida: 10/15/2022 -> 2022-10-15 (Campo: fecha_castigo)
[2025-11-02 22:50:03] ✅ Fecha string convertida: 3/13/2022 -> 2022-03-13 (Campo: fecha_pago)
[2025-11-02 22:50:03] ✅ Fecha string convertida: 4/15/2022 -> 2022-04-15 (Campo: fecha_vencimiento)
[2025-11-02 22:50:03] ✅ Fecha string convertida: 2/7/2018 -> 2018-02-07 (Campo: fecha_susc)
[2025-11-02 22:50:03] ✅ Fecha string convertida: 12/1/2022 -> 2022-12-01 (Campo: fecha_asignacion)
[2025-11-02 22:50:03] ✅ Fecha string convertida: 1/27/2025 -> 2025-01-27 (Campo: fecha_proceso)
[2025-11-02 22:50:03] ✅ Fecha string convertida: 10/15/2022 -> 2022-10-15 (Campo: fecha_castigo)
[2025-11-02 22:50:03] ✅ Fecha string convertida: 3/31/2022 -> 2022-03-31 (Campo: fecha_pago)
[2025-11-02 22:50:03] ✅ Fecha string convertida: 4/15/2022 -> 2022-04-15 (Campo: fecha_vencimiento)
[2025-11-02 22:50:03] ✅ Fecha string convertida: 7/13/2005 -> 2005-07-13 (Campo: fecha_susc)
[2025-11-02 22:50:03] ✅ Fecha string convertida: 12/1/2022 -> 2022-12-01 (Campo: fecha_asignacion)
[2025-11-02 22:50:03] ✅ Fecha string convertida: 1/27/2025 -> 2025-01-27 (Campo: fecha_proceso)
[2025-11-02 22:50:03] ✅ Fecha string convertida: 11/5/2022 -> 2022-11-05 (Campo: fecha_castigo)
[2025-11-02 22:50:03] ✅ Fecha string convertida: 5/26/2022 -> 2022-05-26 (Campo: fecha_pago)
[2025-11-02 22:50:03] ✅ Fecha string convertida: 5/5/2022 -> 2022-05-05 (Campo: fecha_vencimiento)
[2025-11-02 22:50:03] ✅ Fecha string convertida: 3/29/2001 -> 2001-03-29 (Campo: fecha_susc)
[2025-11-02 22:50:03] ✅ Fecha string convertida: 1/1/2023 -> 2023-01-01 (Campo: fecha_asignacion)
[2025-11-02 22:50:03] ✅ Fecha string convertida: 1/27/2025 -> 2025-01-27 (Campo: fecha_proceso)
[2025-11-02 22:50:03] ✅ Fecha string convertida: 11/5/2022 -> 2022-11-05 (Campo: fecha_castigo)
[2025-11-02 22:50:03] ✅ Fecha string convertida: 4/1/2022 -> 2022-04-01 (Campo: fecha_pago)
[2025-11-02 22:50:03] ✅ Fecha string convertida: 5/5/2022 -> 2022-05-05 (Campo: fecha_vencimiento)
[2025-11-02 22:50:03] ✅ Fecha string convertida: 5/10/2013 -> 2013-05-10 (Campo: fecha_susc)
[2025-11-02 22:50:03] ✅ Fecha string convertida: 1/1/2023 -> 2023-01-01 (Campo: fecha_asignacion)
[2025-11-02 22:50:03] ✅ Fecha string convertida: 1/27/2025 -> 2025-01-27 (Campo: fecha_proceso)
[2025-11-02 22:50:03] ✅ Fecha string convertida: 11/5/2022 -> 2022-11-05 (Campo: fecha_castigo)
[2025-11-02 22:50:03] ✅ Fecha string convertida: 4/13/2022 -> 2022-04-13 (Campo: fecha_pago)
[2025-11-02 22:50:03] ✅ Fecha string convertida: 5/5/2022 -> 2022-05-05 (Campo: fecha_vencimiento)
[2025-11-02 22:50:03] ✅ Fecha string convertida: 10/6/2015 -> 2015-10-06 (Campo: fecha_susc)
[2025-11-02 22:50:03] ✅ Fecha string convertida: 1/1/2023 -> 2023-01-01 (Campo: fecha_asignacion)
[2025-11-02 22:50:03] ✅ Fecha string convertida: 1/27/2025 -> 2025-01-27 (Campo: fecha_proceso)
[2025-11-02 22:50:03] ✅ Fecha string convertida: 11/5/2022 -> 2022-11-05 (Campo: fecha_castigo)
[2025-11-02 22:50:03] ✅ Fecha string convertida: 5/9/2022 -> 2022-05-09 (Campo: fecha_pago)
[2025-11-02 22:50:03] ✅ Fecha string convertida: 5/5/2022 -> 2022-05-05 (Campo: fecha_vencimiento)
[2025-11-02 22:50:03] ✅ Fecha string convertida: 9/1/2016 -> 2016-09-01 (Campo: fecha_susc)
[2025-11-02 22:50:03] ✅ Fecha string convertida: 1/1/2023 -> 2023-01-01 (Campo: fecha_asignacion)
[2025-11-02 22:50:03] ✅ Fecha string convertida: 1/27/2025 -> 2025-01-27 (Campo: fecha_proceso)
[2025-11-02 22:50:03] ✅ Fecha string convertida: 11/5/2022 -> 2022-11-05 (Campo: fecha_castigo)
[2025-11-02 22:50:03] ✅ Fecha string convertida: 9/5/2022 -> 2022-09-05 (Campo: fecha_pago)
[2025-11-02 22:50:03] ✅ Fecha string convertida: 5/5/2022 -> 2022-05-05 (Campo: fecha_vencimiento)
[2025-11-02 22:50:03] ✅ Fecha string convertida: 10/18/2013 -> 2013-10-18 (Campo: fecha_susc)
[2025-11-02 22:50:03] ✅ Fecha string convertida: 1/1/2023 -> 2023-01-01 (Campo: fecha_asignacion)
[2025-11-02 22:50:03] ✅ Fecha string convertida: 1/27/2025 -> 2025-01-27 (Campo: fecha_proceso)
[2025-11-02 22:50:03] ✅ Fecha string convertida: 11/10/2022 -> 2022-11-10 (Campo: fecha_castigo)
[2025-11-02 22:50:03] ✅ Fecha string convertida: 2/7/2024 -> 2024-02-07 (Campo: fecha_pago)
[2025-11-02 22:50:03] ✅ Fecha string convertida: 5/10/2022 -> 2022-05-10 (Campo: fecha_vencimiento)
[2025-11-02 22:50:03] ✅ Fecha string convertida: 11/24/2020 -> 2020-11-24 (Campo: fecha_susc)
[2025-11-02 22:50:03] ✅ Fecha string convertida: 1/1/2023 -> 2023-01-01 (Campo: fecha_asignacion)
[2025-11-02 22:50:03] ✅ Fecha string convertida: 1/27/2025 -> 2025-01-27 (Campo: fecha_proceso)
[2025-11-02 22:50:03] ✅ Fecha string convertida: 12/5/2022 -> 2022-12-05 (Campo: fecha_castigo)
[2025-11-02 22:50:03] ✅ Fecha string convertida: 4/20/2022 -> 2022-04-20 (Campo: fecha_pago)
[2025-11-02 22:50:03] ✅ Fecha string convertida: 6/5/2022 -> 2022-06-05 (Campo: fecha_vencimiento)
[2025-11-02 22:50:03] ✅ Fecha string convertida: 5/6/2016 -> 2016-05-06 (Campo: fecha_susc)
[2025-11-02 22:50:03] ✅ Fecha string convertida: 2/1/2023 -> 2023-02-01 (Campo: fecha_asignacion)
[2025-11-02 22:50:03] ✅ Fecha string convertida: 1/27/2025 -> 2025-01-27 (Campo: fecha_proceso)
[2025-11-02 22:50:03] ✅ Fecha string convertida: 12/5/2022 -> 2022-12-05 (Campo: fecha_castigo)
[2025-11-02 22:50:03] ✅ Fecha string convertida: 8/31/2023 -> 2023-08-31 (Campo: fecha_pago)
[2025-11-02 22:50:03] ✅ Fecha string convertida: 6/5/2022 -> 2022-06-05 (Campo: fecha_vencimiento)
[2025-11-02 22:50:03] ✅ Fecha string convertida: 7/6/2019 -> 2019-07-06 (Campo: fecha_susc)
[2025-11-02 22:50:03] ✅ Fecha string convertida: 2/1/2023 -> 2023-02-01 (Campo: fecha_asignacion)
[2025-11-02 22:50:03] ✅ Fecha string convertida: 1/27/2025 -> 2025-01-27 (Campo: fecha_proceso)
[2025-11-02 22:50:03] ✅ Fecha string convertida: 12/5/2022 -> 2022-12-05 (Campo: fecha_castigo)
[2025-11-02 22:50:03] ✅ Fecha string convertida: 6/8/2022 -> 2022-06-08 (Campo: fecha_pago)
[2025-11-02 22:50:03] ✅ Fecha string convertida: 6/5/2022 -> 2022-06-05 (Campo: fecha_vencimiento)
[2025-11-02 22:50:03] ✅ Fecha string convertida: 6/1/2015 -> 2015-06-01 (Campo: fecha_susc)
[2025-11-02 22:50:03] ✅ Fecha string convertida: 2/1/2023 -> 2023-02-01 (Campo: fecha_asignacion)
[2025-11-02 22:50:03] ✅ Fecha string convertida: 1/27/2025 -> 2025-01-27 (Campo: fecha_proceso)
[2025-11-02 22:50:03] ✅ Fecha string convertida: 12/5/2022 -> 2022-12-05 (Campo: fecha_castigo)
[2025-11-02 22:50:03] ✅ Fecha string convertida: 9/10/2024 -> 2024-09-10 (Campo: fecha_pago)
[2025-11-02 22:50:03] ✅ Fecha string convertida: 6/5/2022 -> 2022-06-05 (Campo: fecha_vencimiento)
[2025-11-02 22:50:03] ✅ Fecha string convertida: 4/9/2010 -> 2010-04-09 (Campo: fecha_susc)
[2025-11-02 22:50:03] ✅ Fecha string convertida: 11/1/2022 -> 2022-11-01 (Campo: fecha_asignacion)
[2025-11-02 22:50:03] ✅ Fecha string convertida: 1/27/2025 -> 2025-01-27 (Campo: fecha_proceso)
[2025-11-02 22:50:03] ✅ Fecha string convertida: 12/10/2022 -> 2022-12-10 (Campo: fecha_castigo)
[2025-11-02 22:50:03] ✅ Fecha string convertida: 6/19/2022 -> 2022-06-19 (Campo: fecha_pago)
[2025-11-02 22:50:03] ✅ Fecha string convertida: 6/10/2022 -> 2022-06-10 (Campo: fecha_vencimiento)
[2025-11-02 22:50:03] ✅ Fecha string convertida: 3/15/2017 -> 2017-03-15 (Campo: fecha_susc)
[2025-11-02 22:50:03] ✅ Fecha string convertida: 2/1/2023 -> 2023-02-01 (Campo: fecha_asignacion)
[2025-11-02 22:50:03] ✅ Fecha string convertida: 1/27/2025 -> 2025-01-27 (Campo: fecha_proceso)
[2025-11-02 22:50:03] ✅ Fecha string convertida: 1/20/2023 -> 2023-01-20 (Campo: fecha_castigo)
[2025-11-02 22:50:03] ✅ Fecha string convertida: 6/15/2022 -> 2022-06-15 (Campo: fecha_pago)
[2025-11-02 22:50:03] ✅ Fecha string convertida: 7/20/2022 -> 2022-07-20 (Campo: fecha_vencimiento)
[2025-11-02 22:50:03] ✅ Fecha string convertida: 8/15/2017 -> 2017-08-15 (Campo: fecha_susc)
[2025-11-02 22:50:03] ✅ Fecha string convertida: 3/1/2023 -> 2023-03-01 (Campo: fecha_asignacion)
[2025-11-02 22:50:03] ✅ Fecha string convertida: 1/27/2025 -> 2025-01-27 (Campo: fecha_proceso)
[2025-11-02 22:50:03] ✅ Fecha string convertida: 4/5/2023 -> 2023-04-05 (Campo: fecha_castigo)
[2025-11-02 22:50:03] ✅ Fecha string convertida: 8/17/2022 -> 2022-08-17 (Campo: fecha_pago)
[2025-11-02 22:50:03] ✅ Fecha string convertida: 10/5/2022 -> 2022-10-05 (Campo: fecha_vencimiento)
[2025-11-02 22:50:03] ✅ Fecha string convertida: 9/17/2018 -> 2018-09-17 (Campo: fecha_susc)
[2025-11-02 22:50:03] ✅ Fecha string convertida: 6/1/2023 -> 2023-06-01 (Campo: fecha_asignacion)
[2025-11-02 22:50:03] ✅ Fecha string convertida: 1/27/2025 -> 2025-01-27 (Campo: fecha_proceso)
[2025-11-02 22:50:03] ✅ Fecha string convertida: 4/5/2023 -> 2023-04-05 (Campo: fecha_castigo)
[2025-11-02 22:50:03] ✅ Fecha string convertida: 7/10/2022 -> 2022-07-10 (Campo: fecha_pago)
[2025-11-02 22:50:03] ✅ Fecha string convertida: 10/5/2022 -> 2022-10-05 (Campo: fecha_vencimiento)
[2025-11-02 22:50:03] ✅ Fecha string convertida: 10/27/2017 -> 2017-10-27 (Campo: fecha_susc)
[2025-11-02 22:50:03] ✅ Fecha string convertida: 6/1/2023 -> 2023-06-01 (Campo: fecha_asignacion)
[2025-11-02 22:50:03] ✅ Fecha string convertida: 1/27/2025 -> 2025-01-27 (Campo: fecha_proceso)
[2025-11-02 22:50:03] ✅ Fecha string convertida: 4/5/2023 -> 2023-04-05 (Campo: fecha_castigo)
[2025-11-02 22:50:03] ✅ Fecha string convertida: 11/27/2022 -> 2022-11-27 (Campo: fecha_pago)
[2025-11-02 22:50:03] ✅ Fecha string convertida: 10/5/2022 -> 2022-10-05 (Campo: fecha_vencimiento)
[2025-11-02 22:50:03] ✅ Fecha string convertida: 12/28/2014 -> 2014-12-28 (Campo: fecha_susc)
[2025-11-02 22:50:03] ✅ Fecha string convertida: 6/1/2023 -> 2023-06-01 (Campo: fecha_asignacion)
[2025-11-02 22:50:03] ✅ Fecha string convertida: 1/27/2025 -> 2025-01-27 (Campo: fecha_proceso)
[2025-11-02 22:50:03] ✅ Fecha string convertida: 4/5/2023 -> 2023-04-05 (Campo: fecha_castigo)
[2025-11-02 22:50:03] ✅ Fecha string convertida: 9/1/2022 -> 2022-09-01 (Campo: fecha_pago)
[2025-11-02 22:50:03] ✅ Fecha string convertida: 10/5/2022 -> 2022-10-05 (Campo: fecha_vencimiento)
[2025-11-02 22:50:03] ✅ Fecha string convertida: 1/17/2017 -> 2017-01-17 (Campo: fecha_susc)
[2025-11-02 22:50:03] ✅ Fecha string convertida: 6/1/2023 -> 2023-06-01 (Campo: fecha_asignacion)
[2025-11-02 22:50:03] ✅ Fecha string convertida: 1/27/2025 -> 2025-01-27 (Campo: fecha_proceso)
[2025-11-02 22:50:03] ✅ Fecha string convertida: 6/25/2023 -> 2023-06-25 (Campo: fecha_castigo)
[2025-11-02 22:50:03] ✅ Fecha string convertida: 12/7/2022 -> 2022-12-07 (Campo: fecha_pago)
[2025-11-02 22:50:03] ✅ Fecha string convertida: 12/25/2022 -> 2022-12-25 (Campo: fecha_vencimiento)
[2025-11-02 22:50:03] ✅ Fecha string convertida: 12/22/2012 -> 2012-12-22 (Campo: fecha_susc)
[2025-11-02 22:50:03] ✅ Fecha string convertida: 8/1/2023 -> 2023-08-01 (Campo: fecha_asignacion)
[2025-11-02 22:50:03] ✅ Fecha string convertida: 1/27/2025 -> 2025-01-27 (Campo: fecha_proceso)
[2025-11-02 22:50:03] ✅ Fecha string convertida: 7/5/2023 -> 2023-07-05 (Campo: fecha_castigo)
[2025-11-02 22:50:03] ✅ Fecha string convertida: 12/7/2022 -> 2022-12-07 (Campo: fecha_pago)
[2025-11-02 22:50:03] ✅ Fecha string convertida: 1/5/2023 -> 2023-01-05 (Campo: fecha_vencimiento)
[2025-11-02 22:50:03] ✅ Fecha string convertida: 7/21/2009 -> 2009-07-21 (Campo: fecha_susc)
[2025-11-02 22:50:03] ✅ Fecha string convertida: 9/1/2023 -> 2023-09-01 (Campo: fecha_asignacion)
[2025-11-02 22:50:03] ✅ Fecha string convertida: 1/27/2025 -> 2025-01-27 (Campo: fecha_proceso)
[2025-11-02 22:50:03] ✅ Fecha string convertida: 7/5/2023 -> 2023-07-05 (Campo: fecha_castigo)
[2025-11-02 22:50:03] ✅ Fecha string convertida: 12/2/2022 -> 2022-12-02 (Campo: fecha_pago)
[2025-11-02 22:50:03] ✅ Fecha string convertida: 1/5/2023 -> 2023-01-05 (Campo: fecha_vencimiento)
[2025-11-02 22:50:03] ✅ Fecha string convertida: 11/28/2020 -> 2020-11-28 (Campo: fecha_susc)
[2025-11-02 22:50:03] ✅ Fecha string convertida: 9/1/2023 -> 2023-09-01 (Campo: fecha_asignacion)
[2025-11-02 22:50:03] ✅ Fecha string convertida: 1/27/2025 -> 2025-01-27 (Campo: fecha_proceso)
[2025-11-02 22:50:03] ✅ Fecha string convertida: 7/5/2023 -> 2023-07-05 (Campo: fecha_castigo)
[2025-11-02 22:50:03] ✅ Fecha string convertida: 12/20/2022 -> 2022-12-20 (Campo: fecha_pago)
[2025-11-02 22:50:03] ✅ Fecha string convertida: 1/5/2023 -> 2023-01-05 (Campo: fecha_vencimiento)
[2025-11-02 22:50:03] ✅ Fecha string convertida: 12/20/2014 -> 2014-12-20 (Campo: fecha_susc)
[2025-11-02 22:50:03] ✅ Fecha string convertida: 9/1/2023 -> 2023-09-01 (Campo: fecha_asignacion)
[2025-11-02 22:50:03] ✅ Fecha string convertida: 1/27/2025 -> 2025-01-27 (Campo: fecha_proceso)
[2025-11-02 22:50:03] ✅ Fecha string convertida: 7/5/2023 -> 2023-07-05 (Campo: fecha_castigo)
[2025-11-02 22:50:03] ✅ Fecha string convertida: 11/15/2022 -> 2022-11-15 (Campo: fecha_pago)
[2025-11-02 22:50:03] ✅ Fecha string convertida: 1/5/2023 -> 2023-01-05 (Campo: fecha_vencimiento)
[2025-11-02 22:50:03] ✅ Fecha string convertida: 10/27/2013 -> 2013-10-27 (Campo: fecha_susc)
[2025-11-02 22:50:03] ✅ Fecha string convertida: 9/1/2023 -> 2023-09-01 (Campo: fecha_asignacion)
[2025-11-02 22:50:03] ✅ Fecha string convertida: 1/27/2025 -> 2025-01-27 (Campo: fecha_proceso)
[2025-11-02 22:50:03] ✅ Fecha string convertida: 7/15/2023 -> 2023-07-15 (Campo: fecha_castigo)
[2025-11-02 22:50:03] ✅ Fecha string convertida: 12/21/2022 -> 2022-12-21 (Campo: fecha_pago)
[2025-11-02 22:50:03] ✅ Fecha string convertida: 1/15/2023 -> 2023-01-15 (Campo: fecha_vencimiento)
[2025-11-02 22:50:04] ✅ Fecha string convertida: 11/13/2006 -> 2006-11-13 (Campo: fecha_susc)
[2025-11-02 22:50:04] ✅ Fecha string convertida: 9/1/2023 -> 2023-09-01 (Campo: fecha_asignacion)
[2025-11-02 22:50:04] ✅ Fecha string convertida: 1/27/2025 -> 2025-01-27 (Campo: fecha_proceso)
[2025-11-02 22:50:04] ✅ Fecha string convertida: 7/30/2023 -> 2023-07-30 (Campo: fecha_castigo)
[2025-11-02 22:50:04] ✅ Fecha string convertida: 12/27/2022 -> 2022-12-27 (Campo: fecha_pago)
[2025-11-02 22:50:04] ✅ Fecha string convertida: 1/30/2023 -> 2023-01-30 (Campo: fecha_vencimiento)
[2025-11-02 22:50:04] ✅ Fecha string convertida: 2/25/1993 -> 1993-02-25 (Campo: fecha_susc)
[2025-11-02 22:50:04] ✅ Fecha string convertida: 9/1/2023 -> 2023-09-01 (Campo: fecha_asignacion)
[2025-11-02 22:50:04] ✅ Fecha string convertida: 1/27/2025 -> 2025-01-27 (Campo: fecha_proceso)
[2025-11-02 22:50:04] ✅ Fecha string convertida: 8/10/2023 -> 2023-08-10 (Campo: fecha_castigo)
[2025-11-02 22:50:04] ✅ Fecha string convertida: 10/3/2024 -> 2024-10-03 (Campo: fecha_pago)
[2025-11-02 22:50:04] ✅ Fecha string convertida: 2/10/2023 -> 2023-02-10 (Campo: fecha_vencimiento)
[2025-11-02 22:50:04] ✅ Fecha string convertida: 2/18/2018 -> 2018-02-18 (Campo: fecha_susc)
[2025-11-02 22:50:04] ✅ Fecha string convertida: 10/1/2023 -> 2023-10-01 (Campo: fecha_asignacion)
[2025-11-02 22:50:04] ✅ Fecha string convertida: 1/27/2025 -> 2025-01-27 (Campo: fecha_proceso)
[2025-11-02 22:50:04] ✅ Fecha string convertida: 9/5/2023 -> 2023-09-05 (Campo: fecha_castigo)
[2025-11-02 22:50:04] ✅ Fecha string convertida: 2/28/2024 -> 2024-02-28 (Campo: fecha_pago)
[2025-11-02 22:50:04] ✅ Fecha string convertida: 3/5/2023 -> 2023-03-05 (Campo: fecha_vencimiento)
[2025-11-02 22:50:04] ✅ Fecha string convertida: 11/18/2010 -> 2010-11-18 (Campo: fecha_susc)
[2025-11-02 22:50:04] ✅ Fecha string convertida: 11/1/2023 -> 2023-11-01 (Campo: fecha_asignacion)
[2025-11-02 22:50:04] ✅ Fecha string convertida: 1/27/2025 -> 2025-01-27 (Campo: fecha_proceso)
[2025-11-02 22:50:04] ✅ Fecha string convertida: 9/5/2023 -> 2023-09-05 (Campo: fecha_castigo)
[2025-11-02 22:50:04] ✅ Fecha string convertida: 3/8/2023 -> 2023-03-08 (Campo: fecha_pago)
[2025-11-02 22:50:04] ✅ Fecha string convertida: 3/5/2023 -> 2023-03-05 (Campo: fecha_vencimiento)
[2025-11-02 22:50:04] ✅ Fecha string convertida: 3/8/2016 -> 2016-03-08 (Campo: fecha_susc)
[2025-11-02 22:50:04] ✅ Fecha string convertida: 11/1/2023 -> 2023-11-01 (Campo: fecha_asignacion)
[2025-11-02 22:50:04] ✅ Fecha string convertida: 1/27/2025 -> 2025-01-27 (Campo: fecha_proceso)
[2025-11-02 22:50:04] ✅ Fecha string convertida: 9/10/2023 -> 2023-09-10 (Campo: fecha_castigo)
[2025-11-02 22:50:04] ✅ Fecha string convertida: 4/15/2024 -> 2024-04-15 (Campo: fecha_pago)
[2025-11-02 22:50:04] ✅ Fecha string convertida: 3/10/2023 -> 2023-03-10 (Campo: fecha_vencimiento)
[2025-11-02 22:50:04] ✅ Fecha string convertida: 11/26/2020 -> 2020-11-26 (Campo: fecha_susc)
[2025-11-02 22:50:04] ✅ Fecha string convertida: 11/1/2023 -> 2023-11-01 (Campo: fecha_asignacion)
[2025-11-02 22:50:04] ✅ Fecha string convertida: 1/27/2025 -> 2025-01-27 (Campo: fecha_proceso)
[2025-11-02 22:50:04] ✅ Fecha string convertida: 10/5/2023 -> 2023-10-05 (Campo: fecha_castigo)
[2025-11-02 22:50:04] ✅ Fecha string convertida: 3/28/2023 -> 2023-03-28 (Campo: fecha_pago)
[2025-11-02 22:50:04] ✅ Fecha string convertida: 4/5/2023 -> 2023-04-05 (Campo: fecha_vencimiento)
[2025-11-02 22:50:04] ✅ Fecha string convertida: 6/12/2019 -> 2019-06-12 (Campo: fecha_susc)
[2025-11-02 22:50:04] ✅ Fecha string convertida: 12/1/2023 -> 2023-12-01 (Campo: fecha_asignacion)
[2025-11-02 22:50:04] ✅ Fecha string convertida: 1/27/2025 -> 2025-01-27 (Campo: fecha_proceso)
[2025-11-02 22:50:04] ✅ Fecha string convertida: 11/5/2023 -> 2023-11-05 (Campo: fecha_castigo)
[2025-11-02 22:50:04] ✅ Fecha string convertida: 8/26/2023 -> 2023-08-26 (Campo: fecha_pago)
[2025-11-02 22:50:04] ✅ Fecha string convertida: 5/5/2023 -> 2023-05-05 (Campo: fecha_vencimiento)
[2025-11-02 22:50:04] ✅ Fecha string convertida: 12/12/2021 -> 2021-12-12 (Campo: fecha_susc)
[2025-11-02 22:50:04] ✅ Fecha string convertida: 1/1/2024 -> 2024-01-01 (Campo: fecha_asignacion)
[2025-11-02 22:50:04] ✅ Fecha string convertida: 1/27/2025 -> 2025-01-27 (Campo: fecha_proceso)
[2025-11-02 22:50:04] ✅ Fecha string convertida: 11/5/2023 -> 2023-11-05 (Campo: fecha_castigo)
[2025-11-02 22:50:04] ✅ Fecha string convertida: 3/31/2023 -> 2023-03-31 (Campo: fecha_pago)
[2025-11-02 22:50:04] ✅ Fecha string convertida: 5/5/2023 -> 2023-05-05 (Campo: fecha_vencimiento)
[2025-11-02 22:50:04] ✅ Fecha string convertida: 8/18/2021 -> 2021-08-18 (Campo: fecha_susc)
[2025-11-02 22:50:04] ✅ Fecha string convertida: 1/1/2024 -> 2024-01-01 (Campo: fecha_asignacion)
[2025-11-02 22:50:04] ✅ Fecha string convertida: 1/27/2025 -> 2025-01-27 (Campo: fecha_proceso)
[2025-11-02 22:50:04] ✅ Fecha string convertida: 11/5/2023 -> 2023-11-05 (Campo: fecha_castigo)
[2025-11-02 22:50:04] ✅ Fecha string convertida: 3/28/2023 -> 2023-03-28 (Campo: fecha_pago)
[2025-11-02 22:50:04] ✅ Fecha string convertida: 5/5/2023 -> 2023-05-05 (Campo: fecha_vencimiento)
[2025-11-02 22:50:04] ✅ Fecha string convertida: 10/30/2021 -> 2021-10-30 (Campo: fecha_susc)
[2025-11-02 22:50:04] ✅ Fecha string convertida: 1/1/2024 -> 2024-01-01 (Campo: fecha_asignacion)
[2025-11-02 22:50:04] ✅ Fecha string convertida: 1/27/2025 -> 2025-01-27 (Campo: fecha_proceso)
[2025-11-02 22:50:04] ✅ Fecha string convertida: 11/5/2023 -> 2023-11-05 (Campo: fecha_castigo)
[2025-11-02 22:50:04] ✅ Fecha string convertida: 4/3/2023 -> 2023-04-03 (Campo: fecha_pago)
[2025-11-02 22:50:04] ✅ Fecha string convertida: 5/5/2023 -> 2023-05-05 (Campo: fecha_vencimiento)
[2025-11-02 22:50:04] ✅ Fecha string convertida: 5/11/2022 -> 2022-05-11 (Campo: fecha_susc)
[2025-11-02 22:50:04] ✅ Fecha string convertida: 1/1/2024 -> 2024-01-01 (Campo: fecha_asignacion)
[2025-11-02 22:50:04] ✅ Fecha string convertida: 1/27/2025 -> 2025-01-27 (Campo: fecha_proceso)
[2025-11-02 22:50:04] ✅ Fecha string convertida: 11/5/2023 -> 2023-11-05 (Campo: fecha_castigo)
[2025-11-02 22:50:04] ✅ Fecha string convertida: 6/3/2023 -> 2023-06-03 (Campo: fecha_pago)
[2025-11-02 22:50:04] ✅ Fecha string convertida: 5/5/2023 -> 2023-05-05 (Campo: fecha_vencimiento)
[2025-11-02 22:50:04] ✅ Fecha string convertida: 7/26/2016 -> 2016-07-26 (Campo: fecha_susc)
[2025-11-02 22:50:04] ✅ Fecha string convertida: 1/1/2024 -> 2024-01-01 (Campo: fecha_asignacion)
[2025-11-02 22:50:04] ✅ Fecha string convertida: 1/27/2025 -> 2025-01-27 (Campo: fecha_proceso)
[2025-11-02 22:50:04] ✅ Fecha string convertida: 11/5/2023 -> 2023-11-05 (Campo: fecha_castigo)
[2025-11-02 22:50:04] ✅ Fecha string convertida: 4/10/2024 -> 2024-04-10 (Campo: fecha_pago)
[2025-11-02 22:50:04] ✅ Fecha string convertida: 5/5/2023 -> 2023-05-05 (Campo: fecha_vencimiento)
[2025-11-02 22:50:04] ✅ Fecha string convertida: 4/13/2016 -> 2016-04-13 (Campo: fecha_susc)
[2025-11-02 22:50:04] ✅ Fecha string convertida: 1/1/2024 -> 2024-01-01 (Campo: fecha_asignacion)
[2025-11-02 22:50:04] ✅ Fecha string convertida: 1/27/2025 -> 2025-01-27 (Campo: fecha_proceso)
[2025-11-02 22:50:04] ✅ Fecha string convertida: 11/5/2023 -> 2023-11-05 (Campo: fecha_castigo)
[2025-11-02 22:50:04] ✅ Fecha string convertida: 3/6/2023 -> 2023-03-06 (Campo: fecha_pago)
[2025-11-02 22:50:04] ✅ Fecha string convertida: 5/5/2023 -> 2023-05-05 (Campo: fecha_vencimiento)
[2025-11-02 22:50:04] ✅ Fecha string convertida: 11/1/2017 -> 2017-11-01 (Campo: fecha_susc)
[2025-11-02 22:50:04] ✅ Fecha string convertida: 1/1/2024 -> 2024-01-01 (Campo: fecha_asignacion)
[2025-11-02 22:50:04] ✅ Fecha string convertida: 1/27/2025 -> 2025-01-27 (Campo: fecha_proceso)
[2025-11-02 22:50:04] ✅ Fecha string convertida: 11/5/2023 -> 2023-11-05 (Campo: fecha_castigo)
[2025-11-02 22:50:04] ✅ Fecha string convertida: 3/26/2023 -> 2023-03-26 (Campo: fecha_pago)
[2025-11-02 22:50:04] ✅ Fecha string convertida: 5/5/2023 -> 2023-05-05 (Campo: fecha_vencimiento)
[2025-11-02 22:50:04] ✅ Fecha string convertida: 4/13/2019 -> 2019-04-13 (Campo: fecha_susc)
[2025-11-02 22:50:04] ✅ Fecha string convertida: 1/1/2024 -> 2024-01-01 (Campo: fecha_asignacion)
[2025-11-02 22:50:04] ✅ Fecha string convertida: 1/27/2025 -> 2025-01-27 (Campo: fecha_proceso)
[2025-11-02 22:50:04] ✅ Fecha string convertida: 11/10/2023 -> 2023-11-10 (Campo: fecha_castigo)
[2025-11-02 22:50:04] ✅ Fecha string convertida: 4/12/2023 -> 2023-04-12 (Campo: fecha_pago)
[2025-11-02 22:50:04] ✅ Fecha string convertida: 5/10/2023 -> 2023-05-10 (Campo: fecha_vencimiento)
[2025-11-02 22:50:04] ✅ Fecha string convertida: 8/14/2021 -> 2021-08-14 (Campo: fecha_susc)
[2025-11-02 22:50:04] ✅ Fecha string convertida: 1/1/2024 -> 2024-01-01 (Campo: fecha_asignacion)
[2025-11-02 22:50:04] ✅ Fecha string convertida: 1/27/2025 -> 2025-01-27 (Campo: fecha_proceso)
[2025-11-02 22:50:04] ✅ Fecha string convertida: 11/10/2023 -> 2023-11-10 (Campo: fecha_castigo)
[2025-11-02 22:50:04] ✅ Fecha string convertida: 4/20/2023 -> 2023-04-20 (Campo: fecha_pago)
[2025-11-02 22:50:04] ✅ Fecha string convertida: 5/10/2023 -> 2023-05-10 (Campo: fecha_vencimiento)
[2025-11-02 22:50:04] ✅ Fecha string convertida: 9/28/2021 -> 2021-09-28 (Campo: fecha_susc)
[2025-11-02 22:50:04] ✅ Fecha string convertida: 1/1/2024 -> 2024-01-01 (Campo: fecha_asignacion)
[2025-11-02 22:50:04] ✅ Fecha string convertida: 1/27/2025 -> 2025-01-27 (Campo: fecha_proceso)
[2025-11-02 22:50:04] ✅ Fecha string convertida: 11/10/2023 -> 2023-11-10 (Campo: fecha_castigo)
[2025-11-02 22:50:04] ✅ DV con valor '0' - ES VÁLIDO
[2025-11-02 22:50:04] ✅ Fecha string convertida: 8/21/2023 -> 2023-08-21 (Campo: fecha_pago)
[2025-11-02 22:50:04] ✅ Fecha string convertida: 5/10/2023 -> 2023-05-10 (Campo: fecha_vencimiento)
[2025-11-02 22:50:04] ✅ Fecha string convertida: 7/12/2014 -> 2014-07-12 (Campo: fecha_susc)
[2025-11-02 22:50:04] ✅ Fecha string convertida: 1/1/2024 -> 2024-01-01 (Campo: fecha_asignacion)
[2025-11-02 22:50:04] ✅ Fecha string convertida: 1/27/2025 -> 2025-01-27 (Campo: fecha_proceso)
[2025-11-02 22:50:04] ✅ Fecha string convertida: 11/20/2023 -> 2023-11-20 (Campo: fecha_castigo)
[2025-11-02 22:50:04] ✅ Fecha string convertida: 7/9/2023 -> 2023-07-09 (Campo: fecha_pago)
[2025-11-02 22:50:04] ✅ Fecha string convertida: 5/20/2023 -> 2023-05-20 (Campo: fecha_vencimiento)
[2025-11-02 22:50:04] ✅ Fecha string convertida: 8/23/2014 -> 2014-08-23 (Campo: fecha_susc)
[2025-11-02 22:50:04] ✅ Fecha string convertida: 1/1/2024 -> 2024-01-01 (Campo: fecha_asignacion)
[2025-11-02 22:50:04] ✅ Fecha string convertida: 1/27/2025 -> 2025-01-27 (Campo: fecha_proceso)
[2025-11-02 22:50:04] ✅ Fecha string convertida: 12/5/2023 -> 2023-12-05 (Campo: fecha_castigo)
[2025-11-02 22:50:04] ✅ Fecha string convertida: 6/5/2023 -> 2023-06-05 (Campo: fecha_vencimiento)
[2025-11-02 22:50:04] ✅ Fecha string convertida: 8/29/2019 -> 2019-08-29 (Campo: fecha_susc)
[2025-11-02 22:50:04] ✅ Fecha string convertida: 2/1/2024 -> 2024-02-01 (Campo: fecha_asignacion)
[2025-11-02 22:50:04] ✅ Fecha string convertida: 1/27/2025 -> 2025-01-27 (Campo: fecha_proceso)
[2025-11-02 22:50:04] ✅ Fecha string convertida: 12/5/2023 -> 2023-12-05 (Campo: fecha_castigo)
[2025-11-02 22:50:04] ✅ Fecha string convertida: 5/3/2023 -> 2023-05-03 (Campo: fecha_pago)
[2025-11-02 22:50:04] ✅ Fecha string convertida: 6/5/2023 -> 2023-06-05 (Campo: fecha_vencimiento)
[2025-11-02 22:50:04] ✅ Fecha string convertida: 12/1/2014 -> 2014-12-01 (Campo: fecha_susc)
[2025-11-02 22:50:04] ✅ Fecha string convertida: 2/1/2024 -> 2024-02-01 (Campo: fecha_asignacion)
[2025-11-02 22:50:04] ✅ Fecha string convertida: 1/27/2025 -> 2025-01-27 (Campo: fecha_proceso)
[2025-11-02 22:50:04] ✅ Fecha string convertida: 12/5/2023 -> 2023-12-05 (Campo: fecha_castigo)
[2025-11-02 22:50:04] ✅ Fecha string convertida: 5/9/2023 -> 2023-05-09 (Campo: fecha_pago)
[2025-11-02 22:50:04] ✅ Fecha string convertida: 6/5/2023 -> 2023-06-05 (Campo: fecha_vencimiento)
[2025-11-02 22:50:04] ✅ Fecha string convertida: 3/29/2015 -> 2015-03-29 (Campo: fecha_susc)
[2025-11-02 22:50:04] ✅ Fecha string convertida: 2/1/2024 -> 2024-02-01 (Campo: fecha_asignacion)
[2025-11-02 22:50:04] ✅ Fecha string convertida: 1/27/2025 -> 2025-01-27 (Campo: fecha_proceso)
[2025-11-02 22:50:04] ✅ Fecha string convertida: 12/5/2023 -> 2023-12-05 (Campo: fecha_castigo)
[2025-11-02 22:50:04] ✅ Fecha string convertida: 5/16/2023 -> 2023-05-16 (Campo: fecha_pago)
[2025-11-02 22:50:04] ✅ Fecha string convertida: 6/5/2023 -> 2023-06-05 (Campo: fecha_vencimiento)
[2025-11-02 22:50:04] ✅ Fecha string convertida: 7/15/2016 -> 2016-07-15 (Campo: fecha_susc)
[2025-11-02 22:50:04] ✅ Fecha string convertida: 2/1/2024 -> 2024-02-01 (Campo: fecha_asignacion)
[2025-11-02 22:50:04] ✅ Fecha string convertida: 1/27/2025 -> 2025-01-27 (Campo: fecha_proceso)
[2025-11-02 22:50:04] ✅ Fecha string convertida: 12/5/2023 -> 2023-12-05 (Campo: fecha_castigo)
[2025-11-02 22:50:04] ✅ Fecha string convertida: 4/17/2023 -> 2023-04-17 (Campo: fecha_pago)
[2025-11-02 22:50:04] ✅ Fecha string convertida: 6/5/2023 -> 2023-06-05 (Campo: fecha_vencimiento)
[2025-11-02 22:50:04] ✅ Fecha string convertida: 5/22/2014 -> 2014-05-22 (Campo: fecha_susc)
[2025-11-02 22:50:04] ✅ Fecha string convertida: 2/1/2024 -> 2024-02-01 (Campo: fecha_asignacion)
[2025-11-02 22:50:04] ✅ Fecha string convertida: 1/27/2025 -> 2025-01-27 (Campo: fecha_proceso)
[2025-11-02 22:50:04] ✅ Fecha string convertida: 12/5/2023 -> 2023-12-05 (Campo: fecha_castigo)
[2025-11-02 22:50:04] ✅ Fecha string convertida: 4/10/2023 -> 2023-04-10 (Campo: fecha_pago)
[2025-11-02 22:50:04] ✅ Fecha string convertida: 6/5/2023 -> 2023-06-05 (Campo: fecha_vencimiento)
[2025-11-02 22:50:04] ✅ Fecha string convertida: 5/17/2014 -> 2014-05-17 (Campo: fecha_susc)
[2025-11-02 22:50:04] ✅ Fecha string convertida: 2/1/2024 -> 2024-02-01 (Campo: fecha_asignacion)
[2025-11-02 22:50:04] ✅ Fecha string convertida: 1/27/2025 -> 2025-01-27 (Campo: fecha_proceso)
[2025-11-02 22:50:04] ✅ Fecha string convertida: 1/5/2024 -> 2024-01-05 (Campo: fecha_castigo)
[2025-11-02 22:50:04] ✅ Fecha string convertida: 6/27/2023 -> 2023-06-27 (Campo: fecha_pago)
[2025-11-02 22:50:04] ✅ Fecha string convertida: 7/5/2023 -> 2023-07-05 (Campo: fecha_vencimiento)
[2025-11-02 22:50:04] ✅ Fecha string convertida: 4/16/2014 -> 2014-04-16 (Campo: fecha_susc)
[2025-11-02 22:50:04] ✅ Fecha string convertida: 3/1/2024 -> 2024-03-01 (Campo: fecha_asignacion)
[2025-11-02 22:50:04] ✅ Fecha string convertida: 1/27/2025 -> 2025-01-27 (Campo: fecha_proceso)
[2025-11-02 22:50:04] ✅ Fecha string convertida: 1/5/2024 -> 2024-01-05 (Campo: fecha_castigo)
[2025-11-02 22:50:04] ✅ Fecha string convertida: 6/13/2023 -> 2023-06-13 (Campo: fecha_pago)
[2025-11-02 22:50:04] ✅ Fecha string convertida: 7/5/2023 -> 2023-07-05 (Campo: fecha_vencimiento)
[2025-11-02 22:50:04] ✅ Fecha string convertida: 6/9/2016 -> 2016-06-09 (Campo: fecha_susc)
[2025-11-02 22:50:04] ✅ Fecha string convertida: 3/1/2024 -> 2024-03-01 (Campo: fecha_asignacion)
[2025-11-02 22:50:04] ✅ Fecha string convertida: 1/27/2025 -> 2025-01-27 (Campo: fecha_proceso)
[2025-11-02 22:50:04] ✅ Fecha string convertida: 1/5/2024 -> 2024-01-05 (Campo: fecha_castigo)
[2025-11-02 22:50:04] ✅ DV con valor '0' - ES VÁLIDO
[2025-11-02 22:50:04] ✅ Fecha string convertida: 9/15/2023 -> 2023-09-15 (Campo: fecha_pago)
[2025-11-02 22:50:04] ✅ Fecha string convertida: 7/5/2023 -> 2023-07-05 (Campo: fecha_vencimiento)
[2025-11-02 22:50:04] ✅ Fecha string convertida: 6/18/2015 -> 2015-06-18 (Campo: fecha_susc)
[2025-11-02 22:50:04] ✅ Fecha string convertida: 3/1/2024 -> 2024-03-01 (Campo: fecha_asignacion)
[2025-11-02 22:50:04] ✅ Fecha string convertida: 1/27/2025 -> 2025-01-27 (Campo: fecha_proceso)
[2025-11-02 22:50:04] ✅ Fecha string convertida: 1/5/2024 -> 2024-01-05 (Campo: fecha_castigo)
[2025-11-02 22:50:04] ✅ Fecha string convertida: 6/6/2023 -> 2023-06-06 (Campo: fecha_pago)
[2025-11-02 22:50:04] ✅ Fecha string convertida: 7/5/2023 -> 2023-07-05 (Campo: fecha_vencimiento)
[2025-11-02 22:50:04] ✅ Fecha string convertida: 4/25/2019 -> 2019-04-25 (Campo: fecha_susc)
[2025-11-02 22:50:04] ✅ Fecha string convertida: 3/1/2024 -> 2024-03-01 (Campo: fecha_asignacion)
[2025-11-02 22:50:04] ✅ Fecha string convertida: 1/27/2025 -> 2025-01-27 (Campo: fecha_proceso)
[2025-11-02 22:50:04] ✅ Fecha string convertida: 1/5/2024 -> 2024-01-05 (Campo: fecha_castigo)
[2025-11-02 22:50:04] ✅ Fecha string convertida: 4/28/2023 -> 2023-04-28 (Campo: fecha_pago)
[2025-11-02 22:50:04] ✅ Fecha string convertida: 7/5/2023 -> 2023-07-05 (Campo: fecha_vencimiento)
[2025-11-02 22:50:04] ✅ Fecha string convertida: 1/10/2023 -> 2023-01-10 (Campo: fecha_susc)
[2025-11-02 22:50:04] ✅ Fecha string convertida: 3/1/2024 -> 2024-03-01 (Campo: fecha_asignacion)
[2025-11-02 22:50:04] ✅ Fecha string convertida: 1/27/2025 -> 2025-01-27 (Campo: fecha_proceso)
[2025-11-02 22:50:04] ✅ Fecha string convertida: 1/5/2024 -> 2024-01-05 (Campo: fecha_castigo)
[2025-11-02 22:50:04] ✅ Fecha string convertida: 5/22/2023 -> 2023-05-22 (Campo: fecha_pago)
[2025-11-02 22:50:04] ✅ Fecha string convertida: 7/5/2023 -> 2023-07-05 (Campo: fecha_vencimiento)
[2025-11-02 22:50:04] ✅ Valor convertido a INT: '515' -> 515
[2025-11-02 22:50:04] ✅ Fecha string convertida: 12/26/2013 -> 2013-12-26 (Campo: fecha_susc)
[2025-11-02 22:50:04] ✅ Fecha string convertida: 3/1/2024 -> 2024-03-01 (Campo: fecha_asignacion)
[2025-11-02 22:50:04] ✅ Fecha string convertida: 1/27/2025 -> 2025-01-27 (Campo: fecha_proceso)
[2025-11-02 22:50:04] ✅ Fecha string convertida: 1/5/2024 -> 2024-01-05 (Campo: fecha_castigo)
[2025-11-02 22:50:04] ✅ Fecha string convertida: 6/14/2023 -> 2023-06-14 (Campo: fecha_pago)
[2025-11-02 22:50:04] ✅ Fecha string convertida: 7/5/2023 -> 2023-07-05 (Campo: fecha_vencimiento)
[2025-11-02 22:50:04] ✅ Fecha string convertida: 4/19/2016 -> 2016-04-19 (Campo: fecha_susc)
[2025-11-02 22:50:04] ✅ Fecha string convertida: 3/1/2024 -> 2024-03-01 (Campo: fecha_asignacion)
[2025-11-02 22:50:04] ✅ Fecha string convertida: 1/27/2025 -> 2025-01-27 (Campo: fecha_proceso)
[2025-11-02 22:50:04] ✅ Fecha string convertida: 1/5/2024 -> 2024-01-05 (Campo: fecha_castigo)
[2025-11-02 22:50:04] ✅ Fecha string convertida: 6/18/2023 -> 2023-06-18 (Campo: fecha_pago)
[2025-11-02 22:50:04] ✅ Fecha string convertida: 7/5/2023 -> 2023-07-05 (Campo: fecha_vencimiento)
[2025-11-02 22:50:04] ✅ Fecha string convertida: 7/23/2010 -> 2010-07-23 (Campo: fecha_susc)
[2025-11-02 22:50:04] ✅ Fecha string convertida: 3/1/2024 -> 2024-03-01 (Campo: fecha_asignacion)
[2025-11-02 22:50:04] ✅ Fecha string convertida: 1/27/2025 -> 2025-01-27 (Campo: fecha_proceso)
[2025-11-02 22:50:04] ✅ Fecha string convertida: 1/5/2024 -> 2024-01-05 (Campo: fecha_castigo)
[2025-11-02 22:50:04] ✅ Fecha string convertida: 7/29/2023 -> 2023-07-29 (Campo: fecha_pago)
[2025-11-02 22:50:04] ✅ Fecha string convertida: 7/5/2023 -> 2023-07-05 (Campo: fecha_vencimiento)
[2025-11-02 22:50:04] ✅ Fecha string convertida: 4/18/2019 -> 2019-04-18 (Campo: fecha_susc)
[2025-11-02 22:50:04] ✅ Fecha string convertida: 3/1/2024 -> 2024-03-01 (Campo: fecha_asignacion)
[2025-11-02 22:50:04] ✅ Fecha string convertida: 1/27/2025 -> 2025-01-27 (Campo: fecha_proceso)
[2025-11-02 22:50:04] ✅ Fecha string convertida: 1/5/2024 -> 2024-01-05 (Campo: fecha_castigo)
[2025-11-02 22:50:04] ✅ Fecha string convertida: 8/11/2023 -> 2023-08-11 (Campo: fecha_pago)
[2025-11-02 22:50:04] ✅ Fecha string convertida: 7/5/2023 -> 2023-07-05 (Campo: fecha_vencimiento)
[2025-11-02 22:50:04] ✅ Fecha string convertida: 5/30/2015 -> 2015-05-30 (Campo: fecha_susc)
[2025-11-02 22:50:04] ✅ Fecha string convertida: 3/1/2024 -> 2024-03-01 (Campo: fecha_asignacion)
[2025-11-02 22:50:04] ✅ Fecha string convertida: 1/27/2025 -> 2025-01-27 (Campo: fecha_proceso)
[2025-11-02 22:50:04] ✅ Fecha string convertida: 1/10/2024 -> 2024-01-10 (Campo: fecha_castigo)
[2025-11-02 22:50:04] ✅ Fecha string convertida: 4/10/2023 -> 2023-04-10 (Campo: fecha_pago)
[2025-11-02 22:50:04] ✅ Fecha string convertida: 7/10/2023 -> 2023-07-10 (Campo: fecha_vencimiento)
[2025-11-02 22:50:04] ✅ Fecha string convertida: 7/18/2018 -> 2018-07-18 (Campo: fecha_susc)
[2025-11-02 22:50:04] ✅ Fecha string convertida: 3/1/2024 -> 2024-03-01 (Campo: fecha_asignacion)
[2025-11-02 22:50:04] ✅ Fecha string convertida: 1/27/2025 -> 2025-01-27 (Campo: fecha_proceso)
[2025-11-02 22:50:04] ✅ Fecha string convertida: 1/15/2024 -> 2024-01-15 (Campo: fecha_castigo)
[2025-11-02 22:50:04] ✅ Fecha string convertida: 6/5/2023 -> 2023-06-05 (Campo: fecha_pago)
[2025-11-02 22:50:04] ✅ Fecha string convertida: 7/15/2023 -> 2023-07-15 (Campo: fecha_vencimiento)
[2025-11-02 22:50:04] ✅ Fecha string convertida: 12/28/2022 -> 2022-12-28 (Campo: fecha_susc)
[2025-11-02 22:50:04] ✅ Fecha string convertida: 3/1/2024 -> 2024-03-01 (Campo: fecha_asignacion)
[2025-11-02 22:50:04] ✅ Fecha string convertida: 1/27/2025 -> 2025-01-27 (Campo: fecha_proceso)
[2025-11-02 22:50:04] ✅ Fecha string convertida: 1/15/2024 -> 2024-01-15 (Campo: fecha_castigo)
[2025-11-02 22:50:04] ✅ Fecha string convertida: 6/24/2023 -> 2023-06-24 (Campo: fecha_pago)
[2025-11-02 22:50:04] ✅ Fecha string convertida: 7/15/2023 -> 2023-07-15 (Campo: fecha_vencimiento)
[2025-11-02 22:50:04] ✅ Fecha string convertida: 11/10/2022 -> 2022-11-10 (Campo: fecha_susc)
[2025-11-02 22:50:04] ✅ Fecha string convertida: 3/1/2024 -> 2024-03-01 (Campo: fecha_asignacion)
[2025-11-02 22:50:04] ✅ Fecha string convertida: 1/27/2025 -> 2025-01-27 (Campo: fecha_proceso)
[2025-11-02 22:50:04] ✅ Fecha string convertida: 2/5/2024 -> 2024-02-05 (Campo: fecha_castigo)
[2025-11-02 22:50:04] ✅ Fecha string convertida: 7/3/2023 -> 2023-07-03 (Campo: fecha_pago)
[2025-11-02 22:50:04] ✅ Fecha string convertida: 8/5/2023 -> 2023-08-05 (Campo: fecha_vencimiento)
[2025-11-02 22:50:04] ✅ Fecha string convertida: 2/24/2022 -> 2022-02-24 (Campo: fecha_susc)
[2025-11-02 22:50:04] ✅ Fecha string convertida: 4/1/2024 -> 2024-04-01 (Campo: fecha_asignacion)
[2025-11-02 22:50:04] ✅ Fecha string convertida: 1/27/2025 -> 2025-01-27 (Campo: fecha_proceso)
[2025-11-02 22:50:04] ✅ Fecha string convertida: 2/5/2024 -> 2024-02-05 (Campo: fecha_castigo)
[2025-11-02 22:50:04] ✅ Fecha string convertida: 8/1/2023 -> 2023-08-01 (Campo: fecha_pago)
[2025-11-02 22:50:04] ✅ Fecha string convertida: 8/5/2023 -> 2023-08-05 (Campo: fecha_vencimiento)
[2025-11-02 22:50:04] ✅ Fecha string convertida: 9/7/2021 -> 2021-09-07 (Campo: fecha_susc)
[2025-11-02 22:50:04] ✅ Fecha string convertida: 4/1/2024 -> 2024-04-01 (Campo: fecha_asignacion)
[2025-11-02 22:50:04] ✅ Fecha string convertida: 1/27/2025 -> 2025-01-27 (Campo: fecha_proceso)
[2025-11-02 22:50:04] ✅ Fecha string convertida: 2/5/2024 -> 2024-02-05 (Campo: fecha_castigo)
[2025-11-02 22:50:04] ✅ Fecha string convertida: 6/30/2023 -> 2023-06-30 (Campo: fecha_pago)
[2025-11-02 22:50:04] ✅ Fecha string convertida: 8/5/2023 -> 2023-08-05 (Campo: fecha_vencimiento)
[2025-11-02 22:50:04] ✅ Fecha string convertida: 3/13/2021 -> 2021-03-13 (Campo: fecha_susc)
[2025-11-02 22:50:04] ✅ Fecha string convertida: 4/1/2024 -> 2024-04-01 (Campo: fecha_asignacion)
[2025-11-02 22:50:04] ✅ Fecha string convertida: 1/27/2025 -> 2025-01-27 (Campo: fecha_proceso)
[2025-11-02 22:50:04] ✅ Fecha string convertida: 2/5/2024 -> 2024-02-05 (Campo: fecha_castigo)
[2025-11-02 22:50:04] ✅ Fecha string convertida: 10/9/2023 -> 2023-10-09 (Campo: fecha_pago)
[2025-11-02 22:50:04] ✅ Fecha string convertida: 8/5/2023 -> 2023-08-05 (Campo: fecha_vencimiento)
[2025-11-02 22:50:04] ✅ Fecha string convertida: 4/20/2022 -> 2022-04-20 (Campo: fecha_susc)
[2025-11-02 22:50:04] ✅ Fecha string convertida: 4/1/2024 -> 2024-04-01 (Campo: fecha_asignacion)
[2025-11-02 22:50:04] ✅ Fecha string convertida: 1/27/2025 -> 2025-01-27 (Campo: fecha_proceso)
[2025-11-02 22:50:04] ✅ Fecha string convertida: 2/5/2024 -> 2024-02-05 (Campo: fecha_castigo)
[2025-11-02 22:50:04] ✅ Fecha string convertida: 7/31/2023 -> 2023-07-31 (Campo: fecha_pago)
[2025-11-02 22:50:04] ✅ Fecha string convertida: 8/5/2023 -> 2023-08-05 (Campo: fecha_vencimiento)
[2025-11-02 22:50:04] ✅ Fecha string convertida: 7/23/2016 -> 2016-07-23 (Campo: fecha_susc)
[2025-11-02 22:50:04] ✅ Fecha string convertida: 4/1/2024 -> 2024-04-01 (Campo: fecha_asignacion)
[2025-11-02 22:50:04] ✅ Fecha string convertida: 1/27/2025 -> 2025-01-27 (Campo: fecha_proceso)
[2025-11-02 22:50:04] ✅ Fecha string convertida: 2/5/2024 -> 2024-02-05 (Campo: fecha_castigo)
[2025-11-02 22:50:04] ✅ Fecha string convertida: 7/4/2023 -> 2023-07-04 (Campo: fecha_pago)
[2025-11-02 22:50:04] ✅ Fecha string convertida: 8/5/2023 -> 2023-08-05 (Campo: fecha_vencimiento)
[2025-11-02 22:50:04] ✅ Fecha string convertida: 11/3/2016 -> 2016-11-03 (Campo: fecha_susc)
[2025-11-02 22:50:04] ✅ Fecha string convertida: 4/1/2024 -> 2024-04-01 (Campo: fecha_asignacion)
[2025-11-02 22:50:04] ✅ Fecha string convertida: 1/27/2025 -> 2025-01-27 (Campo: fecha_proceso)
[2025-11-02 22:50:04] ✅ Fecha string convertida: 2/5/2024 -> 2024-02-05 (Campo: fecha_castigo)
[2025-11-02 22:50:04] ✅ Fecha string convertida: 8/24/2023 -> 2023-08-24 (Campo: fecha_pago)
[2025-11-02 22:50:04] ✅ Fecha string convertida: 8/5/2023 -> 2023-08-05 (Campo: fecha_vencimiento)
[2025-11-02 22:50:04] ✅ Fecha string convertida: 12/17/2013 -> 2013-12-17 (Campo: fecha_susc)
[2025-11-02 22:50:04] ✅ Fecha string convertida: 4/1/2024 -> 2024-04-01 (Campo: fecha_asignacion)
[2025-11-02 22:50:04] ✅ Fecha string convertida: 1/27/2025 -> 2025-01-27 (Campo: fecha_proceso)
[2025-11-02 22:50:04] ✅ Fecha string convertida: 2/5/2024 -> 2024-02-05 (Campo: fecha_castigo)
[2025-11-02 22:50:04] ✅ Fecha string convertida: 4/28/2023 -> 2023-04-28 (Campo: fecha_pago)
[2025-11-02 22:50:04] ✅ Fecha string convertida: 8/5/2023 -> 2023-08-05 (Campo: fecha_vencimiento)
[2025-11-02 22:50:04] ✅ Fecha string convertida: 12/22/2022 -> 2022-12-22 (Campo: fecha_susc)
[2025-11-02 22:50:04] ✅ Fecha string convertida: 4/1/2024 -> 2024-04-01 (Campo: fecha_asignacion)
[2025-11-02 22:50:04] ✅ Fecha string convertida: 1/27/2025 -> 2025-01-27 (Campo: fecha_proceso)
[2025-11-02 22:50:04] ✅ Fecha string convertida: 2/5/2024 -> 2024-02-05 (Campo: fecha_castigo)
[2025-11-02 22:50:04] ✅ Fecha string convertida: 10/5/2023 -> 2023-10-05 (Campo: fecha_pago)
[2025-11-02 22:50:04] ✅ Fecha string convertida: 8/5/2023 -> 2023-08-05 (Campo: fecha_vencimiento)
[2025-11-02 22:50:04] ✅ Fecha string convertida: 8/16/2015 -> 2015-08-16 (Campo: fecha_susc)
[2025-11-02 22:50:04] ✅ Fecha string convertida: 4/1/2024 -> 2024-04-01 (Campo: fecha_asignacion)
[2025-11-02 22:50:04] ✅ Fecha string convertida: 1/27/2025 -> 2025-01-27 (Campo: fecha_proceso)
[2025-11-02 22:50:04] ✅ Fecha string convertida: 2/5/2024 -> 2024-02-05 (Campo: fecha_castigo)
[2025-11-02 22:50:04] ✅ Fecha string convertida: 8/27/2023 -> 2023-08-27 (Campo: fecha_pago)
[2025-11-02 22:50:04] ✅ Fecha string convertida: 8/5/2023 -> 2023-08-05 (Campo: fecha_vencimiento)
[2025-11-02 22:50:04] ✅ Fecha string convertida: 1/26/2020 -> 2020-01-26 (Campo: fecha_susc)
[2025-11-02 22:50:04] ✅ Fecha string convertida: 4/1/2024 -> 2024-04-01 (Campo: fecha_asignacion)
[2025-11-02 22:50:04] ✅ Fecha string convertida: 1/27/2025 -> 2025-01-27 (Campo: fecha_proceso)
[2025-11-02 22:50:04] ✅ Fecha string convertida: 2/5/2024 -> 2024-02-05 (Campo: fecha_castigo)
[2025-11-02 22:50:04] ✅ Fecha string convertida: 9/3/2023 -> 2023-09-03 (Campo: fecha_pago)
[2025-11-02 22:50:04] ✅ Fecha string convertida: 8/5/2023 -> 2023-08-05 (Campo: fecha_vencimiento)
[2025-11-02 22:50:04] ✅ Fecha string convertida: 9/9/2010 -> 2010-09-09 (Campo: fecha_susc)
[2025-11-02 22:50:04] ✅ Fecha string convertida: 4/1/2024 -> 2024-04-01 (Campo: fecha_asignacion)
[2025-11-02 22:50:04] ✅ Fecha string convertida: 1/27/2025 -> 2025-01-27 (Campo: fecha_proceso)
[2025-11-02 22:50:04] ✅ Fecha string convertida: 2/10/2024 -> 2024-02-10 (Campo: fecha_castigo)
[2025-11-02 22:50:04] ✅ Fecha string convertida: 7/26/2024 -> 2024-07-26 (Campo: fecha_pago)
[2025-11-02 22:50:04] ✅ Fecha string convertida: 8/10/2023 -> 2023-08-10 (Campo: fecha_vencimiento)
[2025-11-02 22:50:04] ✅ Fecha string convertida: 12/15/2011 -> 2011-12-15 (Campo: fecha_susc)
[2025-11-02 22:50:04] ✅ Fecha string convertida: 4/1/2024 -> 2024-04-01 (Campo: fecha_asignacion)
[2025-11-02 22:50:05] ✅ Fecha string convertida: 1/27/2025 -> 2025-01-27 (Campo: fecha_proceso)
[2025-11-02 22:50:05] ✅ Fecha string convertida: 2/10/2024 -> 2024-02-10 (Campo: fecha_castigo)
[2025-11-02 22:50:05] ✅ Fecha string convertida: 8/12/2023 -> 2023-08-12 (Campo: fecha_pago)
[2025-11-02 22:50:05] ✅ Fecha string convertida: 8/10/2023 -> 2023-08-10 (Campo: fecha_vencimiento)
[2025-11-02 22:50:05] ✅ Fecha string convertida: 1/18/2022 -> 2022-01-18 (Campo: fecha_susc)
[2025-11-02 22:50:05] ✅ Fecha string convertida: 4/1/2024 -> 2024-04-01 (Campo: fecha_asignacion)
[2025-11-02 22:50:05] ✅ Fecha string convertida: 1/27/2025 -> 2025-01-27 (Campo: fecha_proceso)
[2025-11-02 22:50:05] ✅ Fecha string convertida: 3/5/2024 -> 2024-03-05 (Campo: fecha_castigo)
[2025-11-02 22:50:05] ✅ Fecha string convertida: 8/6/2023 -> 2023-08-06 (Campo: fecha_pago)
[2025-11-02 22:50:05] ✅ Fecha string convertida: 9/5/2023 -> 2023-09-05 (Campo: fecha_vencimiento)
[2025-11-02 22:50:05] ✅ Fecha string convertida: 8/16/2013 -> 2013-08-16 (Campo: fecha_susc)
[2025-11-02 22:50:05] ✅ Fecha string convertida: 5/1/2024 -> 2024-05-01 (Campo: fecha_asignacion)
[2025-11-02 22:50:05] ✅ Fecha string convertida: 1/27/2025 -> 2025-01-27 (Campo: fecha_proceso)
[2025-11-02 22:50:05] ✅ Fecha string convertida: 4/5/2024 -> 2024-04-05 (Campo: fecha_castigo)
[2025-11-02 22:50:05] ✅ Fecha string convertida: 9/14/2023 -> 2023-09-14 (Campo: fecha_pago)
[2025-11-02 22:50:05] ✅ Fecha string convertida: 10/5/2023 -> 2023-10-05 (Campo: fecha_vencimiento)
[2025-11-02 22:50:05] ✅ Fecha string convertida: 9/16/2014 -> 2014-09-16 (Campo: fecha_susc)
[2025-11-02 22:50:05] ✅ Fecha string convertida: 6/1/2024 -> 2024-06-01 (Campo: fecha_asignacion)
[2025-11-02 22:50:05] ✅ Fecha string convertida: 1/27/2025 -> 2025-01-27 (Campo: fecha_proceso)
[2025-11-02 22:50:05] ✅ Fecha string convertida: 4/5/2024 -> 2024-04-05 (Campo: fecha_castigo)
[2025-11-02 22:50:05] ✅ Fecha string convertida: 8/29/2023 -> 2023-08-29 (Campo: fecha_pago)
[2025-11-02 22:50:05] ✅ Fecha string convertida: 10/5/2023 -> 2023-10-05 (Campo: fecha_vencimiento)
[2025-11-02 22:50:05] ✅ Fecha string convertida: 9/9/2011 -> 2011-09-09 (Campo: fecha_susc)
[2025-11-02 22:50:05] ✅ Fecha string convertida: 6/1/2024 -> 2024-06-01 (Campo: fecha_asignacion)
[2025-11-02 22:50:05] ✅ Fecha string convertida: 1/27/2025 -> 2025-01-27 (Campo: fecha_proceso)
[2025-11-02 22:50:05] ✅ Fecha string convertida: 4/5/2024 -> 2024-04-05 (Campo: fecha_castigo)
[2025-11-02 22:50:05] ✅ Fecha string convertida: 9/22/2023 -> 2023-09-22 (Campo: fecha_pago)
[2025-11-02 22:50:05] ✅ Fecha string convertida: 10/5/2023 -> 2023-10-05 (Campo: fecha_vencimiento)
[2025-11-02 22:50:05] ✅ Fecha string convertida: 5/13/2014 -> 2014-05-13 (Campo: fecha_susc)
[2025-11-02 22:50:05] ✅ Fecha string convertida: 6/1/2024 -> 2024-06-01 (Campo: fecha_asignacion)
[2025-11-02 22:50:05] ✅ Fecha string convertida: 1/27/2025 -> 2025-01-27 (Campo: fecha_proceso)
[2025-11-02 22:50:05] ✅ Fecha string convertida: 4/5/2024 -> 2024-04-05 (Campo: fecha_castigo)
[2025-11-02 22:50:05] ✅ Fecha string convertida: 8/31/2023 -> 2023-08-31 (Campo: fecha_pago)
[2025-11-02 22:50:05] ✅ Fecha string convertida: 10/5/2023 -> 2023-10-05 (Campo: fecha_vencimiento)
[2025-11-02 22:50:05] ✅ Fecha string convertida: 9/7/2013 -> 2013-09-07 (Campo: fecha_susc)
[2025-11-02 22:50:05] ✅ Fecha string convertida: 6/1/2024 -> 2024-06-01 (Campo: fecha_asignacion)
[2025-11-02 22:50:05] ✅ Fecha string convertida: 1/27/2025 -> 2025-01-27 (Campo: fecha_proceso)
[2025-11-02 22:50:05] ✅ Fecha string convertida: 4/5/2024 -> 2024-04-05 (Campo: fecha_castigo)
[2025-11-02 22:50:05] ✅ Fecha string convertida: 1/26/2023 -> 2023-01-26 (Campo: fecha_pago)
[2025-11-02 22:50:05] ✅ Fecha string convertida: 10/5/2023 -> 2023-10-05 (Campo: fecha_vencimiento)
[2025-11-02 22:50:05] ✅ Fecha string convertida: 7/23/1999 -> 1999-07-23 (Campo: fecha_susc)
[2025-11-02 22:50:05] ✅ Fecha string convertida: 6/1/2024 -> 2024-06-01 (Campo: fecha_asignacion)
[2025-11-02 22:50:05] ✅ Fecha string convertida: 1/27/2025 -> 2025-01-27 (Campo: fecha_proceso)
[2025-11-02 22:50:05] ✅ Fecha string convertida: 5/5/2024 -> 2024-05-05 (Campo: fecha_castigo)
[2025-11-02 22:50:05] ✅ Fecha string convertida: 9/22/2023 -> 2023-09-22 (Campo: fecha_pago)
[2025-11-02 22:50:05] ✅ Fecha string convertida: 11/5/2023 -> 2023-11-05 (Campo: fecha_vencimiento)
[2025-11-02 22:50:05] ✅ Fecha string convertida: 1/24/2015 -> 2015-01-24 (Campo: fecha_susc)
[2025-11-02 22:50:05] ✅ Fecha string convertida: 7/1/2024 -> 2024-07-01 (Campo: fecha_asignacion)
[2025-11-02 22:50:05] ✅ Fecha string convertida: 1/27/2025 -> 2025-01-27 (Campo: fecha_proceso)
[2025-11-02 22:50:05] ✅ Fecha string convertida: 5/5/2024 -> 2024-05-05 (Campo: fecha_castigo)
[2025-11-02 22:50:05] ✅ Fecha string convertida: 10/6/2023 -> 2023-10-06 (Campo: fecha_pago)
[2025-11-02 22:50:05] ✅ Fecha string convertida: 11/5/2023 -> 2023-11-05 (Campo: fecha_vencimiento)
[2025-11-02 22:50:05] ✅ Fecha string convertida: 5/16/2007 -> 2007-05-16 (Campo: fecha_susc)
[2025-11-02 22:50:05] ✅ Fecha string convertida: 7/1/2024 -> 2024-07-01 (Campo: fecha_asignacion)
[2025-11-02 22:50:05] ✅ Fecha string convertida: 1/27/2025 -> 2025-01-27 (Campo: fecha_proceso)
[2025-11-02 22:50:05] ✅ Fecha string convertida: 6/15/2024 -> 2024-06-15 (Campo: fecha_castigo)
[2025-11-02 22:50:05] ✅ Fecha string convertida: 12/22/2023 -> 2023-12-22 (Campo: fecha_pago)
[2025-11-02 22:50:05] ✅ Fecha string convertida: 12/15/2023 -> 2023-12-15 (Campo: fecha_vencimiento)
[2025-11-02 22:50:05] ✅ Fecha string convertida: 12/15/2018 -> 2018-12-15 (Campo: fecha_susc)
[2025-11-02 22:50:05] ✅ Fecha string convertida: 8/1/2024 -> 2024-08-01 (Campo: fecha_asignacion)
[2025-11-02 22:50:05] ✅ Fecha string convertida: 1/27/2025 -> 2025-01-27 (Campo: fecha_proceso)
[2025-11-02 22:50:05] ✅ Fecha string convertida: 7/5/2024 -> 2024-07-05 (Campo: fecha_castigo)
[2025-11-02 22:50:05] ✅ Fecha string convertida: 3/28/2024 -> 2024-03-28 (Campo: fecha_pago)
[2025-11-02 22:50:05] ✅ Fecha string convertida: 1/5/2024 -> 2024-01-05 (Campo: fecha_vencimiento)
[2025-11-02 22:50:05] ✅ Fecha string convertida: 6/28/1999 -> 1999-06-28 (Campo: fecha_susc)
[2025-11-02 22:50:05] ✅ Fecha string convertida: 9/1/2024 -> 2024-09-01 (Campo: fecha_asignacion)
[2025-11-02 22:50:05] ✅ Fecha string convertida: 1/27/2025 -> 2025-01-27 (Campo: fecha_proceso)
[2025-11-02 22:50:05] ✅ Fecha string convertida: 7/10/2024 -> 2024-07-10 (Campo: fecha_castigo)
[2025-11-02 22:50:05] ✅ Fecha string convertida: 12/8/2023 -> 2023-12-08 (Campo: fecha_pago)
[2025-11-02 22:50:05] ✅ Fecha string convertida: 1/10/2024 -> 2024-01-10 (Campo: fecha_vencimiento)
[2025-11-02 22:50:05] ✅ Fecha string convertida: 3/11/2020 -> 2020-03-11 (Campo: fecha_susc)
[2025-11-02 22:50:05] ✅ Fecha string convertida: 9/1/2024 -> 2024-09-01 (Campo: fecha_asignacion)
[2025-11-02 22:50:05] ✅ Fecha string convertida: 1/27/2025 -> 2025-01-27 (Campo: fecha_proceso)
[2025-11-02 22:50:05] ✅ Fecha string convertida: 8/5/2024 -> 2024-08-05 (Campo: fecha_castigo)
[2025-11-02 22:50:05] ✅ Fecha string convertida: 1/11/2024 -> 2024-01-11 (Campo: fecha_pago)
[2025-11-02 22:50:05] ✅ Fecha string convertida: 2/5/2024 -> 2024-02-05 (Campo: fecha_vencimiento)
[2025-11-02 22:50:05] ✅ Fecha string convertida: 7/20/2016 -> 2016-07-20 (Campo: fecha_susc)
[2025-11-02 22:50:05] ✅ Fecha string convertida: 10/1/2024 -> 2024-10-01 (Campo: fecha_asignacion)
[2025-11-02 22:50:05] ✅ Fecha string convertida: 1/27/2025 -> 2025-01-27 (Campo: fecha_proceso)
[2025-11-02 22:50:05] ✅ Fecha string convertida: 8/5/2024 -> 2024-08-05 (Campo: fecha_castigo)
[2025-11-02 22:50:05] ✅ Fecha string convertida: 1/11/2024 -> 2024-01-11 (Campo: fecha_pago)
[2025-11-02 22:50:05] ✅ Fecha string convertida: 2/5/2024 -> 2024-02-05 (Campo: fecha_vencimiento)
[2025-11-02 22:50:05] ✅ Fecha string convertida: 11/27/2015 -> 2015-11-27 (Campo: fecha_susc)
[2025-11-02 22:50:05] ✅ Fecha string convertida: 10/1/2024 -> 2024-10-01 (Campo: fecha_asignacion)
[2025-11-02 22:50:05] ✅ Fecha string convertida: 1/27/2025 -> 2025-01-27 (Campo: fecha_proceso)
[2025-11-02 22:50:05] ✅ Fecha string convertida: 10/5/2024 -> 2024-10-05 (Campo: fecha_castigo)
[2025-11-02 22:50:05] ✅ Fecha string convertida: 3/18/2024 -> 2024-03-18 (Campo: fecha_pago)
[2025-11-02 22:50:05] ✅ Fecha string convertida: 4/5/2024 -> 2024-04-05 (Campo: fecha_vencimiento)
[2025-11-02 22:50:05] ✅ Fecha string convertida: 12/11/2011 -> 2011-12-11 (Campo: fecha_susc)
[2025-11-02 22:50:05] ✅ Fecha string convertida: 12/1/2024 -> 2024-12-01 (Campo: fecha_asignacion)
[2025-11-02 22:50:05] ✅ Fecha string convertida: 1/27/2025 -> 2025-01-27 (Campo: fecha_proceso)
[2025-11-02 22:50:05] ✅ Fecha string convertida: 10/5/2024 -> 2024-10-05 (Campo: fecha_castigo)
[2025-11-02 22:50:05] ✅ Fecha string convertida: 3/4/2024 -> 2024-03-04 (Campo: fecha_pago)
[2025-11-02 22:50:05] ✅ Fecha string convertida: 4/5/2024 -> 2024-04-05 (Campo: fecha_vencimiento)
[2025-11-02 22:50:05] ✅ Fecha string convertida: 1/29/2024 -> 2024-01-29 (Campo: fecha_susc)
[2025-11-02 22:50:05] ✅ Fecha string convertida: 12/1/2024 -> 2024-12-01 (Campo: fecha_asignacion)
[2025-11-02 22:50:05] ✅ Fecha string convertida: 1/27/2025 -> 2025-01-27 (Campo: fecha_proceso)
[2025-11-02 22:50:05] ✅ Fecha string convertida: 10/5/2024 -> 2024-10-05 (Campo: fecha_castigo)
[2025-11-02 22:50:05] ✅ Fecha string convertida: 3/8/2024 -> 2024-03-08 (Campo: fecha_pago)
[2025-11-02 22:50:05] ✅ Fecha string convertida: 4/5/2024 -> 2024-04-05 (Campo: fecha_vencimiento)
[2025-11-02 22:50:05] ✅ Fecha string convertida: 6/13/2021 -> 2021-06-13 (Campo: fecha_susc)
[2025-11-02 22:50:05] ✅ Fecha string convertida: 12/1/2024 -> 2024-12-01 (Campo: fecha_asignacion)
[2025-11-02 22:50:05] ✅ Fecha string convertida: 1/27/2025 -> 2025-01-27 (Campo: fecha_proceso)
[2025-11-02 22:50:05] ✅ Fecha string convertida: 10/5/2024 -> 2024-10-05 (Campo: fecha_castigo)
[2025-11-02 22:50:05] ✅ Fecha string convertida: 3/4/2024 -> 2024-03-04 (Campo: fecha_pago)
[2025-11-02 22:50:05] ✅ Fecha string convertida: 4/5/2024 -> 2024-04-05 (Campo: fecha_vencimiento)
[2025-11-02 22:50:05] ✅ Fecha string convertida: 6/9/2014 -> 2014-06-09 (Campo: fecha_susc)
[2025-11-02 22:50:05] ✅ Fecha string convertida: 12/1/2024 -> 2024-12-01 (Campo: fecha_asignacion)
[2025-11-02 22:50:05] ✅ Fecha string convertida: 1/27/2025 -> 2025-01-27 (Campo: fecha_proceso)
[2025-11-02 22:50:05] ✅ Fecha string convertida: 10/5/2024 -> 2024-10-05 (Campo: fecha_castigo)
[2025-11-02 22:50:05] ✅ Fecha string convertida: 4/29/2024 -> 2024-04-29 (Campo: fecha_pago)
[2025-11-02 22:50:05] ✅ Fecha string convertida: 4/5/2024 -> 2024-04-05 (Campo: fecha_vencimiento)
[2025-11-02 22:50:05] ✅ Fecha string convertida: 8/3/2013 -> 2013-08-03 (Campo: fecha_susc)
[2025-11-02 22:50:05] ✅ Fecha string convertida: 12/1/2024 -> 2024-12-01 (Campo: fecha_asignacion)
[2025-11-02 22:50:05] ✅ Fecha string convertida: 1/27/2025 -> 2025-01-27 (Campo: fecha_proceso)
[2025-11-02 22:50:05] ✅ Fecha string convertida: 10/5/2024 -> 2024-10-05 (Campo: fecha_castigo)
[2025-11-02 22:50:05] ✅ Fecha string convertida: 3/12/2024 -> 2024-03-12 (Campo: fecha_pago)
[2025-11-02 22:50:05] ✅ Fecha string convertida: 4/5/2024 -> 2024-04-05 (Campo: fecha_vencimiento)
[2025-11-02 22:50:05] ✅ Fecha string convertida: 11/25/2014 -> 2014-11-25 (Campo: fecha_susc)
[2025-11-02 22:50:05] ✅ Fecha string convertida: 12/1/2024 -> 2024-12-01 (Campo: fecha_asignacion)
[2025-11-02 22:50:05] ✅ Fecha string convertida: 1/27/2025 -> 2025-01-27 (Campo: fecha_proceso)
[2025-11-02 22:50:05] ✅ Fecha string convertida: 10/10/2024 -> 2024-10-10 (Campo: fecha_castigo)
[2025-11-02 22:50:05] ✅ Fecha string convertida: 3/11/2024 -> 2024-03-11 (Campo: fecha_pago)
[2025-11-02 22:50:05] ✅ Fecha string convertida: 4/10/2024 -> 2024-04-10 (Campo: fecha_vencimiento)
[2025-11-02 22:50:05] ✅ Fecha string convertida: 9/21/2023 -> 2023-09-21 (Campo: fecha_susc)
[2025-11-02 22:50:05] ✅ Fecha string convertida: 12/1/2024 -> 2024-12-01 (Campo: fecha_asignacion)
[2025-11-02 22:50:05] ✅ Fecha string convertida: 1/27/2025 -> 2025-01-27 (Campo: fecha_proceso)
[2025-11-02 22:50:05] ✅ Fecha string convertida: 10/10/2024 -> 2024-10-10 (Campo: fecha_castigo)
[2025-11-02 22:50:05] ✅ Fecha string convertida: 11/29/2024 -> 2024-11-29 (Campo: fecha_pago)
[2025-11-02 22:50:05] ✅ Fecha string convertida: 4/10/2024 -> 2024-04-10 (Campo: fecha_vencimiento)
[2025-11-02 22:50:05] ✅ Fecha string convertida: 1/30/2020 -> 2020-01-30 (Campo: fecha_susc)
[2025-11-02 22:50:05] ✅ Fecha string convertida: 12/1/2024 -> 2024-12-01 (Campo: fecha_asignacion)
[2025-11-02 22:50:05] ✅ Fecha string convertida: 1/27/2025 -> 2025-01-27 (Campo: fecha_proceso)
[2025-11-02 22:50:05] ✅ Fecha string convertida: 10/10/2024 -> 2024-10-10 (Campo: fecha_castigo)
[2025-11-02 22:50:05] ✅ Fecha string convertida: 6/24/2024 -> 2024-06-24 (Campo: fecha_pago)
[2025-11-02 22:50:05] ✅ Fecha string convertida: 4/10/2024 -> 2024-04-10 (Campo: fecha_vencimiento)
[2025-11-02 22:50:05] ✅ Fecha string convertida: 2/6/2012 -> 2012-02-06 (Campo: fecha_susc)
[2025-11-02 22:50:05] ✅ Fecha string convertida: 12/1/2024 -> 2024-12-01 (Campo: fecha_asignacion)
[2025-11-02 22:50:05] ✅ Fecha string convertida: 1/27/2025 -> 2025-01-27 (Campo: fecha_proceso)
[2025-11-02 22:50:05] ✅ Fecha string convertida: 10/20/2024 -> 2024-10-20 (Campo: fecha_castigo)
[2025-11-02 22:50:05] ✅ Fecha string convertida: 7/13/2024 -> 2024-07-13 (Campo: fecha_pago)
[2025-11-02 22:50:05] ✅ Fecha string convertida: 4/20/2024 -> 2024-04-20 (Campo: fecha_vencimiento)
[2025-11-02 22:50:05] ✅ Fecha string convertida: 10/10/2015 -> 2015-10-10 (Campo: fecha_susc)
[2025-11-02 22:50:05] ✅ Fecha string convertida: 12/1/2024 -> 2024-12-01 (Campo: fecha_asignacion)
[2025-11-02 22:50:05] ✅ Fecha string convertida: 1/27/2025 -> 2025-01-27 (Campo: fecha_proceso)
[2025-11-02 22:50:05] ✅ Fecha string convertida: 10/25/2024 -> 2024-10-25 (Campo: fecha_castigo)
[2025-11-02 22:50:05] ✅ Fecha string convertida: 3/27/2024 -> 2024-03-27 (Campo: fecha_pago)
[2025-11-02 22:50:05] ✅ Fecha string convertida: 4/25/2024 -> 2024-04-25 (Campo: fecha_vencimiento)
[2025-11-02 22:50:05] ✅ Fecha string convertida: 3/2/2007 -> 2007-03-02 (Campo: fecha_susc)
[2025-11-02 22:50:05] ✅ Fecha string convertida: 12/1/2024 -> 2024-12-01 (Campo: fecha_asignacion)
[2025-11-02 22:50:05] ✅ Fecha string convertida: 1/27/2025 -> 2025-01-27 (Campo: fecha_proceso)
[2025-11-02 22:50:05] ✅ Fecha string convertida: 10/25/2024 -> 2024-10-25 (Campo: fecha_castigo)
[2025-11-02 22:50:05] ✅ Fecha string convertida: 3/29/2024 -> 2024-03-29 (Campo: fecha_pago)
[2025-11-02 22:50:05] ✅ Fecha string convertida: 4/25/2024 -> 2024-04-25 (Campo: fecha_vencimiento)
[2025-11-02 22:50:05] ✅ Fecha string convertida: 1/10/2022 -> 2022-01-10 (Campo: fecha_susc)
[2025-11-02 22:50:05] ✅ Fecha string convertida: 12/1/2024 -> 2024-12-01 (Campo: fecha_asignacion)
[2025-11-02 22:50:05] ✅ Fecha string convertida: 1/27/2025 -> 2025-01-27 (Campo: fecha_proceso)
[2025-11-02 22:50:05] ✅ Fecha string convertida: 9/5/2019 -> 2019-09-05 (Campo: fecha_castigo)
[2025-11-02 22:50:05] ✅ Fecha string convertida: 9/30/2022 -> 2022-09-30 (Campo: fecha_pago)
[2025-11-02 22:50:05] ✅ Fecha string convertida: 3/5/2019 -> 2019-03-05 (Campo: fecha_vencimiento)
[2025-11-02 22:50:05] ✅ Fecha string convertida: 5/11/2008 -> 2008-05-11 (Campo: fecha_susc)
[2025-11-02 22:50:05] ✅ Fecha string convertida: 11/1/2019 -> 2019-11-01 (Campo: fecha_asignacion)
[2025-11-02 22:50:05] ✅ Fecha string convertida: 1/27/2025 -> 2025-01-27 (Campo: fecha_proceso)
[2025-11-02 22:50:05] ✅ Fecha string convertida: 2/5/2020 -> 2020-02-05 (Campo: fecha_castigo)
[2025-11-02 22:50:05] ✅ Fecha string convertida: 1/4/2021 -> 2021-01-04 (Campo: fecha_pago)
[2025-11-02 22:50:05] ✅ Fecha string convertida: 8/5/2019 -> 2019-08-05 (Campo: fecha_vencimiento)
[2025-11-02 22:50:05] ✅ Fecha string convertida: 10/14/2014 -> 2014-10-14 (Campo: fecha_susc)
[2025-11-02 22:50:05] ✅ Fecha string convertida: 4/1/2020 -> 2020-04-01 (Campo: fecha_asignacion)
[2025-11-02 22:50:05] ✅ Fecha string convertida: 1/27/2025 -> 2025-01-27 (Campo: fecha_proceso)
[2025-11-02 22:50:05] ✅ Fecha string convertida: 2/5/2020 -> 2020-02-05 (Campo: fecha_castigo)
[2025-11-02 22:50:05] ✅ Fecha string convertida: 1/7/2021 -> 2021-01-07 (Campo: fecha_pago)
[2025-11-02 22:50:05] ✅ Fecha string convertida: 8/5/2019 -> 2019-08-05 (Campo: fecha_vencimiento)
[2025-11-02 22:50:05] ✅ Fecha string convertida: 8/5/2003 -> 2003-08-05 (Campo: fecha_susc)
[2025-11-02 22:50:05] ✅ Fecha string convertida: 1/1/2020 -> 2020-01-01 (Campo: fecha_asignacion)
[2025-11-02 22:50:05] ✅ Fecha string convertida: 1/27/2025 -> 2025-01-27 (Campo: fecha_proceso)
[2025-11-02 22:50:05] ✅ Fecha string convertida: 5/5/2020 -> 2020-05-05 (Campo: fecha_castigo)
[2025-11-02 22:50:05] ✅ Fecha string convertida: 8/5/2024 -> 2024-08-05 (Campo: fecha_pago)
[2025-11-02 22:50:05] ✅ Fecha string convertida: 11/5/2019 -> 2019-11-05 (Campo: fecha_vencimiento)
[2025-11-02 22:50:05] ✅ Fecha string convertida: 2/1/2017 -> 2017-02-01 (Campo: fecha_susc)
[2025-11-02 22:50:05] ✅ Fecha string convertida: 7/1/2020 -> 2020-07-01 (Campo: fecha_asignacion)
[2025-11-02 22:50:05] ✅ Fecha string convertida: 1/27/2025 -> 2025-01-27 (Campo: fecha_proceso)
[2025-11-02 22:50:05] ✅ Fecha string convertida: 8/5/2020 -> 2020-08-05 (Campo: fecha_castigo)
[2025-11-02 22:50:05] ✅ Fecha string convertida: 3/16/2023 -> 2023-03-16 (Campo: fecha_pago)
[2025-11-02 22:50:05] ✅ Fecha string convertida: 2/5/2020 -> 2020-02-05 (Campo: fecha_vencimiento)
[2025-11-02 22:50:05] ✅ Fecha string convertida: 6/29/2010 -> 2010-06-29 (Campo: fecha_susc)
[2025-11-02 22:50:05] ✅ Fecha string convertida: 10/1/2020 -> 2020-10-01 (Campo: fecha_asignacion)
[2025-11-02 22:50:05] ✅ Fecha string convertida: 1/27/2025 -> 2025-01-27 (Campo: fecha_proceso)
[2025-11-02 22:50:05] ✅ Fecha string convertida: 9/5/2020 -> 2020-09-05 (Campo: fecha_castigo)
[2025-11-02 22:50:05] ✅ Fecha string convertida: 3/5/2020 -> 2020-03-05 (Campo: fecha_vencimiento)
[2025-11-02 22:50:05] ✅ Fecha string convertida: 4/3/2017 -> 2017-04-03 (Campo: fecha_susc)
[2025-11-02 22:50:05] ✅ Fecha string convertida: 11/1/2020 -> 2020-11-01 (Campo: fecha_asignacion)
[2025-11-02 22:50:05] ✅ Fecha string convertida: 1/27/2025 -> 2025-01-27 (Campo: fecha_proceso)
[2025-11-02 22:50:05] ✅ Fecha string convertida: 12/5/2020 -> 2020-12-05 (Campo: fecha_castigo)
[2025-11-02 22:50:05] ✅ Fecha string convertida: 6/5/2020 -> 2020-06-05 (Campo: fecha_vencimiento)
[2025-11-02 22:50:05] ✅ Fecha string convertida: 2/6/2017 -> 2017-02-06 (Campo: fecha_susc)
[2025-11-02 22:50:05] ✅ Fecha string convertida: 2/1/2021 -> 2021-02-01 (Campo: fecha_asignacion)
[2025-11-02 22:50:05] ✅ Fecha string convertida: 1/27/2025 -> 2025-01-27 (Campo: fecha_proceso)
[2025-11-02 22:50:05] ✅ Fecha string convertida: 12/5/2020 -> 2020-12-05 (Campo: fecha_castigo)
[2025-11-02 22:50:05] ✅ Fecha string convertida: 6/5/2020 -> 2020-06-05 (Campo: fecha_vencimiento)
[2025-11-02 22:50:05] ✅ Fecha string convertida: 12/21/2014 -> 2014-12-21 (Campo: fecha_susc)
[2025-11-02 22:50:05] ✅ Fecha string convertida: 2/1/2021 -> 2021-02-01 (Campo: fecha_asignacion)
[2025-11-02 22:50:05] ✅ Fecha string convertida: 1/27/2025 -> 2025-01-27 (Campo: fecha_proceso)
[2025-11-02 22:50:05] ✅ Fecha string convertida: 12/5/2020 -> 2020-12-05 (Campo: fecha_castigo)
[2025-11-02 22:50:05] ✅ Fecha string convertida: 6/5/2020 -> 2020-06-05 (Campo: fecha_vencimiento)
[2025-11-02 22:50:05] ✅ Fecha string convertida: 12/6/2014 -> 2014-12-06 (Campo: fecha_susc)
[2025-11-02 22:50:05] ✅ Fecha string convertida: 2/1/2021 -> 2021-02-01 (Campo: fecha_asignacion)
[2025-11-02 22:50:05] ✅ Fecha string convertida: 1/27/2025 -> 2025-01-27 (Campo: fecha_proceso)
[2025-11-02 22:50:05] ✅ Fecha string convertida: 12/25/2020 -> 2020-12-25 (Campo: fecha_castigo)
[2025-11-02 22:50:05] ✅ Fecha string convertida: 6/25/2020 -> 2020-06-25 (Campo: fecha_vencimiento)
[2025-11-02 22:50:05] ✅ Fecha string convertida: 6/24/2010 -> 2010-06-24 (Campo: fecha_susc)
[2025-11-02 22:50:05] ✅ Fecha string convertida: 2/1/2021 -> 2021-02-01 (Campo: fecha_asignacion)
[2025-11-02 22:50:05] ✅ Fecha string convertida: 1/27/2025 -> 2025-01-27 (Campo: fecha_proceso)
[2025-11-02 22:50:05] ✅ Fecha string convertida: 4/5/2021 -> 2021-04-05 (Campo: fecha_castigo)
[2025-11-02 22:50:05] ✅ Fecha string convertida: 10/5/2020 -> 2020-10-05 (Campo: fecha_vencimiento)
[2025-11-02 22:50:05] ✅ Fecha string convertida: 4/21/2007 -> 2007-04-21 (Campo: fecha_susc)
[2025-11-02 22:50:05] ✅ Fecha string convertida: 6/1/2021 -> 2021-06-01 (Campo: fecha_asignacion)
[2025-11-02 22:50:05] ✅ Fecha string convertida: 1/27/2025 -> 2025-01-27 (Campo: fecha_proceso)
[2025-11-02 22:50:05] ✅ Fecha string convertida: 5/5/2021 -> 2021-05-05 (Campo: fecha_castigo)
[2025-11-02 22:50:05] ✅ Fecha string convertida: 11/5/2020 -> 2020-11-05 (Campo: fecha_vencimiento)
[2025-11-02 22:50:05] ✅ Fecha string convertida: 1/26/2015 -> 2015-01-26 (Campo: fecha_susc)
[2025-11-02 22:50:05] ✅ Fecha string convertida: 7/1/2021 -> 2021-07-01 (Campo: fecha_asignacion)
[2025-11-02 22:50:05] ✅ Fecha string convertida: 1/27/2025 -> 2025-01-27 (Campo: fecha_proceso)
[2025-11-02 22:50:05] ✅ Fecha string convertida: 5/20/2021 -> 2021-05-20 (Campo: fecha_castigo)
[2025-11-02 22:50:05] ✅ Fecha string convertida: 11/20/2020 -> 2020-11-20 (Campo: fecha_vencimiento)
[2025-11-02 22:50:05] ✅ Fecha string convertida: 9/5/2002 -> 2002-09-05 (Campo: fecha_susc)
[2025-11-02 22:50:05] ✅ Fecha string convertida: 7/1/2021 -> 2021-07-01 (Campo: fecha_asignacion)
[2025-11-02 22:50:05] ✅ Fecha string convertida: 1/27/2025 -> 2025-01-27 (Campo: fecha_proceso)
[2025-11-02 22:50:05] ✅ Fecha string convertida: 6/5/2021 -> 2021-06-05 (Campo: fecha_castigo)
[2025-11-02 22:50:05] ✅ Fecha string convertida: 12/5/2020 -> 2020-12-05 (Campo: fecha_vencimiento)
[2025-11-02 22:50:05] ✅ Fecha string convertida: 10/2/2004 -> 2004-10-02 (Campo: fecha_susc)
[2025-11-02 22:50:05] ✅ Fecha string convertida: 8/1/2021 -> 2021-08-01 (Campo: fecha_asignacion)
[2025-11-02 22:50:05] ✅ Fecha string convertida: 1/27/2025 -> 2025-01-27 (Campo: fecha_proceso)
[2025-11-02 22:50:05] ✅ Fecha string convertida: 10/5/2021 -> 2021-10-05 (Campo: fecha_castigo)
[2025-11-02 22:50:05] ✅ Fecha string convertida: 4/5/2021 -> 2021-04-05 (Campo: fecha_vencimiento)
[2025-11-02 22:50:05] ✅ Fecha string convertida: 9/5/2017 -> 2017-09-05 (Campo: fecha_susc)
[2025-11-02 22:50:05] ✅ Fecha string convertida: 12/1/2021 -> 2021-12-01 (Campo: fecha_asignacion)
[2025-11-02 22:50:05] ✅ Fecha string convertida: 1/27/2025 -> 2025-01-27 (Campo: fecha_proceso)
[2025-11-02 22:50:05] ✅ Fecha string convertida: 11/5/2021 -> 2021-11-05 (Campo: fecha_castigo)
[2025-11-02 22:50:05] ✅ Fecha string convertida: 5/5/2021 -> 2021-05-05 (Campo: fecha_vencimiento)
[2025-11-02 22:50:05] ✅ Fecha string convertida: 5/26/2017 -> 2017-05-26 (Campo: fecha_susc)
[2025-11-02 22:50:05] ✅ Fecha string convertida: 1/1/2022 -> 2022-01-01 (Campo: fecha_asignacion)
[2025-11-02 22:50:05] ✅ Fecha string convertida: 1/27/2025 -> 2025-01-27 (Campo: fecha_proceso)
[2025-11-02 22:50:05] ✅ Fecha string convertida: 1/5/2022 -> 2022-01-05 (Campo: fecha_castigo)
[2025-11-02 22:50:05] ✅ Fecha string convertida: 7/5/2021 -> 2021-07-05 (Campo: fecha_vencimiento)
[2025-11-02 22:50:05] ✅ Fecha string convertida: 3/12/2008 -> 2008-03-12 (Campo: fecha_susc)
[2025-11-02 22:50:05] ✅ Fecha string convertida: 3/1/2022 -> 2022-03-01 (Campo: fecha_asignacion)
[2025-11-02 22:50:05] ✅ Fecha string convertida: 1/27/2025 -> 2025-01-27 (Campo: fecha_proceso)
[2025-11-02 22:50:05] ✅ Fecha string convertida: 2/5/2022 -> 2022-02-05 (Campo: fecha_castigo)
[2025-11-02 22:50:05] ✅ Fecha string convertida: 9/7/2022 -> 2022-09-07 (Campo: fecha_pago)
[2025-11-02 22:50:05] ✅ Fecha string convertida: 8/5/2021 -> 2021-08-05 (Campo: fecha_vencimiento)
[2025-11-02 22:50:05] ✅ Fecha string convertida: 6/6/2015 -> 2015-06-06 (Campo: fecha_susc)
[2025-11-02 22:50:05] ✅ Fecha string convertida: 4/1/2022 -> 2022-04-01 (Campo: fecha_asignacion)
[2025-11-02 22:50:05] ✅ Fecha string convertida: 1/27/2025 -> 2025-01-27 (Campo: fecha_proceso)
[2025-11-02 22:50:05] ✅ Fecha string convertida: 2/10/2022 -> 2022-02-10 (Campo: fecha_castigo)
[2025-11-02 22:50:05] ✅ Fecha string convertida: 10/22/2022 -> 2022-10-22 (Campo: fecha_pago)
[2025-11-02 22:50:05] ✅ Fecha string convertida: 8/10/2021 -> 2021-08-10 (Campo: fecha_vencimiento)
[2025-11-02 22:50:05] ✅ Fecha string convertida: 5/8/2014 -> 2014-05-08 (Campo: fecha_susc)
[2025-11-02 22:50:05] ✅ Fecha string convertida: 4/1/2022 -> 2022-04-01 (Campo: fecha_asignacion)
[2025-11-02 22:50:05] ✅ Fecha string convertida: 1/27/2025 -> 2025-01-27 (Campo: fecha_proceso)
[2025-11-02 22:50:05] ✅ Fecha string convertida: 3/5/2022 -> 2022-03-05 (Campo: fecha_castigo)
[2025-11-02 22:50:05] ✅ Fecha string convertida: 6/1/2023 -> 2023-06-01 (Campo: fecha_pago)
[2025-11-02 22:50:05] ✅ Fecha string convertida: 9/5/2021 -> 2021-09-05 (Campo: fecha_vencimiento)
[2025-11-02 22:50:05] ✅ Fecha string convertida: 8/9/2013 -> 2013-08-09 (Campo: fecha_susc)
[2025-11-02 22:50:05] ✅ Fecha string convertida: 2/1/2022 -> 2022-02-01 (Campo: fecha_asignacion)
[2025-11-02 22:50:05] ✅ Fecha string convertida: 1/27/2025 -> 2025-01-27 (Campo: fecha_proceso)
[2025-11-02 22:50:05] ✅ Fecha string convertida: 3/5/2022 -> 2022-03-05 (Campo: fecha_castigo)
[2025-11-02 22:50:05] ✅ Fecha string convertida: 9/5/2021 -> 2021-09-05 (Campo: fecha_vencimiento)
[2025-11-02 22:50:05] ✅ Fecha string convertida: 7/18/2016 -> 2016-07-18 (Campo: fecha_susc)
[2025-11-02 22:50:05] ✅ Fecha string convertida: 5/1/2022 -> 2022-05-01 (Campo: fecha_asignacion)
[2025-11-02 22:50:05] ✅ Fecha string convertida: 1/27/2025 -> 2025-01-27 (Campo: fecha_proceso)
[2025-11-02 22:50:05] ✅ Fecha string convertida: 4/5/2022 -> 2022-04-05 (Campo: fecha_castigo)
[2025-11-02 22:50:05] ✅ Fecha string convertida: 10/5/2021 -> 2021-10-05 (Campo: fecha_vencimiento)
[2025-11-02 22:50:05] ✅ Fecha string convertida: 12/14/2015 -> 2015-12-14 (Campo: fecha_susc)
[2025-11-02 22:50:05] ✅ Fecha string convertida: 6/1/2022 -> 2022-06-01 (Campo: fecha_asignacion)
[2025-11-02 22:50:05] ✅ Fecha string convertida: 1/27/2025 -> 2025-01-27 (Campo: fecha_proceso)
[2025-11-02 22:50:05] ✅ Fecha string convertida: 4/5/2022 -> 2022-04-05 (Campo: fecha_castigo)
[2025-11-02 22:50:05] ✅ Fecha string convertida: 6/12/2023 -> 2023-06-12 (Campo: fecha_pago)
[2025-11-02 22:50:05] ✅ Fecha string convertida: 10/5/2021 -> 2021-10-05 (Campo: fecha_vencimiento)
[2025-11-02 22:50:05] ✅ Fecha string convertida: 10/17/2020 -> 2020-10-17 (Campo: fecha_susc)
[2025-11-02 22:50:05] ✅ Fecha string convertida: 6/1/2022 -> 2022-06-01 (Campo: fecha_asignacion)
[2025-11-02 22:50:05] ✅ Fecha string convertida: 1/27/2025 -> 2025-01-27 (Campo: fecha_proceso)
[2025-11-02 22:50:05] ✅ Fecha string convertida: 4/10/2022 -> 2022-04-10 (Campo: fecha_castigo)
[2025-11-02 22:50:05] ✅ Fecha string convertida: 3/8/2023 -> 2023-03-08 (Campo: fecha_pago)
[2025-11-02 22:50:05] ✅ Fecha string convertida: 10/10/2021 -> 2021-10-10 (Campo: fecha_vencimiento)
[2025-11-02 22:50:05] ✅ Fecha string convertida: 1/8/2009 -> 2009-01-08 (Campo: fecha_susc)
[2025-11-02 22:50:05] ✅ Fecha string convertida: 6/1/2022 -> 2022-06-01 (Campo: fecha_asignacion)
[2025-11-02 22:50:05] ✅ Fecha string convertida: 1/27/2025 -> 2025-01-27 (Campo: fecha_proceso)
[2025-11-02 22:50:05] ✅ Fecha string convertida: 5/5/2022 -> 2022-05-05 (Campo: fecha_castigo)
[2025-11-02 22:50:05] ✅ Fecha string convertida: 11/5/2021 -> 2021-11-05 (Campo: fecha_vencimiento)
[2025-11-02 22:50:05] ✅ Fecha string convertida: 11/23/2017 -> 2017-11-23 (Campo: fecha_susc)
[2025-11-02 22:50:05] ✅ Fecha string convertida: 7/1/2022 -> 2022-07-01 (Campo: fecha_asignacion)
[2025-11-02 22:50:05] ✅ Fecha string convertida: 1/27/2025 -> 2025-01-27 (Campo: fecha_proceso)
[2025-11-02 22:50:05] ✅ Fecha string convertida: 5/5/2022 -> 2022-05-05 (Campo: fecha_castigo)
[2025-11-02 22:50:05] ✅ Fecha string convertida: 1/20/2022 -> 2022-01-20 (Campo: fecha_pago)
[2025-11-02 22:50:05] ✅ Fecha string convertida: 11/5/2021 -> 2021-11-05 (Campo: fecha_vencimiento)
[2025-11-02 22:50:05] ✅ Fecha string convertida: 9/13/2018 -> 2018-09-13 (Campo: fecha_susc)
[2025-11-02 22:50:05] ✅ Fecha string convertida: 7/1/2022 -> 2022-07-01 (Campo: fecha_asignacion)
[2025-11-02 22:50:05] ✅ Fecha string convertida: 1/27/2025 -> 2025-01-27 (Campo: fecha_proceso)
[2025-11-02 22:50:05] ✅ Fecha string convertida: 5/5/2022 -> 2022-05-05 (Campo: fecha_castigo)
[2025-11-02 22:50:05] ✅ Fecha string convertida: 12/30/2022 -> 2022-12-30 (Campo: fecha_pago)
[2025-11-02 22:50:05] ✅ Fecha string convertida: 11/5/2021 -> 2021-11-05 (Campo: fecha_vencimiento)
[2025-11-02 22:50:05] ✅ Fecha string convertida: 10/3/2012 -> 2012-10-03 (Campo: fecha_susc)
[2025-11-02 22:50:06] ✅ Fecha string convertida: 5/1/2022 -> 2022-05-01 (Campo: fecha_asignacion)
[2025-11-02 22:50:06] ✅ Fecha string convertida: 1/27/2025 -> 2025-01-27 (Campo: fecha_proceso)
[2025-11-02 22:50:06] ✅ Fecha string convertida: 5/10/2022 -> 2022-05-10 (Campo: fecha_castigo)
[2025-11-02 22:50:06] ✅ Fecha string convertida: 11/10/2021 -> 2021-11-10 (Campo: fecha_vencimiento)
[2025-11-02 22:50:06] ✅ Fecha string convertida: 5/19/2021 -> 2021-05-19 (Campo: fecha_susc)
[2025-11-02 22:50:06] ✅ Fecha string convertida: 7/1/2022 -> 2022-07-01 (Campo: fecha_asignacion)
[2025-11-02 22:50:06] ✅ Fecha string convertida: 1/27/2025 -> 2025-01-27 (Campo: fecha_proceso)
[2025-11-02 22:50:06] ✅ Fecha string convertida: 5/15/2022 -> 2022-05-15 (Campo: fecha_castigo)
[2025-11-02 22:50:06] ✅ DV con valor '0' - ES VÁLIDO
[2025-11-02 22:50:06] ✅ Fecha string convertida: 1/3/2022 -> 2022-01-03 (Campo: fecha_pago)
[2025-11-02 22:50:06] ✅ Fecha string convertida: 11/15/2021 -> 2021-11-15 (Campo: fecha_vencimiento)
[2025-11-02 22:50:06] ✅ Fecha string convertida: 10/3/2007 -> 2007-10-03 (Campo: fecha_susc)
[2025-11-02 22:50:06] ✅ Fecha string convertida: 7/1/2022 -> 2022-07-01 (Campo: fecha_asignacion)
[2025-11-02 22:50:06] ✅ Fecha string convertida: 1/27/2025 -> 2025-01-27 (Campo: fecha_proceso)
[2025-11-02 22:50:06] ✅ Fecha string convertida: 5/15/2022 -> 2022-05-15 (Campo: fecha_castigo)
[2025-11-02 22:50:06] ✅ Fecha string convertida: 11/15/2021 -> 2021-11-15 (Campo: fecha_vencimiento)
[2025-11-02 22:50:06] ✅ Fecha string convertida: 11/10/2007 -> 2007-11-10 (Campo: fecha_susc)
[2025-11-02 22:50:06] ✅ Fecha string convertida: 7/1/2022 -> 2022-07-01 (Campo: fecha_asignacion)
[2025-11-02 22:50:06] ✅ Fecha string convertida: 1/27/2025 -> 2025-01-27 (Campo: fecha_proceso)
[2025-11-02 22:50:06] ✅ Fecha string convertida: 7/5/2022 -> 2022-07-05 (Campo: fecha_castigo)
[2025-11-02 22:50:06] ✅ Fecha string convertida: 1/5/2022 -> 2022-01-05 (Campo: fecha_vencimiento)
[2025-11-02 22:50:06] ✅ Fecha string convertida: 1/2/2017 -> 2017-01-02 (Campo: fecha_susc)
[2025-11-02 22:50:06] ✅ Fecha string convertida: 9/1/2022 -> 2022-09-01 (Campo: fecha_asignacion)
[2025-11-02 22:50:06] ✅ Fecha string convertida: 1/27/2025 -> 2025-01-27 (Campo: fecha_proceso)
[2025-11-02 22:50:06] ✅ Fecha string convertida: 7/5/2022 -> 2022-07-05 (Campo: fecha_castigo)
[2025-11-02 22:50:06] ✅ Fecha string convertida: 1/5/2022 -> 2022-01-05 (Campo: fecha_vencimiento)
[2025-11-02 22:50:06] ✅ Fecha string convertida: 5/28/2021 -> 2021-05-28 (Campo: fecha_susc)
[2025-11-02 22:50:06] ✅ Fecha string convertida: 9/1/2022 -> 2022-09-01 (Campo: fecha_asignacion)
[2025-11-02 22:50:06] ✅ Fecha string convertida: 1/27/2025 -> 2025-01-27 (Campo: fecha_proceso)
[2025-11-02 22:50:06] ✅ Fecha string convertida: 7/5/2022 -> 2022-07-05 (Campo: fecha_castigo)
[2025-11-02 22:50:06] ✅ Fecha string convertida: 8/15/2023 -> 2023-08-15 (Campo: fecha_pago)
[2025-11-02 22:50:06] ✅ Fecha string convertida: 1/5/2022 -> 2022-01-05 (Campo: fecha_vencimiento)
[2025-11-02 22:50:06] ✅ Fecha string convertida: 12/16/2012 -> 2012-12-16 (Campo: fecha_susc)
[2025-11-02 22:50:06] ✅ Fecha string convertida: 9/1/2022 -> 2022-09-01 (Campo: fecha_asignacion)
[2025-11-02 22:50:06] ✅ Fecha string convertida: 1/27/2025 -> 2025-01-27 (Campo: fecha_proceso)
[2025-11-02 22:50:06] ✅ Fecha string convertida: 7/5/2022 -> 2022-07-05 (Campo: fecha_castigo)
[2025-11-02 22:50:06] ✅ Fecha string convertida: 1/5/2022 -> 2022-01-05 (Campo: fecha_vencimiento)
[2025-11-02 22:50:06] ✅ Fecha string convertida: 12/13/2017 -> 2017-12-13 (Campo: fecha_susc)
[2025-11-02 22:50:06] ✅ Fecha string convertida: 9/1/2022 -> 2022-09-01 (Campo: fecha_asignacion)
[2025-11-02 22:50:06] ✅ Fecha string convertida: 1/27/2025 -> 2025-01-27 (Campo: fecha_proceso)
[2025-11-02 22:50:06] ✅ Fecha string convertida: 7/5/2022 -> 2022-07-05 (Campo: fecha_castigo)
[2025-11-02 22:50:06] ✅ Fecha string convertida: 1/5/2022 -> 2022-01-05 (Campo: fecha_vencimiento)
[2025-11-02 22:50:06] ✅ Fecha string convertida: 5/15/2004 -> 2004-05-15 (Campo: fecha_susc)
[2025-11-02 22:50:06] ✅ Fecha string convertida: 9/1/2022 -> 2022-09-01 (Campo: fecha_asignacion)
[2025-11-02 22:50:06] ✅ Fecha string convertida: 1/27/2025 -> 2025-01-27 (Campo: fecha_proceso)
[2025-11-02 22:50:06] ✅ Fecha string convertida: 7/5/2022 -> 2022-07-05 (Campo: fecha_castigo)
[2025-11-02 22:50:06] ✅ Fecha string convertida: 1/5/2022 -> 2022-01-05 (Campo: fecha_vencimiento)
[2025-11-02 22:50:06] ✅ Fecha string convertida: 12/6/2014 -> 2014-12-06 (Campo: fecha_susc)
[2025-11-02 22:50:06] ✅ Fecha string convertida: 9/1/2022 -> 2022-09-01 (Campo: fecha_asignacion)
[2025-11-02 22:50:06] ✅ Fecha string convertida: 1/27/2025 -> 2025-01-27 (Campo: fecha_proceso)
[2025-11-02 22:50:06] ✅ Fecha string convertida: 7/5/2022 -> 2022-07-05 (Campo: fecha_castigo)
[2025-11-02 22:50:06] ✅ Fecha string convertida: 1/5/2022 -> 2022-01-05 (Campo: fecha_vencimiento)
[2025-11-02 22:50:06] ✅ Fecha string convertida: 11/29/2005 -> 2005-11-29 (Campo: fecha_susc)
[2025-11-02 22:50:06] ✅ Fecha string convertida: 9/1/2022 -> 2022-09-01 (Campo: fecha_asignacion)
[2025-11-02 22:50:06] ✅ Fecha string convertida: 1/27/2025 -> 2025-01-27 (Campo: fecha_proceso)
[2025-11-02 22:50:06] ✅ Fecha string convertida: 7/5/2022 -> 2022-07-05 (Campo: fecha_castigo)
[2025-11-02 22:50:06] ✅ Fecha string convertida: 1/5/2022 -> 2022-01-05 (Campo: fecha_vencimiento)
[2025-11-02 22:50:06] ✅ Fecha string convertida: 11/30/2016 -> 2016-11-30 (Campo: fecha_susc)
[2025-11-02 22:50:06] ✅ Fecha string convertida: 9/1/2022 -> 2022-09-01 (Campo: fecha_asignacion)
[2025-11-02 22:50:06] ✅ Fecha string convertida: 1/27/2025 -> 2025-01-27 (Campo: fecha_proceso)
[2025-11-02 22:50:06] ✅ Fecha string convertida: 7/10/2022 -> 2022-07-10 (Campo: fecha_castigo)
[2025-11-02 22:50:06] ✅ Fecha string convertida: 5/31/2024 -> 2024-05-31 (Campo: fecha_pago)
[2025-11-02 22:50:06] ✅ Fecha string convertida: 1/10/2022 -> 2022-01-10 (Campo: fecha_vencimiento)
[2025-11-02 22:50:06] ✅ Fecha string convertida: 6/4/2001 -> 2001-06-04 (Campo: fecha_susc)
[2025-11-02 22:50:06] ✅ Fecha string convertida: 9/1/2022 -> 2022-09-01 (Campo: fecha_asignacion)
[2025-11-02 22:50:06] ✅ Fecha string convertida: 1/27/2025 -> 2025-01-27 (Campo: fecha_proceso)
[2025-11-02 22:50:06] ✅ Fecha string convertida: 7/10/2022 -> 2022-07-10 (Campo: fecha_castigo)
[2025-11-02 22:50:06] ✅ Fecha string convertida: 1/10/2022 -> 2022-01-10 (Campo: fecha_vencimiento)
[2025-11-02 22:50:06] ✅ Fecha string convertida: 4/3/2018 -> 2018-04-03 (Campo: fecha_susc)
[2025-11-02 22:50:06] ✅ Fecha string convertida: 9/1/2022 -> 2022-09-01 (Campo: fecha_asignacion)
[2025-11-02 22:50:06] ✅ Fecha string convertida: 1/27/2025 -> 2025-01-27 (Campo: fecha_proceso)
[2025-11-02 22:50:06] ✅ Fecha string convertida: 7/10/2022 -> 2022-07-10 (Campo: fecha_castigo)
[2025-11-02 22:50:06] ✅ Fecha string convertida: 1/10/2022 -> 2022-01-10 (Campo: fecha_vencimiento)
[2025-11-02 22:50:06] ✅ Fecha string convertida: 11/11/2018 -> 2018-11-11 (Campo: fecha_susc)
[2025-11-02 22:50:06] ✅ Fecha string convertida: 9/1/2022 -> 2022-09-01 (Campo: fecha_asignacion)
[2025-11-02 22:50:06] ✅ Fecha string convertida: 1/27/2025 -> 2025-01-27 (Campo: fecha_proceso)
[2025-11-02 22:50:06] ✅ Fecha string convertida: 8/5/2022 -> 2022-08-05 (Campo: fecha_castigo)
[2025-11-02 22:50:06] ✅ Fecha string convertida: 1/4/2022 -> 2022-01-04 (Campo: fecha_pago)
[2025-11-02 22:50:06] ✅ Fecha string convertida: 2/5/2022 -> 2022-02-05 (Campo: fecha_vencimiento)
[2025-11-02 22:50:06] ✅ Fecha string convertida: 3/11/2019 -> 2019-03-11 (Campo: fecha_susc)
[2025-11-02 22:50:06] ✅ Fecha string convertida: 10/1/2022 -> 2022-10-01 (Campo: fecha_asignacion)
[2025-11-02 22:50:06] ✅ Fecha string convertida: 1/27/2025 -> 2025-01-27 (Campo: fecha_proceso)
[2025-11-02 22:50:06] ✅ Fecha string convertida: 8/5/2022 -> 2022-08-05 (Campo: fecha_castigo)
[2025-11-02 22:50:06] ✅ Valor convertido a DECIMAL: '$ 1,249,208' -> 1249208
[2025-11-02 22:50:06] ✅ Fecha string convertida: 2/5/2022 -> 2022-02-05 (Campo: fecha_vencimiento)
[2025-11-02 22:50:06] ✅ Fecha string convertida: 9/14/2016 -> 2016-09-14 (Campo: fecha_susc)
[2025-11-02 22:50:06] ✅ Fecha string convertida: 10/1/2022 -> 2022-10-01 (Campo: fecha_asignacion)
[2025-11-02 22:50:06] ✅ Fecha string convertida: 1/27/2025 -> 2025-01-27 (Campo: fecha_proceso)
[2025-11-02 22:50:06] ✅ Fecha string convertida: 8/5/2022 -> 2022-08-05 (Campo: fecha_castigo)
[2025-11-02 22:50:06] ✅ Fecha string convertida: 1/14/2022 -> 2022-01-14 (Campo: fecha_pago)
[2025-11-02 22:50:06] ✅ Fecha string convertida: 2/5/2022 -> 2022-02-05 (Campo: fecha_vencimiento)
[2025-11-02 22:50:06] ✅ Fecha string convertida: 12/3/2020 -> 2020-12-03 (Campo: fecha_susc)
[2025-11-02 22:50:06] ✅ Fecha string convertida: 10/1/2022 -> 2022-10-01 (Campo: fecha_asignacion)
[2025-11-02 22:50:06] ✅ Fecha string convertida: 1/27/2025 -> 2025-01-27 (Campo: fecha_proceso)
[2025-11-02 22:50:06] ✅ Fecha string convertida: 8/5/2022 -> 2022-08-05 (Campo: fecha_castigo)
[2025-11-02 22:50:06] ✅ Fecha string convertida: 1/8/2022 -> 2022-01-08 (Campo: fecha_pago)
[2025-11-02 22:50:06] ✅ Fecha string convertida: 2/5/2022 -> 2022-02-05 (Campo: fecha_vencimiento)
[2025-11-02 22:50:06] ✅ Fecha string convertida: 8/29/2015 -> 2015-08-29 (Campo: fecha_susc)
[2025-11-02 22:50:06] ✅ Fecha string convertida: 10/1/2022 -> 2022-10-01 (Campo: fecha_asignacion)
[2025-11-02 22:50:06] ✅ Fecha string convertida: 1/27/2025 -> 2025-01-27 (Campo: fecha_proceso)
[2025-11-02 22:50:06] ✅ Fecha string convertida: 8/5/2022 -> 2022-08-05 (Campo: fecha_castigo)
[2025-11-02 22:50:06] ✅ Fecha string convertida: 2/5/2022 -> 2022-02-05 (Campo: fecha_vencimiento)
[2025-11-02 22:50:06] ✅ Fecha string convertida: 3/25/2017 -> 2017-03-25 (Campo: fecha_susc)
[2025-11-02 22:50:06] ✅ Fecha string convertida: 10/1/2022 -> 2022-10-01 (Campo: fecha_asignacion)
[2025-11-02 22:50:06] ✅ Fecha string convertida: 1/27/2025 -> 2025-01-27 (Campo: fecha_proceso)
[2025-11-02 22:50:06] ✅ Fecha string convertida: 8/5/2022 -> 2022-08-05 (Campo: fecha_castigo)
[2025-11-02 22:50:06] ✅ Fecha string convertida: 2/5/2022 -> 2022-02-05 (Campo: fecha_vencimiento)
[2025-11-02 22:50:06] ✅ Fecha string convertida: 3/28/2016 -> 2016-03-28 (Campo: fecha_susc)
[2025-11-02 22:50:06] ✅ Fecha string convertida: 10/1/2022 -> 2022-10-01 (Campo: fecha_asignacion)
[2025-11-02 22:50:06] ✅ Fecha string convertida: 1/27/2025 -> 2025-01-27 (Campo: fecha_proceso)
[2025-11-02 22:50:06] ✅ Fecha string convertida: 8/10/2022 -> 2022-08-10 (Campo: fecha_castigo)
[2025-11-02 22:50:06] ✅ Fecha string convertida: 2/10/2022 -> 2022-02-10 (Campo: fecha_vencimiento)
[2025-11-02 22:50:06] ✅ Fecha string convertida: 1/14/2018 -> 2018-01-14 (Campo: fecha_susc)
[2025-11-02 22:50:06] ✅ Fecha string convertida: 10/1/2022 -> 2022-10-01 (Campo: fecha_asignacion)
[2025-11-02 22:50:06] ✅ Fecha string convertida: 1/27/2025 -> 2025-01-27 (Campo: fecha_proceso)
[2025-11-02 22:50:06] ✅ Fecha string convertida: 9/5/2022 -> 2022-09-05 (Campo: fecha_castigo)
[2025-11-02 22:50:06] ✅ Fecha string convertida: 4/13/2022 -> 2022-04-13 (Campo: fecha_pago)
[2025-11-02 22:50:06] ✅ Fecha string convertida: 3/5/2022 -> 2022-03-05 (Campo: fecha_vencimiento)
[2025-11-02 22:50:06] ✅ Fecha string convertida: 3/22/2016 -> 2016-03-22 (Campo: fecha_susc)
[2025-11-02 22:50:06] ✅ Fecha string convertida: 11/1/2022 -> 2022-11-01 (Campo: fecha_asignacion)
[2025-11-02 22:50:06] ✅ Fecha string convertida: 1/27/2025 -> 2025-01-27 (Campo: fecha_proceso)
[2025-11-02 22:50:06] ✅ Fecha string convertida: 9/10/2022 -> 2022-09-10 (Campo: fecha_castigo)
[2025-11-02 22:50:06] ✅ Fecha string convertida: 4/11/2024 -> 2024-04-11 (Campo: fecha_pago)
[2025-11-02 22:50:06] ✅ Fecha string convertida: 3/10/2022 -> 2022-03-10 (Campo: fecha_vencimiento)
[2025-11-02 22:50:06] ✅ Fecha string convertida: 8/27/2017 -> 2017-08-27 (Campo: fecha_susc)
[2025-11-02 22:50:06] ✅ Fecha string convertida: 11/1/2022 -> 2022-11-01 (Campo: fecha_asignacion)
[2025-11-02 22:50:06] ✅ Fecha string convertida: 1/27/2025 -> 2025-01-27 (Campo: fecha_proceso)
[2025-11-02 22:50:06] ✅ Fecha string convertida: 10/5/2022 -> 2022-10-05 (Campo: fecha_castigo)
[2025-11-02 22:50:06] ✅ Fecha string convertida: 3/5/2022 -> 2022-03-05 (Campo: fecha_pago)
[2025-11-02 22:50:06] ✅ Fecha string convertida: 4/5/2022 -> 2022-04-05 (Campo: fecha_vencimiento)
[2025-11-02 22:50:06] ✅ Fecha string convertida: 3/10/2018 -> 2018-03-10 (Campo: fecha_susc)
[2025-11-02 22:50:06] ✅ Fecha string convertida: 12/1/2022 -> 2022-12-01 (Campo: fecha_asignacion)
[2025-11-02 22:50:06] ✅ Fecha string convertida: 1/27/2025 -> 2025-01-27 (Campo: fecha_proceso)
[2025-11-02 22:50:06] ✅ Fecha string convertida: 10/5/2022 -> 2022-10-05 (Campo: fecha_castigo)
[2025-11-02 22:50:06] ✅ Fecha string convertida: 3/8/2022 -> 2022-03-08 (Campo: fecha_pago)
[2025-11-02 22:50:06] ✅ Fecha string convertida: 4/5/2022 -> 2022-04-05 (Campo: fecha_vencimiento)
[2025-11-02 22:50:06] ✅ Fecha string convertida: 12/4/2016 -> 2016-12-04 (Campo: fecha_susc)
[2025-11-02 22:50:06] ✅ Fecha string convertida: 12/1/2022 -> 2022-12-01 (Campo: fecha_asignacion)
[2025-11-02 22:50:06] ✅ Fecha string convertida: 1/27/2025 -> 2025-01-27 (Campo: fecha_proceso)
[2025-11-02 22:50:06] ✅ Fecha string convertida: 10/5/2022 -> 2022-10-05 (Campo: fecha_castigo)
[2025-11-02 22:50:06] ✅ Fecha string convertida: 5/16/2022 -> 2022-05-16 (Campo: fecha_pago)
[2025-11-02 22:50:06] ✅ Fecha string convertida: 4/5/2022 -> 2022-04-05 (Campo: fecha_vencimiento)
[2025-11-02 22:50:06] ✅ Fecha string convertida: 5/5/2016 -> 2016-05-05 (Campo: fecha_susc)
[2025-11-02 22:50:06] ✅ Fecha string convertida: 12/1/2022 -> 2022-12-01 (Campo: fecha_asignacion)
[2025-11-02 22:50:06] ✅ Fecha string convertida: 1/27/2025 -> 2025-01-27 (Campo: fecha_proceso)
[2025-11-02 22:50:06] ✅ Fecha string convertida: 10/5/2022 -> 2022-10-05 (Campo: fecha_castigo)
[2025-11-02 22:50:06] ✅ Fecha string convertida: 1/7/2022 -> 2022-01-07 (Campo: fecha_pago)
[2025-11-02 22:50:06] ✅ Fecha string convertida: 4/5/2022 -> 2022-04-05 (Campo: fecha_vencimiento)
[2025-11-02 22:50:06] ✅ Fecha string convertida: 6/11/2007 -> 2007-06-11 (Campo: fecha_susc)
[2025-11-02 22:50:06] ✅ Fecha string convertida: 11/1/2022 -> 2022-11-01 (Campo: fecha_asignacion)
[2025-11-02 22:50:06] ✅ Fecha string convertida: 1/27/2025 -> 2025-01-27 (Campo: fecha_proceso)
[2025-11-02 22:50:06] ✅ Fecha string convertida: 10/5/2022 -> 2022-10-05 (Campo: fecha_castigo)
[2025-11-02 22:50:06] ✅ Fecha string convertida: 2/26/2022 -> 2022-02-26 (Campo: fecha_pago)
[2025-11-02 22:50:06] ✅ Fecha string convertida: 4/5/2022 -> 2022-04-05 (Campo: fecha_vencimiento)
[2025-11-02 22:50:06] ✅ Fecha string convertida: 9/17/2010 -> 2010-09-17 (Campo: fecha_susc)
[2025-11-02 22:50:06] ✅ Fecha string convertida: 11/1/2022 -> 2022-11-01 (Campo: fecha_asignacion)
[2025-11-02 22:50:06] ✅ Fecha string convertida: 1/27/2025 -> 2025-01-27 (Campo: fecha_proceso)
[2025-11-02 22:50:06] ✅ Fecha string convertida: 10/5/2022 -> 2022-10-05 (Campo: fecha_castigo)
[2025-11-02 22:50:06] ✅ Fecha string convertida: 2/28/2022 -> 2022-02-28 (Campo: fecha_pago)
[2025-11-02 22:50:06] ✅ Fecha string convertida: 4/5/2022 -> 2022-04-05 (Campo: fecha_vencimiento)
[2025-11-02 22:50:06] ✅ Fecha string convertida: 2/6/2016 -> 2016-02-06 (Campo: fecha_susc)
[2025-11-02 22:50:06] ✅ Fecha string convertida: 12/1/2022 -> 2022-12-01 (Campo: fecha_asignacion)
[2025-11-02 22:50:06] ✅ Fecha string convertida: 1/27/2025 -> 2025-01-27 (Campo: fecha_proceso)
[2025-11-02 22:50:06] ✅ Fecha string convertida: 10/25/2022 -> 2022-10-25 (Campo: fecha_castigo)
[2025-11-02 22:50:06] ✅ Fecha string convertida: 8/3/2023 -> 2023-08-03 (Campo: fecha_pago)
[2025-11-02 22:50:06] ✅ Fecha string convertida: 4/25/2022 -> 2022-04-25 (Campo: fecha_vencimiento)
[2025-11-02 22:50:06] ✅ Fecha string convertida: 8/3/1992 -> 1992-08-03 (Campo: fecha_susc)
[2025-11-02 22:50:06] ✅ Fecha string convertida: 12/1/2022 -> 2022-12-01 (Campo: fecha_asignacion)
[2025-11-02 22:50:06] ✅ Fecha string convertida: 1/27/2025 -> 2025-01-27 (Campo: fecha_proceso)
[2025-11-02 22:50:06] ✅ Fecha string convertida: 10/25/2022 -> 2022-10-25 (Campo: fecha_castigo)
[2025-11-02 22:50:06] ✅ Fecha string convertida: 8/31/2023 -> 2023-08-31 (Campo: fecha_pago)
[2025-11-02 22:50:06] ✅ Fecha string convertida: 4/25/2022 -> 2022-04-25 (Campo: fecha_vencimiento)
[2025-11-02 22:50:06] ✅ Fecha string convertida: 7/21/2006 -> 2006-07-21 (Campo: fecha_susc)
[2025-11-02 22:50:06] ✅ Fecha string convertida: 12/1/2022 -> 2022-12-01 (Campo: fecha_asignacion)
[2025-11-02 22:50:06] ✅ Fecha string convertida: 1/27/2025 -> 2025-01-27 (Campo: fecha_proceso)
[2025-11-02 22:50:06] ✅ Fecha string convertida: 11/5/2022 -> 2022-11-05 (Campo: fecha_castigo)
